number,value,datetime_start,datetime_complete,duration,params_n_neighbors,params_p,params_weights,system_attrs_fixed_params,state
0,0.599802239027661,2026-09-20 19:37:57.954819,2026-09-20 19:37:58.735773,0 days 00:00:00.780954,81,1,distance,,COMPLETE
1,0.5783371677211734,2026-09-20 19:37:58.735773,2026-09-20 19:37:59.197935,0 days 00:00:00.462162,11,2,distance,,COMPLETE
2,0.593965893969659,2026-09-20 19:37:59.197935,2026-09-20 19:37:59.974968,0 days 00:00:00.777033,81,1,uniform,,COMPLETE
3,0.5786968704231664,2026-09-20 19:37:59.974968,2026-09-20 19:38:00.434108,0 days 00:00:00.459140,11,2,uniform,,COMPLETE
4,0.5931093208801536,2026-09-20 19:38:00.434108,2026-09-20 19:38:01.097859,0 days 00:00:00.663751,21,1,uniform,,COMPLETE
5,,2026-09-20 19:38:01.097859,2026-09-20 19:38:01.097859,0 days 00:00:00,21,1,uniform,,PRUNED
6,0.5894281405151803,2026-09-20 19:38:01.097859,2026-09-20 19:38:01.676419,0 days 00:00:00.578560,81,2,uniform,,COMPLETE
7,0.5799157704424194,2026-09-20 19:38:01.676419,2026-09-20 19:38:02.337233,0 days 00:00:00.660814,11,1,distance,,COMPLETE
8,0.5665010759652392,2026-09-20 19:38:02.337233,2026-09-20 19:38:02.987585,0 days 00:00:00.650352,5,1,distance,,COMPLETE
9,0.6030124580864235,2026-09-20 19:38:02.987585,2026-09-20 19:38:03.723331,0 days 00:00:00.735746,41,1,distance,,COMPLETE
10,0.6024872636881812,2026-09-20 19:38:03.723331,2026-09-20 19:38:04.215991,0 days 00:00:00.492660,41,2,distance,,COMPLETE
11,,2026-09-20 19:38:04.215991,2026-09-20 19:38:04.215991,0 days 00:00:00,41,2,distance,,PRUNED
12,,2026-09-20 19:38:04.215991,2026-09-20 19:38:04.215991,0 days 00:00:00,41,2,distance,,PRUNED
13,0.5442251681013656,2026-09-20 19:38:04.215991,2026-09-20 19:38:04.659696,0 days 00:00:00.443705,3,2,distance,,COMPLETE
14,,2026-09-20 19:38:04.659696,2026-09-20 19:38:04.659696,0 days 00:00:00,41,1,distance,,PRUNED
15,,2026-09-20 19:38:04.659696,2026-09-20 19:38:04.659696,0 days 00:00:00,41,2,distance,,PRUNED
16,,2026-09-20 19:38:04.659696,2026-09-20 19:38:04.659696,0 days 00:00:00,41,2,distance,,PRUNED
17,0.5397563797563798,2026-09-20 19:38:04.659696,2026-09-20 19:38:05.305912,0 days 00:00:00.646216,3,1,distance,,COMPLETE
18,,2026-09-20 19:38:05.305912,2026-09-20 19:38:05.319800,0 days 00:00:00.013888,5,1,distance,,PRUNED
19,,2026-09-20 19:38:05.319800,2026-09-20 19:38:05.319800,0 days 00:00:00,41,2,distance,,PRUNED
20,,2026-09-20 19:38:05.319800,2026-09-20 19:38:05.319800,0 days 00:00:00,41,2,distance,,PRUNED
21,,2026-09-20 19:38:05.319800,2026-09-20 19:38:05.319800,0 days 00:00:00,81,1,distance,,PRUNED
22,,2026-09-20 19:38:05.319800,2026-09-20 19:38:05.319800,0 days 00:00:00,81,1,distance,,PRUNED
23,,2026-09-20 19:38:05.319800,2026-09-20 19:38:05.319800,0 days 00:00:00,81,1,distance,,PRUNED
24,,2026-09-20 19:38:05.319800,2026-09-20 19:38:05.319800,0 days 00:00:00,41,1,distance,,PRUNED
25,,2026-09-20 19:38:05.319800,2026-09-20 19:38:05.336617,0 days 00:00:00.016817,5,1,distance,,PRUNED
26,0.6010812602467622,2026-09-20 19:38:05.336617,2026-09-20 19:38:06.074747,0 days 00:00:00.738130,41,1,uniform,"{'n_neighbors': 41, 'p': 1, 'weights': 'uniform'}",COMPLETE
27,,2026-09-20 19:38:06.074747,2026-09-20 19:38:06.074747,0 days 00:00:00,41,1,uniform,,PRUNED
28,0.5937870202944272,2026-09-20 19:38:06.074747,2026-09-20 19:38:06.588412,0 days 00:00:00.513665,41,2,uniform,,COMPLETE
29,,2026-09-20 19:38:06.588412,2026-09-20 19:38:06.590420,0 days 00:00:00.002008,41,1,uniform,,PRUNED
30,,2026-09-20 19:38:06.590420,2026-09-20 19:38:06.593461,0 days 00:00:00.003041,21,1,uniform,,PRUNED
31,,2026-09-20 19:38:06.593461,2026-09-20 19:38:06.593461,0 days 00:00:00,3,1,distance,,PRUNED
32,,2026-09-20 19:38:06.593461,2026-09-20 19:38:06.593461,0 days 00:00:00,81,1,uniform,,PRUNED
33,0.5844329766740675,2026-09-20 19:38:06.593461,2026-09-20 19:38:07.276004,0 days 00:00:00.682543,11,1,uniform,,COMPLETE
34,,2026-09-20 19:38:07.276004,2026-09-20 19:38:07.276004,0 days 00:00:00,41,1,distance,,PRUNED
35,,2026-09-20 19:38:07.276004,2026-09-20 19:38:07.276004,0 days 00:00:00,81,2,uniform,,PRUNED
36,,2026-09-20 19:38:07.276004,2026-09-20 19:38:07.276004,0 days 00:00:00,21,1,uniform,,PRUNED
37,,2026-09-20 19:38:07.276004,2026-09-20 19:38:07.276004,0 days 00:00:00,11,1,distance,,PRUNED
38,,2026-09-20 19:38:07.276004,2026-09-20 19:38:07.276004,0 days 00:00:00,41,2,uniform,,PRUNED
39,,2026-09-20 19:38:07.276004,2026-09-20 19:38:07.276004,0 days 00:00:00,81,1,distance,,PRUNED
40,0.561135797213279,2026-09-20 19:38:07.276004,2026-09-20 19:38:07.725818,0 days 00:00:00.449814,5,2,distance,,COMPLETE
41,,2026-09-20 19:38:07.725818,2026-09-20 19:38:07.731407,0 days 00:00:00.005589,81,1,uniform,,PRUNED
42,,2026-09-20 19:38:07.731407,2026-09-20 19:38:07.731407,0 days 00:00:00,81,1,uniform,,PRUNED
43,,2026-09-20 19:38:07.731407,2026-09-20 19:38:07.735614,0 days 00:00:00.004207,81,1,uniform,,PRUNED
44,,2026-09-20 19:38:07.735614,2026-09-20 19:38:07.738198,0 days 00:00:00.002584,21,1,uniform,,PRUNED
45,,2026-09-20 19:38:07.738198,2026-09-20 19:38:07.740399,0 days 00:00:00.002201,11,1,uniform,,PRUNED
46,,2026-09-20 19:38:07.740399,2026-09-20 19:38:07.740399,0 days 00:00:00,41,2,distance,,PRUNED
47,,2026-09-20 19:38:07.740399,2026-09-20 19:38:07.740399,0 days 00:00:00,3,1,distance,,PRUNED
48,,2026-09-20 19:38:07.740399,2026-09-20 19:38:07.740399,0 days 00:00:00,41,2,uniform,,PRUNED
49,0.5650573449514399,2026-09-20 19:38:07.740399,2026-09-20 19:38:08.185540,0 days 00:00:00.445141,5,2,uniform,"{'n_neighbors': 5, 'p': 2, 'weights': 'uniform'}",COMPLETE
50,,2026-09-20 19:38:08.185540,2026-09-20 19:38:08.191734,0 days 00:00:00.006194,41,1,distance,,PRUNED
51,,2026-09-20 19:38:08.191734,2026-09-20 19:38:08.193955,0 days 00:00:00.002221,41,2,uniform,,PRUNED
52,,2026-09-20 19:38:08.193955,2026-09-20 19:38:08.196517,0 days 00:00:00.002562,41,2,uniform,,PRUNED
53,,2026-09-20 19:38:08.196517,2026-09-20 19:38:08.196517,0 days 00:00:00,41,2,uniform,,PRUNED
54,,2026-09-20 19:38:08.196517,2026-09-20 19:38:08.196517,0 days 00:00:00,41,2,distance,,PRUNED
55,,2026-09-20 19:38:08.196517,2026-09-20 19:38:08.196517,0 days 00:00:00,81,2,uniform,,PRUNED
56,,2026-09-20 19:38:08.196517,2026-09-20 19:38:08.196517,0 days 00:00:00,41,1,distance,,PRUNED
57,0.5913607846959387,2026-09-20 19:38:08.196517,2026-09-20 19:38:08.799737,0 days 00:00:00.603220,81,2,distance,,COMPLETE
58,,2026-09-20 19:38:08.799737,2026-09-20 19:38:08.799737,0 days 00:00:00,41,1,uniform,,PRUNED
59,,2026-09-20 19:38:08.799737,2026-09-20 19:38:08.799737,0 days 00:00:00,3,1,distance,,PRUNED
60,,2026-09-20 19:38:08.799737,2026-09-20 19:38:08.806612,0 days 00:00:00.006875,41,2,uniform,,PRUNED
61,,2026-09-20 19:38:08.806612,2026-09-20 19:38:08.806612,0 days 00:00:00,21,1,uniform,,PRUNED
62,,2026-09-20 19:38:08.806612,2026-09-20 19:38:08.806612,0 days 00:00:00,21,1,uniform,,PRUNED
63,,2026-09-20 19:38:08.806612,2026-09-20 19:38:08.806612,0 days 00:00:00,21,1,uniform,,PRUNED
64,0.5871632523028979,2026-09-20 19:38:08.806612,2026-09-20 19:38:09.499822,0 days 00:00:00.693210,21,1,distance,,COMPLETE
65,,2026-09-20 19:38:09.499822,2026-09-20 19:38:09.501829,0 days 00:00:00.002007,81,1,uniform,,PRUNED
66,,2026-09-20 19:38:09.501829,2026-09-20 19:38:09.501829,0 days 00:00:00,11,1,distance,,PRUNED
67,,2026-09-20 19:38:09.501829,2026-09-20 19:38:09.509575,0 days 00:00:00.007746,41,1,uniform,,PRUNED
68,,2026-09-20 19:38:09.509575,2026-09-20 19:38:09.509575,0 days 00:00:00,5,1,distance,,PRUNED
69,,2026-09-20 19:38:09.509575,2026-09-20 19:38:09.509575,0 days 00:00:00,41,2,uniform,,PRUNED
70,,2026-09-20 19:38:09.509575,2026-09-20 19:38:09.515536,0 days 00:00:00.005961,81,1,distance,,PRUNED
71,,2026-09-20 19:38:09.515536,2026-09-20 19:38:09.515536,0 days 00:00:00,81,2,distance,,PRUNED
72,,2026-09-20 19:38:09.515536,2026-09-20 19:38:09.515536,0 days 00:00:00,81,2,distance,,PRUNED
73,0.5657516546629832,2026-09-20 19:38:09.515536,2026-09-20 19:38:10.154610,0 days 00:00:00.639074,5,1,uniform,"{'n_neighbors': 5, 'p': 1, 'weights': 'uniform'}",COMPLETE
74,,2026-09-20 19:38:10.154610,2026-09-20 19:38:10.166567,0 days 00:00:00.011957,81,2,distance,,PRUNED
75,,2026-09-20 19:38:10.166567,2026-09-20 19:38:10.166567,0 days 00:00:00,81,2,distance,,PRUNED
76,0.5895751337175623,2026-09-20 19:38:10.166567,2026-09-20 19:38:10.641530,0 days 00:00:00.474963,21,2,distance,,COMPLETE
77,,2026-09-20 19:38:10.641530,2026-09-20 19:38:10.641530,0 days 00:00:00,81,2,distance,,PRUNED
78,0.5501532602256333,2026-09-20 19:38:10.641530,2026-09-20 19:38:11.276749,0 days 00:00:00.635219,3,1,uniform,,COMPLETE
79,,2026-09-20 19:38:11.276749,2026-09-20 19:38:11.276749,0 days 00:00:00,41,2,distance,,PRUNED
80,,2026-09-20 19:38:11.276749,2026-09-20 19:38:11.292419,0 days 00:00:00.015670,81,1,uniform,,PRUNED
81,,2026-09-20 19:38:11.292419,2026-09-20 19:38:11.292419,0 days 00:00:00,21,2,distance,,PRUNED
82,,2026-09-20 19:38:11.292419,2026-09-20 19:38:11.297150,0 days 00:00:00.004731,21,2,distance,,PRUNED
83,,2026-09-20 19:38:11.297150,2026-09-20 19:38:11.297150,0 days 00:00:00,21,2,distance,,PRUNED
84,,2026-09-20 19:38:11.297150,2026-09-20 19:38:11.297150,0 days 00:00:00,21,2,distance,,PRUNED
85,,2026-09-20 19:38:11.297150,2026-09-20 19:38:11.297150,0 days 00:00:00,41,2,distance,,PRUNED
86,,2026-09-20 19:38:11.297150,2026-09-20 19:38:11.297150,0 days 00:00:00,11,2,distance,,PRUNED
87,0.5928343620277652,2026-09-20 19:38:11.308433,2026-09-20 19:38:11.770051,0 days 00:00:00.461618,21,2,uniform,"{'n_neighbors': 21, 'p': 2, 'weights': 'uniform'}",COMPLETE
88,,2026-09-20 19:38:11.770051,2026-09-20 19:38:11.770051,0 days 00:00:00,41,1,uniform,,PRUNED
89,,2026-09-20 19:38:11.770051,2026-09-20 19:38:11.770051,0 days 00:00:00,81,1,uniform,,PRUNED
90,,2026-09-20 19:38:11.770051,2026-09-20 19:38:11.783845,0 days 00:00:00.013794,41,1,uniform,,PRUNED
91,,2026-09-20 19:38:11.783845,2026-09-20 19:38:11.785854,0 days 00:00:00.002009,21,2,uniform,,PRUNED
92,,2026-09-20 19:38:11.785854,2026-09-20 19:38:11.785854,0 days 00:00:00,21,2,uniform,,PRUNED
93,,2026-09-20 19:38:11.785854,2026-09-20 19:38:11.791879,0 days 00:00:00.006025,21,2,distance,,PRUNED
94,,2026-09-20 19:38:11.791879,2026-09-20 19:38:11.791879,0 days 00:00:00,21,2,uniform,,PRUNED
95,,2026-09-20 19:38:11.791879,2026-09-20 19:38:11.791879,0 days 00:00:00,21,2,distance,,PRUNED
96,0.5481216995620634,2026-09-20 19:38:11.791879,2026-09-20 19:38:12.244719,0 days 00:00:00.452840,3,2,uniform,"{'n_neighbors': 3, 'p': 2, 'weights': 'uniform'}",COMPLETE
