number,value,datetime_start,datetime_complete,duration,params_C,params_penalty,state
0,0.6121012530586112,2026-09-19 23:39:32.922259,2026-09-19 23:39:33.376182,0 days 00:00:00.453923,41.928101479779855,l2,COMPLETE
1,0.6146296841075453,2026-09-19 23:39:33.376182,2026-09-19 23:39:33.816395,0 days 00:00:00.440213,0.04126147874519655,l1,COMPLETE
2,0.0,2026-09-19 23:39:33.816395,2026-09-19 23:39:34.227298,0 days 00:00:00.410903,0.0010333972139926462,l1,COMPLETE
3,0.5742024069701955,2026-09-19 23:39:34.227298,2026-09-19 23:39:34.652158,0 days 00:00:00.424860,0.006967993558156304,l1,COMPLETE
4,0.612107287935585,2026-09-19 23:39:34.652158,2026-09-19 23:39:35.080918,0 days 00:00:00.428760,30.313325105874483,l2,COMPLETE
5,0.6153531881312152,2026-09-19 23:39:35.080918,2026-09-19 23:39:35.766666,0 days 00:00:00.685748,1.5326466262654144,l1,COMPLETE
6,0.6173456936441327,2026-09-19 23:39:35.766666,2026-09-19 23:39:36.156676,0 days 00:00:00.390010,0.002447392039767621,l2,COMPLETE
7,0.6113616144517904,2026-09-19 23:39:36.156676,2026-09-19 23:39:37.983565,0 days 00:00:01.826889,264.728846101169,l1,COMPLETE
8,0.6158661693074358,2026-09-19 23:39:37.983565,2026-09-19 23:39:38.407742,0 days 00:00:00.424177,0.16991002165183255,l2,COMPLETE
9,0.615439472438095,2026-09-19 23:39:38.407742,2026-09-19 23:39:38.834446,0 days 00:00:00.426704,1.3379156998110695,l2,COMPLETE
10,0.6125307198308323,2026-09-19 23:39:38.834446,2026-09-19 23:39:39.254482,0 days 00:00:00.420036,0.0011014341083597037,l2,COMPLETE
11,0.6173128159497226,2026-09-19 23:39:39.254482,2026-09-19 23:39:39.713782,0 days 00:00:00.459300,0.0619655264588237,l2,COMPLETE
12,0.6146661165749104,2026-09-19 23:39:39.713782,2026-09-19 23:39:40.157226,0 days 00:00:00.443444,0.012618889279588862,l2,COMPLETE
13,0.6159576642979938,2026-09-19 23:39:40.157226,2026-09-19 23:39:40.587164,0 days 00:00:00.429938,0.24069483478911602,l2,COMPLETE
14,0.6157307762277076,2026-09-19 23:39:40.587164,2026-09-19 23:39:40.997005,0 days 00:00:00.409841,0.0075649165315289585,l2,COMPLETE
15,0.6177717435586653,2026-09-19 23:39:40.997005,2026-09-19 23:39:41.409238,0 days 00:00:00.412233,0.04938223612672681,l2,COMPLETE
16,0.6189306913233726,2026-09-19 23:39:41.409238,2026-09-19 23:39:41.812177,0 days 00:00:00.402939,0.004197588259765176,l2,COMPLETE
17,0.6154033001322278,2026-09-19 23:39:41.812177,2026-09-19 23:39:42.238765,0 days 00:00:00.426588,0.3903604318766566,l2,COMPLETE
18,0.6188773578039238,2026-09-19 23:39:42.238765,2026-09-19 23:39:42.656685,0 days 00:00:00.417920,0.03365920917002356,l2,COMPLETE
19,0.614845834283735,2026-09-19 23:39:42.656685,2026-09-19 23:39:43.094155,0 days 00:00:00.437470,5.2005891421223005,l2,COMPLETE
20,0.6140806899178864,2026-09-19 23:39:43.094155,2026-09-19 23:39:43.507539,0 days 00:00:00.413384,0.013320429010730769,l2,COMPLETE
21,0.6177686898587019,2026-09-19 23:39:43.507539,2026-09-19 23:39:43.912940,0 days 00:00:00.405401,0.050663943699847024,l2,COMPLETE
22,0.6183939780311847,2026-09-19 23:39:43.912940,2026-09-19 23:39:44.344815,0 days 00:00:00.431875,0.0288588931810223,l2,COMPLETE
23,0.6179392770521025,2026-09-19 23:39:44.344815,2026-09-19 23:39:44.758275,0 days 00:00:00.413460,0.003001095008457669,l2,COMPLETE
