number,value,datetime_start,datetime_complete,duration,params_C,params_penalty,state
0,0.5744197774827349,2026-09-20 20:18:03.923713,2026-09-20 20:18:04.335779,0 days 00:00:00.412066,0.05543016350035931,l1,COMPLETE
1,0.5493609296815681,2026-09-20 20:18:04.335779,2026-09-20 20:18:04.725077,0 days 00:00:00.389298,0.009228135163361705,l2,COMPLETE
2,0.6072010657889368,2026-09-20 20:18:04.725077,2026-09-20 20:18:05.763349,0 days 00:00:01.038272,8.469328049888297,l1,COMPLETE
3,0.5279003517208473,2026-09-20 20:18:05.763349,2026-09-20 20:18:06.149358,0 days 00:00:00.386009,0.0048200387101596555,l2,COMPLETE
4,0.5628293366354783,2026-09-20 20:18:06.149358,2026-09-20 20:18:06.544122,0 days 00:00:00.394764,0.037883504758796774,l1,COMPLETE
5,0.5541005146814639,2026-09-20 20:18:06.544122,2026-09-20 20:18:06.918233,0 days 00:00:00.374111,0.010441140030188603,l2,COMPLETE
6,0.5367645891345808,2026-09-20 20:18:06.918233,2026-09-20 20:18:07.345981,0 days 00:00:00.427748,0.0230952318450288,l1,COMPLETE
7,0.37860108379143176,2026-09-20 20:18:07.345981,2026-09-20 20:18:07.723120,0 days 00:00:00.377139,0.001102789063955343,l2,COMPLETE
8,0.6081918435022281,2026-09-20 20:18:07.723120,2026-09-20 20:18:09.090332,0 days 00:00:01.367212,104.86008616781726,l1,COMPLETE
9,0.6075510154342156,2026-09-20 20:18:09.090332,2026-09-20 20:18:10.411325,0 days 00:00:01.320993,176.34923744918436,l1,COMPLETE
10,0.6079114548591873,2026-09-20 20:18:10.411325,2026-09-20 20:18:11.740307,0 days 00:00:01.328982,719.2057007717483,l1,COMPLETE
11,0.6079114548591873,2026-09-20 20:18:11.740307,2026-09-20 20:18:13.094526,0 days 00:00:01.354219,702.7675512067748,l1,COMPLETE
12,0.6090841785422106,2026-09-20 20:18:13.094526,2026-09-20 20:18:14.423840,0 days 00:00:01.329314,19.95172859547233,l1,COMPLETE
13,0.607823341245041,2026-09-20 20:18:14.423840,2026-09-20 20:18:15.710423,0 days 00:00:01.286583,15.055754616128334,l1,COMPLETE
14,0.6085177956206088,2026-09-20 20:18:15.710423,2026-09-20 20:18:16.999199,0 days 00:00:01.288776,20.766688200687863,l1,COMPLETE
15,0.6005168792365142,2026-09-20 20:18:16.999199,2026-09-20 20:18:17.488934,0 days 00:00:00.489735,0.6666667846555611,l1,COMPLETE
16,0.6034468909810222,2026-09-20 20:18:17.488934,2026-09-20 20:18:18.012190,0 days 00:00:00.523256,1.8679698482133233,l1,COMPLETE
17,0.6066261689819022,2026-09-20 20:18:18.012190,2026-09-20 20:18:19.217417,0 days 00:00:01.205227,13.464361888929833,l1,COMPLETE
18,0.5982433529378388,2026-09-20 20:18:19.217417,2026-09-20 20:18:19.614750,0 days 00:00:00.397333,0.4521473699060165,l2,COMPLETE
19,0.6081918435022281,2026-09-20 20:18:19.614750,2026-09-20 20:18:20.973638,0 days 00:00:01.358888,71.25388879448602,l1,COMPLETE
20,0.6031097426997505,2026-09-20 20:18:20.973638,2026-09-20 20:18:21.613509,0 days 00:00:00.639871,2.8737969330421205,l1,COMPLETE
21,0.6081918435022281,2026-09-20 20:18:21.613509,2026-09-20 20:18:22.883447,0 days 00:00:01.269938,63.824553404240824,l1,COMPLETE
22,0.6079114548591873,2026-09-20 20:18:22.883447,2026-09-20 20:18:24.138902,0 days 00:00:01.255455,51.41697353715828,l1,COMPLETE
23,0.6079114548591873,2026-09-20 20:18:24.138902,2026-09-20 20:18:25.472671,0 days 00:00:01.333769,163.54234468795173,l1,COMPLETE
