number,value,datetime_start,datetime_complete,duration,params_n_neighbors,params_p,params_weights,system_attrs_fixed_params,state
0,0.5928343620277652,2026-09-21 01:09:21.683439,2026-09-21 01:09:22.141677,0 days 00:00:00.458238,21,2,uniform,,COMPLETE
1,0.5657516546629832,2026-09-21 01:09:22.141677,2026-09-21 01:09:22.780972,0 days 00:00:00.639295,5,1,uniform,,COMPLETE
2,0.6030124580864235,2026-09-21 01:09:22.780972,2026-09-21 01:09:23.494253,0 days 00:00:00.713281,41,1,distance,,COMPLETE
3,0.5786968704231664,2026-09-21 01:09:23.494761,2026-09-21 01:09:23.943255,0 days 00:00:00.448494,11,2,uniform,,COMPLETE
4,0.5665010759652392,2026-09-21 01:09:23.943255,2026-09-21 01:09:24.589357,0 days 00:00:00.646102,5,1,distance,,COMPLETE
5,0.5481216995620634,2026-09-21 01:09:24.589357,2026-09-21 01:09:25.017567,0 days 00:00:00.428210,3,2,uniform,,COMPLETE
6,0.5650573449514399,2026-09-21 01:09:25.017567,2026-09-21 01:09:25.466431,0 days 00:00:00.448864,5,2,uniform,,COMPLETE
7,0.5894281405151803,2026-09-21 01:09:25.466431,2026-09-21 01:09:26.043544,0 days 00:00:00.577113,81,2,uniform,,COMPLETE
8,,2026-09-21 01:09:26.043544,2026-09-21 01:09:26.043544,0 days 00:00:00,41,1,distance,,PRUNED
9,,2026-09-21 01:09:26.043544,2026-09-21 01:09:26.043544,0 days 00:00:00,41,1,distance,,PRUNED
10,,2026-09-21 01:09:26.043544,2026-09-21 01:09:26.043544,0 days 00:00:00,41,1,distance,,PRUNED
11,0.5895751337175623,2026-09-21 01:09:26.043544,2026-09-21 01:09:26.537732,0 days 00:00:00.494188,21,2,distance,,COMPLETE
12,,2026-09-21 01:09:26.537732,2026-09-21 01:09:26.542764,0 days 00:00:00.005032,21,2,uniform,,PRUNED
13,0.5871632523028979,2026-09-21 01:09:26.542764,2026-09-21 01:09:27.205573,0 days 00:00:00.662809,21,1,distance,,COMPLETE
14,0.5844329766740675,2026-09-21 01:09:27.205573,2026-09-21 01:09:27.879990,0 days 00:00:00.674417,11,1,uniform,,COMPLETE
15,0.5442251681013656,2026-09-21 01:09:27.879990,2026-09-21 01:09:28.335974,0 days 00:00:00.455984,3,2,distance,,COMPLETE
16,0.5913607846959387,2026-09-21 01:09:28.335974,2026-09-21 01:09:28.914483,0 days 00:00:00.578509,81,2,distance,,COMPLETE
17,0.6010812602467622,2026-09-21 01:09:28.914483,2026-09-21 01:09:29.618154,0 days 00:00:00.703671,41,1,uniform,,COMPLETE
18,,2026-09-21 01:09:29.618154,2026-09-21 01:09:29.618154,0 days 00:00:00,41,1,distance,,PRUNED
19,,2026-09-21 01:09:29.618154,2026-09-21 01:09:29.618154,0 days 00:00:00,41,1,uniform,,PRUNED
20,,2026-09-21 01:09:29.618154,2026-09-21 01:09:29.618154,0 days 00:00:00,41,1,distance,,PRUNED
21,0.5931093208801536,2026-09-21 01:09:29.618154,2026-09-21 01:09:30.284326,0 days 00:00:00.666172,21,1,uniform,,COMPLETE
22,,2026-09-21 01:09:30.284326,2026-09-21 01:09:30.286292,0 days 00:00:00.001966,41,1,uniform,,PRUNED
23,,2026-09-21 01:09:30.286292,2026-09-21 01:09:30.288714,0 days 00:00:00.002422,21,1,uniform,,PRUNED
24,,2026-09-21 01:09:30.288714,2026-09-21 01:09:30.291164,0 days 00:00:00.002450,41,1,uniform,,PRUNED
25,0.593965893969659,2026-09-21 01:09:30.291164,2026-09-21 01:09:31.058975,0 days 00:00:00.767811,81,1,uniform,,COMPLETE
26,,2026-09-21 01:09:31.058975,2026-09-21 01:09:31.058975,0 days 00:00:00,81,1,uniform,,PRUNED
27,,2026-09-21 01:09:31.058975,2026-09-21 01:09:31.058975,0 days 00:00:00,81,1,uniform,,PRUNED
28,0.599802239027661,2026-09-21 01:09:31.058975,2026-09-21 01:09:31.843187,0 days 00:00:00.784212,81,1,distance,,COMPLETE
29,0.5799157704424194,2026-09-21 01:09:31.843187,2026-09-21 01:09:32.488199,0 days 00:00:00.645012,11,1,distance,,COMPLETE
30,0.5397563797563798,2026-09-21 01:09:32.488199,2026-09-21 01:09:33.135803,0 days 00:00:00.647604,3,1,distance,,COMPLETE
31,,2026-09-21 01:09:33.136802,2026-09-21 01:09:33.138803,0 days 00:00:00.002001,81,1,distance,,PRUNED
32,,2026-09-21 01:09:33.138803,2026-09-21 01:09:33.142247,0 days 00:00:00.003444,81,1,distance,,PRUNED
33,,2026-09-21 01:09:33.142247,2026-09-21 01:09:33.146235,0 days 00:00:00.003988,81,1,uniform,,PRUNED
34,,2026-09-21 01:09:33.146235,2026-09-21 01:09:33.148412,0 days 00:00:00.002177,81,1,distance,,PRUNED
35,,2026-09-21 01:09:33.148412,2026-09-21 01:09:33.150418,0 days 00:00:00.002006,5,1,uniform,,PRUNED
36,,2026-09-21 01:09:33.150418,2026-09-21 01:09:33.152415,0 days 00:00:00.001997,81,1,uniform,,PRUNED
37,,2026-09-21 01:09:33.152415,2026-09-21 01:09:33.154415,0 days 00:00:00.002000,41,1,distance,,PRUNED
38,,2026-09-21 01:09:33.154415,2026-09-21 01:09:33.156419,0 days 00:00:00.002004,5,1,uniform,,PRUNED
39,0.561135797213279,2026-09-21 01:09:33.156419,2026-09-21 01:09:33.601085,0 days 00:00:00.444666,5,2,distance,"{'n_neighbors': 5, 'p': 2, 'weights': 'distance'}",COMPLETE
40,,2026-09-21 01:09:33.601085,2026-09-21 01:09:33.603089,0 days 00:00:00.002004,11,1,uniform,,PRUNED
41,,2026-09-21 01:09:33.603089,2026-09-21 01:09:33.603089,0 days 00:00:00,21,1,uniform,,PRUNED
42,,2026-09-21 01:09:33.603089,2026-09-21 01:09:33.603089,0 days 00:00:00,21,1,uniform,,PRUNED
43,,2026-09-21 01:09:33.603089,2026-09-21 01:09:33.603089,0 days 00:00:00,41,1,uniform,,PRUNED
44,0.5501532602256333,2026-09-21 01:09:33.603089,2026-09-21 01:09:34.226341,0 days 00:00:00.623252,3,1,uniform,,COMPLETE
45,,2026-09-21 01:09:34.226341,2026-09-21 01:09:34.226341,0 days 00:00:00,21,1,uniform,,PRUNED
46,,2026-09-21 01:09:34.226341,2026-09-21 01:09:34.233048,0 days 00:00:00.006707,81,1,distance,,PRUNED
47,0.5937870202944272,2026-09-21 01:09:34.233048,2026-09-21 01:09:34.741821,0 days 00:00:00.508773,41,2,uniform,,COMPLETE
48,0.6024872636881812,2026-09-21 01:09:34.741821,2026-09-21 01:09:35.292002,0 days 00:00:00.550181,41,2,distance,,COMPLETE
49,,2026-09-21 01:09:35.292002,2026-09-21 01:09:35.294009,0 days 00:00:00.002007,41,2,distance,,PRUNED
50,,2026-09-21 01:09:35.294009,2026-09-21 01:09:35.294009,0 days 00:00:00,41,2,distance,,PRUNED
51,,2026-09-21 01:09:35.294009,2026-09-21 01:09:35.294009,0 days 00:00:00,41,2,distance,,PRUNED
52,,2026-09-21 01:09:35.294009,2026-09-21 01:09:35.294009,0 days 00:00:00,41,2,distance,,PRUNED
53,,2026-09-21 01:09:35.294009,2026-09-21 01:09:35.294009,0 days 00:00:00,41,2,distance,,PRUNED
54,,2026-09-21 01:09:35.294009,2026-09-21 01:09:35.294009,0 days 00:00:00,41,2,distance,,PRUNED
55,,2026-09-21 01:09:35.294009,2026-09-21 01:09:35.307750,0 days 00:00:00.013741,41,2,uniform,,PRUNED
56,,2026-09-21 01:09:35.307750,2026-09-21 01:09:35.311043,0 days 00:00:00.003293,41,2,distance,,PRUNED
57,0.5783371677211734,2026-09-21 01:09:35.311043,2026-09-21 01:09:35.787837,0 days 00:00:00.476794,11,2,distance,"{'n_neighbors': 11, 'p': 2, 'weights': 'distance'}",COMPLETE
