number,value,datetime_start,datetime_complete,duration,params_C,params_penalty,state
0,0.38817679438593045,2026-09-20 20:18:42.623318,2026-09-20 20:18:42.991769,0 days 00:00:00.368451,0.0011269428740278975,l2,COMPLETE
1,0.5932681759315498,2026-09-20 20:18:42.991769,2026-09-20 20:18:43.431485,0 days 00:00:00.439716,0.6321473437955988,l1,COMPLETE
2,0.5962649389794158,2026-09-20 20:18:43.431485,2026-09-20 20:18:43.816686,0 days 00:00:00.385201,2.3353050713967463,l2,COMPLETE
3,0.0,2026-09-20 20:18:43.816686,2026-09-20 20:18:44.195812,0 days 00:00:00.379126,0.0013862734674883824,l1,COMPLETE
4,0.5951521198860029,2026-09-20 20:18:44.195812,2026-09-20 20:18:45.538327,0 days 00:00:01.342515,231.16564839475382,l1,COMPLETE
5,0.5960847418808646,2026-09-20 20:18:45.538327,2026-09-20 20:18:46.753449,0 days 00:00:01.215122,26.49566712135466,l1,COMPLETE
6,0.5920449215030171,2026-09-20 20:18:46.753449,2026-09-20 20:18:47.137787,0 days 00:00:00.384338,0.5378986610072714,l2,COMPLETE
7,0.5771391623873893,2026-09-20 20:18:47.137787,2026-09-20 20:18:47.533761,0 days 00:00:00.395974,0.020504367354371816,l2,COMPLETE
8,0.596260174983498,2026-09-20 20:18:47.533761,2026-09-20 20:18:47.959526,0 days 00:00:00.425765,20.002626605674976,l2,COMPLETE
9,0.5849096317145303,2026-09-20 20:18:47.959526,2026-09-20 20:18:48.360593,0 days 00:00:00.401067,0.052688370451625756,l2,COMPLETE
10,0.5954068257785131,2026-09-20 20:18:48.360593,2026-09-20 20:18:48.770839,0 days 00:00:00.410246,860.5972307404777,l2,COMPLETE
11,0.5957067784190236,2026-09-20 20:18:48.770839,2026-09-20 20:18:49.184254,0 days 00:00:00.413415,15.354970125296171,l2,COMPLETE
12,0.5957067784190236,2026-09-20 20:18:49.184254,2026-09-20 20:18:49.581734,0 days 00:00:00.397480,12.846243927971477,l2,COMPLETE
13,0.5966333613104241,2026-09-20 20:18:49.581734,2026-09-20 20:18:49.979044,0 days 00:00:00.397310,3.0150671770386297,l2,COMPLETE
14,0.5943295700979823,2026-09-20 20:18:49.979044,2026-09-20 20:18:50.360303,0 days 00:00:00.381259,1.830989309117199,l2,COMPLETE
15,0.5959974650277312,2026-09-20 20:18:50.360303,2026-09-20 20:18:50.776405,0 days 00:00:00.416102,2.5275203115597917,l2,COMPLETE
16,0.5885424579085471,2026-09-20 20:18:50.776405,2026-09-20 20:18:51.168281,0 days 00:00:00.391876,0.0800486422126329,l2,COMPLETE
17,0.5884214978984745,2026-09-20 20:18:51.168281,2026-09-20 20:18:51.565942,0 days 00:00:00.397661,0.1876354798859575,l2,COMPLETE
18,0.5954226476055685,2026-09-20 20:18:51.565942,2026-09-20 20:18:52.866477,0 days 00:00:01.300535,102.2917434075199,l1,COMPLETE
19,0.5959974650277312,2026-09-20 20:18:52.866477,2026-09-20 20:18:53.281542,0 days 00:00:00.415065,3.7017866970543265,l2,COMPLETE
20,0.5685066663161814,2026-09-20 20:18:53.281542,2026-09-20 20:18:53.675820,0 days 00:00:00.394278,0.01303825471949495,l2,COMPLETE
21,0.5965352423633868,2026-09-20 20:18:53.675820,2026-09-20 20:18:54.064818,0 days 00:00:00.388998,5.564869190469078,l2,COMPLETE
22,0.5971819495250371,2026-09-20 20:18:54.064818,2026-09-20 20:18:54.460942,0 days 00:00:00.396124,4.312473456940952,l2,COMPLETE
23,0.5971774195875675,2026-09-20 20:18:54.460942,2026-09-20 20:18:54.874730,0 days 00:00:00.413788,7.066986925560141,l2,COMPLETE
