number,value,datetime_start,datetime_complete,duration,params_n_neighbors,params_p,params_weights,system_attrs_fixed_params,state
0,0.59978474923459,2026-09-20 19:56:40.134679,2026-09-20 19:56:40.638875,0 days 00:00:00.504196,41,2,uniform,,COMPLETE
1,0.6083592030317383,2026-09-20 19:56:40.638875,2026-09-20 19:56:41.418973,0 days 00:00:00.780098,81,1,uniform,,COMPLETE
2,0.586302250603736,2026-09-20 19:56:41.418973,2026-09-20 19:56:41.873533,0 days 00:00:00.454560,11,2,uniform,,COMPLETE
3,0.6020568380225293,2026-09-20 19:56:41.873533,2026-09-20 19:56:42.446980,0 days 00:00:00.573447,81,2,distance,,COMPLETE
4,0.6053265006369618,2026-09-20 19:56:42.446980,2026-09-20 19:56:43.159357,0 days 00:00:00.712377,41,1,distance,,COMPLETE
5,0.5575980561046568,2026-09-20 19:56:43.159357,2026-09-20 19:56:43.788489,0 days 00:00:00.629132,3,1,uniform,,COMPLETE
6,0.5913720188791177,2026-09-20 19:56:43.788489,2026-09-20 19:56:44.442779,0 days 00:00:00.654290,11,1,uniform,,COMPLETE
7,0.6064363661140957,2026-09-20 19:56:44.442779,2026-09-20 19:56:45.106067,0 days 00:00:00.663288,21,1,uniform,,COMPLETE
8,0.5871140080634863,2026-09-20 19:56:45.106067,2026-09-20 19:56:45.745878,0 days 00:00:00.639811,5,1,distance,,COMPLETE
9,,2026-09-20 19:56:45.745878,2026-09-20 19:56:45.749661,0 days 00:00:00.003783,81,1,uniform,,PRUNED
10,,2026-09-20 19:56:45.749661,2026-09-20 19:56:45.749661,0 days 00:00:00,81,2,distance,,PRUNED
11,,2026-09-20 19:56:45.749661,2026-09-20 19:56:45.749661,0 days 00:00:00,21,1,uniform,,PRUNED
12,,2026-09-20 19:56:45.749661,2026-09-20 19:56:45.749661,0 days 00:00:00,21,1,uniform,,PRUNED
13,,2026-09-20 19:56:45.749661,2026-09-20 19:56:45.749661,0 days 00:00:00,21,1,uniform,,PRUNED
14,0.5967024626449103,2026-09-20 19:56:45.749661,2026-09-20 19:56:46.381444,0 days 00:00:00.631783,5,1,uniform,,COMPLETE
15,,2026-09-20 19:56:46.381444,2026-09-20 19:56:46.381444,0 days 00:00:00,3,1,uniform,,PRUNED
16,,2026-09-20 19:56:46.381444,2026-09-20 19:56:46.381444,0 days 00:00:00,21,1,uniform,,PRUNED
17,,2026-09-20 19:56:46.381444,2026-09-20 19:56:46.397442,0 days 00:00:00.015998,81,1,uniform,,PRUNED
18,,2026-09-20 19:56:46.397442,2026-09-20 19:56:46.399626,0 days 00:00:00.002184,81,2,distance,,PRUNED
19,,2026-09-20 19:56:46.399626,2026-09-20 19:56:46.401539,0 days 00:00:00.001913,21,1,uniform,,PRUNED
20,0.6066775866195565,2026-09-20 19:56:46.401539,2026-09-20 19:56:47.091112,0 days 00:00:00.689573,41,1,uniform,,COMPLETE
21,,2026-09-20 19:56:47.091112,2026-09-20 19:56:47.099080,0 days 00:00:00.007968,41,1,uniform,,PRUNED
22,,2026-09-20 19:56:47.099080,2026-09-20 19:56:47.099080,0 days 00:00:00,41,1,uniform,,PRUNED
23,,2026-09-20 19:56:47.099080,2026-09-20 19:56:47.099080,0 days 00:00:00,41,1,uniform,,PRUNED
24,,2026-09-20 19:56:47.099080,2026-09-20 19:56:47.099080,0 days 00:00:00,11,1,uniform,,PRUNED
25,,2026-09-20 19:56:47.099080,2026-09-20 19:56:47.099080,0 days 00:00:00,3,1,uniform,,PRUNED
26,0.5858943431380221,2026-09-20 19:56:47.099080,2026-09-20 19:56:47.531634,0 days 00:00:00.432554,5,2,distance,,COMPLETE
27,,2026-09-20 19:56:47.531634,2026-09-20 19:56:47.531634,0 days 00:00:00,21,1,uniform,,PRUNED
28,,2026-09-20 19:56:47.531634,2026-09-20 19:56:47.531634,0 days 00:00:00,41,1,uniform,,PRUNED
29,0.606198282018964,2026-09-20 19:56:47.531634,2026-09-20 19:56:48.105444,0 days 00:00:00.573810,81,2,uniform,,COMPLETE
30,,2026-09-20 19:56:48.105444,2026-09-20 19:56:48.113847,0 days 00:00:00.008403,41,1,uniform,,PRUNED
31,,2026-09-20 19:56:48.113847,2026-09-20 19:56:48.113847,0 days 00:00:00,81,2,uniform,,PRUNED
32,,2026-09-20 19:56:48.113847,2026-09-20 19:56:48.113847,0 days 00:00:00,81,2,uniform,,PRUNED
33,,2026-09-20 19:56:48.113847,2026-09-20 19:56:48.113847,0 days 00:00:00,81,2,uniform,,PRUNED
34,,2026-09-20 19:56:48.113847,2026-09-20 19:56:48.113847,0 days 00:00:00,81,2,uniform,,PRUNED
35,0.5883759167939325,2026-09-20 19:56:48.113847,2026-09-20 19:56:48.575889,0 days 00:00:00.462042,11,2,distance,,COMPLETE
36,,2026-09-20 19:56:48.575889,2026-09-20 19:56:48.575889,0 days 00:00:00,81,2,uniform,,PRUNED
37,,2026-09-20 19:56:48.575889,2026-09-20 19:56:48.575889,0 days 00:00:00,41,2,uniform,,PRUNED
38,0.5457108187887195,2026-09-20 19:56:48.575889,2026-09-20 19:56:49.264446,0 days 00:00:00.688557,3,1,distance,,COMPLETE
39,,2026-09-20 19:56:49.264446,2026-09-20 19:56:49.267790,0 days 00:00:00.003344,81,2,uniform,,PRUNED
40,,2026-09-20 19:56:49.267790,2026-09-20 19:56:49.269898,0 days 00:00:00.002108,5,1,uniform,,PRUNED
41,,2026-09-20 19:56:49.269898,2026-09-20 19:56:49.269898,0 days 00:00:00,41,1,distance,,PRUNED
42,,2026-09-20 19:56:49.269898,2026-09-20 19:56:49.269898,0 days 00:00:00,41,1,distance,,PRUNED
43,,2026-09-20 19:56:49.269898,2026-09-20 19:56:49.269898,0 days 00:00:00,41,1,distance,,PRUNED
44,0.6007679255180248,2026-09-20 19:56:49.269898,2026-09-20 19:56:49.942335,0 days 00:00:00.672437,21,1,distance,,COMPLETE
45,0.5954837918552511,2026-09-20 19:56:49.942335,2026-09-20 19:56:50.576830,0 days 00:00:00.634495,11,1,distance,,COMPLETE
46,,2026-09-20 19:56:50.576830,2026-09-20 19:56:50.580784,0 days 00:00:00.003954,21,1,uniform,,PRUNED
47,0.6039184968773181,2026-09-20 19:56:50.580784,2026-09-20 19:56:51.350458,0 days 00:00:00.769674,81,1,distance,,COMPLETE
48,,2026-09-20 19:56:51.350458,2026-09-20 19:56:51.365324,0 days 00:00:00.014866,41,1,uniform,,PRUNED
49,,2026-09-20 19:56:51.365324,2026-09-20 19:56:51.366907,0 days 00:00:00.001583,3,1,uniform,,PRUNED
50,0.6023676116999231,2026-09-20 19:56:51.366907,2026-09-20 19:56:51.833287,0 days 00:00:00.466380,21,2,uniform,,COMPLETE
51,,2026-09-20 19:56:51.833287,2026-09-20 19:56:51.849187,0 days 00:00:00.015900,81,1,distance,,PRUNED
52,,2026-09-20 19:56:51.849187,2026-09-20 19:56:51.851899,0 days 00:00:00.002712,81,1,distance,,PRUNED
53,,2026-09-20 19:56:51.851899,2026-09-20 19:56:51.851899,0 days 00:00:00,81,1,distance,,PRUNED
54,,2026-09-20 19:56:51.851899,2026-09-20 19:56:51.851899,0 days 00:00:00,81,1,distance,,PRUNED
55,,2026-09-20 19:56:51.851899,2026-09-20 19:56:51.851899,0 days 00:00:00,5,1,distance,,PRUNED
56,,2026-09-20 19:56:51.851899,2026-09-20 19:56:51.851899,0 days 00:00:00,81,1,distance,,PRUNED
57,,2026-09-20 19:56:51.851899,2026-09-20 19:56:51.862927,0 days 00:00:00.011028,41,1,uniform,,PRUNED
58,,2026-09-20 19:56:51.862927,2026-09-20 19:56:51.862927,0 days 00:00:00,21,1,uniform,,PRUNED
59,0.5934118147754228,2026-09-20 19:56:51.862927,2026-09-20 19:56:52.307681,0 days 00:00:00.444754,5,2,uniform,"{'n_neighbors': 5, 'p': 2, 'weights': 'uniform'}",COMPLETE
60,,2026-09-20 19:56:52.307681,2026-09-20 19:56:52.307681,0 days 00:00:00,81,1,distance,,PRUNED
61,,2026-09-20 19:56:52.307681,2026-09-20 19:56:52.307681,0 days 00:00:00,21,2,uniform,,PRUNED
62,,2026-09-20 19:56:52.307681,2026-09-20 19:56:52.316482,0 days 00:00:00.008801,21,2,uniform,,PRUNED
63,,2026-09-20 19:56:52.316482,2026-09-20 19:56:52.316482,0 days 00:00:00,21,2,uniform,,PRUNED
64,,2026-09-20 19:56:52.316482,2026-09-20 19:56:52.316482,0 days 00:00:00,21,2,uniform,,PRUNED
65,,2026-09-20 19:56:52.316482,2026-09-20 19:56:52.316482,0 days 00:00:00,11,2,uniform,,PRUNED
66,,2026-09-20 19:56:52.316482,2026-09-20 19:56:52.316482,0 days 00:00:00,41,1,uniform,,PRUNED
67,,2026-09-20 19:56:52.316482,2026-09-20 19:56:52.316482,0 days 00:00:00,81,2,uniform,,PRUNED
68,0.596726369943013,2026-09-20 19:56:52.316482,2026-09-20 19:56:52.824302,0 days 00:00:00.507820,21,2,distance,"{'n_neighbors': 21, 'p': 2, 'weights': 'distance'}",COMPLETE
69,,2026-09-20 19:56:52.824302,2026-09-20 19:56:52.826309,0 days 00:00:00.002007,3,1,uniform,,PRUNED
70,,2026-09-20 19:56:52.826309,2026-09-20 19:56:52.828314,0 days 00:00:00.002005,81,1,uniform,,PRUNED
71,,2026-09-20 19:56:52.828314,2026-09-20 19:56:52.832064,0 days 00:00:00.003750,81,2,distance,,PRUNED
72,,2026-09-20 19:56:52.832064,2026-09-20 19:56:52.832064,0 days 00:00:00,81,2,distance,,PRUNED
73,,2026-09-20 19:56:52.832064,2026-09-20 19:56:52.836438,0 days 00:00:00.004374,81,2,distance,,PRUNED
74,0.6010576857275799,2026-09-20 19:56:52.836438,2026-09-20 19:56:53.354837,0 days 00:00:00.518399,41,2,distance,,COMPLETE
75,,2026-09-20 19:56:53.354837,2026-09-20 19:56:53.354837,0 days 00:00:00,81,2,uniform,,PRUNED
76,,2026-09-20 19:56:53.354837,2026-09-20 19:56:53.354837,0 days 00:00:00,21,1,uniform,,PRUNED
77,,2026-09-20 19:56:53.354837,2026-09-20 19:56:53.354837,0 days 00:00:00,41,1,distance,,PRUNED
78,,2026-09-20 19:56:53.354837,2026-09-20 19:56:53.366961,0 days 00:00:00.012124,11,2,uniform,,PRUNED
79,,2026-09-20 19:56:53.366961,2026-09-20 19:56:53.366961,0 days 00:00:00,81,1,distance,,PRUNED
80,,2026-09-20 19:56:53.366961,2026-09-20 19:56:53.366961,0 days 00:00:00,41,1,uniform,,PRUNED
81,,2026-09-20 19:56:53.366961,2026-09-20 19:56:53.366961,0 days 00:00:00,41,2,distance,,PRUNED
82,,2026-09-20 19:56:53.366961,2026-09-20 19:56:53.366961,0 days 00:00:00,41,2,distance,,PRUNED
83,0.5617815669597429,2026-09-20 19:56:53.366961,2026-09-20 19:56:53.801478,0 days 00:00:00.434517,3,2,uniform,"{'n_neighbors': 3, 'p': 2, 'weights': 'uniform'}",COMPLETE
84,,2026-09-20 19:56:53.801478,2026-09-20 19:56:53.801478,0 days 00:00:00,41,2,distance,,PRUNED
85,,2026-09-20 19:56:53.801478,2026-09-20 19:56:53.801478,0 days 00:00:00,41,2,distance,,PRUNED
86,,2026-09-20 19:56:53.801478,2026-09-20 19:56:53.817116,0 days 00:00:00.015638,81,2,distance,,PRUNED
87,,2026-09-20 19:56:53.817116,2026-09-20 19:56:53.817116,0 days 00:00:00,21,1,distance,,PRUNED
88,,2026-09-20 19:56:53.817116,2026-09-20 19:56:53.817116,0 days 00:00:00,41,1,distance,,PRUNED
89,,2026-09-20 19:56:53.817116,2026-09-20 19:56:53.817116,0 days 00:00:00,5,2,uniform,,PRUNED
90,,2026-09-20 19:56:53.817116,2026-09-20 19:56:53.817116,0 days 00:00:00,81,1,distance,,PRUNED
91,,2026-09-20 19:56:53.817116,2026-09-20 19:56:53.817116,0 days 00:00:00,21,1,distance,,PRUNED
92,0.5482415797221014,2026-09-20 19:56:53.817116,2026-09-20 19:56:54.260347,0 days 00:00:00.443231,3,2,distance,"{'n_neighbors': 3, 'p': 2, 'weights': 'distance'}",COMPLETE
