number,value,datetime_start,datetime_complete,duration,params_n_neighbors,params_p,params_weights,system_attrs_fixed_params,state
0,0.5706411128816917,2026-09-20 19:38:49.686602,2026-09-20 19:38:50.266561,0 days 00:00:00.579959,81,2,uniform,,COMPLETE
1,0.5242467207278344,2026-09-20 19:38:50.266561,2026-09-20 19:38:50.716992,0 days 00:00:00.450431,3,2,uniform,,COMPLETE
2,0.5822095289678387,2026-09-20 19:38:50.716992,2026-09-20 19:38:51.216809,0 days 00:00:00.499817,41,2,distance,,COMPLETE
3,0.540202635748365,2026-09-20 19:38:51.216809,2026-09-20 19:38:51.658131,0 days 00:00:00.441322,5,2,distance,,COMPLETE
4,0.5757868450542387,2026-09-20 19:38:51.658131,2026-09-20 19:38:52.129393,0 days 00:00:00.471262,11,2,uniform,,COMPLETE
5,0.5797958676878711,2026-09-20 19:38:52.129393,2026-09-20 19:38:52.810426,0 days 00:00:00.681033,21,1,distance,,COMPLETE
6,,2026-09-20 19:38:52.810426,2026-09-20 19:38:52.810426,0 days 00:00:00,81,2,uniform,,PRUNED
7,0.5844977086000219,2026-09-20 19:38:52.810426,2026-09-20 19:38:53.495496,0 days 00:00:00.685070,41,1,distance,,COMPLETE
8,,2026-09-20 19:38:53.495496,2026-09-20 19:38:53.495496,0 days 00:00:00,41,1,distance,,PRUNED
9,,2026-09-20 19:38:53.495496,2026-09-20 19:38:53.495496,0 days 00:00:00,41,1,distance,,PRUNED
10,0.5689993939007811,2026-09-20 19:38:53.495496,2026-09-20 19:38:54.143748,0 days 00:00:00.648252,11,1,distance,,COMPLETE
11,,2026-09-20 19:38:54.143748,2026-09-20 19:38:54.143748,0 days 00:00:00,41,1,distance,,PRUNED
12,,2026-09-20 19:38:54.143748,2026-09-20 19:38:54.151797,0 days 00:00:00.008049,41,1,distance,,PRUNED
13,,2026-09-20 19:38:54.151797,2026-09-20 19:38:54.151797,0 days 00:00:00,41,2,distance,,PRUNED
14,0.5136269209511527,2026-09-20 19:38:54.151797,2026-09-20 19:38:54.605901,0 days 00:00:00.454104,3,2,distance,,COMPLETE
15,,2026-09-20 19:38:54.605901,2026-09-20 19:38:54.611829,0 days 00:00:00.005928,21,1,distance,,PRUNED
16,0.538737381510833,2026-09-20 19:38:54.611829,2026-09-20 19:38:55.228020,0 days 00:00:00.616191,5,1,distance,,COMPLETE
17,,2026-09-20 19:38:55.228020,2026-09-20 19:38:55.233075,0 days 00:00:00.005055,41,2,distance,,PRUNED
18,0.5855081338905267,2026-09-20 19:38:55.233075,2026-09-20 19:38:55.741918,0 days 00:00:00.508843,41,2,uniform,,COMPLETE
19,0.5852379731669339,2026-09-20 19:38:55.741918,2026-09-20 19:38:56.447326,0 days 00:00:00.705408,41,1,uniform,,COMPLETE
20,0.5826566960142588,2026-09-20 19:38:56.447326,2026-09-20 19:38:56.916134,0 days 00:00:00.468808,21,2,uniform,,COMPLETE
21,,2026-09-20 19:38:56.916134,2026-09-20 19:38:56.918119,0 days 00:00:00.001985,41,1,uniform,,PRUNED
22,,2026-09-20 19:38:56.918119,2026-09-20 19:38:56.918119,0 days 00:00:00,41,1,uniform,,PRUNED
23,,2026-09-20 19:38:56.918119,2026-09-20 19:38:56.918119,0 days 00:00:00,41,1,uniform,,PRUNED
24,,2026-09-20 19:38:56.918119,2026-09-20 19:38:56.918119,0 days 00:00:00,41,1,uniform,,PRUNED
25,0.5749230014362974,2026-09-20 19:38:56.918119,2026-09-20 19:38:57.705115,0 days 00:00:00.786996,81,1,uniform,,COMPLETE
26,0.527374994347943,2026-09-20 19:38:57.705115,2026-09-20 19:38:58.335227,0 days 00:00:00.630112,3,1,uniform,,COMPLETE
27,0.5778774974003413,2026-09-20 19:38:58.335227,2026-09-20 19:38:58.968540,0 days 00:00:00.633313,11,1,uniform,,COMPLETE
28,0.5516030809400053,2026-09-20 19:38:58.968540,2026-09-20 19:38:59.399614,0 days 00:00:00.431074,5,2,uniform,,COMPLETE
29,,2026-09-20 19:38:59.399614,2026-09-20 19:38:59.415261,0 days 00:00:00.015647,81,2,uniform,,PRUNED
30,,2026-09-20 19:38:59.415261,2026-09-20 19:38:59.417268,0 days 00:00:00.002007,41,1,uniform,,PRUNED
31,,2026-09-20 19:38:59.417268,2026-09-20 19:38:59.417268,0 days 00:00:00,21,2,uniform,,PRUNED
32,,2026-09-20 19:38:59.417268,2026-09-20 19:38:59.417268,0 days 00:00:00,21,2,uniform,,PRUNED
33,,2026-09-20 19:38:59.417268,2026-09-20 19:38:59.417268,0 days 00:00:00,21,2,uniform,,PRUNED
34,,2026-09-20 19:38:59.417268,2026-09-20 19:38:59.417268,0 days 00:00:00,21,2,uniform,,PRUNED
35,,2026-09-20 19:38:59.417268,2026-09-20 19:38:59.417268,0 days 00:00:00,3,2,uniform,,PRUNED
36,,2026-09-20 19:38:59.417268,2026-09-20 19:38:59.417268,0 days 00:00:00,41,2,uniform,,PRUNED
37,0.5845166845384865,2026-09-20 19:38:59.417268,2026-09-20 19:39:00.235657,0 days 00:00:00.818389,81,1,distance,"{'n_neighbors': 81, 'p': 1, 'weights': 'distance'}",COMPLETE
38,,2026-09-20 19:39:00.235657,2026-09-20 19:39:00.235657,0 days 00:00:00,81,1,distance,,PRUNED
39,,2026-09-20 19:39:00.235657,2026-09-20 19:39:00.251427,0 days 00:00:00.015770,81,1,distance,,PRUNED
40,,2026-09-20 19:39:00.251427,2026-09-20 19:39:00.251427,0 days 00:00:00,81,1,distance,,PRUNED
41,,2026-09-20 19:39:00.251427,2026-09-20 19:39:00.251427,0 days 00:00:00,11,2,uniform,,PRUNED
42,,2026-09-20 19:39:00.251427,2026-09-20 19:39:00.251427,0 days 00:00:00,5,1,distance,,PRUNED
43,,2026-09-20 19:39:00.251427,2026-09-20 19:39:00.251427,0 days 00:00:00,41,2,distance,,PRUNED
44,0.589431737736701,2026-09-20 19:39:00.251427,2026-09-20 19:39:00.911524,0 days 00:00:00.660097,21,1,uniform,,COMPLETE
45,,2026-09-20 19:39:00.911524,2026-09-20 19:39:00.913528,0 days 00:00:00.002004,81,1,distance,,PRUNED
46,,2026-09-20 19:39:00.913528,2026-09-20 19:39:00.913528,0 days 00:00:00,41,1,uniform,,PRUNED
47,,2026-09-20 19:39:00.913528,2026-09-20 19:39:00.919079,0 days 00:00:00.005551,41,1,distance,,PRUNED
48,,2026-09-20 19:39:00.919079,2026-09-20 19:39:00.921340,0 days 00:00:00.002261,11,1,distance,,PRUNED
49,,2026-09-20 19:39:00.921340,2026-09-20 19:39:00.921340,0 days 00:00:00,21,1,uniform,,PRUNED
50,0.5122930823231033,2026-09-20 19:39:00.921340,2026-09-20 19:39:01.543143,0 days 00:00:00.621803,3,1,distance,,COMPLETE
51,,2026-09-20 19:39:01.543143,2026-09-20 19:39:01.555891,0 days 00:00:00.012748,21,2,uniform,,PRUNED
52,,2026-09-20 19:39:01.555891,2026-09-20 19:39:01.558995,0 days 00:00:00.003104,21,1,uniform,,PRUNED
53,,2026-09-20 19:39:01.558995,2026-09-20 19:39:01.558995,0 days 00:00:00,21,1,uniform,,PRUNED
54,,2026-09-20 19:39:01.558995,2026-09-20 19:39:01.558995,0 days 00:00:00,41,2,uniform,,PRUNED
55,,2026-09-20 19:39:01.558995,2026-09-20 19:39:01.558995,0 days 00:00:00,21,1,uniform,,PRUNED
56,,2026-09-20 19:39:01.558995,2026-09-20 19:39:01.558995,0 days 00:00:00,41,1,distance,,PRUNED
57,,2026-09-20 19:39:01.558995,2026-09-20 19:39:01.558995,0 days 00:00:00,5,2,uniform,,PRUNED
58,,2026-09-20 19:39:01.558995,2026-09-20 19:39:01.558995,0 days 00:00:00,81,1,uniform,,PRUNED
59,0.5752382195381972,2026-09-20 19:39:01.558995,2026-09-20 19:39:02.134166,0 days 00:00:00.575171,81,2,distance,"{'n_neighbors': 81, 'p': 2, 'weights': 'distance'}",COMPLETE
60,,2026-09-20 19:39:02.134166,2026-09-20 19:39:02.141910,0 days 00:00:00.007744,41,1,uniform,,PRUNED
61,,2026-09-20 19:39:02.141910,2026-09-20 19:39:02.141910,0 days 00:00:00,41,2,distance,,PRUNED
62,,2026-09-20 19:39:02.141910,2026-09-20 19:39:02.146806,0 days 00:00:00.004896,41,2,distance,,PRUNED
63,,2026-09-20 19:39:02.146806,2026-09-20 19:39:02.148809,0 days 00:00:00.002003,41,2,distance,,PRUNED
64,,2026-09-20 19:39:02.148809,2026-09-20 19:39:02.150814,0 days 00:00:00.002005,41,2,distance,,PRUNED
65,0.5714408569600485,2026-09-20 19:39:02.150814,2026-09-20 19:39:02.637033,0 days 00:00:00.486219,21,2,distance,,COMPLETE
66,,2026-09-20 19:39:02.637033,2026-09-20 19:39:02.649912,0 days 00:00:00.012879,41,1,uniform,,PRUNED
67,,2026-09-20 19:39:02.649912,2026-09-20 19:39:02.652697,0 days 00:00:00.002785,3,2,uniform,,PRUNED
68,,2026-09-20 19:39:02.652697,2026-09-20 19:39:02.653918,0 days 00:00:00.001221,21,1,distance,,PRUNED
69,,2026-09-20 19:39:02.653918,2026-09-20 19:39:02.653918,0 days 00:00:00,41,2,uniform,,PRUNED
70,,2026-09-20 19:39:02.653918,2026-09-20 19:39:02.653918,0 days 00:00:00,11,1,distance,,PRUNED
71,,2026-09-20 19:39:02.653918,2026-09-20 19:39:02.653918,0 days 00:00:00,21,1,distance,,PRUNED
72,,2026-09-20 19:39:02.653918,2026-09-20 19:39:02.653918,0 days 00:00:00,21,1,distance,,PRUNED
73,,2026-09-20 19:39:02.653918,2026-09-20 19:39:02.653918,0 days 00:00:00,21,1,distance,,PRUNED
74,0.5553801257108649,2026-09-20 19:39:02.653918,2026-09-20 19:39:03.307125,0 days 00:00:00.653207,5,1,uniform,"{'n_neighbors': 5, 'p': 1, 'weights': 'uniform'}",COMPLETE
75,,2026-09-20 19:39:03.307125,2026-09-20 19:39:03.307125,0 days 00:00:00,41,1,distance,,PRUNED
76,,2026-09-20 19:39:03.307125,2026-09-20 19:39:03.307125,0 days 00:00:00,21,2,distance,,PRUNED
77,,2026-09-20 19:39:03.307125,2026-09-20 19:39:03.315160,0 days 00:00:00.008035,81,1,uniform,,PRUNED
78,,2026-09-20 19:39:03.315160,2026-09-20 19:39:03.318807,0 days 00:00:00.003647,41,1,distance,,PRUNED
79,,2026-09-20 19:39:03.318807,2026-09-20 19:39:03.318807,0 days 00:00:00,21,2,uniform,,PRUNED
80,,2026-09-20 19:39:03.318807,2026-09-20 19:39:03.318807,0 days 00:00:00,41,1,distance,,PRUNED
81,,2026-09-20 19:39:03.318807,2026-09-20 19:39:03.318807,0 days 00:00:00,11,1,uniform,,PRUNED
82,,2026-09-20 19:39:03.318807,2026-09-20 19:39:03.318807,0 days 00:00:00,11,1,uniform,,PRUNED
83,0.5645036676286677,2026-09-20 19:39:03.318807,2026-09-20 19:39:03.782123,0 days 00:00:00.463316,11,2,distance,"{'n_neighbors': 11, 'p': 2, 'weights': 'distance'}",COMPLETE
