number,value,datetime_start,datetime_complete,duration,params_n_neighbors,params_p,params_weights,system_attrs_fixed_params,state
0,0.5458175875774659,2026-09-21 01:29:22.361548,2026-09-21 01:29:22.789597,0 days 00:00:00.428049,3,2,distance,,COMPLETE
1,0.5998655818094734,2026-09-21 01:29:22.789597,2026-09-21 01:29:23.375622,0 days 00:00:00.586025,81,2,distance,,COMPLETE
2,0.6016660370703278,2026-09-21 01:29:23.375622,2026-09-21 01:29:24.081225,0 days 00:00:00.705603,41,1,uniform,,COMPLETE
3,,2026-09-21 01:29:24.081225,2026-09-21 01:29:24.081225,0 days 00:00:00,41,1,uniform,,PRUNED
4,0.5706724676606283,2026-09-21 01:29:24.081225,2026-09-21 01:29:24.543938,0 days 00:00:00.462713,5,2,uniform,,COMPLETE
5,,2026-09-21 01:29:24.543938,2026-09-21 01:29:24.543938,0 days 00:00:00,81,2,distance,,PRUNED
6,0.5660688959164965,2026-09-21 01:29:24.543938,2026-09-21 01:29:25.159975,0 days 00:00:00.616037,5,1,distance,,COMPLETE
7,0.5766062716628279,2026-09-21 01:29:25.159975,2026-09-21 01:29:25.614186,0 days 00:00:00.454211,11,2,distance,,COMPLETE
8,0.5889743937212629,2026-09-21 01:29:25.614186,2026-09-21 01:29:26.267379,0 days 00:00:00.653193,21,1,uniform,,COMPLETE
9,,2026-09-21 01:29:26.267379,2026-09-21 01:29:26.267379,0 days 00:00:00,41,1,uniform,,PRUNED
10,,2026-09-21 01:29:26.267379,2026-09-21 01:29:26.267379,0 days 00:00:00,41,1,uniform,,PRUNED
11,,2026-09-21 01:29:26.267379,2026-09-21 01:29:26.267379,0 days 00:00:00,81,2,distance,,PRUNED
12,0.6049080515522599,2026-09-21 01:29:26.267379,2026-09-21 01:29:26.855573,0 days 00:00:00.588194,81,2,uniform,,COMPLETE
13,0.5802077046696809,2026-09-21 01:29:26.855573,2026-09-21 01:29:27.510943,0 days 00:00:00.655370,11,1,uniform,,COMPLETE
14,0.5563240078992359,2026-09-21 01:29:27.510943,2026-09-21 01:29:27.962993,0 days 00:00:00.452050,3,2,uniform,,COMPLETE
15,,2026-09-21 01:29:27.962993,2026-09-21 01:29:27.962993,0 days 00:00:00,21,1,uniform,,PRUNED
16,,2026-09-21 01:29:27.962993,2026-09-21 01:29:27.962993,0 days 00:00:00,41,1,uniform,,PRUNED
17,,2026-09-21 01:29:27.962993,2026-09-21 01:29:27.962993,0 days 00:00:00,81,2,uniform,,PRUNED
18,0.6029686839082841,2026-09-21 01:29:27.962993,2026-09-21 01:29:28.745863,0 days 00:00:00.782870,81,1,uniform,,COMPLETE
19,,2026-09-21 01:29:28.745863,2026-09-21 01:29:28.745863,0 days 00:00:00,81,2,uniform,,PRUNED
20,,2026-09-21 01:29:28.745863,2026-09-21 01:29:28.745863,0 days 00:00:00,81,2,uniform,,PRUNED
21,,2026-09-21 01:29:28.745863,2026-09-21 01:29:28.754016,0 days 00:00:00.008153,81,1,uniform,,PRUNED
22,,2026-09-21 01:29:28.754016,2026-09-21 01:29:28.754016,0 days 00:00:00,41,1,uniform,,PRUNED
23,,2026-09-21 01:29:28.754016,2026-09-21 01:29:28.754016,0 days 00:00:00,81,1,uniform,,PRUNED
24,0.5575513456531304,2026-09-21 01:29:28.754016,2026-09-21 01:29:29.400055,0 days 00:00:00.646039,3,1,uniform,,COMPLETE
25,,2026-09-21 01:29:29.400055,2026-09-21 01:29:29.400563,0 days 00:00:00.000508,11,1,uniform,,PRUNED
26,0.5723497203672793,2026-09-21 01:29:29.400563,2026-09-21 01:29:30.048503,0 days 00:00:00.647940,5,1,uniform,,COMPLETE
27,,2026-09-21 01:29:30.048503,2026-09-21 01:29:30.056364,0 days 00:00:00.007861,41,1,uniform,,PRUNED
28,0.5930705995712136,2026-09-21 01:29:30.056364,2026-09-21 01:29:30.555108,0 days 00:00:00.498744,21,2,uniform,,COMPLETE
29,,2026-09-21 01:29:30.555108,2026-09-21 01:29:30.555108,0 days 00:00:00,3,2,distance,,PRUNED
30,,2026-09-21 01:29:30.555108,2026-09-21 01:29:30.555108,0 days 00:00:00,81,1,uniform,,PRUNED
31,,2026-09-21 01:29:30.555108,2026-09-21 01:29:30.563365,0 days 00:00:00.008257,81,2,distance,,PRUNED
32,,2026-09-21 01:29:30.563365,2026-09-21 01:29:30.565103,0 days 00:00:00.001738,81,2,distance,,PRUNED
33,,2026-09-21 01:29:30.565103,2026-09-21 01:29:30.568235,0 days 00:00:00.003132,81,2,distance,,PRUNED
34,,2026-09-21 01:29:30.568235,2026-09-21 01:29:30.568235,0 days 00:00:00,81,2,distance,,PRUNED
35,0.5648837199924848,2026-09-21 01:29:30.568235,2026-09-21 01:29:31.002862,0 days 00:00:00.434627,5,2,distance,,COMPLETE
36,0.5942294820832622,2026-09-21 01:29:31.002862,2026-09-21 01:29:31.526979,0 days 00:00:00.524117,41,2,distance,,COMPLETE
37,,2026-09-21 01:29:31.526979,2026-09-21 01:29:31.526979,0 days 00:00:00,81,2,distance,,PRUNED
38,,2026-09-21 01:29:31.526979,2026-09-21 01:29:31.537692,0 days 00:00:00.010713,11,1,uniform,,PRUNED
39,,2026-09-21 01:29:31.537692,2026-09-21 01:29:31.540684,0 days 00:00:00.002992,41,1,uniform,,PRUNED
40,0.5858760032660076,2026-09-21 01:29:31.540684,2026-09-21 01:29:32.003967,0 days 00:00:00.463283,21,2,distance,,COMPLETE
41,,2026-09-21 01:29:32.003967,2026-09-21 01:29:32.005977,0 days 00:00:00.002010,41,2,distance,,PRUNED
42,,2026-09-21 01:29:32.005977,2026-09-21 01:29:32.007999,0 days 00:00:00.002022,41,2,distance,,PRUNED
43,,2026-09-21 01:29:32.007999,2026-09-21 01:29:32.010001,0 days 00:00:00.002002,41,2,distance,,PRUNED
44,,2026-09-21 01:29:32.010001,2026-09-21 01:29:32.012000,0 days 00:00:00.001999,41,2,distance,,PRUNED
45,,2026-09-21 01:29:32.012000,2026-09-21 01:29:32.014000,0 days 00:00:00.002000,81,2,distance,,PRUNED
46,,2026-09-21 01:29:32.014000,2026-09-21 01:29:32.016000,0 days 00:00:00.002000,5,1,uniform,,PRUNED
47,,2026-09-21 01:29:32.016000,2026-09-21 01:29:32.020998,0 days 00:00:00.004998,41,2,distance,,PRUNED
48,,2026-09-21 01:29:32.020998,2026-09-21 01:29:32.022001,0 days 00:00:00.001003,3,1,uniform,,PRUNED
49,0.5795344632047471,2026-09-21 01:29:32.022001,2026-09-21 01:29:32.651169,0 days 00:00:00.629168,11,1,distance,"{'n_neighbors': 11, 'p': 1, 'weights': 'distance'}",COMPLETE
50,,2026-09-21 01:29:32.651169,2026-09-21 01:29:32.651169,0 days 00:00:00,81,2,uniform,,PRUNED
51,,2026-09-21 01:29:32.651169,2026-09-21 01:29:32.651169,0 days 00:00:00,21,2,uniform,,PRUNED
52,,2026-09-21 01:29:32.651169,2026-09-21 01:29:32.651169,0 days 00:00:00,21,2,uniform,,PRUNED
53,,2026-09-21 01:29:32.651169,2026-09-21 01:29:32.651169,0 days 00:00:00,21,2,uniform,,PRUNED
54,,2026-09-21 01:29:32.664964,2026-09-21 01:29:32.666971,0 days 00:00:00.002007,21,2,uniform,,PRUNED
55,,2026-09-21 01:29:32.666971,2026-09-21 01:29:32.666971,0 days 00:00:00,21,2,uniform,,PRUNED
56,,2026-09-21 01:29:32.666971,2026-09-21 01:29:32.666971,0 days 00:00:00,81,2,uniform,,PRUNED
57,,2026-09-21 01:29:32.666971,2026-09-21 01:29:32.666971,0 days 00:00:00,41,1,uniform,,PRUNED
58,0.5987119720279864,2026-09-21 01:29:32.666971,2026-09-21 01:29:33.356771,0 days 00:00:00.689800,41,1,distance,"{'n_neighbors': 41, 'p': 1, 'weights': 'distance'}",COMPLETE
59,,2026-09-21 01:29:33.356771,2026-09-21 01:29:33.356771,0 days 00:00:00,41,1,distance,,PRUNED
60,,2026-09-21 01:29:33.356771,2026-09-21 01:29:33.356771,0 days 00:00:00,41,1,distance,,PRUNED
61,,2026-09-21 01:29:33.356771,2026-09-21 01:29:33.356771,0 days 00:00:00,41,1,distance,,PRUNED
62,,2026-09-21 01:29:33.356771,2026-09-21 01:29:33.356771,0 days 00:00:00,81,1,uniform,,PRUNED
63,,2026-09-21 01:29:33.356771,2026-09-21 01:29:33.373019,0 days 00:00:00.016248,41,1,uniform,,PRUNED
64,0.5454410461208263,2026-09-21 01:29:33.373019,2026-09-21 01:29:34.018033,0 days 00:00:00.645014,3,1,distance,,COMPLETE
65,,2026-09-21 01:29:34.018033,2026-09-21 01:29:34.022696,0 days 00:00:00.004663,81,2,uniform,,PRUNED
66,,2026-09-21 01:29:34.022696,2026-09-21 01:29:34.022696,0 days 00:00:00,5,2,distance,,PRUNED
67,,2026-09-21 01:29:34.022696,2026-09-21 01:29:34.022696,0 days 00:00:00,81,1,uniform,,PRUNED
68,,2026-09-21 01:29:34.022696,2026-09-21 01:29:34.022696,0 days 00:00:00,11,2,distance,,PRUNED
69,,2026-09-21 01:29:34.022696,2026-09-21 01:29:34.031619,0 days 00:00:00.008923,41,1,uniform,,PRUNED
70,,2026-09-21 01:29:34.031619,2026-09-21 01:29:34.035321,0 days 00:00:00.003702,81,2,distance,,PRUNED
71,,2026-09-21 01:29:34.035321,2026-09-21 01:29:34.037329,0 days 00:00:00.002008,21,1,uniform,,PRUNED
72,,2026-09-21 01:29:34.037329,2026-09-21 01:29:34.039337,0 days 00:00:00.002008,21,1,uniform,,PRUNED
73,0.5999988267879751,2026-09-21 01:29:34.039337,2026-09-21 01:29:34.849682,0 days 00:00:00.810345,81,1,distance,"{'n_neighbors': 81, 'p': 1, 'weights': 'distance'}",COMPLETE
74,,2026-09-21 01:29:34.849682,2026-09-21 01:29:34.849682,0 days 00:00:00,81,1,distance,,PRUNED
75,,2026-09-21 01:29:34.849682,2026-09-21 01:29:34.854152,0 days 00:00:00.004470,81,1,distance,,PRUNED
76,,2026-09-21 01:29:34.854152,2026-09-21 01:29:34.854152,0 days 00:00:00,81,1,distance,,PRUNED
77,,2026-09-21 01:29:34.854152,2026-09-21 01:29:34.854152,0 days 00:00:00,81,2,distance,,PRUNED
78,,2026-09-21 01:29:34.854152,2026-09-21 01:29:34.854152,0 days 00:00:00,41,1,distance,,PRUNED
79,,2026-09-21 01:29:34.854152,2026-09-21 01:29:34.863556,0 days 00:00:00.009404,81,2,distance,,PRUNED
80,,2026-09-21 01:29:34.863556,2026-09-21 01:29:34.863556,0 days 00:00:00,41,1,distance,,PRUNED
81,,2026-09-21 01:29:34.863556,2026-09-21 01:29:34.863556,0 days 00:00:00,21,1,uniform,,PRUNED
82,0.5855327193779628,2026-09-21 01:29:34.863556,2026-09-21 01:29:35.530865,0 days 00:00:00.667309,21,1,distance,"{'n_neighbors': 21, 'p': 1, 'weights': 'distance'}",COMPLETE
83,,2026-09-21 01:29:35.530865,2026-09-21 01:29:35.530865,0 days 00:00:00,5,1,uniform,,PRUNED
84,,2026-09-21 01:29:35.530865,2026-09-21 01:29:35.530865,0 days 00:00:00,3,1,uniform,,PRUNED
85,,2026-09-21 01:29:35.530865,2026-09-21 01:29:35.530865,0 days 00:00:00,21,2,uniform,,PRUNED
86,,2026-09-21 01:29:35.530865,2026-09-21 01:29:35.546781,0 days 00:00:00.015916,81,1,uniform,,PRUNED
87,0.5810893753043754,2026-09-21 01:29:35.546781,2026-09-21 01:29:36.007155,0 days 00:00:00.460374,11,2,uniform,,COMPLETE
88,,2026-09-21 01:29:36.007155,2026-09-21 01:29:36.007155,0 days 00:00:00,41,1,uniform,,PRUNED
89,,2026-09-21 01:29:36.007155,2026-09-21 01:29:36.007155,0 days 00:00:00,21,2,uniform,,PRUNED
90,,2026-09-21 01:29:36.007155,2026-09-21 01:29:36.022840,0 days 00:00:00.015685,81,2,distance,,PRUNED
91,,2026-09-21 01:29:36.022840,2026-09-21 01:29:36.022840,0 days 00:00:00,21,2,distance,,PRUNED
92,,2026-09-21 01:29:36.022840,2026-09-21 01:29:36.022840,0 days 00:00:00,21,2,distance,,PRUNED
93,,2026-09-21 01:29:36.022840,2026-09-21 01:29:36.022840,0 days 00:00:00,21,2,distance,,PRUNED
94,,2026-09-21 01:29:36.022840,2026-09-21 01:29:36.022840,0 days 00:00:00,21,2,distance,,PRUNED
95,,2026-09-21 01:29:36.022840,2026-09-21 01:29:36.022840,0 days 00:00:00,41,2,distance,,PRUNED
96,0.5991969011742642,2026-09-21 01:29:36.022840,2026-09-21 01:29:36.543237,0 days 00:00:00.520397,41,2,uniform,"{'n_neighbors': 41, 'p': 2, 'weights': 'uniform'}",COMPLETE
