number,value,datetime_start,datetime_complete,duration,params_n_neighbors,params_p,params_weights,system_attrs_fixed_params,state
0,0.5706724676606283,2026-09-20 19:57:15.782276,2026-09-20 19:57:16.230655,0 days 00:00:00.448379,5,2,uniform,,COMPLETE
1,0.5998655818094734,2026-09-20 19:57:16.230655,2026-09-20 19:57:16.813808,0 days 00:00:00.583153,81,2,distance,,COMPLETE
2,0.5810893753043754,2026-09-20 19:57:16.813808,2026-09-20 19:57:17.289663,0 days 00:00:00.475855,11,2,uniform,,COMPLETE
3,0.5723497203672793,2026-09-20 19:57:17.289663,2026-09-20 19:57:17.942077,0 days 00:00:00.652414,5,1,uniform,,COMPLETE
4,0.5855327193779628,2026-09-20 19:57:17.942077,2026-09-20 19:57:18.617767,0 days 00:00:00.675690,21,1,distance,,COMPLETE
5,0.5795344632047471,2026-09-20 19:57:18.617767,2026-09-20 19:57:19.276761,0 days 00:00:00.658994,11,1,distance,,COMPLETE
6,0.6049080515522599,2026-09-20 19:57:19.278701,2026-09-20 19:57:19.831526,0 days 00:00:00.552825,81,2,uniform,,COMPLETE
7,0.5563240078992359,2026-09-20 19:57:19.831526,2026-09-20 19:57:20.258372,0 days 00:00:00.426846,3,2,uniform,,COMPLETE
8,0.5991969011742642,2026-09-20 19:57:20.258372,2026-09-20 19:57:20.799446,0 days 00:00:00.541074,41,2,uniform,,COMPLETE
9,,2026-09-20 19:57:20.799446,2026-09-20 19:57:20.799446,0 days 00:00:00,81,2,uniform,,PRUNED
10,0.5999988267879751,2026-09-20 19:57:20.799446,2026-09-20 19:57:21.568735,0 days 00:00:00.769289,81,1,distance,,COMPLETE
11,,2026-09-20 19:57:21.568735,2026-09-20 19:57:21.572180,0 days 00:00:00.003445,81,1,distance,,PRUNED
12,,2026-09-20 19:57:21.572180,2026-09-20 19:57:21.572180,0 days 00:00:00,81,1,distance,,PRUNED
13,,2026-09-20 19:57:21.572180,2026-09-20 19:57:21.572180,0 days 00:00:00,81,1,distance,,PRUNED
14,,2026-09-20 19:57:21.572180,2026-09-20 19:57:21.572180,0 days 00:00:00,3,2,uniform,,PRUNED
15,0.5987119720279864,2026-09-20 19:57:21.572180,2026-09-20 19:57:22.291322,0 days 00:00:00.719142,41,1,distance,,COMPLETE
16,,2026-09-20 19:57:22.291322,2026-09-20 19:57:22.291322,0 days 00:00:00,21,1,distance,,PRUNED
17,,2026-09-20 19:57:22.291322,2026-09-20 19:57:22.291322,0 days 00:00:00,81,2,uniform,,PRUNED
18,,2026-09-20 19:57:22.291322,2026-09-20 19:57:22.291322,0 days 00:00:00,81,2,distance,,PRUNED
19,0.6029686839082841,2026-09-20 19:57:22.291322,2026-09-20 19:57:23.070208,0 days 00:00:00.778886,81,1,uniform,,COMPLETE
20,0.5930705995712136,2026-09-20 19:57:23.070208,2026-09-20 19:57:23.561060,0 days 00:00:00.490852,21,2,uniform,,COMPLETE
21,,2026-09-20 19:57:23.561060,2026-09-20 19:57:23.561060,0 days 00:00:00,81,1,uniform,,PRUNED
22,,2026-09-20 19:57:23.561060,2026-09-20 19:57:23.561060,0 days 00:00:00,81,1,uniform,,PRUNED
23,,2026-09-20 19:57:23.561060,2026-09-20 19:57:23.561060,0 days 00:00:00,81,1,uniform,,PRUNED
24,,2026-09-20 19:57:23.561060,2026-09-20 19:57:23.571332,0 days 00:00:00.010272,81,1,uniform,,PRUNED
25,0.5802077046696809,2026-09-20 19:57:23.571332,2026-09-20 19:57:24.219376,0 days 00:00:00.648044,11,1,uniform,,COMPLETE
26,0.5660688959164965,2026-09-20 19:57:24.219376,2026-09-20 19:57:24.833997,0 days 00:00:00.614621,5,1,distance,,COMPLETE
27,0.5575513456531304,2026-09-20 19:57:24.833997,2026-09-20 19:57:25.461425,0 days 00:00:00.627428,3,1,uniform,,COMPLETE
28,0.5942294820832622,2026-09-20 19:57:25.461425,2026-09-20 19:57:25.962938,0 days 00:00:00.501513,41,2,distance,,COMPLETE
29,,2026-09-20 19:57:25.962938,2026-09-20 19:57:25.964951,0 days 00:00:00.002013,5,2,uniform,,PRUNED
30,,2026-09-20 19:57:25.964951,2026-09-20 19:57:25.969486,0 days 00:00:00.004535,81,1,uniform,,PRUNED
31,,2026-09-20 19:57:25.969486,2026-09-20 19:57:25.970691,0 days 00:00:00.001205,81,2,distance,,PRUNED
32,,2026-09-20 19:57:25.970691,2026-09-20 19:57:25.970691,0 days 00:00:00,81,2,distance,,PRUNED
33,,2026-09-20 19:57:25.970691,2026-09-20 19:57:25.973699,0 days 00:00:00.003008,81,2,distance,,PRUNED
34,0.5766062716628279,2026-09-20 19:57:25.975748,2026-09-20 19:57:26.414430,0 days 00:00:00.438682,11,2,distance,,COMPLETE
35,,2026-09-20 19:57:26.414430,2026-09-20 19:57:26.414430,0 days 00:00:00,81,2,distance,,PRUNED
36,0.5648837199924848,2026-09-20 19:57:26.414430,2026-09-20 19:57:26.857003,0 days 00:00:00.442573,5,2,distance,,COMPLETE
37,,2026-09-20 19:57:26.857003,2026-09-20 19:57:26.857003,0 days 00:00:00,81,1,uniform,,PRUNED
38,,2026-09-20 19:57:26.857003,2026-09-20 19:57:26.857003,0 days 00:00:00,21,2,uniform,,PRUNED
39,0.5454410461208263,2026-09-20 19:57:26.857003,2026-09-20 19:57:27.481744,0 days 00:00:00.624741,3,1,distance,,COMPLETE
40,,2026-09-20 19:57:27.481744,2026-09-20 19:57:27.488990,0 days 00:00:00.007246,11,2,uniform,,PRUNED
41,,2026-09-20 19:57:27.488990,2026-09-20 19:57:27.488990,0 days 00:00:00,41,2,uniform,,PRUNED
42,,2026-09-20 19:57:27.488990,2026-09-20 19:57:27.493417,0 days 00:00:00.004427,41,2,uniform,,PRUNED
43,,2026-09-20 19:57:27.493417,2026-09-20 19:57:27.493417,0 days 00:00:00,41,2,uniform,,PRUNED
44,,2026-09-20 19:57:27.493417,2026-09-20 19:57:27.493417,0 days 00:00:00,41,2,uniform,,PRUNED
45,,2026-09-20 19:57:27.493417,2026-09-20 19:57:27.493417,0 days 00:00:00,81,1,distance,,PRUNED
46,,2026-09-20 19:57:27.493417,2026-09-20 19:57:27.493417,0 days 00:00:00,81,2,uniform,,PRUNED
47,,2026-09-20 19:57:27.493417,2026-09-20 19:57:27.493417,0 days 00:00:00,41,2,distance,,PRUNED
48,0.5889743937212629,2026-09-20 19:57:27.493417,2026-09-20 19:57:28.182952,0 days 00:00:00.689535,21,1,uniform,"{'n_neighbors': 21, 'p': 1, 'weights': 'uniform'}",COMPLETE
49,,2026-09-20 19:57:28.182952,2026-09-20 19:57:28.182952,0 days 00:00:00,81,2,distance,,PRUNED
50,,2026-09-20 19:57:28.182952,2026-09-20 19:57:28.182952,0 days 00:00:00,3,1,uniform,,PRUNED
51,,2026-09-20 19:57:28.182952,2026-09-20 19:57:28.182952,0 days 00:00:00,41,1,distance,,PRUNED
52,,2026-09-20 19:57:28.182952,2026-09-20 19:57:28.182952,0 days 00:00:00,41,1,distance,,PRUNED
53,,2026-09-20 19:57:28.182952,2026-09-20 19:57:28.182952,0 days 00:00:00,41,1,distance,,PRUNED
54,,2026-09-20 19:57:28.182952,2026-09-20 19:57:28.198590,0 days 00:00:00.015638,81,1,distance,,PRUNED
55,,2026-09-20 19:57:28.198590,2026-09-20 19:57:28.198590,0 days 00:00:00,41,1,distance,,PRUNED
56,,2026-09-20 19:57:28.198590,2026-09-20 19:57:28.198590,0 days 00:00:00,81,1,uniform,,PRUNED
57,0.6016660370703278,2026-09-20 19:57:28.198590,2026-09-20 19:57:28.894450,0 days 00:00:00.695860,41,1,uniform,"{'n_neighbors': 41, 'p': 1, 'weights': 'uniform'}",COMPLETE
58,,2026-09-20 19:57:28.894450,2026-09-20 19:57:28.897450,0 days 00:00:00.003000,5,2,uniform,,PRUNED
59,,2026-09-20 19:57:28.897450,2026-09-20 19:57:28.900203,0 days 00:00:00.002753,81,1,uniform,,PRUNED
60,,2026-09-20 19:57:28.901202,2026-09-20 19:57:28.903202,0 days 00:00:00.002000,11,1,uniform,,PRUNED
61,,2026-09-20 19:57:28.903202,2026-09-20 19:57:28.905203,0 days 00:00:00.002001,41,1,uniform,,PRUNED
62,,2026-09-20 19:57:28.905203,2026-09-20 19:57:28.908203,0 days 00:00:00.003000,41,1,uniform,,PRUNED
63,,2026-09-20 19:57:28.908203,2026-09-20 19:57:28.910203,0 days 00:00:00.002000,41,1,distance,,PRUNED
64,,2026-09-20 19:57:28.910203,2026-09-20 19:57:28.912203,0 days 00:00:00.002000,81,1,uniform,,PRUNED
65,0.5858760032660076,2026-09-20 19:57:28.913202,2026-09-20 19:57:29.376974,0 days 00:00:00.463772,21,2,distance,,COMPLETE
66,,2026-09-20 19:57:29.376974,2026-09-20 19:57:29.382715,0 days 00:00:00.005741,81,1,uniform,,PRUNED
67,,2026-09-20 19:57:29.382715,2026-09-20 19:57:29.382715,0 days 00:00:00,41,2,distance,,PRUNED
68,,2026-09-20 19:57:29.382715,2026-09-20 19:57:29.382715,0 days 00:00:00,81,1,uniform,,PRUNED
69,0.5458175875774659,2026-09-20 19:57:29.382715,2026-09-20 19:57:29.814705,0 days 00:00:00.431990,3,2,distance,,COMPLETE
