number,value,datetime_start,datetime_complete,duration,params_n_neighbors,params_p,params_weights,system_attrs_fixed_params,state
0,0.5851403139516111,2026-09-19 22:24:33.728271,2026-09-19 22:24:35.842050,0 days 00:00:02.113779,21,2,distance,,COMPLETE
1,0.5930999562596503,2026-09-19 22:24:35.842050,2026-09-19 22:24:38.129487,0 days 00:00:02.287437,81,2,uniform,,COMPLETE
2,0.540548470066005,2026-09-19 22:24:38.129487,2026-09-19 22:24:40.043914,0 days 00:00:01.914427,5,2,distance,,COMPLETE
3,0.6141645545389676,2026-09-19 22:24:40.043914,2026-09-19 22:24:42.041428,0 days 00:00:01.997514,41,1,uniform,,COMPLETE
4,0.5375169553689768,2026-09-19 22:24:42.041428,2026-09-19 22:24:42.824716,0 days 00:00:00.783288,3,2,uniform,,COMPLETE
5,,2026-09-19 22:24:42.824716,2026-09-19 22:24:42.824716,0 days 00:00:00,3,2,uniform,,PRUNED
6,0.5911422216588488,2026-09-19 22:24:42.824716,2026-09-19 22:24:43.845647,0 days 00:00:01.020931,81,2,distance,,COMPLETE
7,0.609761404267644,2026-09-19 22:24:43.845647,2026-09-19 22:24:45.010766,0 days 00:00:01.165119,41,1,distance,,COMPLETE
8,0.5936125467930177,2026-09-19 22:24:45.010766,2026-09-19 22:24:46.160213,0 days 00:00:01.149447,11,1,uniform,,COMPLETE
9,,2026-09-19 22:24:46.160213,2026-09-19 22:24:46.160213,0 days 00:00:00,41,1,uniform,,PRUNED
10,,2026-09-19 22:24:46.160213,2026-09-19 22:24:46.160213,0 days 00:00:00,41,1,uniform,,PRUNED
11,,2026-09-19 22:24:46.160213,2026-09-19 22:24:46.175230,0 days 00:00:00.015017,41,1,distance,,PRUNED
12,,2026-09-19 22:24:46.175230,2026-09-19 22:24:46.175230,0 days 00:00:00,41,1,distance,,PRUNED
13,,2026-09-19 22:24:46.175230,2026-09-19 22:24:46.175230,0 days 00:00:00,41,1,distance,,PRUNED
14,0.5699878833258033,2026-09-19 22:24:46.175230,2026-09-19 22:24:47.344719,0 days 00:00:01.169489,5,1,uniform,,COMPLETE
15,0.5818516998469107,2026-09-19 22:24:47.344719,2026-09-19 22:24:48.465529,0 days 00:00:01.120810,11,1,distance,,COMPLETE
16,0.5987027557512102,2026-09-19 22:24:48.465529,2026-09-19 22:24:49.561401,0 days 00:00:01.095872,21,1,distance,,COMPLETE
17,,2026-09-19 22:24:49.561401,2026-09-19 22:24:49.561401,0 days 00:00:00,41,1,uniform,,PRUNED
18,,2026-09-19 22:24:49.561401,2026-09-19 22:24:49.561401,0 days 00:00:00,41,1,distance,,PRUNED
19,,2026-09-19 22:24:49.561401,2026-09-19 22:24:49.561401,0 days 00:00:00,41,1,uniform,,PRUNED
20,0.6075649161438736,2026-09-19 22:24:49.561401,2026-09-19 22:24:50.829599,0 days 00:00:01.268198,81,1,distance,,COMPLETE
21,0.5518279289550074,2026-09-19 22:24:50.829599,2026-09-19 22:24:51.918580,0 days 00:00:01.088981,5,1,distance,,COMPLETE
22,,2026-09-19 22:24:51.918580,2026-09-19 22:24:51.919466,0 days 00:00:00.000886,81,1,distance,,PRUNED
23,,2026-09-19 22:24:51.919466,2026-09-19 22:24:51.922626,0 days 00:00:00.003160,81,1,distance,,PRUNED
24,,2026-09-19 22:24:51.922626,2026-09-19 22:24:51.924230,0 days 00:00:00.001604,81,1,distance,,PRUNED
25,,2026-09-19 22:24:51.924230,2026-09-19 22:24:51.926434,0 days 00:00:00.002204,21,1,distance,,PRUNED
26,0.5487570056260153,2026-09-19 22:24:51.926434,2026-09-19 22:24:52.942185,0 days 00:00:01.015751,3,1,uniform,,COMPLETE
27,,2026-09-19 22:24:52.942185,2026-09-19 22:24:52.946645,0 days 00:00:00.004460,11,1,distance,,PRUNED
28,0.6093478070750797,2026-09-19 22:24:52.946645,2026-09-19 22:24:54.236725,0 days 00:00:01.290080,81,1,uniform,,COMPLETE
29,0.5913140215181715,2026-09-19 22:24:54.236725,2026-09-19 22:24:54.986058,0 days 00:00:00.749333,21,2,uniform,,COMPLETE
30,,2026-09-19 22:24:54.986058,2026-09-19 22:24:54.990112,0 days 00:00:00.004054,41,1,uniform,,PRUNED
31,,2026-09-19 22:24:54.990470,2026-09-19 22:24:54.991005,0 days 00:00:00.000535,81,1,uniform,,PRUNED
32,,2026-09-19 22:24:54.991005,2026-09-19 22:24:54.991005,0 days 00:00:00,81,1,uniform,,PRUNED
33,,2026-09-19 22:24:54.991005,2026-09-19 22:24:54.996902,0 days 00:00:00.005897,81,1,uniform,,PRUNED
34,,2026-09-19 22:24:54.996902,2026-09-19 22:24:55.001434,0 days 00:00:00.004532,81,2,distance,,PRUNED
35,,2026-09-19 22:24:55.001434,2026-09-19 22:24:55.001434,0 days 00:00:00,81,2,uniform,,PRUNED
36,0.5324371800728455,2026-09-19 22:24:55.001434,2026-09-19 22:24:56.454029,0 days 00:00:01.452595,3,1,distance,,COMPLETE
37,0.5556134670909683,2026-09-19 22:24:56.454029,2026-09-19 22:24:57.230914,0 days 00:00:00.776885,5,2,uniform,,COMPLETE
38,,2026-09-19 22:24:57.230914,2026-09-19 22:24:57.234922,0 days 00:00:00.004008,81,1,uniform,,PRUNED
39,,2026-09-19 22:24:57.234922,2026-09-19 22:24:57.236925,0 days 00:00:00.002003,41,1,distance,,PRUNED
40,0.586171234655789,2026-09-19 22:24:57.236925,2026-09-19 22:24:58.491929,0 days 00:00:01.255004,11,2,uniform,,COMPLETE
41,,2026-09-19 22:24:58.491929,2026-09-19 22:24:58.491929,0 days 00:00:00,21,1,distance,,PRUNED
42,,2026-09-19 22:24:58.491929,2026-09-19 22:24:58.491929,0 days 00:00:00,21,1,distance,,PRUNED
43,,2026-09-19 22:24:58.491929,2026-09-19 22:24:58.503325,0 days 00:00:00.011396,21,1,distance,,PRUNED
44,,2026-09-19 22:24:58.503325,2026-09-19 22:24:58.503325,0 days 00:00:00,21,1,distance,,PRUNED
45,,2026-09-19 22:24:58.503325,2026-09-19 22:24:58.503325,0 days 00:00:00,41,1,distance,,PRUNED
46,,2026-09-19 22:24:58.503325,2026-09-19 22:24:58.503325,0 days 00:00:00,3,1,distance,,PRUNED
47,,2026-09-19 22:24:58.503325,2026-09-19 22:24:58.503325,0 days 00:00:00,41,1,uniform,,PRUNED
48,,2026-09-19 22:24:58.503325,2026-09-19 22:24:58.519201,0 days 00:00:00.015876,21,1,distance,,PRUNED
49,0.5769082289620385,2026-09-19 22:24:58.519201,2026-09-19 22:24:59.262620,0 days 00:00:00.743419,11,2,distance,"{'n_neighbors': 11, 'p': 2, 'weights': 'distance'}",COMPLETE
50,,2026-09-19 22:24:59.262620,2026-09-19 22:24:59.272661,0 days 00:00:00.010041,41,1,uniform,,PRUNED
51,,2026-09-19 22:24:59.272661,2026-09-19 22:24:59.272661,0 days 00:00:00,11,1,uniform,,PRUNED
52,,2026-09-19 22:24:59.272661,2026-09-19 22:24:59.279320,0 days 00:00:00.006659,11,1,uniform,,PRUNED
53,,2026-09-19 22:24:59.279320,2026-09-19 22:24:59.282554,0 days 00:00:00.003234,5,1,uniform,,PRUNED
54,,2026-09-19 22:24:59.282554,2026-09-19 22:24:59.286974,0 days 00:00:00.004420,11,1,uniform,,PRUNED
55,,2026-09-19 22:24:59.286974,2026-09-19 22:24:59.290438,0 days 00:00:00.003464,41,1,distance,,PRUNED
56,,2026-09-19 22:24:59.290438,2026-09-19 22:24:59.290438,0 days 00:00:00,81,1,uniform,,PRUNED
57,,2026-09-19 22:24:59.290438,2026-09-19 22:24:59.290438,0 days 00:00:00,41,1,distance,,PRUNED
58,0.518687072873989,2026-09-19 22:24:59.290438,2026-09-19 22:24:59.973232,0 days 00:00:00.682794,3,2,distance,"{'n_neighbors': 3, 'p': 2, 'weights': 'distance'}",COMPLETE
59,,2026-09-19 22:24:59.973232,2026-09-19 22:24:59.976647,0 days 00:00:00.003415,81,1,uniform,,PRUNED
60,,2026-09-19 22:24:59.976647,2026-09-19 22:24:59.979658,0 days 00:00:00.003011,11,1,uniform,,PRUNED
61,,2026-09-19 22:24:59.979658,2026-09-19 22:24:59.981406,0 days 00:00:00.001748,81,2,uniform,,PRUNED
62,,2026-09-19 22:24:59.981406,2026-09-19 22:24:59.981406,0 days 00:00:00,81,2,uniform,,PRUNED
63,,2026-09-19 22:24:59.981406,2026-09-19 22:24:59.988711,0 days 00:00:00.007305,81,2,uniform,,PRUNED
64,,2026-09-19 22:24:59.988711,2026-09-19 22:24:59.990433,0 days 00:00:00.001722,81,1,uniform,,PRUNED
65,,2026-09-19 22:24:59.990433,2026-09-19 22:24:59.990433,0 days 00:00:00,5,2,uniform,,PRUNED
66,,2026-09-19 22:24:59.990433,2026-09-19 22:24:59.990433,0 days 00:00:00,41,1,distance,,PRUNED
67,0.5927073856728907,2026-09-19 22:24:59.990433,2026-09-19 22:25:00.833272,0 days 00:00:00.842839,41,2,distance,"{'n_neighbors': 41, 'p': 2, 'weights': 'distance'}",COMPLETE
68,,2026-09-19 22:25:00.833272,2026-09-19 22:25:00.835635,0 days 00:00:00.002363,81,1,uniform,,PRUNED
69,0.6057886978111712,2026-09-19 22:25:00.835635,2026-09-19 22:25:01.968392,0 days 00:00:01.132757,21,1,uniform,,COMPLETE
70,,2026-09-19 22:25:01.968392,2026-09-19 22:25:01.970407,0 days 00:00:00.002015,21,1,uniform,,PRUNED
71,,2026-09-19 22:25:01.970407,2026-09-19 22:25:01.974038,0 days 00:00:00.003631,21,1,uniform,,PRUNED
72,,2026-09-19 22:25:01.974038,2026-09-19 22:25:01.974038,0 days 00:00:00,21,1,uniform,,PRUNED
73,,2026-09-19 22:25:01.974038,2026-09-19 22:25:01.974038,0 days 00:00:00,21,1,uniform,,PRUNED
74,,2026-09-19 22:25:01.974038,2026-09-19 22:25:01.974038,0 days 00:00:00,81,1,uniform,,PRUNED
75,,2026-09-19 22:25:01.974038,2026-09-19 22:25:01.974038,0 days 00:00:00,21,1,distance,,PRUNED
76,,2026-09-19 22:25:01.974038,2026-09-19 22:25:01.987799,0 days 00:00:00.013761,81,1,uniform,,PRUNED
77,,2026-09-19 22:25:01.987799,2026-09-19 22:25:01.988616,0 days 00:00:00.000817,11,1,distance,,PRUNED
78,0.596059297802683,2026-09-19 22:25:01.988616,2026-09-19 22:25:02.738636,0 days 00:00:00.750020,41,2,uniform,"{'n_neighbors': 41, 'p': 2, 'weights': 'uniform'}",COMPLETE
