number,value,datetime_start,datetime_complete,duration,params_C,params_penalty,state
0,0.6251201014757651,2026-09-19 23:48:17.006836,2026-09-19 23:48:17.384033,0 days 00:00:00.377197,0.21245872383827005,l1,COMPLETE
1,0.6036034163044794,2026-09-19 23:48:17.384033,2026-09-19 23:48:17.763505,0 days 00:00:00.379472,0.01752055912507804,l1,COMPLETE
2,0.6148843806940502,2026-09-19 23:48:17.763505,2026-09-19 23:48:18.116781,0 days 00:00:00.353276,0.001058437647387625,l2,COMPLETE
3,0.6251491521098439,2026-09-19 23:48:18.116781,2026-09-19 23:48:18.478582,0 days 00:00:00.361801,10.154765882836715,l2,COMPLETE
4,0.6160414270443749,2026-09-19 23:48:18.478582,2026-09-19 23:48:18.839906,0 days 00:00:00.361324,0.001197226068952316,l2,COMPLETE
5,0.6254956425484243,2026-09-19 23:48:18.839906,2026-09-19 23:48:19.232374,0 days 00:00:00.392468,0.3176766312774478,l1,COMPLETE
6,0.615084163283585,2026-09-19 23:48:19.232374,2026-09-19 23:48:19.572850,0 days 00:00:00.340476,0.0010779961731446164,l2,COMPLETE
7,0.6237774308827535,2026-09-19 23:48:19.572850,2026-09-19 23:48:19.978162,0 days 00:00:00.405312,0.040884288951917876,l1,COMPLETE
8,0.6259979899314745,2026-09-19 23:48:19.978162,2026-09-19 23:48:21.288142,0 days 00:00:01.309980,30.991393762594473,l1,COMPLETE
9,0.6257945866939729,2026-09-19 23:48:21.288142,2026-09-19 23:48:22.787570,0 days 00:00:01.499428,293.85278591719884,l1,COMPLETE
10,0.6255546110970918,2026-09-19 23:48:22.787570,2026-09-19 23:48:24.075824,0 days 00:00:01.288254,15.254094414148703,l1,COMPLETE
11,0.6262375724808336,2026-09-19 23:48:24.075824,2026-09-19 23:48:25.563854,0 days 00:00:01.488030,971.202401417581,l1,COMPLETE
12,0.6262375724808336,2026-09-19 23:48:25.563854,2026-09-19 23:48:27.056514,0 days 00:00:01.492660,565.5123116313472,l1,COMPLETE
13,0.6262375724808336,2026-09-19 23:48:27.056514,2026-09-19 23:48:28.605473,0 days 00:00:01.548959,735.9025420381446,l1,COMPLETE
14,0.6257945866939729,2026-09-19 23:48:28.605473,2026-09-19 23:48:30.156768,0 days 00:00:01.551295,128.6437655823589,l1,COMPLETE
15,0.6262375724808336,2026-09-19 23:48:30.156768,2026-09-19 23:48:31.655103,0 days 00:00:01.498335,988.2980372145005,l1,COMPLETE
16,0.6259979899314745,2026-09-19 23:48:31.655103,2026-09-19 23:48:33.060720,0 days 00:00:01.405617,78.51690922623932,l1,COMPLETE
17,0.6240157543000865,2026-09-19 23:48:33.060720,2026-09-19 23:48:33.778288,0 days 00:00:00.717568,3.438159083898901,l1,COMPLETE
18,0.6238556911321081,2026-09-19 23:48:33.778288,2026-09-19 23:48:34.168403,0 days 00:00:00.390115,2.9497564166534906,l2,COMPLETE
19,0.6257945866939729,2026-09-19 23:48:34.168403,2026-09-19 23:48:35.641783,0 days 00:00:01.473380,163.45807443378547,l1,COMPLETE
20,0.6257945866939729,2026-09-19 23:48:35.641783,2026-09-19 23:48:37.041642,0 days 00:00:01.399859,50.07223895429097,l1,COMPLETE
21,0.6262375724808336,2026-09-19 23:48:37.041642,2026-09-19 23:48:38.539984,0 days 00:00:01.498342,858.1791602699943,l1,COMPLETE
22,0.6262375724808336,2026-09-19 23:48:38.539984,2026-09-19 23:48:40.143633,0 days 00:00:01.603649,405.9252127576193,l1,COMPLETE
23,0.6262375724808336,2026-09-19 23:48:40.143633,2026-09-19 23:48:41.680738,0 days 00:00:01.537105,389.5843663969796,l1,COMPLETE
