number,value,datetime_start,datetime_complete,duration,params_C,params_penalty,state
0,0.6306140512053949,2026-09-20 20:35:51.424979,2026-09-20 20:35:52.833107,0 days 00:00:01.408128,617.5095048395709,l1,COMPLETE
1,0.630612698678584,2026-09-20 20:35:52.833107,2026-09-20 20:35:54.279113,0 days 00:00:01.446006,222.1354681266507,l1,COMPLETE
2,0.6303691174009765,2026-09-20 20:35:54.279113,2026-09-20 20:35:54.690337,0 days 00:00:00.411224,95.0918426649204,l2,COMPLETE
3,0.6341147602315012,2026-09-20 20:35:54.690337,2026-09-20 20:35:55.070517,0 days 00:00:00.380180,1.1930780800274143,l2,COMPLETE
4,0.6283069692823915,2026-09-20 20:35:55.070517,2026-09-20 20:35:55.491398,0 days 00:00:00.420881,0.0332538440215121,l1,COMPLETE
5,0.6342315130649154,2026-09-20 20:35:55.491398,2026-09-20 20:35:55.887514,0 days 00:00:00.396116,0.565293031808911,l2,COMPLETE
6,0.6291113880775345,2026-09-20 20:35:55.887514,2026-09-20 20:35:57.283801,0 days 00:00:01.396287,24.34589304502169,l1,COMPLETE
7,0.6339548946018906,2026-09-20 20:35:57.283801,2026-09-20 20:35:57.703947,0 days 00:00:00.420146,0.978764192765424,l1,COMPLETE
8,0.6354711156353914,2026-09-20 20:35:57.703947,2026-09-20 20:35:58.090238,0 days 00:00:00.386291,0.004213234959870661,l2,COMPLETE
9,0.6265349755869741,2026-09-20 20:35:58.090238,2026-09-20 20:35:58.468981,0 days 00:00:00.378743,0.0010148524948105351,l2,COMPLETE
10,0.6265349755869741,2026-09-20 20:35:58.468981,2026-09-20 20:35:58.820917,0 days 00:00:00.351936,0.001019375955558787,l2,COMPLETE
11,0.6404366417309043,2026-09-20 20:35:58.820917,2026-09-20 20:35:59.216842,0 days 00:00:00.395925,0.03306992002419086,l2,COMPLETE
12,0.6430101254960494,2026-09-20 20:35:59.216842,2026-09-20 20:35:59.608261,0 days 00:00:00.391419,0.019437839524432076,l2,COMPLETE
13,0.6392085252763895,2026-09-20 20:35:59.608261,2026-09-20 20:36:00.025817,0 days 00:00:00.417556,0.05667157472566781,l2,COMPLETE
14,0.6389864431690615,2026-09-20 20:36:00.025817,2026-09-20 20:36:00.440794,0 days 00:00:00.414977,0.05292547583665446,l2,COMPLETE
15,0.6385108161747151,2026-09-20 20:36:00.440794,2026-09-20 20:36:00.824006,0 days 00:00:00.383212,0.008895521430667536,l2,COMPLETE
16,0.6345325432302032,2026-09-20 20:36:00.824006,2026-09-20 20:36:01.207061,0 days 00:00:00.383055,0.2702914862329829,l2,COMPLETE
17,0.6389767463493724,2026-09-20 20:36:01.207061,2026-09-20 20:36:01.596442,0 days 00:00:00.389381,0.010055724965289699,l2,COMPLETE
18,0.6308659165012414,2026-09-20 20:36:01.596442,2026-09-20 20:36:01.995867,0 days 00:00:00.399425,9.834074613155972,l2,COMPLETE
19,0.6350232641406102,2026-09-20 20:36:01.995867,2026-09-20 20:36:02.374302,0 days 00:00:00.378435,0.151436025516296,l2,COMPLETE
20,0.6326216023558945,2026-09-20 20:36:02.374302,2026-09-20 20:36:02.780121,0 days 00:00:00.405819,3.7794614534567677,l2,COMPLETE
21,0.6392038456105177,2026-09-20 20:36:02.780121,2026-09-20 20:36:03.157044,0 days 00:00:00.376923,0.04972702668779889,l2,COMPLETE
22,0.6426048564176067,2026-09-20 20:36:03.157044,2026-09-20 20:36:03.548581,0 days 00:00:00.391537,0.021569617869539263,l2,COMPLETE
23,0.6413609338931742,2026-09-20 20:36:03.548581,2026-09-20 20:36:03.984125,0 days 00:00:00.435544,0.017079155333825317,l2,COMPLETE
