number,value,datetime_start,datetime_complete,duration,params_criterion,params_max_depth,params_min_samples_leaf,system_attrs_fixed_params,state
0,0.5693259505742245,2026-09-20 20:49:39.615353,2026-09-20 20:49:40.087363,0 days 00:00:00.472010,gini,,20,,COMPLETE
1,0.5828807725341081,2026-09-20 20:49:40.087363,2026-09-20 20:49:40.555647,0 days 00:00:00.468284,entropy,,20,,COMPLETE
2,0.539174800150802,2026-09-20 20:49:40.555647,2026-09-20 20:49:41.062775,0 days 00:00:00.507128,entropy,,5,,COMPLETE
3,0.5650582455587454,2026-09-20 20:49:41.062775,2026-09-20 20:49:41.552585,0 days 00:00:00.489810,gini,12.0,5,,COMPLETE
4,0.5956319785336767,2026-09-20 20:49:41.552585,2026-09-20 20:49:42.007000,0 days 00:00:00.454415,gini,6.0,5,,COMPLETE
5,0.5768250720665802,2026-09-20 20:49:42.007000,2026-09-20 20:49:42.440023,0 days 00:00:00.433023,gini,3.0,20,,COMPLETE
6,0.5703071248784239,2026-09-20 20:49:42.440023,2026-09-20 20:49:42.915798,0 days 00:00:00.475775,entropy,12.0,5,,COMPLETE
7,0.578135108885698,2026-09-20 20:49:42.915798,2026-09-20 20:49:43.344574,0 days 00:00:00.428776,entropy,3.0,5,,COMPLETE
8,0.597851815965559,2026-09-20 20:49:43.344574,2026-09-20 20:49:43.808373,0 days 00:00:00.463799,gini,6.0,1,,COMPLETE
9,,2026-09-20 20:49:43.808373,2026-09-20 20:49:43.808373,0 days 00:00:00,gini,6.0,1,,PRUNED
10,,2026-09-20 20:49:43.808373,2026-09-20 20:49:43.808373,0 days 00:00:00,gini,6.0,1,,PRUNED
11,,2026-09-20 20:49:43.808373,2026-09-20 20:49:43.808373,0 days 00:00:00,gini,6.0,1,,PRUNED
12,,2026-09-20 20:49:43.808373,2026-09-20 20:49:43.808373,0 days 00:00:00,gini,6.0,1,,PRUNED
13,,2026-09-20 20:49:43.808373,2026-09-20 20:49:43.808373,0 days 00:00:00,gini,6.0,5,,PRUNED
14,,2026-09-20 20:49:43.808373,2026-09-20 20:49:43.808373,0 days 00:00:00,gini,6.0,1,,PRUNED
15,,2026-09-20 20:49:43.808373,2026-09-20 20:49:43.824503,0 days 00:00:00.016130,gini,6.0,5,,PRUNED
16,,2026-09-20 20:49:43.824503,2026-09-20 20:49:43.824503,0 days 00:00:00,gini,6.0,1,,PRUNED
17,0.5248124909624502,2026-09-20 20:49:43.824503,2026-09-20 20:49:44.328437,0 days 00:00:00.503934,gini,,1,"{'criterion': 'gini', 'max_depth': None, 'min_samples_leaf': 1}",COMPLETE
18,,2026-09-20 20:49:44.328437,2026-09-20 20:49:44.328437,0 days 00:00:00,entropy,3.0,5,,PRUNED
19,0.5746754226853279,2026-09-20 20:49:44.328437,2026-09-20 20:49:44.793974,0 days 00:00:00.465537,gini,12.0,20,,COMPLETE
20,,2026-09-20 20:49:44.793974,2026-09-20 20:49:44.796405,0 days 00:00:00.002431,gini,6.0,5,,PRUNED
21,,2026-09-20 20:49:44.797403,2026-09-20 20:49:44.798404,0 days 00:00:00.001001,entropy,,20,,PRUNED
22,,2026-09-20 20:49:44.798404,2026-09-20 20:49:44.800404,0 days 00:00:00.002000,entropy,,20,,PRUNED
23,,2026-09-20 20:49:44.800404,2026-09-20 20:49:44.802403,0 days 00:00:00.001999,entropy,,20,,PRUNED
24,0.6001940679230037,2026-09-20 20:49:44.802403,2026-09-20 20:49:45.247707,0 days 00:00:00.445304,entropy,6.0,20,,COMPLETE
25,,2026-09-20 20:49:45.247707,2026-09-20 20:49:45.254211,0 days 00:00:00.006504,entropy,6.0,20,,PRUNED
26,0.5933121454275935,2026-09-20 20:49:45.254211,2026-09-20 20:49:45.692997,0 days 00:00:00.438786,entropy,6.0,1,,COMPLETE
27,,2026-09-20 20:49:45.692997,2026-09-20 20:49:45.692997,0 days 00:00:00,gini,6.0,5,,PRUNED
28,,2026-09-20 20:49:45.692997,2026-09-20 20:49:45.709014,0 days 00:00:00.016017,entropy,6.0,20,,PRUNED
29,,2026-09-20 20:49:45.709014,2026-09-20 20:49:45.709014,0 days 00:00:00,gini,6.0,1,,PRUNED
30,,2026-09-20 20:49:45.709014,2026-09-20 20:49:45.709014,0 days 00:00:00,gini,3.0,20,,PRUNED
31,,2026-09-20 20:49:45.709014,2026-09-20 20:49:45.709014,0 days 00:00:00,entropy,6.0,1,,PRUNED
32,,2026-09-20 20:49:45.709014,2026-09-20 20:49:45.709014,0 days 00:00:00,entropy,6.0,1,,PRUNED
33,,2026-09-20 20:49:45.709014,2026-09-20 20:49:45.709014,0 days 00:00:00,entropy,6.0,1,,PRUNED
34,0.5606560831534811,2026-09-20 20:49:45.709014,2026-09-20 20:49:46.203350,0 days 00:00:00.494336,entropy,12.0,1,,COMPLETE
35,,2026-09-20 20:49:46.203350,2026-09-20 20:49:46.208463,0 days 00:00:00.005113,entropy,6.0,1,,PRUNED
36,0.592945777127914,2026-09-20 20:49:46.208463,2026-09-20 20:49:46.697945,0 days 00:00:00.489482,entropy,6.0,5,,COMPLETE
37,0.5869620605354225,2026-09-20 20:49:46.697945,2026-09-20 20:49:47.208579,0 days 00:00:00.510634,entropy,12.0,20,,COMPLETE
38,0.5768250720665802,2026-09-20 20:49:47.208579,2026-09-20 20:49:47.651745,0 days 00:00:00.443166,gini,3.0,5,,COMPLETE
39,,2026-09-20 20:49:47.651745,2026-09-20 20:49:47.658481,0 days 00:00:00.006736,entropy,6.0,1,,PRUNED
40,0.6009294906422902,2026-09-20 20:49:47.658481,2026-09-20 20:49:48.119515,0 days 00:00:00.461034,gini,6.0,20,,COMPLETE
41,,2026-09-20 20:49:48.119515,2026-09-20 20:49:48.121914,0 days 00:00:00.002399,gini,6.0,20,,PRUNED
42,,2026-09-20 20:49:48.121914,2026-09-20 20:49:48.121914,0 days 00:00:00,gini,6.0,20,,PRUNED
43,,2026-09-20 20:49:48.121914,2026-09-20 20:49:48.121914,0 days 00:00:00,gini,6.0,20,,PRUNED
44,,2026-09-20 20:49:48.121914,2026-09-20 20:49:48.128860,0 days 00:00:00.006946,gini,6.0,20,,PRUNED
45,,2026-09-20 20:49:48.128860,2026-09-20 20:49:48.128860,0 days 00:00:00,gini,6.0,5,,PRUNED
46,,2026-09-20 20:49:48.128860,2026-09-20 20:49:48.128860,0 days 00:00:00,gini,6.0,1,,PRUNED
47,,2026-09-20 20:49:48.128860,2026-09-20 20:49:48.135281,0 days 00:00:00.006421,gini,12.0,20,,PRUNED
48,,2026-09-20 20:49:48.135281,2026-09-20 20:49:48.135281,0 days 00:00:00,gini,6.0,5,,PRUNED
49,0.578135108885698,2026-09-20 20:49:48.135281,2026-09-20 20:49:48.592161,0 days 00:00:00.456880,entropy,3.0,20,"{'criterion': 'entropy', 'max_depth': 3, 'min_samples_leaf': 20}",COMPLETE
50,,2026-09-20 20:49:48.592161,2026-09-20 20:49:48.592161,0 days 00:00:00,gini,6.0,1,,PRUNED
51,,2026-09-20 20:49:48.592161,2026-09-20 20:49:48.592161,0 days 00:00:00,entropy,6.0,5,,PRUNED
52,,2026-09-20 20:49:48.592161,2026-09-20 20:49:48.592161,0 days 00:00:00,entropy,6.0,5,,PRUNED
53,,2026-09-20 20:49:48.592161,2026-09-20 20:49:48.592161,0 days 00:00:00,entropy,6.0,5,,PRUNED
54,,2026-09-20 20:49:48.592161,2026-09-20 20:49:48.592161,0 days 00:00:00,entropy,6.0,5,,PRUNED
55,,2026-09-20 20:49:48.592161,2026-09-20 20:49:48.606061,0 days 00:00:00.013900,entropy,6.0,5,,PRUNED
56,,2026-09-20 20:49:48.606061,2026-09-20 20:49:48.606061,0 days 00:00:00,entropy,,5,,PRUNED
57,,2026-09-20 20:49:48.606061,2026-09-20 20:49:48.606061,0 days 00:00:00,gini,6.0,1,,PRUNED
58,0.578135108885698,2026-09-20 20:49:48.606061,2026-09-20 20:49:49.052855,0 days 00:00:00.446794,entropy,3.0,1,"{'criterion': 'entropy', 'max_depth': 3, 'min_samples_leaf': 1}",COMPLETE
59,,2026-09-20 20:49:49.052855,2026-09-20 20:49:49.055848,0 days 00:00:00.002993,gini,6.0,5,,PRUNED
60,,2026-09-20 20:49:49.055848,2026-09-20 20:49:49.057848,0 days 00:00:00.002000,gini,6.0,20,,PRUNED
61,,2026-09-20 20:49:49.057848,2026-09-20 20:49:49.059850,0 days 00:00:00.002002,entropy,12.0,20,,PRUNED
62,,2026-09-20 20:49:49.059850,2026-09-20 20:49:49.063097,0 days 00:00:00.003247,entropy,12.0,20,,PRUNED
63,,2026-09-20 20:49:49.063097,2026-09-20 20:49:49.063097,0 days 00:00:00,entropy,12.0,20,,PRUNED
64,,2026-09-20 20:49:49.063097,2026-09-20 20:49:49.063097,0 days 00:00:00,entropy,12.0,20,,PRUNED
65,,2026-09-20 20:49:49.063097,2026-09-20 20:49:49.063097,0 days 00:00:00,entropy,12.0,20,,PRUNED
66,0.5100403755478332,2026-09-20 20:49:49.063097,2026-09-20 20:49:49.572031,0 days 00:00:00.508934,entropy,,1,,COMPLETE
67,,2026-09-20 20:49:49.572031,2026-09-20 20:49:49.574031,0 days 00:00:00.002000,entropy,6.0,20,,PRUNED
68,,2026-09-20 20:49:49.574031,2026-09-20 20:49:49.576032,0 days 00:00:00.002001,gini,12.0,5,,PRUNED
69,,2026-09-20 20:49:49.576032,2026-09-20 20:49:49.577032,0 days 00:00:00.001000,entropy,6.0,1,,PRUNED
70,,2026-09-20 20:49:49.577032,2026-09-20 20:49:49.577032,0 days 00:00:00,gini,6.0,20,,PRUNED
71,,2026-09-20 20:49:49.577032,2026-09-20 20:49:49.582863,0 days 00:00:00.005831,entropy,,20,,PRUNED
72,,2026-09-20 20:49:49.582863,2026-09-20 20:49:49.582863,0 days 00:00:00,entropy,,20,,PRUNED
73,,2026-09-20 20:49:49.582863,2026-09-20 20:49:49.587067,0 days 00:00:00.004204,entropy,,20,,PRUNED
74,,2026-09-20 20:49:49.587067,2026-09-20 20:49:49.587067,0 days 00:00:00,entropy,,20,,PRUNED
75,0.5768250720665802,2026-09-20 20:49:49.587067,2026-09-20 20:49:50.019925,0 days 00:00:00.432858,gini,3.0,1,"{'criterion': 'gini', 'max_depth': 3, 'min_samples_leaf': 1}",COMPLETE
76,,2026-09-20 20:49:50.019925,2026-09-20 20:49:50.026720,0 days 00:00:00.006795,entropy,6.0,20,,PRUNED
77,,2026-09-20 20:49:50.026720,2026-09-20 20:49:50.028943,0 days 00:00:00.002223,entropy,6.0,5,,PRUNED
78,,2026-09-20 20:49:50.028943,2026-09-20 20:49:50.028943,0 days 00:00:00,gini,,1,,PRUNED
79,,2026-09-20 20:49:50.028943,2026-09-20 20:49:50.034247,0 days 00:00:00.005304,entropy,6.0,20,,PRUNED
80,,2026-09-20 20:49:50.034247,2026-09-20 20:49:50.034247,0 days 00:00:00,gini,6.0,5,,PRUNED
81,,2026-09-20 20:49:50.034247,2026-09-20 20:49:50.034247,0 days 00:00:00,entropy,3.0,5,,PRUNED
82,,2026-09-20 20:49:50.034247,2026-09-20 20:49:50.040212,0 days 00:00:00.005965,entropy,3.0,5,,PRUNED
83,,2026-09-20 20:49:50.040212,2026-09-20 20:49:50.042448,0 days 00:00:00.002236,entropy,3.0,5,,PRUNED
84,0.5472590242536769,2026-09-20 20:49:50.042448,2026-09-20 20:49:50.537008,0 days 00:00:00.494560,gini,,5,"{'criterion': 'gini', 'max_depth': None, 'min_samples_leaf': 5}",COMPLETE
85,,2026-09-20 20:49:50.537008,2026-09-20 20:49:50.537008,0 days 00:00:00,entropy,3.0,1,,PRUNED
86,,2026-09-20 20:49:50.537008,2026-09-20 20:49:50.548301,0 days 00:00:00.011293,entropy,6.0,20,,PRUNED
87,,2026-09-20 20:49:50.548301,2026-09-20 20:49:50.550599,0 days 00:00:00.002298,entropy,6.0,5,,PRUNED
88,0.5655432132186272,2026-09-20 20:49:50.550599,2026-09-20 20:49:51.059307,0 days 00:00:00.508708,gini,12.0,1,,COMPLETE
