number,value,datetime_start,datetime_complete,duration,params_n_neighbors,params_p,params_weights,system_attrs_fixed_params,state
0,0.5703360889600245,2026-09-19 22:40:12.090291,2026-09-19 22:40:12.766645,0 days 00:00:00.676354,5,1,distance,,COMPLETE
1,0.5824713515996329,2026-09-19 22:40:12.766645,2026-09-19 22:40:13.242962,0 days 00:00:00.476317,5,2,uniform,,COMPLETE
2,0.6052524421854435,2026-09-19 22:40:13.242962,2026-09-19 22:40:13.905387,0 days 00:00:00.662425,21,1,uniform,,COMPLETE
3,0.5921963026253714,2026-09-19 22:40:13.905387,2026-09-19 22:40:14.536805,0 days 00:00:00.631418,11,1,uniform,,COMPLETE
4,0.6016383942524259,2026-09-19 22:40:14.536805,2026-09-19 22:40:15.013352,0 days 00:00:00.476547,21,2,uniform,,COMPLETE
5,0.6030771042507429,2026-09-19 22:40:15.013352,2026-09-19 22:40:15.530703,0 days 00:00:00.517351,41,2,uniform,,COMPLETE
6,0.5953474685592743,2026-09-19 22:40:15.530703,2026-09-19 22:40:15.980550,0 days 00:00:00.449847,21,2,distance,,COMPLETE
7,0.5680714414359553,2026-09-19 22:40:15.980550,2026-09-19 22:40:16.411747,0 days 00:00:00.431197,5,2,distance,,COMPLETE
8,0.5529758774084541,2026-09-19 22:40:16.411747,2026-09-19 22:40:17.029629,0 days 00:00:00.617882,3,1,uniform,,COMPLETE
9,0.6055028412718774,2026-09-19 22:40:17.029629,2026-09-19 22:40:17.794774,0 days 00:00:00.765145,81,1,uniform,,COMPLETE
10,0.6057609060377396,2026-09-19 22:40:17.794774,2026-09-19 22:40:18.579741,0 days 00:00:00.784967,81,1,distance,,COMPLETE
11,,2026-09-19 22:40:18.579741,2026-09-19 22:40:18.582742,0 days 00:00:00.003001,81,1,distance,,PRUNED
12,,2026-09-19 22:40:18.582742,2026-09-19 22:40:18.585743,0 days 00:00:00.003001,81,1,distance,,PRUNED
13,,2026-09-19 22:40:18.585743,2026-09-19 22:40:18.589068,0 days 00:00:00.003325,81,1,distance,,PRUNED
14,,2026-09-19 22:40:18.589068,2026-09-19 22:40:18.589465,0 days 00:00:00.000397,81,1,uniform,,PRUNED
15,,2026-09-19 22:40:18.589465,2026-09-19 22:40:18.589465,0 days 00:00:00,81,1,distance,,PRUNED
16,0.5390544275232864,2026-09-19 22:40:18.589465,2026-09-19 22:40:19.239508,0 days 00:00:00.650043,3,1,distance,,COMPLETE
17,0.6054743750055427,2026-09-19 22:40:19.239508,2026-09-19 22:40:19.937634,0 days 00:00:00.698126,41,1,uniform,,COMPLETE
18,0.5900229611109756,2026-09-19 22:40:19.937634,2026-09-19 22:40:20.574051,0 days 00:00:00.636417,11,1,distance,,COMPLETE
19,,2026-09-19 22:40:20.574051,2026-09-19 22:40:20.574051,0 days 00:00:00,81,1,uniform,,PRUNED
20,,2026-09-19 22:40:20.574051,2026-09-19 22:40:20.592596,0 days 00:00:00.018545,81,1,distance,,PRUNED
21,,2026-09-19 22:40:20.592596,2026-09-19 22:40:20.595597,0 days 00:00:00.003001,41,1,uniform,,PRUNED
22,,2026-09-19 22:40:20.595597,2026-09-19 22:40:20.598597,0 days 00:00:00.003000,41,1,uniform,,PRUNED
23,,2026-09-19 22:40:20.598597,2026-09-19 22:40:20.601596,0 days 00:00:00.002999,41,1,uniform,,PRUNED
24,,2026-09-19 22:40:20.601596,2026-09-19 22:40:20.608023,0 days 00:00:00.006427,41,1,uniform,,PRUNED
25,,2026-09-19 22:40:20.608023,2026-09-19 22:40:20.612022,0 days 00:00:00.003999,81,1,uniform,,PRUNED
26,0.5546915861192897,2026-09-19 22:40:20.612022,2026-09-19 22:40:21.033499,0 days 00:00:00.421477,3,2,uniform,,COMPLETE
27,,2026-09-19 22:40:21.033499,2026-09-19 22:40:21.033499,0 days 00:00:00,11,1,uniform,,PRUNED
28,0.6051038970258966,2026-09-19 22:40:21.033499,2026-09-19 22:40:21.717131,0 days 00:00:00.683632,41,1,distance,,COMPLETE
29,,2026-09-19 22:40:21.717131,2026-09-19 22:40:21.733200,0 days 00:00:00.016069,5,1,distance,,PRUNED
30,,2026-09-19 22:40:21.733200,2026-09-19 22:40:21.733200,0 days 00:00:00,81,1,uniform,,PRUNED
31,,2026-09-19 22:40:21.733200,2026-09-19 22:40:21.741580,0 days 00:00:00.008380,21,1,uniform,,PRUNED
32,,2026-09-19 22:40:21.741580,2026-09-19 22:40:21.741580,0 days 00:00:00,21,1,uniform,,PRUNED
33,,2026-09-19 22:40:21.741580,2026-09-19 22:40:21.749163,0 days 00:00:00.007583,21,1,uniform,,PRUNED
34,,2026-09-19 22:40:21.749163,2026-09-19 22:40:21.749163,0 days 00:00:00,21,2,uniform,,PRUNED
35,0.5851004912408421,2026-09-19 22:40:21.749163,2026-09-19 22:40:22.405825,0 days 00:00:00.656662,5,1,uniform,,COMPLETE
36,0.5888951841021446,2026-09-19 22:40:22.405825,2026-09-19 22:40:22.865257,0 days 00:00:00.459432,11,2,uniform,,COMPLETE
37,,2026-09-19 22:40:22.865257,2026-09-19 22:40:22.876973,0 days 00:00:00.011716,21,1,uniform,,PRUNED
38,0.6030113213421023,2026-09-19 22:40:22.876973,2026-09-19 22:40:23.451592,0 days 00:00:00.574619,81,2,uniform,,COMPLETE
39,,2026-09-19 22:40:23.451592,2026-09-19 22:40:23.467265,0 days 00:00:00.015673,41,1,distance,,PRUNED
40,,2026-09-19 22:40:23.467265,2026-09-19 22:40:23.472110,0 days 00:00:00.004845,21,1,uniform,,PRUNED
41,,2026-09-19 22:40:23.472110,2026-09-19 22:40:23.472110,0 days 00:00:00,41,1,distance,,PRUNED
42,,2026-09-19 22:40:23.472110,2026-09-19 22:40:23.483064,0 days 00:00:00.010954,41,1,distance,,PRUNED
43,,2026-09-19 22:40:23.483064,2026-09-19 22:40:23.485070,0 days 00:00:00.002006,41,1,distance,,PRUNED
44,,2026-09-19 22:40:23.485070,2026-09-19 22:40:23.485070,0 days 00:00:00,41,1,distance,,PRUNED
45,,2026-09-19 22:40:23.485070,2026-09-19 22:40:23.485070,0 days 00:00:00,3,1,distance,,PRUNED
46,0.6034168355169269,2026-09-19 22:40:23.485070,2026-09-19 22:40:24.081987,0 days 00:00:00.596917,81,2,distance,,COMPLETE
47,,2026-09-19 22:40:24.081987,2026-09-19 22:40:24.081987,0 days 00:00:00,81,1,distance,,PRUNED
48,,2026-09-19 22:40:24.081987,2026-09-19 22:40:24.090585,0 days 00:00:00.008598,5,1,distance,,PRUNED
49,,2026-09-19 22:40:24.090585,2026-09-19 22:40:24.090585,0 days 00:00:00,41,1,uniform,,PRUNED
50,,2026-09-19 22:40:24.090585,2026-09-19 22:40:24.097734,0 days 00:00:00.007149,81,1,distance,,PRUNED
51,,2026-09-19 22:40:24.097734,2026-09-19 22:40:24.097734,0 days 00:00:00,81,2,distance,,PRUNED
52,,2026-09-19 22:40:24.097734,2026-09-19 22:40:24.097734,0 days 00:00:00,81,2,distance,,PRUNED
53,,2026-09-19 22:40:24.097734,2026-09-19 22:40:24.097734,0 days 00:00:00,81,2,distance,,PRUNED
54,,2026-09-19 22:40:24.097734,2026-09-19 22:40:24.097734,0 days 00:00:00,81,2,distance,,PRUNED
55,0.5998247484322808,2026-09-19 22:40:24.097734,2026-09-19 22:40:24.758840,0 days 00:00:00.661106,21,1,distance,"{'n_neighbors': 21, 'p': 1, 'weights': 'distance'}",COMPLETE
56,,2026-09-19 22:40:24.758840,2026-09-19 22:40:24.758840,0 days 00:00:00,11,2,uniform,,PRUNED
57,0.5397052399479644,2026-09-19 22:40:24.758840,2026-09-19 22:40:25.178879,0 days 00:00:00.420039,3,2,distance,,COMPLETE
58,,2026-09-19 22:40:25.178879,2026-09-19 22:40:25.178879,0 days 00:00:00,81,1,uniform,,PRUNED
59,,2026-09-19 22:40:25.178879,2026-09-19 22:40:25.189101,0 days 00:00:00.010222,41,1,distance,,PRUNED
60,,2026-09-19 22:40:25.189101,2026-09-19 22:40:25.194914,0 days 00:00:00.005813,81,1,uniform,,PRUNED
61,,2026-09-19 22:40:25.194914,2026-09-19 22:40:25.194914,0 days 00:00:00,41,2,uniform,,PRUNED
62,,2026-09-19 22:40:25.194914,2026-09-19 22:40:25.194914,0 days 00:00:00,41,2,uniform,,PRUNED
63,,2026-09-19 22:40:25.194914,2026-09-19 22:40:25.194914,0 days 00:00:00,41,2,uniform,,PRUNED
64,,2026-09-19 22:40:25.194914,2026-09-19 22:40:25.194914,0 days 00:00:00,41,2,uniform,,PRUNED
65,,2026-09-19 22:40:25.194914,2026-09-19 22:40:25.194914,0 days 00:00:00,81,2,uniform,,PRUNED
66,0.587692290457444,2026-09-19 22:40:25.194914,2026-09-19 22:40:25.672244,0 days 00:00:00.477330,11,2,distance,"{'n_neighbors': 11, 'p': 2, 'weights': 'distance'}",COMPLETE
67,,2026-09-19 22:40:25.672244,2026-09-19 22:40:25.672244,0 days 00:00:00,5,1,uniform,,PRUNED
68,,2026-09-19 22:40:25.672244,2026-09-19 22:40:25.687129,0 days 00:00:00.014885,21,1,uniform,,PRUNED
69,,2026-09-19 22:40:25.687129,2026-09-19 22:40:25.687129,0 days 00:00:00,41,1,uniform,,PRUNED
70,,2026-09-19 22:40:25.687129,2026-09-19 22:40:25.687129,0 days 00:00:00,81,1,uniform,,PRUNED
71,,2026-09-19 22:40:25.687129,2026-09-19 22:40:25.687129,0 days 00:00:00,81,2,uniform,,PRUNED
72,,2026-09-19 22:40:25.687129,2026-09-19 22:40:25.703025,0 days 00:00:00.015896,81,2,uniform,,PRUNED
73,,2026-09-19 22:40:25.703025,2026-09-19 22:40:25.703025,0 days 00:00:00,81,2,uniform,,PRUNED
74,,2026-09-19 22:40:25.703025,2026-09-19 22:40:25.703025,0 days 00:00:00,81,2,uniform,,PRUNED
75,0.6005468918576018,2026-09-19 22:40:25.703025,2026-09-19 22:40:26.300636,0 days 00:00:00.597611,41,2,distance,"{'n_neighbors': 41, 'p': 2, 'weights': 'distance'}",COMPLETE
