number,value,datetime_start,datetime_complete,duration,params_criterion,params_max_depth,params_min_samples_leaf,system_attrs_fixed_params,state
0,0.5075423139105396,2026-09-20 00:00:17.886238,2026-09-20 00:00:18.276714,0 days 00:00:00.390476,gini,12.0,1,,COMPLETE
1,0.5927431620998113,2026-09-20 00:00:18.276714,2026-09-20 00:00:18.635077,0 days 00:00:00.358363,entropy,3.0,1,,COMPLETE
2,0.5202563845058922,2026-09-20 00:00:18.635077,2026-09-20 00:00:19.028685,0 days 00:00:00.393608,gini,12.0,20,,COMPLETE
3,0.5357756536470165,2026-09-20 00:00:19.028685,2026-09-20 00:00:19.403757,0 days 00:00:00.375072,entropy,6.0,5,,COMPLETE
4,0.5927431620998113,2026-09-20 00:00:19.403757,2026-09-20 00:00:19.765729,0 days 00:00:00.361972,entropy,3.0,20,,COMPLETE
5,0.49515944631392883,2026-09-20 00:00:19.765729,2026-09-20 00:00:20.146850,0 days 00:00:00.381121,gini,3.0,5,,COMPLETE
6,0.5313352365406996,2026-09-20 00:00:20.146850,2026-09-20 00:00:20.530192,0 days 00:00:00.383342,entropy,6.0,1,,COMPLETE
7,0.5136996866615793,2026-09-20 00:00:20.530192,2026-09-20 00:00:20.910358,0 days 00:00:00.380166,gini,,5,,COMPLETE
8,,2026-09-20 00:00:20.910358,2026-09-20 00:00:20.910358,0 days 00:00:00,entropy,3.0,1,,PRUNED
9,0.5230389496377827,2026-09-20 00:00:20.910358,2026-09-20 00:00:21.338274,0 days 00:00:00.427916,entropy,,1,,COMPLETE
10,,2026-09-20 00:00:21.338274,2026-09-20 00:00:21.339518,0 days 00:00:00.001244,entropy,3.0,1,,PRUNED
11,,2026-09-20 00:00:21.339518,2026-09-20 00:00:21.339518,0 days 00:00:00,entropy,3.0,20,,PRUNED
12,,2026-09-20 00:00:21.339518,2026-09-20 00:00:21.339518,0 days 00:00:00,entropy,3.0,20,,PRUNED
13,,2026-09-20 00:00:21.339518,2026-09-20 00:00:21.339518,0 days 00:00:00,entropy,3.0,20,,PRUNED
14,,2026-09-20 00:00:21.339518,2026-09-20 00:00:21.339518,0 days 00:00:00,entropy,3.0,20,,PRUNED
15,,2026-09-20 00:00:21.339518,2026-09-20 00:00:21.339518,0 days 00:00:00,entropy,3.0,1,,PRUNED
16,0.5412050411931797,2026-09-20 00:00:21.339518,2026-09-20 00:00:21.733664,0 days 00:00:00.394146,entropy,6.0,20,,COMPLETE
17,,2026-09-20 00:00:21.733664,2026-09-20 00:00:21.736662,0 days 00:00:00.002998,entropy,,1,,PRUNED
18,,2026-09-20 00:00:21.736662,2026-09-20 00:00:21.738453,0 days 00:00:00.001791,gini,12.0,20,,PRUNED
19,0.5927431620998113,2026-09-20 00:00:21.738453,2026-09-20 00:00:22.126906,0 days 00:00:00.388453,entropy,3.0,5,,COMPLETE
20,,2026-09-20 00:00:22.126906,2026-09-20 00:00:22.134517,0 days 00:00:00.007611,entropy,3.0,20,,PRUNED
21,,2026-09-20 00:00:22.134517,2026-09-20 00:00:22.134517,0 days 00:00:00,entropy,3.0,5,,PRUNED
22,,2026-09-20 00:00:22.134517,2026-09-20 00:00:22.134517,0 days 00:00:00,entropy,3.0,5,,PRUNED
23,,2026-09-20 00:00:22.134517,2026-09-20 00:00:22.134517,0 days 00:00:00,entropy,3.0,5,,PRUNED
24,,2026-09-20 00:00:22.134517,2026-09-20 00:00:22.134517,0 days 00:00:00,entropy,3.0,5,,PRUNED
25,,2026-09-20 00:00:22.134517,2026-09-20 00:00:22.134517,0 days 00:00:00,entropy,3.0,5,,PRUNED
26,,2026-09-20 00:00:22.134517,2026-09-20 00:00:22.134517,0 days 00:00:00,gini,12.0,1,,PRUNED
27,,2026-09-20 00:00:22.134517,2026-09-20 00:00:22.134517,0 days 00:00:00,entropy,,1,,PRUNED
28,0.5171068352989434,2026-09-20 00:00:22.134517,2026-09-20 00:00:22.526164,0 days 00:00:00.391647,gini,6.0,5,"{'criterion': 'gini', 'max_depth': 6, 'min_samples_leaf': 5}",COMPLETE
29,0.5479844384999256,2026-09-20 00:00:22.526164,2026-09-20 00:00:22.914966,0 days 00:00:00.388802,entropy,12.0,20,,COMPLETE
30,,2026-09-20 00:00:22.914966,2026-09-20 00:00:22.919507,0 days 00:00:00.004541,entropy,3.0,1,,PRUNED
31,,2026-09-20 00:00:22.919507,2026-09-20 00:00:22.919507,0 days 00:00:00,entropy,12.0,20,,PRUNED
32,,2026-09-20 00:00:22.919507,2026-09-20 00:00:22.923862,0 days 00:00:00.004355,entropy,12.0,20,,PRUNED
33,,2026-09-20 00:00:22.923862,2026-09-20 00:00:22.923862,0 days 00:00:00,entropy,12.0,20,,PRUNED
34,,2026-09-20 00:00:22.923862,2026-09-20 00:00:22.923862,0 days 00:00:00,gini,12.0,20,,PRUNED
35,,2026-09-20 00:00:22.923862,2026-09-20 00:00:22.930779,0 days 00:00:00.006917,entropy,12.0,20,,PRUNED
36,,2026-09-20 00:00:22.930779,2026-09-20 00:00:22.930779,0 days 00:00:00,entropy,6.0,5,,PRUNED
37,0.49515944631392883,2026-09-20 00:00:22.930779,2026-09-20 00:00:23.281038,0 days 00:00:00.350259,gini,3.0,20,,COMPLETE
38,0.5166888060027924,2026-09-20 00:00:23.281038,2026-09-20 00:00:23.672662,0 days 00:00:00.391624,entropy,12.0,1,,COMPLETE
39,0.5256430477367273,2026-09-20 00:00:23.672662,2026-09-20 00:00:24.074251,0 days 00:00:00.401589,entropy,,5,,COMPLETE
40,,2026-09-20 00:00:24.074251,2026-09-20 00:00:24.077244,0 days 00:00:00.002993,entropy,3.0,1,,PRUNED
41,,2026-09-20 00:00:24.077244,2026-09-20 00:00:24.079244,0 days 00:00:00.002000,entropy,6.0,20,,PRUNED
42,,2026-09-20 00:00:24.079244,2026-09-20 00:00:24.081244,0 days 00:00:00.002000,entropy,6.0,20,,PRUNED
43,,2026-09-20 00:00:24.081244,2026-09-20 00:00:24.083245,0 days 00:00:00.002001,entropy,6.0,20,,PRUNED
44,,2026-09-20 00:00:24.083245,2026-09-20 00:00:24.084246,0 days 00:00:00.001001,entropy,6.0,20,,PRUNED
45,,2026-09-20 00:00:24.084246,2026-09-20 00:00:24.086246,0 days 00:00:00.002000,entropy,6.0,20,,PRUNED
46,,2026-09-20 00:00:24.086246,2026-09-20 00:00:24.088858,0 days 00:00:00.002612,entropy,3.0,20,,PRUNED
47,,2026-09-20 00:00:24.088858,2026-09-20 00:00:24.090801,0 days 00:00:00.001943,entropy,3.0,1,,PRUNED
48,0.5096011656707752,2026-09-20 00:00:24.090801,2026-09-20 00:00:24.467058,0 days 00:00:00.376257,gini,6.0,20,"{'criterion': 'gini', 'max_depth': 6, 'min_samples_leaf': 20}",COMPLETE
49,,2026-09-20 00:00:24.467058,2026-09-20 00:00:24.471379,0 days 00:00:00.004321,entropy,,5,,PRUNED
50,,2026-09-20 00:00:24.471379,2026-09-20 00:00:24.471379,0 days 00:00:00,entropy,3.0,20,,PRUNED
51,,2026-09-20 00:00:24.471379,2026-09-20 00:00:24.471379,0 days 00:00:00,entropy,6.0,5,,PRUNED
52,,2026-09-20 00:00:24.471379,2026-09-20 00:00:24.471379,0 days 00:00:00,entropy,6.0,5,,PRUNED
53,,2026-09-20 00:00:24.471379,2026-09-20 00:00:24.471379,0 days 00:00:00,entropy,6.0,5,,PRUNED
54,,2026-09-20 00:00:24.471379,2026-09-20 00:00:24.471379,0 days 00:00:00,entropy,3.0,5,,PRUNED
55,,2026-09-20 00:00:24.471379,2026-09-20 00:00:24.482994,0 days 00:00:00.011615,entropy,3.0,1,,PRUNED
56,,2026-09-20 00:00:24.482994,2026-09-20 00:00:24.482994,0 days 00:00:00,entropy,6.0,5,,PRUNED
57,0.5272243942234571,2026-09-20 00:00:24.482994,2026-09-20 00:00:24.862058,0 days 00:00:00.379064,entropy,12.0,5,"{'criterion': 'entropy', 'max_depth': 12, 'min_samples_leaf': 5}",COMPLETE
58,0.49515944631392883,2026-09-20 00:00:24.862058,2026-09-20 00:00:25.215158,0 days 00:00:00.353100,gini,3.0,1,,COMPLETE
59,0.5479844384999256,2026-09-20 00:00:25.215158,2026-09-20 00:00:25.586574,0 days 00:00:00.371416,entropy,,20,,COMPLETE
60,,2026-09-20 00:00:25.586574,2026-09-20 00:00:25.598216,0 days 00:00:00.011642,entropy,,20,,PRUNED
61,,2026-09-20 00:00:25.598216,2026-09-20 00:00:25.598216,0 days 00:00:00,entropy,,20,,PRUNED
62,,2026-09-20 00:00:25.598216,2026-09-20 00:00:25.603050,0 days 00:00:00.004834,entropy,,20,,PRUNED
63,,2026-09-20 00:00:25.603050,2026-09-20 00:00:25.605243,0 days 00:00:00.002193,entropy,,20,,PRUNED
64,,2026-09-20 00:00:25.605243,2026-09-20 00:00:25.607134,0 days 00:00:00.001891,entropy,3.0,20,,PRUNED
65,,2026-09-20 00:00:25.607134,2026-09-20 00:00:25.607134,0 days 00:00:00,entropy,12.0,20,,PRUNED
66,,2026-09-20 00:00:25.607134,2026-09-20 00:00:25.611868,0 days 00:00:00.004734,entropy,,5,,PRUNED
67,,2026-09-20 00:00:25.611868,2026-09-20 00:00:25.611868,0 days 00:00:00,entropy,3.0,1,,PRUNED
68,0.5183771357954873,2026-09-20 00:00:25.611868,2026-09-20 00:00:25.990459,0 days 00:00:00.378591,gini,6.0,1,"{'criterion': 'gini', 'max_depth': 6, 'min_samples_leaf': 1}",COMPLETE
69,,2026-09-20 00:00:25.990459,2026-09-20 00:00:25.996156,0 days 00:00:00.005697,entropy,3.0,20,,PRUNED
70,,2026-09-20 00:00:25.996156,2026-09-20 00:00:25.996156,0 days 00:00:00,entropy,12.0,20,,PRUNED
71,,2026-09-20 00:00:25.996156,2026-09-20 00:00:25.996156,0 days 00:00:00,entropy,6.0,1,,PRUNED
72,,2026-09-20 00:00:25.996156,2026-09-20 00:00:25.996156,0 days 00:00:00,entropy,6.0,1,,PRUNED
73,,2026-09-20 00:00:25.996156,2026-09-20 00:00:26.004131,0 days 00:00:00.007975,entropy,6.0,1,,PRUNED
74,,2026-09-20 00:00:26.004131,2026-09-20 00:00:26.006941,0 days 00:00:00.002810,entropy,6.0,1,,PRUNED
75,,2026-09-20 00:00:26.006941,2026-09-20 00:00:26.006941,0 days 00:00:00,entropy,3.0,5,,PRUNED
76,,2026-09-20 00:00:26.006941,2026-09-20 00:00:26.006941,0 days 00:00:00,entropy,6.0,20,,PRUNED
77,0.5202563845058922,2026-09-20 00:00:26.006941,2026-09-20 00:00:26.372612,0 days 00:00:00.365671,gini,,20,"{'criterion': 'gini', 'max_depth': None, 'min_samples_leaf': 20}",COMPLETE
78,,2026-09-20 00:00:26.372612,2026-09-20 00:00:26.386689,0 days 00:00:00.014077,entropy,12.0,1,,PRUNED
79,,2026-09-20 00:00:26.386689,2026-09-20 00:00:26.387694,0 days 00:00:00.001005,entropy,3.0,5,,PRUNED
80,,2026-09-20 00:00:26.387694,2026-09-20 00:00:26.387694,0 days 00:00:00,entropy,6.0,20,,PRUNED
81,,2026-09-20 00:00:26.387694,2026-09-20 00:00:26.395358,0 days 00:00:00.007664,entropy,12.0,5,,PRUNED
82,,2026-09-20 00:00:26.395358,2026-09-20 00:00:26.395358,0 days 00:00:00,entropy,12.0,5,,PRUNED
83,,2026-09-20 00:00:26.395358,2026-09-20 00:00:26.395358,0 days 00:00:00,entropy,12.0,5,,PRUNED
84,,2026-09-20 00:00:26.395358,2026-09-20 00:00:26.403028,0 days 00:00:00.007670,entropy,12.0,5,,PRUNED
85,,2026-09-20 00:00:26.403028,2026-09-20 00:00:26.405551,0 days 00:00:00.002523,entropy,12.0,5,,PRUNED
86,0.5090719243289725,2026-09-20 00:00:26.405551,2026-09-20 00:00:26.803505,0 days 00:00:00.397954,gini,,1,"{'criterion': 'gini', 'max_depth': None, 'min_samples_leaf': 1}",COMPLETE
87,,2026-09-20 00:00:26.803505,2026-09-20 00:00:26.805012,0 days 00:00:00.001507,entropy,3.0,5,,PRUNED
88,,2026-09-20 00:00:26.805012,2026-09-20 00:00:26.808522,0 days 00:00:00.003510,entropy,6.0,20,,PRUNED
89,,2026-09-20 00:00:26.808522,2026-09-20 00:00:26.810808,0 days 00:00:00.002286,entropy,12.0,5,,PRUNED
90,,2026-09-20 00:00:26.810808,2026-09-20 00:00:26.813072,0 days 00:00:00.002264,entropy,3.0,20,,PRUNED
91,,2026-09-20 00:00:26.813072,2026-09-20 00:00:26.815387,0 days 00:00:00.002315,entropy,,5,,PRUNED
92,,2026-09-20 00:00:26.815387,2026-09-20 00:00:26.817569,0 days 00:00:00.002182,entropy,,5,,PRUNED
93,,2026-09-20 00:00:26.817569,2026-09-20 00:00:26.819733,0 days 00:00:00.002164,entropy,,5,,PRUNED
94,,2026-09-20 00:00:26.819733,2026-09-20 00:00:26.820739,0 days 00:00:00.001006,entropy,,5,,PRUNED
95,0.516691433779096,2026-09-20 00:00:26.820739,2026-09-20 00:00:27.215265,0 days 00:00:00.394526,gini,12.0,5,"{'criterion': 'gini', 'max_depth': 12, 'min_samples_leaf': 5}",COMPLETE
