number,value,datetime_start,datetime_complete,duration,params_C,params_penalty,state
0,0.6083081135644713,2026-09-20 20:30:41.079427,2026-09-20 20:30:41.569545,0 days 00:00:00.490118,0.05577136378378569,l1,COMPLETE
1,0.6081996550734058,2026-09-20 20:30:41.569545,2026-09-20 20:30:42.055870,0 days 00:00:00.486325,86.67798931742034,l2,COMPLETE
2,0.6085585285588196,2026-09-20 20:30:42.055870,2026-09-20 20:30:43.412447,0 days 00:00:01.356577,5.628805587105362,l1,COMPLETE
3,0.6081996550734058,2026-09-20 20:30:43.412447,2026-09-20 20:30:45.564984,0 days 00:00:02.152537,215.42746079312872,l1,COMPLETE
4,0.6170698131836713,2026-09-20 20:30:45.564984,2026-09-20 20:30:46.002485,0 days 00:00:00.437501,0.01149620829515605,l2,COMPLETE
5,0.610217169254167,2026-09-20 20:30:46.002485,2026-09-20 20:30:46.477524,0 days 00:00:00.475039,0.12246211097110996,l1,COMPLETE
6,0.6097721187812818,2026-09-20 20:30:46.477524,2026-09-20 20:30:46.928993,0 days 00:00:00.451469,1.4545723630535605,l2,COMPLETE
7,0.609170473986463,2026-09-20 20:30:46.945087,2026-09-20 20:30:47.380859,0 days 00:00:00.435772,4.622971216148953,l2,COMPLETE
8,0.6129658909260245,2026-09-20 20:30:47.380859,2026-09-20 20:30:47.814298,0 days 00:00:00.433439,0.0011503992897376534,l2,COMPLETE
9,0.6125060172112003,2026-09-20 20:30:47.814298,2026-09-20 20:30:48.249514,0 days 00:00:00.435216,0.0012338261309568308,l2,COMPLETE
10,0.617496495516631,2026-09-20 20:30:48.249514,2026-09-20 20:30:48.686266,0 days 00:00:00.436752,0.022548752554129012,l2,COMPLETE
11,0.6146483758515527,2026-09-20 20:30:48.686266,2026-09-20 20:30:49.125815,0 days 00:00:00.439549,0.06534909589091516,l2,COMPLETE
12,0.61907877875717,2026-09-20 20:30:49.125815,2026-09-20 20:30:49.571314,0 days 00:00:00.445499,0.008083139885156758,l2,COMPLETE
13,0.6192388065154173,2026-09-20 20:30:49.571314,2026-09-20 20:30:50.006580,0 days 00:00:00.435266,0.009489452751712058,l2,COMPLETE
14,0.6193231314777802,2026-09-20 20:30:50.006580,2026-09-20 20:30:50.443435,0 days 00:00:00.436855,0.005435193939936225,l2,COMPLETE
15,0.6120632353777072,2026-09-20 20:30:50.443435,2026-09-20 20:30:50.886623,0 days 00:00:00.443188,0.3574381739213015,l2,COMPLETE
16,0.618789344127435,2026-09-20 20:30:50.886623,2026-09-20 20:30:51.314354,0 days 00:00:00.427731,0.004251514601588056,l2,COMPLETE
17,0.6116933921671484,2026-09-20 20:30:51.314354,2026-09-20 20:30:51.755108,0 days 00:00:00.440754,0.3744104759721965,l2,COMPLETE
18,0.5552588517284308,2026-09-20 20:30:51.755108,2026-09-20 20:30:52.207431,0 days 00:00:00.452323,0.0036181676902688033,l1,COMPLETE
19,0.6167488598183657,2026-09-20 20:30:52.207431,2026-09-20 20:30:52.649644,0 days 00:00:00.442213,0.03171215427431406,l2,COMPLETE
20,0.6079876135569671,2026-09-20 20:30:52.649644,2026-09-20 20:30:53.144712,0 days 00:00:00.495068,35.141860521429074,l2,COMPLETE
21,0.6186248888381539,2026-09-20 20:30:53.144712,2026-09-20 20:30:53.584460,0 days 00:00:00.439748,0.007756301971234384,l2,COMPLETE
22,0.618505817304126,2026-09-20 20:30:53.584460,2026-09-20 20:30:54.039034,0 days 00:00:00.454574,0.0031399062772230328,l2,COMPLETE
23,0.6177636063674702,2026-09-20 20:30:54.039034,2026-09-20 20:30:54.476724,0 days 00:00:00.437690,0.012568524138688746,l2,COMPLETE
