number,value,datetime_start,datetime_complete,duration,params_n_neighbors,params_p,params_weights,system_attrs_fixed_params,state
0,0.5356808818270609,2026-09-20 19:51:23.691573,2026-09-20 19:51:24.204428,0 days 00:00:00.512855,5,2,distance,,COMPLETE
1,,2026-09-20 19:51:24.204428,2026-09-20 19:51:24.204428,0 days 00:00:00,5,2,distance,,PRUNED
2,0.5386932149959306,2026-09-20 19:51:24.204428,2026-09-20 19:51:24.739463,0 days 00:00:00.535035,3,2,uniform,,COMPLETE
3,0.5336515058627707,2026-09-20 19:51:24.739463,2026-09-20 19:51:25.552540,0 days 00:00:00.813077,3,1,uniform,,COMPLETE
4,0.5610490786955262,2026-09-20 19:51:25.554555,2026-09-20 19:51:26.055394,0 days 00:00:00.500839,11,2,uniform,,COMPLETE
5,0.5278698788984021,2026-09-20 19:51:26.071035,2026-09-20 19:51:26.575037,0 days 00:00:00.504002,3,2,distance,,COMPLETE
6,0.5560479685497822,2026-09-20 19:51:26.575037,2026-09-20 19:51:27.372460,0 days 00:00:00.797423,11,1,distance,,COMPLETE
7,0.5698526710083442,2026-09-20 19:51:27.372460,2026-09-20 19:51:27.967706,0 days 00:00:00.595246,41,2,uniform,,COMPLETE
8,0.5896597027849025,2026-09-20 19:51:27.967706,2026-09-20 19:51:28.825234,0 days 00:00:00.857528,41,1,uniform,,COMPLETE
9,0.5788587017296799,2026-09-20 19:51:28.825234,2026-09-20 19:51:29.688292,0 days 00:00:00.863058,21,1,uniform,,COMPLETE
10,,2026-09-20 19:51:29.688292,2026-09-20 19:51:29.688292,0 days 00:00:00,41,1,uniform,,PRUNED
11,,2026-09-20 19:51:29.688292,2026-09-20 19:51:29.688292,0 days 00:00:00,21,1,uniform,,PRUNED
12,,2026-09-20 19:51:29.688292,2026-09-20 19:51:29.688292,0 days 00:00:00,21,1,uniform,,PRUNED
13,0.5905325882090328,2026-09-20 19:51:29.688292,2026-09-20 19:51:30.680778,0 days 00:00:00.992486,81,1,uniform,,COMPLETE
14,,2026-09-20 19:51:30.680778,2026-09-20 19:51:30.680778,0 days 00:00:00,81,1,uniform,,PRUNED
15,,2026-09-20 19:51:30.680778,2026-09-20 19:51:30.680778,0 days 00:00:00,81,1,uniform,,PRUNED
16,,2026-09-20 19:51:30.680778,2026-09-20 19:51:30.680778,0 days 00:00:00,41,1,uniform,,PRUNED
17,,2026-09-20 19:51:30.680778,2026-09-20 19:51:30.690665,0 days 00:00:00.009887,81,1,uniform,,PRUNED
18,0.584933670249302,2026-09-20 19:51:30.690665,2026-09-20 19:51:31.546276,0 days 00:00:00.855611,41,1,distance,,COMPLETE
19,,2026-09-20 19:51:31.546276,2026-09-20 19:51:31.546276,0 days 00:00:00,81,1,uniform,,PRUNED
20,,2026-09-20 19:51:31.546276,2026-09-20 19:51:31.546276,0 days 00:00:00,81,1,uniform,,PRUNED
21,,2026-09-20 19:51:31.546276,2026-09-20 19:51:31.546276,0 days 00:00:00,41,1,distance,,PRUNED
22,,2026-09-20 19:51:31.546276,2026-09-20 19:51:31.562243,0 days 00:00:00.015967,41,1,distance,,PRUNED
23,,2026-09-20 19:51:31.562243,2026-09-20 19:51:31.562243,0 days 00:00:00,41,1,distance,,PRUNED
24,,2026-09-20 19:51:31.562243,2026-09-20 19:51:31.562243,0 days 00:00:00,41,1,distance,,PRUNED
25,,2026-09-20 19:51:31.562243,2026-09-20 19:51:31.562243,0 days 00:00:00,41,1,distance,,PRUNED
26,,2026-09-20 19:51:31.562243,2026-09-20 19:51:31.562243,0 days 00:00:00,11,1,distance,,PRUNED
27,0.5493739672308254,2026-09-20 19:51:31.562243,2026-09-20 19:51:32.103561,0 days 00:00:00.541318,11,2,distance,"{'n_neighbors': 11, 'p': 2, 'weights': 'distance'}",COMPLETE
28,0.5652181626341853,2026-09-20 19:51:32.103561,2026-09-20 19:51:32.915804,0 days 00:00:00.812243,5,1,uniform,,COMPLETE
29,0.5490217011721165,2026-09-20 19:51:32.915804,2026-09-20 19:51:33.736449,0 days 00:00:00.820645,5,1,distance,,COMPLETE
30,,2026-09-20 19:51:33.736449,2026-09-20 19:51:33.742333,0 days 00:00:00.005884,81,1,uniform,,PRUNED
31,,2026-09-20 19:51:33.742333,2026-09-20 19:51:33.742333,0 days 00:00:00,21,1,uniform,,PRUNED
32,,2026-09-20 19:51:33.742333,2026-09-20 19:51:33.742333,0 days 00:00:00,21,1,uniform,,PRUNED
33,,2026-09-20 19:51:33.742333,2026-09-20 19:51:33.742333,0 days 00:00:00,21,1,uniform,,PRUNED
34,0.56732565164601,2026-09-20 19:51:33.742333,2026-09-20 19:51:34.299282,0 days 00:00:00.556949,21,2,uniform,,COMPLETE
35,,2026-09-20 19:51:34.299282,2026-09-20 19:51:34.307532,0 days 00:00:00.008250,3,1,uniform,,PRUNED
36,,2026-09-20 19:51:34.307532,2026-09-20 19:51:34.307532,0 days 00:00:00,41,2,uniform,,PRUNED
37,,2026-09-20 19:51:34.307532,2026-09-20 19:51:34.307532,0 days 00:00:00,5,1,distance,,PRUNED
38,,2026-09-20 19:51:34.307532,2026-09-20 19:51:34.315198,0 days 00:00:00.007666,3,2,uniform,,PRUNED
39,,2026-09-20 19:51:34.315198,2026-09-20 19:51:34.315198,0 days 00:00:00,41,1,uniform,,PRUNED
40,0.5758104494216028,2026-09-20 19:51:34.315198,2026-09-20 19:51:35.161861,0 days 00:00:00.846663,21,1,distance,,COMPLETE
41,,2026-09-20 19:51:35.161861,2026-09-20 19:51:35.165540,0 days 00:00:00.003679,21,1,distance,,PRUNED
42,,2026-09-20 19:51:35.165540,2026-09-20 19:51:35.165540,0 days 00:00:00,21,1,distance,,PRUNED
43,,2026-09-20 19:51:35.165540,2026-09-20 19:51:35.165540,0 days 00:00:00,21,1,distance,,PRUNED
44,,2026-09-20 19:51:35.165540,2026-09-20 19:51:35.165540,0 days 00:00:00,21,1,distance,,PRUNED
45,0.5906764553987439,2026-09-20 19:51:35.165540,2026-09-20 19:51:36.146440,0 days 00:00:00.980900,81,1,distance,,COMPLETE
46,0.5727735332256176,2026-09-20 19:51:36.146440,2026-09-20 19:51:36.832689,0 days 00:00:00.686249,81,2,uniform,,COMPLETE
47,,2026-09-20 19:51:36.832689,2026-09-20 19:51:36.832689,0 days 00:00:00,81,1,uniform,,PRUNED
48,,2026-09-20 19:51:36.832689,2026-09-20 19:51:36.832689,0 days 00:00:00,81,1,distance,,PRUNED
49,,2026-09-20 19:51:36.832689,2026-09-20 19:51:36.832689,0 days 00:00:00,81,1,uniform,,PRUNED
50,,2026-09-20 19:51:36.832689,2026-09-20 19:51:36.842097,0 days 00:00:00.009408,41,1,uniform,,PRUNED
51,,2026-09-20 19:51:36.842097,2026-09-20 19:51:36.842097,0 days 00:00:00,11,1,distance,,PRUNED
52,,2026-09-20 19:51:36.842097,2026-09-20 19:51:36.842097,0 days 00:00:00,81,1,distance,,PRUNED
53,0.5237847086518177,2026-09-20 19:51:36.842097,2026-09-20 19:51:37.662440,0 days 00:00:00.820343,3,1,distance,,COMPLETE
54,,2026-09-20 19:51:37.662440,2026-09-20 19:51:37.662440,0 days 00:00:00,41,1,distance,,PRUNED
55,,2026-09-20 19:51:37.662440,2026-09-20 19:51:37.662440,0 days 00:00:00,21,1,distance,,PRUNED
56,,2026-09-20 19:51:37.662440,2026-09-20 19:51:37.662440,0 days 00:00:00,81,1,distance,,PRUNED
57,,2026-09-20 19:51:37.662440,2026-09-20 19:51:37.673187,0 days 00:00:00.010747,41,1,uniform,,PRUNED
58,,2026-09-20 19:51:37.673187,2026-09-20 19:51:37.673187,0 days 00:00:00,5,1,distance,,PRUNED
59,,2026-09-20 19:51:37.673187,2026-09-20 19:51:37.678817,0 days 00:00:00.005630,81,2,uniform,,PRUNED
60,,2026-09-20 19:51:37.678817,2026-09-20 19:51:37.678817,0 days 00:00:00,41,1,distance,,PRUNED
61,,2026-09-20 19:51:37.678817,2026-09-20 19:51:37.682595,0 days 00:00:00.003778,81,2,uniform,,PRUNED
62,0.5714627982557033,2026-09-20 19:51:37.684059,2026-09-20 19:51:38.351372,0 days 00:00:00.667313,81,2,distance,"{'n_neighbors': 81, 'p': 2, 'weights': 'distance'}",COMPLETE
63,,2026-09-20 19:51:38.351372,2026-09-20 19:51:38.353638,0 days 00:00:00.002266,81,2,uniform,,PRUNED
64,,2026-09-20 19:51:38.353638,2026-09-20 19:51:38.357507,0 days 00:00:00.003869,81,2,uniform,,PRUNED
65,,2026-09-20 19:51:38.357507,2026-09-20 19:51:38.359668,0 days 00:00:00.002161,21,2,uniform,,PRUNED
66,0.5714127051268818,2026-09-20 19:51:38.360299,2026-09-20 19:51:39.164968,0 days 00:00:00.804669,11,1,uniform,,COMPLETE
67,,2026-09-20 19:51:39.164968,2026-09-20 19:51:39.167009,0 days 00:00:00.002041,81,1,uniform,,PRUNED
68,,2026-09-20 19:51:39.167009,2026-09-20 19:51:39.169011,0 days 00:00:00.002002,41,2,uniform,,PRUNED
69,,2026-09-20 19:51:39.169011,2026-09-20 19:51:39.169011,0 days 00:00:00,21,1,uniform,,PRUNED
70,,2026-09-20 19:51:39.169011,2026-09-20 19:51:39.169011,0 days 00:00:00,81,1,distance,,PRUNED
71,,2026-09-20 19:51:39.169011,2026-09-20 19:51:39.169011,0 days 00:00:00,81,2,distance,,PRUNED
72,,2026-09-20 19:51:39.169011,2026-09-20 19:51:39.169011,0 days 00:00:00,81,2,distance,,PRUNED
73,,2026-09-20 19:51:39.169011,2026-09-20 19:51:39.169011,0 days 00:00:00,81,2,distance,,PRUNED
74,,2026-09-20 19:51:39.180804,2026-09-20 19:51:39.180804,0 days 00:00:00,3,2,distance,,PRUNED
75,0.561403108822828,2026-09-20 19:51:39.180804,2026-09-20 19:51:39.749275,0 days 00:00:00.568471,21,2,distance,"{'n_neighbors': 21, 'p': 2, 'weights': 'distance'}",COMPLETE
76,,2026-09-20 19:51:39.749275,2026-09-20 19:51:39.749275,0 days 00:00:00,41,2,uniform,,PRUNED
77,,2026-09-20 19:51:39.749275,2026-09-20 19:51:39.752919,0 days 00:00:00.003644,81,1,distance,,PRUNED
78,,2026-09-20 19:51:39.752919,2026-09-20 19:51:39.752919,0 days 00:00:00,5,1,uniform,,PRUNED
79,,2026-09-20 19:51:39.752919,2026-09-20 19:51:39.752919,0 days 00:00:00,81,1,distance,,PRUNED
80,,2026-09-20 19:51:39.752919,2026-09-20 19:51:39.752919,0 days 00:00:00,11,2,uniform,,PRUNED
81,,2026-09-20 19:51:39.752919,2026-09-20 19:51:39.752919,0 days 00:00:00,11,1,uniform,,PRUNED
82,,2026-09-20 19:51:39.752919,2026-09-20 19:51:39.752919,0 days 00:00:00,11,1,uniform,,PRUNED
83,,2026-09-20 19:51:39.752919,2026-09-20 19:51:39.752919,0 days 00:00:00,11,1,uniform,,PRUNED
84,0.5482343741320812,2026-09-20 19:51:39.752919,2026-09-20 19:51:40.306253,0 days 00:00:00.553334,5,2,uniform,"{'n_neighbors': 5, 'p': 2, 'weights': 'uniform'}",COMPLETE
85,,2026-09-20 19:51:40.306253,2026-09-20 19:51:40.306253,0 days 00:00:00,11,1,uniform,,PRUNED
86,,2026-09-20 19:51:40.306253,2026-09-20 19:51:40.306253,0 days 00:00:00,21,1,uniform,,PRUNED
87,,2026-09-20 19:51:40.306253,2026-09-20 19:51:40.306253,0 days 00:00:00,41,1,distance,,PRUNED
88,,2026-09-20 19:51:40.306253,2026-09-20 19:51:40.306253,0 days 00:00:00,81,1,uniform,,PRUNED
89,,2026-09-20 19:51:40.306253,2026-09-20 19:51:40.306253,0 days 00:00:00,41,1,distance,,PRUNED
90,,2026-09-20 19:51:40.306253,2026-09-20 19:51:40.306253,0 days 00:00:00,21,1,uniform,,PRUNED
91,,2026-09-20 19:51:40.306253,2026-09-20 19:51:40.322374,0 days 00:00:00.016121,41,2,uniform,,PRUNED
92,,2026-09-20 19:51:40.322374,2026-09-20 19:51:40.322374,0 days 00:00:00,41,2,uniform,,PRUNED
93,0.5651861849057876,2026-09-20 19:51:40.322374,2026-09-20 19:51:40.901860,0 days 00:00:00.579486,41,2,distance,"{'n_neighbors': 41, 'p': 2, 'weights': 'distance'}",COMPLETE
