number,value,datetime_start,datetime_complete,duration,params_C,params_penalty,state
0,0.6264616654420457,2026-09-21 02:10:09.326666,2026-09-21 02:10:09.842987,0 days 00:00:00.516321,2.6357448788442195,l1,COMPLETE
1,0.6260097554106041,2026-09-21 02:10:09.842987,2026-09-21 02:10:10.223937,0 days 00:00:00.380950,0.0037717780786253492,l2,COMPLETE
2,0.6250856143402467,2026-09-21 02:10:10.223937,2026-09-21 02:10:10.652000,0 days 00:00:00.428063,174.598191439296,l2,COMPLETE
3,0.6252864156020559,2026-09-21 02:10:10.652000,2026-09-21 02:10:12.249076,0 days 00:00:01.597076,484.1663065302786,l1,COMPLETE
4,0.6252864156020559,2026-09-21 02:10:12.249076,2026-09-21 02:10:13.786796,0 days 00:00:01.537720,76.82525678967939,l1,COMPLETE
5,0.6226226761792576,2026-09-21 02:10:13.786796,2026-09-21 02:10:14.197194,0 days 00:00:00.410398,0.04800154457114455,l1,COMPLETE
6,0.626040002169959,2026-09-21 02:10:14.197194,2026-09-21 02:10:15.633149,0 days 00:00:01.435955,22.92622414637338,l1,COMPLETE
7,0.6286132524251189,2026-09-21 02:10:15.633149,2026-09-21 02:10:16.027113,0 days 00:00:00.393964,0.09006041162195456,l2,COMPLETE
8,0.6273538915699898,2026-09-21 02:10:16.027113,2026-09-21 02:10:16.448489,0 days 00:00:00.421376,0.14111146584598513,l2,COMPLETE
9,0.6180565546445445,2026-09-21 02:10:16.448489,2026-09-21 02:10:16.853479,0 days 00:00:00.404990,0.0011316673755467994,l2,COMPLETE
10,0.6270371129395124,2026-09-21 02:10:16.853479,2026-09-21 02:10:17.245099,0 days 00:00:00.391620,0.5683270627714114,l2,COMPLETE
11,0.6271099396055376,2026-09-21 02:10:17.245099,2026-09-21 02:10:17.620380,0 days 00:00:00.375281,0.10129706196450322,l2,COMPLETE
12,0.627705556604884,2026-09-21 02:10:17.620380,2026-09-21 02:10:18.010396,0 days 00:00:00.390016,0.02625426499551132,l2,COMPLETE
13,0.6306069461245771,2026-09-21 02:10:18.010396,2026-09-21 02:10:18.396626,0 days 00:00:00.386230,0.01304399836825571,l2,COMPLETE
14,0.6295974160636041,2026-09-21 02:10:18.396626,2026-09-21 02:10:18.785119,0 days 00:00:00.388493,0.007773968704226594,l2,COMPLETE
15,0.6289383487353031,2026-09-21 02:10:18.785119,2026-09-21 02:10:19.156722,0 days 00:00:00.371603,0.007169445449526356,l2,COMPLETE
16,0.6257955023745395,2026-09-21 02:10:19.156722,2026-09-21 02:10:19.561064,0 days 00:00:00.404342,2.4391742890479424,l2,COMPLETE
17,0.628875303397586,2026-09-21 02:10:19.561064,2026-09-21 02:10:19.956082,0 days 00:00:00.395018,0.008686102185996523,l2,COMPLETE
18,0.6195251258466791,2026-09-21 02:10:19.956082,2026-09-21 02:10:20.367940,0 days 00:00:00.411858,0.001776336196102673,l2,COMPLETE
19,0.626621616500159,2026-09-21 02:10:20.367940,2026-09-21 02:10:20.774165,0 days 00:00:00.406225,0.6938362707866275,l2,COMPLETE
20,0.6291605596474223,2026-09-21 02:10:20.774165,2026-09-21 02:10:21.182745,0 days 00:00:00.408580,0.016670591391140546,l2,COMPLETE
21,0.6301794497642409,2026-09-21 02:10:21.182745,2026-09-21 02:10:21.574111,0 days 00:00:00.391366,0.013611963634862528,l2,COMPLETE
22,0.6262224653563736,2026-09-21 02:10:21.574111,2026-09-21 02:10:21.965078,0 days 00:00:00.390967,0.003988074354032777,l2,COMPLETE
23,0.6287013293727963,2026-09-21 02:10:21.965078,2026-09-21 02:10:22.329989,0 days 00:00:00.364911,0.2981832243898808,l2,COMPLETE
