number,value,datetime_start,datetime_complete,duration,params_n_neighbors,params_p,params_weights,system_attrs_fixed_params,state
0,0.5531945792736932,2026-09-20 19:43:51.211739,2026-09-20 19:43:51.720571,0 days 00:00:00.508832,5,2,uniform,,COMPLETE
1,0.595629055864978,2026-09-20 19:43:51.720571,2026-09-20 19:43:52.379567,0 days 00:00:00.658996,81,2,distance,,COMPLETE
2,0.5938051653238995,2026-09-20 19:43:52.379567,2026-09-20 19:43:53.165390,0 days 00:00:00.785823,11,1,uniform,,COMPLETE
3,0.5958811066834797,2026-09-20 19:43:53.165390,2026-09-20 19:43:53.988168,0 days 00:00:00.822778,21,1,distance,,COMPLETE
4,,2026-09-20 19:43:53.988168,2026-09-20 19:43:53.990168,0 days 00:00:00.002000,21,1,distance,,PRUNED
5,0.560191801406956,2026-09-20 19:43:53.990168,2026-09-20 19:43:54.791361,0 days 00:00:00.801193,3,1,uniform,,COMPLETE
6,,2026-09-20 19:43:54.791361,2026-09-20 19:43:54.791361,0 days 00:00:00,21,1,distance,,PRUNED
7,0.5674451915707442,2026-09-20 19:43:54.791361,2026-09-20 19:43:55.584171,0 days 00:00:00.792810,5,1,uniform,,COMPLETE
8,0.5847063005656662,2026-09-20 19:43:55.584171,2026-09-20 19:43:56.141074,0 days 00:00:00.556903,41,2,distance,,COMPLETE
9,,2026-09-20 19:43:56.141074,2026-09-20 19:43:56.150375,0 days 00:00:00.009301,21,1,distance,,PRUNED
10,0.5718024355381098,2026-09-20 19:43:56.150375,2026-09-20 19:43:56.633291,0 days 00:00:00.482916,11,2,distance,,COMPLETE
11,,2026-09-20 19:43:56.633291,2026-09-20 19:43:56.635844,0 days 00:00:00.002553,81,2,distance,,PRUNED
12,,2026-09-20 19:43:56.635844,2026-09-20 19:43:56.635844,0 days 00:00:00,81,2,distance,,PRUNED
13,,2026-09-20 19:43:56.635844,2026-09-20 19:43:56.635844,0 days 00:00:00,81,2,distance,,PRUNED
14,0.5502793888234907,2026-09-20 19:43:56.635844,2026-09-20 19:43:57.411511,0 days 00:00:00.775667,3,1,distance,,COMPLETE
15,,2026-09-20 19:43:57.411511,2026-09-20 19:43:57.414574,0 days 00:00:00.003063,41,2,distance,,PRUNED
16,0.5776188839237231,2026-09-20 19:43:57.414574,2026-09-20 19:43:57.936962,0 days 00:00:00.522388,21,2,distance,,COMPLETE
17,0.6057667587869324,2026-09-20 19:43:57.936962,2026-09-20 19:43:58.887658,0 days 00:00:00.950696,81,1,distance,,COMPLETE
18,0.6041181446580213,2026-09-20 19:43:58.887658,2026-09-20 19:43:59.825303,0 days 00:00:00.937645,81,1,uniform,,COMPLETE
19,,2026-09-20 19:43:59.825303,2026-09-20 19:43:59.839359,0 days 00:00:00.014056,81,1,uniform,,PRUNED
20,,2026-09-20 19:43:59.839359,2026-09-20 19:43:59.841605,0 days 00:00:00.002246,81,1,uniform,,PRUNED
21,,2026-09-20 19:43:59.841605,2026-09-20 19:43:59.843020,0 days 00:00:00.001415,81,1,uniform,,PRUNED
22,0.6000095134504044,2026-09-20 19:43:59.843020,2026-09-20 19:44:00.660335,0 days 00:00:00.817315,21,1,uniform,,COMPLETE
23,,2026-09-20 19:44:00.660335,2026-09-20 19:44:00.663964,0 days 00:00:00.003629,81,1,uniform,,PRUNED
24,0.6051763999835109,2026-09-20 19:44:00.663964,2026-09-20 19:44:01.526609,0 days 00:00:00.862645,41,1,uniform,,COMPLETE
25,,2026-09-20 19:44:01.526609,2026-09-20 19:44:01.526609,0 days 00:00:00,41,1,uniform,,PRUNED
26,,2026-09-20 19:44:01.526609,2026-09-20 19:44:01.531855,0 days 00:00:00.005246,41,1,uniform,,PRUNED
27,,2026-09-20 19:44:01.531855,2026-09-20 19:44:01.531855,0 days 00:00:00,41,1,uniform,,PRUNED
28,,2026-09-20 19:44:01.531855,2026-09-20 19:44:01.536268,0 days 00:00:00.004413,11,1,uniform,,PRUNED
29,,2026-09-20 19:44:01.536268,2026-09-20 19:44:01.536268,0 days 00:00:00,5,1,uniform,,PRUNED
30,,2026-09-20 19:44:01.536268,2026-09-20 19:44:01.536268,0 days 00:00:00,3,1,uniform,,PRUNED
31,,2026-09-20 19:44:01.536268,2026-09-20 19:44:01.542742,0 days 00:00:00.006474,5,1,uniform,,PRUNED
32,,2026-09-20 19:44:01.542742,2026-09-20 19:44:01.542742,0 days 00:00:00,81,1,uniform,,PRUNED
33,0.5988514061506761,2026-09-20 19:44:01.542742,2026-09-20 19:44:02.413238,0 days 00:00:00.870496,41,1,distance,"{'n_neighbors': 41, 'p': 1, 'weights': 'distance'}",COMPLETE
34,,2026-09-20 19:44:02.413238,2026-09-20 19:44:02.425771,0 days 00:00:00.012533,21,1,uniform,,PRUNED
35,,2026-09-20 19:44:02.425771,2026-09-20 19:44:02.425771,0 days 00:00:00,81,1,uniform,,PRUNED
36,,2026-09-20 19:44:02.425771,2026-09-20 19:44:02.425771,0 days 00:00:00,21,1,uniform,,PRUNED
37,,2026-09-20 19:44:02.425771,2026-09-20 19:44:02.425771,0 days 00:00:00,11,1,uniform,,PRUNED
38,,2026-09-20 19:44:02.425771,2026-09-20 19:44:02.433856,0 days 00:00:00.008085,21,1,uniform,,PRUNED
39,,2026-09-20 19:44:02.433856,2026-09-20 19:44:02.433856,0 days 00:00:00,41,1,uniform,,PRUNED
40,,2026-09-20 19:44:02.433856,2026-09-20 19:44:02.433856,0 days 00:00:00,3,1,uniform,,PRUNED
41,,2026-09-20 19:44:02.433856,2026-09-20 19:44:02.433856,0 days 00:00:00,41,1,distance,,PRUNED
42,0.5541832608761742,2026-09-20 19:44:02.441660,2026-09-20 19:44:02.916640,0 days 00:00:00.474980,3,2,uniform,"{'n_neighbors': 3, 'p': 2, 'weights': 'uniform'}",COMPLETE
43,,2026-09-20 19:44:02.916640,2026-09-20 19:44:02.916640,0 days 00:00:00,41,1,distance,,PRUNED
44,,2026-09-20 19:44:02.916640,2026-09-20 19:44:02.916640,0 days 00:00:00,41,1,distance,,PRUNED
45,0.5561832890600015,2026-09-20 19:44:02.916640,2026-09-20 19:44:03.726983,0 days 00:00:00.810343,5,1,distance,,COMPLETE
46,,2026-09-20 19:44:03.726983,2026-09-20 19:44:03.726983,0 days 00:00:00,81,1,distance,,PRUNED
47,,2026-09-20 19:44:03.726983,2026-09-20 19:44:03.726983,0 days 00:00:00,21,1,distance,,PRUNED
48,,2026-09-20 19:44:03.726983,2026-09-20 19:44:03.726983,0 days 00:00:00,41,1,distance,,PRUNED
49,0.5797737324526073,2026-09-20 19:44:03.726983,2026-09-20 19:44:04.495824,0 days 00:00:00.768841,11,1,distance,,COMPLETE
50,,2026-09-20 19:44:04.495824,2026-09-20 19:44:04.495824,0 days 00:00:00,81,2,distance,,PRUNED
51,,2026-09-20 19:44:04.495824,2026-09-20 19:44:04.505499,0 days 00:00:00.009675,21,1,distance,,PRUNED
52,,2026-09-20 19:44:04.505499,2026-09-20 19:44:04.505499,0 days 00:00:00,21,1,distance,,PRUNED
53,,2026-09-20 19:44:04.505499,2026-09-20 19:44:04.505499,0 days 00:00:00,21,1,distance,,PRUNED
54,,2026-09-20 19:44:04.505499,2026-09-20 19:44:04.505499,0 days 00:00:00,21,1,distance,,PRUNED
55,,2026-09-20 19:44:04.505499,2026-09-20 19:44:04.505499,0 days 00:00:00,81,1,distance,,PRUNED
56,,2026-09-20 19:44:04.505499,2026-09-20 19:44:04.505499,0 days 00:00:00,41,2,distance,,PRUNED
57,,2026-09-20 19:44:04.505499,2026-09-20 19:44:04.505499,0 days 00:00:00,81,1,uniform,,PRUNED
58,0.5397138591764,2026-09-20 19:44:04.505499,2026-09-20 19:44:05.019506,0 days 00:00:00.514007,3,2,distance,"{'n_neighbors': 3, 'p': 2, 'weights': 'distance'}",COMPLETE
59,,2026-09-20 19:44:05.019506,2026-09-20 19:44:05.019506,0 days 00:00:00,41,1,uniform,,PRUNED
60,,2026-09-20 19:44:05.026500,2026-09-20 19:44:05.027510,0 days 00:00:00.001010,21,1,uniform,,PRUNED
61,,2026-09-20 19:44:05.027510,2026-09-20 19:44:05.027510,0 days 00:00:00,81,2,distance,,PRUNED
62,,2026-09-20 19:44:05.027510,2026-09-20 19:44:05.033236,0 days 00:00:00.005726,81,2,distance,,PRUNED
63,,2026-09-20 19:44:05.033236,2026-09-20 19:44:05.035596,0 days 00:00:00.002360,81,2,distance,,PRUNED
64,,2026-09-20 19:44:05.035596,2026-09-20 19:44:05.035596,0 days 00:00:00,81,2,distance,,PRUNED
65,,2026-09-20 19:44:05.035596,2026-09-20 19:44:05.039972,0 days 00:00:00.004376,5,1,uniform,,PRUNED
66,,2026-09-20 19:44:05.039972,2026-09-20 19:44:05.039972,0 days 00:00:00,11,1,distance,,PRUNED
67,0.5798095108313325,2026-09-20 19:44:05.039972,2026-09-20 19:44:05.568071,0 days 00:00:00.528099,21,2,uniform,"{'n_neighbors': 21, 'p': 2, 'weights': 'uniform'}",COMPLETE
68,,2026-09-20 19:44:05.568071,2026-09-20 19:44:05.568071,0 days 00:00:00,81,1,distance,,PRUNED
69,,2026-09-20 19:44:05.568071,2026-09-20 19:44:05.574262,0 days 00:00:00.006191,41,1,uniform,,PRUNED
70,,2026-09-20 19:44:05.574262,2026-09-20 19:44:05.574262,0 days 00:00:00,81,1,uniform,,PRUNED
71,,2026-09-20 19:44:05.574262,2026-09-20 19:44:05.574262,0 days 00:00:00,11,1,uniform,,PRUNED
72,,2026-09-20 19:44:05.574262,2026-09-20 19:44:05.574262,0 days 00:00:00,11,1,uniform,,PRUNED
73,,2026-09-20 19:44:05.574262,2026-09-20 19:44:05.574262,0 days 00:00:00,41,1,uniform,,PRUNED
74,,2026-09-20 19:44:05.574262,2026-09-20 19:44:05.583880,0 days 00:00:00.009618,11,1,uniform,,PRUNED
75,,2026-09-20 19:44:05.583880,2026-09-20 19:44:05.583880,0 days 00:00:00,21,1,uniform,,PRUNED
76,0.5795037137286804,2026-09-20 19:44:05.583880,2026-09-20 19:44:06.074718,0 days 00:00:00.490838,11,2,uniform,"{'n_neighbors': 11, 'p': 2, 'weights': 'uniform'}",COMPLETE
77,,2026-09-20 19:44:06.074718,2026-09-20 19:44:06.077430,0 days 00:00:00.002712,81,1,distance,,PRUNED
78,,2026-09-20 19:44:06.077430,2026-09-20 19:44:06.077430,0 days 00:00:00,5,1,distance,,PRUNED
79,,2026-09-20 19:44:06.077430,2026-09-20 19:44:06.083145,0 days 00:00:00.005715,41,1,uniform,,PRUNED
80,,2026-09-20 19:44:06.083145,2026-09-20 19:44:06.083145,0 days 00:00:00,21,1,distance,,PRUNED
81,,2026-09-20 19:44:06.083145,2026-09-20 19:44:06.087318,0 days 00:00:00.004173,41,2,distance,,PRUNED
82,,2026-09-20 19:44:06.087318,2026-09-20 19:44:06.087318,0 days 00:00:00,41,2,distance,,PRUNED
83,,2026-09-20 19:44:06.087318,2026-09-20 19:44:06.090603,0 days 00:00:00.003285,41,2,distance,,PRUNED
84,,2026-09-20 19:44:06.090603,2026-09-20 19:44:06.090603,0 days 00:00:00,41,2,distance,,PRUNED
85,0.5962804291801338,2026-09-20 19:44:06.090603,2026-09-20 19:44:06.758902,0 days 00:00:00.668299,81,2,uniform,"{'n_neighbors': 81, 'p': 2, 'weights': 'uniform'}",COMPLETE
86,,2026-09-20 19:44:06.758902,2026-09-20 19:44:06.769616,0 days 00:00:00.010714,81,1,uniform,,PRUNED
87,,2026-09-20 19:44:06.769616,2026-09-20 19:44:06.772434,0 days 00:00:00.002818,81,1,uniform,,PRUNED
88,,2026-09-20 19:44:06.772434,2026-09-20 19:44:06.774550,0 days 00:00:00.002116,81,2,uniform,,PRUNED
89,,2026-09-20 19:44:06.774550,2026-09-20 19:44:06.777270,0 days 00:00:00.002720,3,1,uniform,,PRUNED
90,,2026-09-20 19:44:06.777270,2026-09-20 19:44:06.779457,0 days 00:00:00.002187,81,1,uniform,,PRUNED
91,,2026-09-20 19:44:06.779457,2026-09-20 19:44:06.779457,0 days 00:00:00,21,2,distance,,PRUNED
92,,2026-09-20 19:44:06.779457,2026-09-20 19:44:06.783987,0 days 00:00:00.004530,41,2,distance,,PRUNED
93,,2026-09-20 19:44:06.783987,2026-09-20 19:44:06.786167,0 days 00:00:00.002180,81,2,uniform,,PRUNED
94,0.5873207274139346,2026-09-20 19:44:06.786167,2026-09-20 19:44:07.347540,0 days 00:00:00.561373,41,2,uniform,"{'n_neighbors': 41, 'p': 2, 'weights': 'uniform'}",COMPLETE
95,,2026-09-20 19:44:07.347540,2026-09-20 19:44:07.354232,0 days 00:00:00.006692,11,2,uniform,,PRUNED
96,,2026-09-20 19:44:07.354232,2026-09-20 19:44:07.357755,0 days 00:00:00.003523,81,2,uniform,,PRUNED
97,,2026-09-20 19:44:07.357755,2026-09-20 19:44:07.358982,0 days 00:00:00.001227,21,1,uniform,,PRUNED
98,,2026-09-20 19:44:07.358982,2026-09-20 19:44:07.363549,0 days 00:00:00.004567,41,1,uniform,,PRUNED
99,,2026-09-20 19:44:07.363549,2026-09-20 19:44:07.363549,0 days 00:00:00,81,2,uniform,,PRUNED
100,,2026-09-20 19:44:07.363549,2026-09-20 19:44:07.367657,0 days 00:00:00.004108,5,1,uniform,,PRUNED
101,,2026-09-20 19:44:07.367657,2026-09-20 19:44:07.369895,0 days 00:00:00.002238,41,2,distance,,PRUNED
102,,2026-09-20 19:44:07.369895,2026-09-20 19:44:07.372171,0 days 00:00:00.002276,41,2,distance,,PRUNED
103,0.5436229733227363,2026-09-20 19:44:07.372171,2026-09-20 19:44:07.871329,0 days 00:00:00.499158,5,2,distance,"{'n_neighbors': 5, 'p': 2, 'weights': 'distance'}",COMPLETE
