number,value,datetime_start,datetime_complete,duration,params_C,params_penalty,state
0,0.6214409967432601,2026-09-20 20:29:59.087294,2026-09-20 20:30:00.527038,0 days 00:00:01.439744,458.1436646735198,l1,COMPLETE
1,0.6054830083030392,2026-09-20 20:30:00.527038,2026-09-20 20:30:00.976652,0 days 00:00:00.449614,0.010864695586570043,l1,COMPLETE
2,0.6256412619148457,2026-09-20 20:30:00.976652,2026-09-20 20:30:01.496103,0 days 00:00:00.519451,0.4832885830422632,l1,COMPLETE
3,0.6288885302587891,2026-09-20 20:30:01.496103,2026-09-20 20:30:01.923069,0 days 00:00:00.426966,0.03588693126779009,l2,COMPLETE
4,0.5690263664051589,2026-09-20 20:30:01.923069,2026-09-20 20:30:02.355558,0 days 00:00:00.432489,0.005430618841642239,l1,COMPLETE
5,0.623980248074719,2026-09-20 20:30:02.355558,2026-09-20 20:30:02.778687,0 days 00:00:00.423129,4.219633466486892,l2,COMPLETE
6,0.6220579004241741,2026-09-20 20:30:02.778687,2026-09-20 20:30:04.351769,0 days 00:00:01.573082,22.960397431432074,l1,COMPLETE
7,0.6276872669291242,2026-09-20 20:30:04.351769,2026-09-20 20:30:04.784174,0 days 00:00:00.432405,0.01174191121880418,l2,COMPLETE
8,0.6257174187358943,2026-09-20 20:30:04.784174,2026-09-20 20:30:05.233387,0 days 00:00:00.449213,0.2517526341018527,l2,COMPLETE
9,0.628442883536796,2026-09-20 20:30:05.233387,2026-09-20 20:30:05.665227,0 days 00:00:00.431840,0.1048932996525953,l2,COMPLETE
10,0.6244494343501478,2026-09-20 20:30:05.665227,2026-09-20 20:30:06.092112,0 days 00:00:00.426885,0.0010913701815876747,l2,COMPLETE
11,0.6287936250534006,2026-09-20 20:30:06.092112,2026-09-20 20:30:06.538235,0 days 00:00:00.446123,0.0939300648829246,l2,COMPLETE
12,0.6301248864937039,2026-09-20 20:30:06.538235,2026-09-20 20:30:06.981118,0 days 00:00:00.442883,0.05268353393578756,l2,COMPLETE
13,0.6239761344798564,2026-09-20 20:30:06.981118,2026-09-20 20:30:07.426394,0 days 00:00:00.445276,3.0457686865975524,l2,COMPLETE
14,0.6288885302587891,2026-09-20 20:30:07.426394,2026-09-20 20:30:07.859007,0 days 00:00:00.432613,0.035419297257147805,l2,COMPLETE
15,0.6298031286793168,2026-09-20 20:30:07.859007,2026-09-20 20:30:08.281992,0 days 00:00:00.422985,0.0033265260878464122,l2,COMPLETE
16,0.6243130213470235,2026-09-20 20:30:08.281992,2026-09-20 20:30:08.717294,0 days 00:00:00.435302,0.0015510697016230673,l2,COMPLETE
17,0.6293301581275293,2026-09-20 20:30:08.717294,2026-09-20 20:30:09.186867,0 days 00:00:00.469573,0.003988687420110643,l2,COMPLETE
18,0.6243251547488226,2026-09-20 20:30:09.186867,2026-09-20 20:30:09.654902,0 days 00:00:00.468035,1.4401188346152738,l2,COMPLETE
19,0.6214552181170174,2026-09-20 20:30:09.654902,2026-09-20 20:30:10.106146,0 days 00:00:00.451244,22.029400874145793,l2,COMPLETE
20,0.6289555471033488,2026-09-20 20:30:10.106146,2026-09-20 20:30:10.555259,0 days 00:00:00.449113,0.08802817999547365,l2,COMPLETE
21,0.6318403315649537,2026-09-20 20:30:10.555259,2026-09-20 20:30:11.022850,0 days 00:00:00.467591,0.004777201802059254,l2,COMPLETE
22,0.6296450791178334,2026-09-20 20:30:11.022850,2026-09-20 20:30:11.490803,0 days 00:00:00.467953,0.025495874843373102,l2,COMPLETE
23,0.6289398719892644,2026-09-20 20:30:11.490803,2026-09-20 20:30:12.010041,0 days 00:00:00.519238,0.0031198598985834594,l2,COMPLETE
