number,value,datetime_start,datetime_complete,duration,params_n_neighbors,params_p,params_weights,system_attrs_fixed_params,state
0,0.5392898493931441,2026-09-21 01:10:01.134989,2026-09-21 01:10:01.611006,0 days 00:00:00.476017,5,2,distance,,COMPLETE
1,0.5578151604767574,2026-09-21 01:10:01.611006,2026-09-21 01:10:02.237328,0 days 00:00:00.626322,5,1,uniform,,COMPLETE
2,0.5950221679679221,2026-09-21 01:10:02.237328,2026-09-21 01:10:03.016514,0 days 00:00:00.779186,81,1,distance,,COMPLETE
3,0.5836240603080097,2026-09-21 01:10:03.016514,2026-09-21 01:10:03.603574,0 days 00:00:00.587060,81,2,distance,,COMPLETE
4,0.5685256340974637,2026-09-21 01:10:03.603574,2026-09-21 01:10:04.070353,0 days 00:00:00.466779,11,2,distance,,COMPLETE
5,,2026-09-21 01:10:04.070353,2026-09-21 01:10:04.070353,0 days 00:00:00,5,2,distance,,PRUNED
6,,2026-09-21 01:10:04.070353,2026-09-21 01:10:04.070353,0 days 00:00:00,81,1,distance,,PRUNED
7,0.5850021771825015,2026-09-21 01:10:04.070353,2026-09-21 01:10:04.735556,0 days 00:00:00.665203,21,1,distance,,COMPLETE
8,0.605567415129849,2026-09-21 01:10:04.735556,2026-09-21 01:10:05.410326,0 days 00:00:00.674770,41,1,uniform,,COMPLETE
9,,2026-09-21 01:10:05.410326,2026-09-21 01:10:05.410326,0 days 00:00:00,41,1,uniform,,PRUNED
10,,2026-09-21 01:10:05.410326,2026-09-21 01:10:05.410326,0 days 00:00:00,41,1,uniform,,PRUNED
11,0.5291488687390327,2026-09-21 01:10:05.410326,2026-09-21 01:10:06.041036,0 days 00:00:00.630710,3,1,uniform,,COMPLETE
12,0.5950889685748922,2026-09-21 01:10:06.041036,2026-09-21 01:10:06.828387,0 days 00:00:00.787351,81,1,uniform,,COMPLETE
13,,2026-09-21 01:10:06.828387,2026-09-21 01:10:06.833049,0 days 00:00:00.004662,41,1,uniform,,PRUNED
14,,2026-09-21 01:10:06.833049,2026-09-21 01:10:06.833049,0 days 00:00:00,3,1,uniform,,PRUNED
15,0.5977170874335966,2026-09-21 01:10:06.833049,2026-09-21 01:10:07.524807,0 days 00:00:00.691758,21,1,uniform,,COMPLETE
16,,2026-09-21 01:10:07.524807,2026-09-21 01:10:07.524807,0 days 00:00:00,21,1,uniform,,PRUNED
17,,2026-09-21 01:10:07.524807,2026-09-21 01:10:07.524807,0 days 00:00:00,21,1,uniform,,PRUNED
18,0.5811194252934547,2026-09-21 01:10:07.524807,2026-09-21 01:10:07.975154,0 days 00:00:00.450347,11,2,uniform,,COMPLETE
19,,2026-09-21 01:10:07.975154,2026-09-21 01:10:07.975154,0 days 00:00:00,21,1,uniform,,PRUNED
20,,2026-09-21 01:10:07.975154,2026-09-21 01:10:07.975154,0 days 00:00:00,41,1,uniform,,PRUNED
21,,2026-09-21 01:10:07.975154,2026-09-21 01:10:07.975154,0 days 00:00:00,81,1,uniform,,PRUNED
22,,2026-09-21 01:10:07.975154,2026-09-21 01:10:07.991213,0 days 00:00:00.016059,81,1,uniform,,PRUNED
23,,2026-09-21 01:10:07.991213,2026-09-21 01:10:07.991213,0 days 00:00:00,41,1,uniform,,PRUNED
24,,2026-09-21 01:10:07.991213,2026-09-21 01:10:07.991213,0 days 00:00:00,21,1,uniform,,PRUNED
25,,2026-09-21 01:10:07.991213,2026-09-21 01:10:07.991213,0 days 00:00:00,3,1,uniform,,PRUNED
26,,2026-09-21 01:10:07.991213,2026-09-21 01:10:07.991213,0 days 00:00:00,11,2,uniform,,PRUNED
27,0.5898704330430143,2026-09-21 01:10:07.991213,2026-09-21 01:10:08.479724,0 days 00:00:00.488511,21,2,distance,"{'n_neighbors': 21, 'p': 2, 'weights': 'distance'}",COMPLETE
28,,2026-09-21 01:10:08.479724,2026-09-21 01:10:08.479724,0 days 00:00:00,41,1,uniform,,PRUNED
29,,2026-09-21 01:10:08.479724,2026-09-21 01:10:08.487225,0 days 00:00:00.007501,5,1,uniform,,PRUNED
30,,2026-09-21 01:10:08.487225,2026-09-21 01:10:08.489313,0 days 00:00:00.002088,81,1,uniform,,PRUNED
31,,2026-09-21 01:10:08.489313,2026-09-21 01:10:08.489313,0 days 00:00:00,81,1,distance,,PRUNED
32,,2026-09-21 01:10:08.489313,2026-09-21 01:10:08.489313,0 days 00:00:00,81,1,distance,,PRUNED
33,,2026-09-21 01:10:08.489313,2026-09-21 01:10:08.489313,0 days 00:00:00,81,1,distance,,PRUNED
34,,2026-09-21 01:10:08.489313,2026-09-21 01:10:08.497100,0 days 00:00:00.007787,81,1,distance,,PRUNED
35,,2026-09-21 01:10:08.497100,2026-09-21 01:10:08.497100,0 days 00:00:00,5,2,distance,,PRUNED
36,0.5361444470545779,2026-09-21 01:10:08.497100,2026-09-21 01:10:09.145834,0 days 00:00:00.648734,5,1,distance,"{'n_neighbors': 5, 'p': 1, 'weights': 'distance'}",COMPLETE
37,,2026-09-21 01:10:09.145834,2026-09-21 01:10:09.145834,0 days 00:00:00,81,2,distance,,PRUNED
38,0.5926330575673586,2026-09-21 01:10:09.145834,2026-09-21 01:10:09.815264,0 days 00:00:00.669430,11,1,uniform,,COMPLETE
39,0.5939064358196348,2026-09-21 01:10:09.815264,2026-09-21 01:10:10.536384,0 days 00:00:00.721120,41,1,distance,,COMPLETE
40,,2026-09-21 01:10:10.536384,2026-09-21 01:10:10.540115,0 days 00:00:00.003731,21,1,uniform,,PRUNED
41,,2026-09-21 01:10:10.540115,2026-09-21 01:10:10.540115,0 days 00:00:00,41,1,distance,,PRUNED
42,,2026-09-21 01:10:10.540115,2026-09-21 01:10:10.540115,0 days 00:00:00,41,1,distance,,PRUNED
43,,2026-09-21 01:10:10.540115,2026-09-21 01:10:10.540115,0 days 00:00:00,41,1,distance,,PRUNED
44,,2026-09-21 01:10:10.540115,2026-09-21 01:10:10.540115,0 days 00:00:00,41,1,distance,,PRUNED
45,0.5153499005066039,2026-09-21 01:10:10.540115,2026-09-21 01:10:11.174825,0 days 00:00:00.634710,3,1,distance,,COMPLETE
46,,2026-09-21 01:10:11.174825,2026-09-21 01:10:11.174825,0 days 00:00:00,81,1,uniform,,PRUNED
47,,2026-09-21 01:10:11.174825,2026-09-21 01:10:11.174825,0 days 00:00:00,41,1,distance,,PRUNED
48,0.5974336366032721,2026-09-21 01:10:11.174825,2026-09-21 01:10:11.645939,0 days 00:00:00.471114,21,2,uniform,,COMPLETE
49,,2026-09-21 01:10:11.645939,2026-09-21 01:10:11.645939,0 days 00:00:00,21,2,uniform,,PRUNED
50,,2026-09-21 01:10:11.645939,2026-09-21 01:10:11.645939,0 days 00:00:00,21,2,uniform,,PRUNED
51,,2026-09-21 01:10:11.645939,2026-09-21 01:10:11.645939,0 days 00:00:00,21,2,uniform,,PRUNED
52,,2026-09-21 01:10:11.645939,2026-09-21 01:10:11.659429,0 days 00:00:00.013490,21,2,uniform,,PRUNED
53,0.598457645549442,2026-09-21 01:10:11.659429,2026-09-21 01:10:12.159353,0 days 00:00:00.499924,41,2,uniform,,COMPLETE
54,0.5852629462628045,2026-09-21 01:10:12.159353,2026-09-21 01:10:12.740791,0 days 00:00:00.581438,81,2,uniform,,COMPLETE
55,,2026-09-21 01:10:12.740791,2026-09-21 01:10:12.740791,0 days 00:00:00,21,2,uniform,,PRUNED
56,,2026-09-21 01:10:12.740791,2026-09-21 01:10:12.740791,0 days 00:00:00,11,2,uniform,,PRUNED
57,,2026-09-21 01:10:12.740791,2026-09-21 01:10:12.740791,0 days 00:00:00,41,2,uniform,,PRUNED
58,0.5317136186821211,2026-09-21 01:10:12.740791,2026-09-21 01:10:13.210076,0 days 00:00:00.469285,3,2,uniform,,COMPLETE
59,,2026-09-21 01:10:13.210076,2026-09-21 01:10:13.210076,0 days 00:00:00,21,2,uniform,,PRUNED
60,,2026-09-21 01:10:13.210076,2026-09-21 01:10:13.210076,0 days 00:00:00,81,2,uniform,,PRUNED
61,,2026-09-21 01:10:13.210076,2026-09-21 01:10:13.210076,0 days 00:00:00,41,1,uniform,,PRUNED
62,,2026-09-21 01:10:13.210076,2026-09-21 01:10:13.210076,0 days 00:00:00,41,1,uniform,,PRUNED
63,,2026-09-21 01:10:13.210076,2026-09-21 01:10:13.210076,0 days 00:00:00,41,1,uniform,,PRUNED
64,,2026-09-21 01:10:13.210076,2026-09-21 01:10:13.210076,0 days 00:00:00,41,1,uniform,,PRUNED
65,,2026-09-21 01:10:13.210076,2026-09-21 01:10:13.228412,0 days 00:00:00.018336,41,1,distance,,PRUNED
66,,2026-09-21 01:10:13.228412,2026-09-21 01:10:13.228919,0 days 00:00:00.000507,5,1,uniform,,PRUNED
67,0.5194871415693174,2026-09-21 01:10:13.228919,2026-09-21 01:10:13.680598,0 days 00:00:00.451679,3,2,distance,"{'n_neighbors': 3, 'p': 2, 'weights': 'distance'}",COMPLETE
68,,2026-09-21 01:10:13.680598,2026-09-21 01:10:13.694756,0 days 00:00:00.014158,81,1,uniform,,PRUNED
69,,2026-09-21 01:10:13.695753,2026-09-21 01:10:13.697753,0 days 00:00:00.002000,21,1,uniform,,PRUNED
70,0.5722871862325392,2026-09-21 01:10:13.697753,2026-09-21 01:10:14.326487,0 days 00:00:00.628734,11,1,distance,,COMPLETE
71,,2026-09-21 01:10:14.326487,2026-09-21 01:10:14.326487,0 days 00:00:00,11,1,uniform,,PRUNED
72,,2026-09-21 01:10:14.326487,2026-09-21 01:10:14.326487,0 days 00:00:00,11,1,uniform,,PRUNED
73,,2026-09-21 01:10:14.326487,2026-09-21 01:10:14.326487,0 days 00:00:00,11,1,uniform,,PRUNED
74,,2026-09-21 01:10:14.326487,2026-09-21 01:10:14.326487,0 days 00:00:00,11,1,uniform,,PRUNED
75,,2026-09-21 01:10:14.326487,2026-09-21 01:10:14.341517,0 days 00:00:00.015030,81,1,uniform,,PRUNED
76,,2026-09-21 01:10:14.341517,2026-09-21 01:10:14.343270,0 days 00:00:00.001753,41,1,uniform,,PRUNED
77,,2026-09-21 01:10:14.343270,2026-09-21 01:10:14.343270,0 days 00:00:00,21,1,distance,,PRUNED
78,,2026-09-21 01:10:14.343270,2026-09-21 01:10:14.343270,0 days 00:00:00,41,1,uniform,,PRUNED
79,0.5939104636826504,2026-09-21 01:10:14.343270,2026-09-21 01:10:15.121853,0 days 00:00:00.778583,41,2,distance,"{'n_neighbors': 41, 'p': 2, 'weights': 'distance'}",COMPLETE
80,,2026-09-21 01:10:15.121853,2026-09-21 01:10:15.137518,0 days 00:00:00.015665,41,2,distance,,PRUNED
81,,2026-09-21 01:10:15.137518,2026-09-21 01:10:15.137518,0 days 00:00:00,41,2,distance,,PRUNED
82,,2026-09-21 01:10:15.137518,2026-09-21 01:10:15.143356,0 days 00:00:00.005838,41,2,distance,,PRUNED
83,,2026-09-21 01:10:15.143356,2026-09-21 01:10:15.146799,0 days 00:00:00.003443,81,2,distance,,PRUNED
84,,2026-09-21 01:10:15.146799,2026-09-21 01:10:15.149109,0 days 00:00:00.002310,5,2,distance,,PRUNED
85,,2026-09-21 01:10:15.149109,2026-09-21 01:10:15.151294,0 days 00:00:00.002185,41,1,distance,,PRUNED
86,,2026-09-21 01:10:15.151294,2026-09-21 01:10:15.153303,0 days 00:00:00.002009,21,2,uniform,,PRUNED
87,,2026-09-21 01:10:15.153303,2026-09-21 01:10:15.155816,0 days 00:00:00.002513,81,1,uniform,,PRUNED
88,0.5569249880856625,2026-09-21 01:10:15.155816,2026-09-21 01:10:15.590487,0 days 00:00:00.434671,5,2,uniform,"{'n_neighbors': 5, 'p': 2, 'weights': 'uniform'}",COMPLETE
