number,value,datetime_start,datetime_complete,duration,params_criterion,params_max_depth,params_min_samples_leaf,system_attrs_fixed_params,state
0,0.5837654886818843,2026-09-20 00:15:25.534216,2026-09-20 00:15:25.979429,0 days 00:00:00.445213,entropy,6.0,1,,COMPLETE
1,0.5861767700542507,2026-09-20 00:15:25.979429,2026-09-20 00:15:26.383147,0 days 00:00:00.403718,gini,6.0,5,,COMPLETE
2,0.5120817428029935,2026-09-20 00:15:26.383147,2026-09-20 00:15:26.822368,0 days 00:00:00.439221,gini,,1,,COMPLETE
3,0.5745293645165276,2026-09-20 00:15:26.822368,2026-09-20 00:15:27.227566,0 days 00:00:00.405198,entropy,3.0,1,,COMPLETE
4,0.5653022356716753,2026-09-20 00:15:27.227566,2026-09-20 00:15:27.664367,0 days 00:00:00.436801,entropy,12.0,20,,COMPLETE
5,0.5847379249065706,2026-09-20 00:15:27.664367,2026-09-20 00:15:28.093391,0 days 00:00:00.429024,entropy,6.0,5,,COMPLETE
6,0.5760799769310939,2026-09-20 00:15:28.093391,2026-09-20 00:15:28.466788,0 days 00:00:00.373397,gini,3.0,5,,COMPLETE
7,0.5760799769310939,2026-09-20 00:15:28.466788,2026-09-20 00:15:28.842030,0 days 00:00:00.375242,gini,3.0,1,,COMPLETE
8,,2026-09-20 00:15:28.842030,2026-09-20 00:15:28.842030,0 days 00:00:00,gini,6.0,5,,PRUNED
9,0.5816125195959078,2026-09-20 00:15:28.842030,2026-09-20 00:15:29.276921,0 days 00:00:00.434891,gini,12.0,20,,COMPLETE
10,0.5232761964383779,2026-09-20 00:15:29.276921,2026-09-20 00:15:29.686526,0 days 00:00:00.409605,gini,,5,,COMPLETE
11,,2026-09-20 00:15:29.686526,2026-09-20 00:15:29.702170,0 days 00:00:00.015644,entropy,6.0,5,,PRUNED
12,,2026-09-20 00:15:29.702170,2026-09-20 00:15:29.702170,0 days 00:00:00,entropy,6.0,5,,PRUNED
13,,2026-09-20 00:15:29.702170,2026-09-20 00:15:29.718024,0 days 00:00:00.015854,entropy,6.0,5,,PRUNED
14,,2026-09-20 00:15:29.718024,2026-09-20 00:15:29.722022,0 days 00:00:00.003998,gini,6.0,5,,PRUNED
15,,2026-09-20 00:15:29.722022,2026-09-20 00:15:29.725509,0 days 00:00:00.003487,entropy,6.0,5,,PRUNED
16,0.5888821909264936,2026-09-20 00:15:29.725509,2026-09-20 00:15:30.127196,0 days 00:00:00.401687,entropy,6.0,20,,COMPLETE
17,0.5817544782264168,2026-09-20 00:15:30.127196,2026-09-20 00:15:30.535791,0 days 00:00:00.408595,gini,,20,,COMPLETE
18,,2026-09-20 00:15:30.535791,2026-09-20 00:15:30.537803,0 days 00:00:00.002012,gini,12.0,20,,PRUNED
19,,2026-09-20 00:15:30.537803,2026-09-20 00:15:30.542222,0 days 00:00:00.004419,entropy,6.0,20,,PRUNED
20,,2026-09-20 00:15:30.542222,2026-09-20 00:15:30.546253,0 days 00:00:00.004031,entropy,6.0,20,,PRUNED
21,,2026-09-20 00:15:30.546253,2026-09-20 00:15:30.546253,0 days 00:00:00,entropy,6.0,5,,PRUNED
22,,2026-09-20 00:15:30.546253,2026-09-20 00:15:30.553112,0 days 00:00:00.006859,entropy,6.0,5,,PRUNED
23,,2026-09-20 00:15:30.553112,2026-09-20 00:15:30.553112,0 days 00:00:00,entropy,6.0,20,,PRUNED
24,,2026-09-20 00:15:30.553112,2026-09-20 00:15:30.563491,0 days 00:00:00.010379,entropy,6.0,5,,PRUNED
25,,2026-09-20 00:15:30.563491,2026-09-20 00:15:30.573618,0 days 00:00:00.010127,entropy,6.0,20,,PRUNED
26,0.5683231746737887,2026-09-20 00:15:30.573618,2026-09-20 00:15:30.996767,0 days 00:00:00.423149,entropy,,20,"{'criterion': 'entropy', 'max_depth': None, 'min_samples_leaf': 20}",COMPLETE
27,0.5381980945326195,2026-09-20 00:15:30.996767,2026-09-20 00:15:31.428119,0 days 00:00:00.431352,gini,12.0,5,,COMPLETE
28,,2026-09-20 00:15:31.430131,2026-09-20 00:15:31.433239,0 days 00:00:00.003108,gini,3.0,1,,PRUNED
29,,2026-09-20 00:15:31.433239,2026-09-20 00:15:31.440235,0 days 00:00:00.006996,entropy,6.0,5,,PRUNED
30,,2026-09-20 00:15:31.440235,2026-09-20 00:15:31.440235,0 days 00:00:00,entropy,6.0,1,,PRUNED
31,,2026-09-20 00:15:31.440235,2026-09-20 00:15:31.440235,0 days 00:00:00,entropy,6.0,1,,PRUNED
32,,2026-09-20 00:15:31.440235,2026-09-20 00:15:31.453529,0 days 00:00:00.013294,entropy,6.0,1,,PRUNED
33,0.5234776007988561,2026-09-20 00:15:31.453529,2026-09-20 00:15:31.901916,0 days 00:00:00.448387,entropy,,1,,COMPLETE
34,,2026-09-20 00:15:31.901916,2026-09-20 00:15:31.901916,0 days 00:00:00,entropy,3.0,1,,PRUNED
35,0.5866323163309526,2026-09-20 00:15:31.901916,2026-09-20 00:15:32.308904,0 days 00:00:00.406988,gini,6.0,1,,COMPLETE
36,,2026-09-20 00:15:32.308904,2026-09-20 00:15:32.308904,0 days 00:00:00,gini,6.0,1,,PRUNED
37,,2026-09-20 00:15:32.308904,2026-09-20 00:15:32.308904,0 days 00:00:00,gini,6.0,1,,PRUNED
38,,2026-09-20 00:15:32.322484,2026-09-20 00:15:32.326396,0 days 00:00:00.003912,gini,12.0,5,,PRUNED
39,0.5760799769310939,2026-09-20 00:15:32.326396,2026-09-20 00:15:32.705793,0 days 00:00:00.379397,gini,3.0,20,,COMPLETE
40,,2026-09-20 00:15:32.705793,2026-09-20 00:15:32.708717,0 days 00:00:00.002924,gini,6.0,5,,PRUNED
41,,2026-09-20 00:15:32.708717,2026-09-20 00:15:32.708717,0 days 00:00:00,gini,6.0,1,,PRUNED
42,,2026-09-20 00:15:32.708717,2026-09-20 00:15:32.708717,0 days 00:00:00,gini,6.0,1,,PRUNED
43,,2026-09-20 00:15:32.708717,2026-09-20 00:15:32.708717,0 days 00:00:00,entropy,6.0,1,,PRUNED
44,,2026-09-20 00:15:32.708717,2026-09-20 00:15:32.708717,0 days 00:00:00,gini,6.0,1,,PRUNED
45,0.5309441980587244,2026-09-20 00:15:32.708717,2026-09-20 00:15:33.134579,0 days 00:00:00.425862,entropy,,5,,COMPLETE
46,,2026-09-20 00:15:33.134579,2026-09-20 00:15:33.150354,0 days 00:00:00.015775,gini,6.0,1,,PRUNED
47,0.5618224380395432,2026-09-20 00:15:33.150354,2026-09-20 00:15:33.578425,0 days 00:00:00.428071,entropy,12.0,5,,COMPLETE
48,0.5745293645165276,2026-09-20 00:15:33.578425,2026-09-20 00:15:33.967521,0 days 00:00:00.389096,entropy,3.0,20,,COMPLETE
49,,2026-09-20 00:15:33.967521,2026-09-20 00:15:33.967521,0 days 00:00:00,gini,6.0,5,,PRUNED
50,,2026-09-20 00:15:33.967521,2026-09-20 00:15:33.983249,0 days 00:00:00.015728,entropy,6.0,20,,PRUNED
51,,2026-09-20 00:15:33.983249,2026-09-20 00:15:33.983249,0 days 00:00:00,gini,,20,,PRUNED
52,,2026-09-20 00:15:33.983249,2026-09-20 00:15:33.990897,0 days 00:00:00.007648,gini,,20,,PRUNED
53,,2026-09-20 00:15:33.990897,2026-09-20 00:15:33.990897,0 days 00:00:00,gini,,20,,PRUNED
54,,2026-09-20 00:15:33.990897,2026-09-20 00:15:33.998988,0 days 00:00:00.008091,gini,,20,,PRUNED
55,0.5888160761362494,2026-09-20 00:15:33.998988,2026-09-20 00:15:34.393274,0 days 00:00:00.394286,gini,6.0,20,,COMPLETE
56,,2026-09-20 00:15:34.393274,2026-09-20 00:15:34.396277,0 days 00:00:00.003003,gini,6.0,5,,PRUNED
57,,2026-09-20 00:15:34.396277,2026-09-20 00:15:34.399278,0 days 00:00:00.003001,entropy,6.0,20,,PRUNED
58,,2026-09-20 00:15:34.400280,2026-09-20 00:15:34.403279,0 days 00:00:00.002999,gini,6.0,5,,PRUNED
59,,2026-09-20 00:15:34.403279,2026-09-20 00:15:34.405814,0 days 00:00:00.002535,entropy,6.0,20,,PRUNED
60,,2026-09-20 00:15:34.405814,2026-09-20 00:15:34.411926,0 days 00:00:00.006112,entropy,6.0,1,,PRUNED
61,,2026-09-20 00:15:34.411926,2026-09-20 00:15:34.413930,0 days 00:00:00.002004,gini,,20,,PRUNED
62,,2026-09-20 00:15:34.413930,2026-09-20 00:15:34.418708,0 days 00:00:00.004778,gini,6.0,20,,PRUNED
63,,2026-09-20 00:15:34.418708,2026-09-20 00:15:34.420714,0 days 00:00:00.002006,gini,12.0,20,,PRUNED
64,0.5745293645165276,2026-09-20 00:15:34.420714,2026-09-20 00:15:34.800646,0 days 00:00:00.379932,entropy,3.0,5,"{'criterion': 'entropy', 'max_depth': 3, 'min_samples_leaf': 5}",COMPLETE
65,,2026-09-20 00:15:34.800646,2026-09-20 00:15:34.816730,0 days 00:00:00.016084,gini,6.0,20,,PRUNED
66,,2026-09-20 00:15:34.816730,2026-09-20 00:15:34.816730,0 days 00:00:00,gini,6.0,20,,PRUNED
67,,2026-09-20 00:15:34.816730,2026-09-20 00:15:34.832535,0 days 00:00:00.015805,gini,6.0,1,,PRUNED
68,,2026-09-20 00:15:34.832535,2026-09-20 00:15:34.835919,0 days 00:00:00.003384,entropy,6.0,5,,PRUNED
69,,2026-09-20 00:15:34.835919,2026-09-20 00:15:34.837924,0 days 00:00:00.002005,gini,,20,,PRUNED
70,,2026-09-20 00:15:34.837924,2026-09-20 00:15:34.837924,0 days 00:00:00,entropy,6.0,1,,PRUNED
71,,2026-09-20 00:15:34.837924,2026-09-20 00:15:34.837924,0 days 00:00:00,gini,12.0,20,,PRUNED
72,,2026-09-20 00:15:34.837924,2026-09-20 00:15:34.848593,0 days 00:00:00.010669,gini,12.0,20,,PRUNED
73,0.5327231311199739,2026-09-20 00:15:34.848593,2026-09-20 00:15:35.261348,0 days 00:00:00.412755,gini,12.0,1,"{'criterion': 'gini', 'max_depth': 12, 'min_samples_leaf': 1}",COMPLETE
74,,2026-09-20 00:15:35.261348,2026-09-20 00:15:35.261348,0 days 00:00:00,gini,12.0,20,,PRUNED
75,,2026-09-20 00:15:35.261348,2026-09-20 00:15:35.279287,0 days 00:00:00.017939,gini,6.0,20,,PRUNED
76,,2026-09-20 00:15:35.279287,2026-09-20 00:15:35.279287,0 days 00:00:00,entropy,12.0,5,,PRUNED
77,,2026-09-20 00:15:35.279287,2026-09-20 00:15:35.292920,0 days 00:00:00.013633,gini,6.0,20,,PRUNED
78,,2026-09-20 00:15:35.292920,2026-09-20 00:15:35.292920,0 days 00:00:00,entropy,6.0,5,,PRUNED
79,,2026-09-20 00:15:35.292920,2026-09-20 00:15:35.309057,0 days 00:00:00.016137,gini,3.0,1,,PRUNED
80,,2026-09-20 00:15:35.309057,2026-09-20 00:15:35.311806,0 days 00:00:00.002749,entropy,6.0,20,,PRUNED
81,,2026-09-20 00:15:35.311806,2026-09-20 00:15:35.311806,0 days 00:00:00,gini,3.0,5,,PRUNED
82,0.5580198031417544,2026-09-20 00:15:35.311806,2026-09-20 00:15:35.745501,0 days 00:00:00.433695,entropy,12.0,1,"{'criterion': 'entropy', 'max_depth': 12, 'min_samples_leaf': 1}",COMPLETE
