number,value,datetime_start,datetime_complete,duration,params_criterion,params_max_depth,params_min_samples_leaf,system_attrs_fixed_params,state
0,0.49828846928741033,2026-09-20 00:12:01.255889,2026-09-20 00:12:01.721782,0 days 00:00:00.465893,gini,,1,,COMPLETE
1,0.5920576965388619,2026-09-20 00:12:01.721782,2026-09-20 00:12:02.113067,0 days 00:00:00.391285,gini,6.0,20,,COMPLETE
2,0.5935657324912006,2026-09-20 00:12:02.113067,2026-09-20 00:12:02.519114,0 days 00:00:00.406047,entropy,6.0,5,,COMPLETE
3,0.5869272386900851,2026-09-20 00:12:02.519114,2026-09-20 00:12:02.942941,0 days 00:00:00.423827,entropy,12.0,20,,COMPLETE
4,0.5675790187144177,2026-09-20 00:12:02.942941,2026-09-20 00:12:03.344155,0 days 00:00:00.401214,entropy,3.0,20,,COMPLETE
5,0.580066799899954,2026-09-20 00:12:03.344155,2026-09-20 00:12:03.757806,0 days 00:00:00.413651,gini,6.0,1,,COMPLETE
6,,2026-09-20 00:12:03.757806,2026-09-20 00:12:03.770251,0 days 00:00:00.012445,gini,6.0,20,,PRUNED
7,0.5924427344295986,2026-09-20 00:12:03.770251,2026-09-20 00:12:04.167327,0 days 00:00:00.397076,entropy,6.0,20,,COMPLETE
8,0.5706873905259761,2026-09-20 00:12:04.167327,2026-09-20 00:12:04.605540,0 days 00:00:00.438213,entropy,12.0,5,,COMPLETE
9,0.5675790187144177,2026-09-20 00:12:04.605540,2026-09-20 00:12:04.997668,0 days 00:00:00.392128,entropy,3.0,5,,COMPLETE
10,0.536098917863883,2026-09-20 00:12:04.997668,2026-09-20 00:12:05.456838,0 days 00:00:00.459170,entropy,,5,,COMPLETE
11,,2026-09-20 00:12:05.456838,2026-09-20 00:12:05.456838,0 days 00:00:00,entropy,6.0,5,,PRUNED
12,,2026-09-20 00:12:05.456838,2026-09-20 00:12:05.456838,0 days 00:00:00,entropy,6.0,20,,PRUNED
13,,2026-09-20 00:12:05.456838,2026-09-20 00:12:05.456838,0 days 00:00:00,entropy,6.0,5,,PRUNED
14,0.5929140544201676,2026-09-20 00:12:05.456838,2026-09-20 00:12:05.866339,0 days 00:00:00.409501,entropy,6.0,1,,COMPLETE
15,,2026-09-20 00:12:05.866339,2026-09-20 00:12:05.866339,0 days 00:00:00,entropy,6.0,1,,PRUNED
16,0.5675790187144177,2026-09-20 00:12:05.866339,2026-09-20 00:12:06.282317,0 days 00:00:00.415978,entropy,3.0,1,,COMPLETE
17,0.5628720702854274,2026-09-20 00:12:06.282317,2026-09-20 00:12:06.706558,0 days 00:00:00.424241,entropy,12.0,1,,COMPLETE
18,,2026-09-20 00:12:06.706558,2026-09-20 00:12:06.722663,0 days 00:00:00.016105,gini,,1,,PRUNED
19,,2026-09-20 00:12:06.722663,2026-09-20 00:12:06.722663,0 days 00:00:00,entropy,6.0,5,,PRUNED
20,,2026-09-20 00:12:06.722663,2026-09-20 00:12:06.738385,0 days 00:00:00.015722,entropy,6.0,1,,PRUNED
21,,2026-09-20 00:12:06.738385,2026-09-20 00:12:06.738385,0 days 00:00:00,entropy,6.0,20,,PRUNED
22,,2026-09-20 00:12:06.738385,2026-09-20 00:12:06.750773,0 days 00:00:00.012388,entropy,6.0,20,,PRUNED
23,,2026-09-20 00:12:06.750773,2026-09-20 00:12:06.754255,0 days 00:00:00.003482,entropy,6.0,5,,PRUNED
24,,2026-09-20 00:12:06.754255,2026-09-20 00:12:06.754255,0 days 00:00:00,entropy,6.0,20,,PRUNED
25,,2026-09-20 00:12:06.754255,2026-09-20 00:12:06.754255,0 days 00:00:00,entropy,6.0,5,,PRUNED
26,0.5819973473155442,2026-09-20 00:12:06.754255,2026-09-20 00:12:07.166532,0 days 00:00:00.412277,gini,6.0,5,"{'criterion': 'gini', 'max_depth': 6, 'min_samples_leaf': 5}",COMPLETE
27,,2026-09-20 00:12:07.166532,2026-09-20 00:12:07.171532,0 days 00:00:00.005000,entropy,12.0,1,,PRUNED
28,,2026-09-20 00:12:07.171532,2026-09-20 00:12:07.176095,0 days 00:00:00.004563,entropy,3.0,1,,PRUNED
29,0.5669932581607487,2026-09-20 00:12:07.176095,2026-09-20 00:12:07.581611,0 days 00:00:00.405516,gini,,20,,COMPLETE
30,0.5140666761548424,2026-09-20 00:12:07.581611,2026-09-20 00:12:08.024954,0 days 00:00:00.443343,entropy,,1,,COMPLETE
31,,2026-09-20 00:12:08.024954,2026-09-20 00:12:08.040978,0 days 00:00:00.016024,gini,6.0,20,,PRUNED
32,,2026-09-20 00:12:08.040978,2026-09-20 00:12:08.040978,0 days 00:00:00,gini,6.0,20,,PRUNED
33,,2026-09-20 00:12:08.040978,2026-09-20 00:12:08.040978,0 days 00:00:00,gini,6.0,20,,PRUNED
34,,2026-09-20 00:12:08.040978,2026-09-20 00:12:08.040978,0 days 00:00:00,gini,6.0,20,,PRUNED
35,0.5692830245573646,2026-09-20 00:12:08.040978,2026-09-20 00:12:08.454781,0 days 00:00:00.413803,gini,12.0,20,,COMPLETE
36,,2026-09-20 00:12:08.454781,2026-09-20 00:12:08.454781,0 days 00:00:00,gini,6.0,20,,PRUNED
37,,2026-09-20 00:12:08.454781,2026-09-20 00:12:08.454781,0 days 00:00:00,entropy,3.0,20,,PRUNED
38,,2026-09-20 00:12:08.454781,2026-09-20 00:12:08.454781,0 days 00:00:00,gini,6.0,5,,PRUNED
39,,2026-09-20 00:12:08.454781,2026-09-20 00:12:08.454781,0 days 00:00:00,entropy,6.0,1,,PRUNED
40,,2026-09-20 00:12:08.454781,2026-09-20 00:12:08.470867,0 days 00:00:00.016086,entropy,12.0,20,,PRUNED
41,,2026-09-20 00:12:08.470867,2026-09-20 00:12:08.470867,0 days 00:00:00,entropy,12.0,20,,PRUNED
42,,2026-09-20 00:12:08.470867,2026-09-20 00:12:08.470867,0 days 00:00:00,entropy,12.0,20,,PRUNED
43,,2026-09-20 00:12:08.470867,2026-09-20 00:12:08.470867,0 days 00:00:00,entropy,12.0,20,,PRUNED
44,0.5706710710940034,2026-09-20 00:12:08.470867,2026-09-20 00:12:08.870778,0 days 00:00:00.399911,gini,3.0,1,"{'criterion': 'gini', 'max_depth': 3, 'min_samples_leaf': 1}",COMPLETE
45,,2026-09-20 00:12:08.870778,2026-09-20 00:12:08.870778,0 days 00:00:00,entropy,,5,,PRUNED
46,,2026-09-20 00:12:08.870778,2026-09-20 00:12:08.870778,0 days 00:00:00,entropy,6.0,20,,PRUNED
47,,2026-09-20 00:12:08.870778,2026-09-20 00:12:08.870778,0 days 00:00:00,entropy,12.0,5,,PRUNED
48,,2026-09-20 00:12:08.870778,2026-09-20 00:12:08.870778,0 days 00:00:00,entropy,6.0,20,,PRUNED
49,,2026-09-20 00:12:08.870778,2026-09-20 00:12:08.886463,0 days 00:00:00.015685,entropy,6.0,1,,PRUNED
50,,2026-09-20 00:12:08.886463,2026-09-20 00:12:08.886463,0 days 00:00:00,entropy,6.0,5,,PRUNED
51,,2026-09-20 00:12:08.886463,2026-09-20 00:12:08.886463,0 days 00:00:00,gini,6.0,5,,PRUNED
52,,2026-09-20 00:12:08.886463,2026-09-20 00:12:08.886463,0 days 00:00:00,gini,6.0,5,,PRUNED
53,0.5362745207706449,2026-09-20 00:12:08.886463,2026-09-20 00:12:09.309465,0 days 00:00:00.423002,gini,12.0,1,"{'criterion': 'gini', 'max_depth': 12, 'min_samples_leaf': 1}",COMPLETE
54,,2026-09-20 00:12:09.309465,2026-09-20 00:12:09.310776,0 days 00:00:00.001311,gini,6.0,5,,PRUNED
55,,2026-09-20 00:12:09.310776,2026-09-20 00:12:09.310776,0 days 00:00:00,gini,6.0,5,,PRUNED
56,,2026-09-20 00:12:09.310776,2026-09-20 00:12:09.310776,0 days 00:00:00,entropy,6.0,5,,PRUNED
57,,2026-09-20 00:12:09.310776,2026-09-20 00:12:09.326766,0 days 00:00:00.015990,entropy,3.0,5,,PRUNED
58,,2026-09-20 00:12:09.326766,2026-09-20 00:12:09.326766,0 days 00:00:00,gini,,20,,PRUNED
59,,2026-09-20 00:12:09.326766,2026-09-20 00:12:09.342354,0 days 00:00:00.015588,entropy,6.0,20,,PRUNED
60,,2026-09-20 00:12:09.342354,2026-09-20 00:12:09.343756,0 days 00:00:00.001402,entropy,6.0,1,,PRUNED
61,,2026-09-20 00:12:09.343756,2026-09-20 00:12:09.343756,0 days 00:00:00,gini,6.0,1,,PRUNED
62,0.5350388326040664,2026-09-20 00:12:09.343756,2026-09-20 00:12:09.756248,0 days 00:00:00.412492,gini,,5,"{'criterion': 'gini', 'max_depth': None, 'min_samples_leaf': 5}",COMPLETE
63,,2026-09-20 00:12:09.756248,2026-09-20 00:12:09.756248,0 days 00:00:00,gini,6.0,1,,PRUNED
64,,2026-09-20 00:12:09.756248,2026-09-20 00:12:09.756248,0 days 00:00:00,gini,6.0,1,,PRUNED
65,,2026-09-20 00:12:09.756248,2026-09-20 00:12:09.756248,0 days 00:00:00,gini,6.0,1,,PRUNED
66,,2026-09-20 00:12:09.756248,2026-09-20 00:12:09.756248,0 days 00:00:00,entropy,6.0,20,,PRUNED
67,,2026-09-20 00:12:09.756248,2026-09-20 00:12:09.776763,0 days 00:00:00.020515,gini,6.0,1,,PRUNED
68,,2026-09-20 00:12:09.776763,2026-09-20 00:12:09.776763,0 days 00:00:00,entropy,6.0,20,,PRUNED
69,0.5544268374488124,2026-09-20 00:12:09.776763,2026-09-20 00:12:10.195657,0 days 00:00:00.418894,gini,12.0,5,,COMPLETE
70,,2026-09-20 00:12:10.195657,2026-09-20 00:12:10.195657,0 days 00:00:00,entropy,3.0,20,,PRUNED
71,,2026-09-20 00:12:10.195657,2026-09-20 00:12:10.195657,0 days 00:00:00,entropy,12.0,5,,PRUNED
72,,2026-09-20 00:12:10.195657,2026-09-20 00:12:10.205802,0 days 00:00:00.010145,entropy,12.0,5,,PRUNED
73,,2026-09-20 00:12:10.205802,2026-09-20 00:12:10.205802,0 days 00:00:00,entropy,12.0,5,,PRUNED
74,,2026-09-20 00:12:10.205802,2026-09-20 00:12:10.205802,0 days 00:00:00,entropy,12.0,5,,PRUNED
75,,2026-09-20 00:12:10.205802,2026-09-20 00:12:10.205802,0 days 00:00:00,entropy,6.0,1,,PRUNED
76,,2026-09-20 00:12:10.205802,2026-09-20 00:12:10.205802,0 days 00:00:00,entropy,6.0,20,,PRUNED
77,,2026-09-20 00:12:10.205802,2026-09-20 00:12:10.205802,0 days 00:00:00,gini,12.0,5,,PRUNED
78,0.5706710710940034,2026-09-20 00:12:10.205802,2026-09-20 00:12:10.597204,0 days 00:00:00.391402,gini,3.0,5,"{'criterion': 'gini', 'max_depth': 3, 'min_samples_leaf': 5}",COMPLETE
79,,2026-09-20 00:12:10.597204,2026-09-20 00:12:10.597204,0 days 00:00:00,entropy,6.0,20,,PRUNED
80,,2026-09-20 00:12:10.597204,2026-09-20 00:12:10.597204,0 days 00:00:00,entropy,6.0,1,,PRUNED
81,,2026-09-20 00:12:10.597204,2026-09-20 00:12:10.597204,0 days 00:00:00,gini,3.0,1,,PRUNED
82,,2026-09-20 00:12:10.597204,2026-09-20 00:12:10.613009,0 days 00:00:00.015805,gini,3.0,1,,PRUNED
83,,2026-09-20 00:12:10.613009,2026-09-20 00:12:10.613009,0 days 00:00:00,gini,3.0,1,,PRUNED
84,,2026-09-20 00:12:10.613009,2026-09-20 00:12:10.613009,0 days 00:00:00,gini,3.0,1,,PRUNED
85,,2026-09-20 00:12:10.613009,2026-09-20 00:12:10.613009,0 days 00:00:00,gini,12.0,20,,PRUNED
86,,2026-09-20 00:12:10.613009,2026-09-20 00:12:10.613009,0 days 00:00:00,entropy,,1,,PRUNED
87,0.5837245083706913,2026-09-20 00:12:10.613009,2026-09-20 00:12:11.034938,0 days 00:00:00.421929,entropy,,20,"{'criterion': 'entropy', 'max_depth': None, 'min_samples_leaf': 20}",COMPLETE
88,,2026-09-20 00:12:11.034938,2026-09-20 00:12:11.034938,0 days 00:00:00,entropy,,20,,PRUNED
89,,2026-09-20 00:12:11.034938,2026-09-20 00:12:11.034938,0 days 00:00:00,entropy,,20,,PRUNED
90,,2026-09-20 00:12:11.034938,2026-09-20 00:12:11.050670,0 days 00:00:00.015732,entropy,,20,,PRUNED
91,,2026-09-20 00:12:11.050670,2026-09-20 00:12:11.050670,0 days 00:00:00,entropy,6.0,20,,PRUNED
92,,2026-09-20 00:12:11.050670,2026-09-20 00:12:11.050670,0 days 00:00:00,entropy,6.0,20,,PRUNED
93,,2026-09-20 00:12:11.050670,2026-09-20 00:12:11.050670,0 days 00:00:00,gini,,5,,PRUNED
94,,2026-09-20 00:12:11.050670,2026-09-20 00:12:11.066410,0 days 00:00:00.015740,entropy,6.0,1,,PRUNED
95,,2026-09-20 00:12:11.066410,2026-09-20 00:12:11.066410,0 days 00:00:00,gini,12.0,20,,PRUNED
96,0.5706710710940034,2026-09-20 00:12:11.066410,2026-09-20 00:12:11.456704,0 days 00:00:00.390294,gini,3.0,20,"{'criterion': 'gini', 'max_depth': 3, 'min_samples_leaf': 20}",COMPLETE
