number,value,datetime_start,datetime_complete,duration,params_criterion,params_max_depth,params_min_samples_leaf,system_attrs_fixed_params,state
0,0.5669438742400347,2026-09-21 02:27:13.906146,2026-09-21 02:27:14.304897,0 days 00:00:00.398751,entropy,3.0,5,,COMPLETE
1,0.5998978778737583,2026-09-21 02:27:14.304897,2026-09-21 02:27:14.721693,0 days 00:00:00.416796,entropy,,20,,COMPLETE
2,0.5579551009510829,2026-09-21 02:27:14.721693,2026-09-21 02:27:15.139841,0 days 00:00:00.418148,entropy,12.0,5,,COMPLETE
3,0.5111968609489477,2026-09-21 02:27:15.139841,2026-09-21 02:27:15.556518,0 days 00:00:00.416677,entropy,,1,,COMPLETE
4,0.5662878761077895,2026-09-21 02:27:15.556518,2026-09-21 02:27:15.958902,0 days 00:00:00.402384,gini,3.0,5,,COMPLETE
5,,2026-09-21 02:27:15.958902,2026-09-21 02:27:15.961825,0 days 00:00:00.002923,entropy,12.0,5,,PRUNED
6,0.6088036161086232,2026-09-21 02:27:15.961825,2026-09-21 02:27:16.351803,0 days 00:00:00.389978,gini,6.0,1,,COMPLETE
7,0.6125593490787243,2026-09-21 02:27:16.351803,2026-09-21 02:27:16.747226,0 days 00:00:00.395423,gini,6.0,20,,COMPLETE
8,,2026-09-21 02:27:16.747226,2026-09-21 02:27:16.754950,0 days 00:00:00.007724,gini,6.0,20,,PRUNED
9,,2026-09-21 02:27:16.754950,2026-09-21 02:27:16.754950,0 days 00:00:00,gini,6.0,20,,PRUNED
10,,2026-09-21 02:27:16.754950,2026-09-21 02:27:16.754950,0 days 00:00:00,gini,6.0,20,,PRUNED
11,,2026-09-21 02:27:16.754950,2026-09-21 02:27:16.754950,0 days 00:00:00,gini,6.0,1,,PRUNED
12,,2026-09-21 02:27:16.754950,2026-09-21 02:27:16.754950,0 days 00:00:00,gini,6.0,1,,PRUNED
13,,2026-09-21 02:27:16.754950,2026-09-21 02:27:16.754950,0 days 00:00:00,gini,6.0,1,,PRUNED
14,,2026-09-21 02:27:16.754950,2026-09-21 02:27:16.754950,0 days 00:00:00,gini,6.0,20,,PRUNED
15,,2026-09-21 02:27:16.754950,2026-09-21 02:27:16.770597,0 days 00:00:00.015647,gini,6.0,1,,PRUNED
16,0.5141287024784004,2026-09-21 02:27:16.770597,2026-09-21 02:27:17.179231,0 days 00:00:00.408634,gini,,1,"{'criterion': 'gini', 'max_depth': None, 'min_samples_leaf': 1}",COMPLETE
17,0.5662878761077895,2026-09-21 02:27:17.179231,2026-09-21 02:27:17.551952,0 days 00:00:00.372721,gini,3.0,20,,COMPLETE
18,0.5958311755679452,2026-09-21 02:27:17.551952,2026-09-21 02:27:17.962301,0 days 00:00:00.410349,gini,12.0,20,,COMPLETE
19,,2026-09-21 02:27:17.962301,2026-09-21 02:27:17.962301,0 days 00:00:00,gini,6.0,1,,PRUNED
20,,2026-09-21 02:27:17.962301,2026-09-21 02:27:17.962301,0 days 00:00:00,gini,6.0,20,,PRUNED
21,,2026-09-21 02:27:17.962301,2026-09-21 02:27:17.962301,0 days 00:00:00,entropy,,20,,PRUNED
22,,2026-09-21 02:27:17.962301,2026-09-21 02:27:17.962301,0 days 00:00:00,entropy,,20,,PRUNED
23,,2026-09-21 02:27:17.962301,2026-09-21 02:27:17.962301,0 days 00:00:00,entropy,,20,,PRUNED
24,,2026-09-21 02:27:17.962301,2026-09-21 02:27:17.962301,0 days 00:00:00,entropy,,20,,PRUNED
25,,2026-09-21 02:27:17.962301,2026-09-21 02:27:17.962301,0 days 00:00:00,entropy,,1,,PRUNED
26,0.5669438742400347,2026-09-21 02:27:17.962301,2026-09-21 02:27:18.375358,0 days 00:00:00.413057,entropy,3.0,20,,COMPLETE
27,,2026-09-21 02:27:18.375358,2026-09-21 02:27:18.375358,0 days 00:00:00,gini,12.0,20,,PRUNED
28,0.6025851769786517,2026-09-21 02:27:18.375358,2026-09-21 02:27:18.787946,0 days 00:00:00.412588,entropy,6.0,5,,COMPLETE
29,,2026-09-21 02:27:18.787946,2026-09-21 02:27:18.793194,0 days 00:00:00.005248,entropy,6.0,5,,PRUNED
30,0.6094637336731039,2026-09-21 02:27:18.793194,2026-09-21 02:27:19.187907,0 days 00:00:00.394713,gini,6.0,5,,COMPLETE
31,,2026-09-21 02:27:19.187907,2026-09-21 02:27:19.189920,0 days 00:00:00.002013,gini,6.0,5,,PRUNED
32,,2026-09-21 02:27:19.189920,2026-09-21 02:27:19.189920,0 days 00:00:00,gini,6.0,5,,PRUNED
33,,2026-09-21 02:27:19.189920,2026-09-21 02:27:19.193588,0 days 00:00:00.003668,gini,6.0,5,,PRUNED
34,,2026-09-21 02:27:19.193588,2026-09-21 02:27:19.193588,0 days 00:00:00,gini,6.0,5,,PRUNED
35,,2026-09-21 02:27:19.193588,2026-09-21 02:27:19.193588,0 days 00:00:00,entropy,6.0,5,,PRUNED
36,,2026-09-21 02:27:19.193588,2026-09-21 02:27:19.193588,0 days 00:00:00,gini,3.0,5,,PRUNED
37,,2026-09-21 02:27:19.193588,2026-09-21 02:27:19.201819,0 days 00:00:00.008231,entropy,6.0,5,,PRUNED
38,0.564533922728355,2026-09-21 02:27:19.201819,2026-09-21 02:27:19.616595,0 days 00:00:00.414776,gini,12.0,5,,COMPLETE
39,,2026-09-21 02:27:19.616595,2026-09-21 02:27:19.616595,0 days 00:00:00,entropy,6.0,5,,PRUNED
40,,2026-09-21 02:27:19.616595,2026-09-21 02:27:19.616595,0 days 00:00:00,gini,6.0,1,,PRUNED
41,0.5362470194709629,2026-09-21 02:27:19.616595,2026-09-21 02:27:20.059501,0 days 00:00:00.442906,entropy,,5,,COMPLETE
42,0.6041591884647292,2026-09-21 02:27:20.059501,2026-09-21 02:27:20.466241,0 days 00:00:00.406740,entropy,6.0,1,,COMPLETE
43,,2026-09-21 02:27:20.466241,2026-09-21 02:27:20.468983,0 days 00:00:00.002742,entropy,6.0,1,,PRUNED
44,,2026-09-21 02:27:20.468983,2026-09-21 02:27:20.468983,0 days 00:00:00,entropy,6.0,1,,PRUNED
45,,2026-09-21 02:27:20.468983,2026-09-21 02:27:20.472639,0 days 00:00:00.003656,entropy,6.0,1,,PRUNED
46,,2026-09-21 02:27:20.472639,2026-09-21 02:27:20.472639,0 days 00:00:00,gini,6.0,1,,PRUNED
47,,2026-09-21 02:27:20.472639,2026-09-21 02:27:20.472639,0 days 00:00:00,gini,6.0,1,,PRUNED
48,0.5669438742400347,2026-09-21 02:27:20.472639,2026-09-21 02:27:20.857024,0 days 00:00:00.384385,entropy,3.0,1,,COMPLETE
49,,2026-09-21 02:27:20.857024,2026-09-21 02:27:20.859021,0 days 00:00:00.001997,gini,6.0,5,,PRUNED
50,0.5666391737494832,2026-09-21 02:27:20.859021,2026-09-21 02:27:21.282110,0 days 00:00:00.423089,gini,12.0,1,,COMPLETE
51,0.6035118418494365,2026-09-21 02:27:21.282110,2026-09-21 02:27:21.685219,0 days 00:00:00.403109,entropy,6.0,20,,COMPLETE
52,,2026-09-21 02:27:21.685219,2026-09-21 02:27:21.688276,0 days 00:00:00.003057,entropy,6.0,20,,PRUNED
53,,2026-09-21 02:27:21.688276,2026-09-21 02:27:21.690232,0 days 00:00:00.001956,entropy,6.0,20,,PRUNED
54,,2026-09-21 02:27:21.690232,2026-09-21 02:27:21.694282,0 days 00:00:00.004050,entropy,6.0,20,,PRUNED
55,,2026-09-21 02:27:21.694282,2026-09-21 02:27:21.697420,0 days 00:00:00.003138,entropy,6.0,20,,PRUNED
56,,2026-09-21 02:27:21.697420,2026-09-21 02:27:21.697420,0 days 00:00:00,gini,6.0,1,,PRUNED
57,,2026-09-21 02:27:21.697420,2026-09-21 02:27:21.703214,0 days 00:00:00.005794,entropy,6.0,5,,PRUNED
58,,2026-09-21 02:27:21.703214,2026-09-21 02:27:21.707358,0 days 00:00:00.004144,gini,6.0,20,,PRUNED
59,,2026-09-21 02:27:21.707358,2026-09-21 02:27:21.707358,0 days 00:00:00,entropy,3.0,1,,PRUNED
60,0.5662878761077895,2026-09-21 02:27:21.707358,2026-09-21 02:27:22.108853,0 days 00:00:00.401495,gini,3.0,1,"{'criterion': 'gini', 'max_depth': 3, 'min_samples_leaf': 1}",COMPLETE
61,,2026-09-21 02:27:22.108853,2026-09-21 02:27:22.108853,0 days 00:00:00,entropy,,20,,PRUNED
62,,2026-09-21 02:27:22.108853,2026-09-21 02:27:22.108853,0 days 00:00:00,entropy,,20,,PRUNED
63,,2026-09-21 02:27:22.108853,2026-09-21 02:27:22.108853,0 days 00:00:00,entropy,,20,,PRUNED
64,,2026-09-21 02:27:22.108853,2026-09-21 02:27:22.108853,0 days 00:00:00,entropy,6.0,20,,PRUNED
65,0.5998978778737583,2026-09-21 02:27:22.108853,2026-09-21 02:27:22.539588,0 days 00:00:00.430735,entropy,12.0,20,,COMPLETE
66,,2026-09-21 02:27:22.539588,2026-09-21 02:27:22.542155,0 days 00:00:00.002567,gini,6.0,20,,PRUNED
67,,2026-09-21 02:27:22.542155,2026-09-21 02:27:22.542155,0 days 00:00:00,entropy,6.0,5,,PRUNED
68,0.5958311755679452,2026-09-21 02:27:22.542155,2026-09-21 02:27:22.947714,0 days 00:00:00.405559,gini,,20,,COMPLETE
69,,2026-09-21 02:27:22.947714,2026-09-21 02:27:22.947714,0 days 00:00:00,entropy,6.0,5,,PRUNED
70,,2026-09-21 02:27:22.947714,2026-09-21 02:27:22.947714,0 days 00:00:00,gini,6.0,20,,PRUNED
71,,2026-09-21 02:27:22.947714,2026-09-21 02:27:22.947714,0 days 00:00:00,entropy,12.0,20,,PRUNED
72,,2026-09-21 02:27:22.947714,2026-09-21 02:27:22.961036,0 days 00:00:00.013322,entropy,12.0,20,,PRUNED
73,,2026-09-21 02:27:22.961036,2026-09-21 02:27:22.963994,0 days 00:00:00.002958,entropy,12.0,20,,PRUNED
74,,2026-09-21 02:27:22.963994,2026-09-21 02:27:22.965992,0 days 00:00:00.001998,entropy,12.0,20,,PRUNED
75,,2026-09-21 02:27:22.965992,2026-09-21 02:27:22.967991,0 days 00:00:00.001999,entropy,12.0,5,,PRUNED
76,,2026-09-21 02:27:22.967991,2026-09-21 02:27:22.969989,0 days 00:00:00.001998,entropy,6.0,20,,PRUNED
77,0.5613200351447517,2026-09-21 02:27:22.969989,2026-09-21 02:27:23.382403,0 days 00:00:00.412414,entropy,12.0,1,"{'criterion': 'entropy', 'max_depth': 12, 'min_samples_leaf': 1}",COMPLETE
78,0.5545157944620408,2026-09-21 02:27:23.382403,2026-09-21 02:27:23.796431,0 days 00:00:00.414028,gini,,5,,COMPLETE
