number,value,datetime_start,datetime_complete,duration,params_n_neighbors,params_p,params_weights,system_attrs_fixed_params,state
0,0.5928343620277652,2026-09-19 22:07:56.431103,2026-09-19 22:07:58.240495,0 days 00:00:01.809392,21,2,uniform,,COMPLETE
1,0.5937870202944272,2026-09-19 22:07:58.240495,2026-09-19 22:08:00.234357,0 days 00:00:01.993862,41,2,uniform,,COMPLETE
2,0.5799157704424194,2026-09-19 22:08:00.234357,2026-09-19 22:08:02.570471,0 days 00:00:02.336114,11,1,distance,,COMPLETE
3,0.5442251681013656,2026-09-19 22:08:02.570471,2026-09-19 22:08:04.274761,0 days 00:00:01.704290,3,2,distance,,COMPLETE
4,0.5501532602256333,2026-09-19 22:08:04.274761,2026-09-19 22:08:06.582523,0 days 00:00:02.307762,3,1,uniform,,COMPLETE
5,0.5481216995620634,2026-09-19 22:08:06.582523,2026-09-19 22:08:08.279002,0 days 00:00:01.696479,3,2,uniform,,COMPLETE
6,0.5844329766740675,2026-09-19 22:08:08.279002,2026-09-19 22:08:10.745123,0 days 00:00:02.466121,11,1,uniform,,COMPLETE
7,0.5894281405151803,2026-09-19 22:08:10.745123,2026-09-19 22:08:12.910200,0 days 00:00:02.165077,81,2,uniform,,COMPLETE
8,0.6024872636881812,2026-09-19 22:08:12.910200,2026-09-19 22:08:14.912562,0 days 00:00:02.002362,41,2,distance,,COMPLETE
9,0.561135797213279,2026-09-19 22:08:14.912562,2026-09-19 22:08:16.572437,0 days 00:00:01.659875,5,2,distance,,COMPLETE
10,0.6030124580864235,2026-09-19 22:08:16.572437,2026-09-19 22:08:19.264434,0 days 00:00:02.691997,41,1,distance,,COMPLETE
11,,2026-09-19 22:08:19.264434,2026-09-19 22:08:19.275624,0 days 00:00:00.011190,41,1,distance,,PRUNED
12,,2026-09-19 22:08:19.275624,2026-09-19 22:08:19.276383,0 days 00:00:00.000759,41,1,distance,,PRUNED
13,,2026-09-19 22:08:19.276383,2026-09-19 22:08:19.286885,0 days 00:00:00.010502,41,1,distance,,PRUNED
14,,2026-09-19 22:08:19.289476,2026-09-19 22:08:19.293357,0 days 00:00:00.003881,41,2,distance,,PRUNED
15,0.5871632523028979,2026-09-19 22:08:19.293357,2026-09-19 22:08:21.911296,0 days 00:00:02.617939,21,1,distance,,COMPLETE
16,0.5665010759652392,2026-09-19 22:08:21.911296,2026-09-19 22:08:24.224654,0 days 00:00:02.313358,5,1,distance,,COMPLETE
17,0.5913607846959387,2026-09-19 22:08:24.225543,2026-09-19 22:08:26.375537,0 days 00:00:02.149994,81,2,distance,,COMPLETE
18,,2026-09-19 22:08:26.377952,2026-09-19 22:08:26.381977,0 days 00:00:00.004025,41,2,distance,,PRUNED
19,,2026-09-19 22:08:26.381977,2026-09-19 22:08:26.390836,0 days 00:00:00.008859,41,1,distance,,PRUNED
20,,2026-09-19 22:08:26.390836,2026-09-19 22:08:26.395442,0 days 00:00:00.004606,41,2,distance,,PRUNED
21,,2026-09-19 22:08:26.395442,2026-09-19 22:08:26.402822,0 days 00:00:00.007380,41,2,uniform,,PRUNED
22,,2026-09-19 22:08:26.402822,2026-09-19 22:08:26.404002,0 days 00:00:00.001180,41,2,uniform,,PRUNED
23,,2026-09-19 22:08:26.404002,2026-09-19 22:08:26.414024,0 days 00:00:00.010022,41,2,uniform,,PRUNED
24,,2026-09-19 22:08:26.414024,2026-09-19 22:08:26.418796,0 days 00:00:00.004772,41,2,uniform,,PRUNED
25,0.5895751337175623,2026-09-19 22:08:26.418796,2026-09-19 22:08:28.312173,0 days 00:00:01.893377,21,2,distance,,COMPLETE
26,0.593965893969659,2026-09-19 22:08:28.312173,2026-09-19 22:08:31.091398,0 days 00:00:02.779225,81,1,uniform,,COMPLETE
27,0.599802239027661,2026-09-19 22:08:31.091398,2026-09-19 22:08:33.791237,0 days 00:00:02.699839,81,1,distance,,COMPLETE
28,,2026-09-19 22:08:33.791237,2026-09-19 22:08:33.807833,0 days 00:00:00.016596,81,1,distance,,PRUNED
29,,2026-09-19 22:08:33.807833,2026-09-19 22:08:33.808880,0 days 00:00:00.001047,81,1,distance,,PRUNED
30,,2026-09-19 22:08:33.808880,2026-09-19 22:08:33.840419,0 days 00:00:00.031539,5,1,distance,,PRUNED
31,,2026-09-19 22:08:33.840419,2026-09-19 22:08:33.840419,0 days 00:00:00,81,1,distance,,PRUNED
32,,2026-09-19 22:08:33.840419,2026-09-19 22:08:33.850255,0 days 00:00:00.009836,81,1,uniform,,PRUNED
33,,2026-09-19 22:08:33.850255,2026-09-19 22:08:33.857711,0 days 00:00:00.007456,81,1,distance,,PRUNED
34,,2026-09-19 22:08:33.857711,2026-09-19 22:08:33.866021,0 days 00:00:00.008310,11,1,uniform,,PRUNED
35,,2026-09-19 22:08:33.866021,2026-09-19 22:08:33.870553,0 days 00:00:00.004532,81,1,distance,,PRUNED
36,0.5931093208801536,2026-09-19 22:08:33.873730,2026-09-19 22:08:36.338481,0 days 00:00:02.464751,21,1,uniform,"{'n_neighbors': 21, 'p': 1, 'weights': 'uniform'}",COMPLETE
37,0.5397563797563798,2026-09-19 22:08:36.338481,2026-09-19 22:08:38.890080,0 days 00:00:02.551599,3,1,distance,,COMPLETE
38,,2026-09-19 22:08:38.890080,2026-09-19 22:08:38.896662,0 days 00:00:00.006582,11,1,uniform,,PRUNED
39,,2026-09-19 22:08:38.896662,2026-09-19 22:08:38.906041,0 days 00:00:00.009379,81,1,distance,,PRUNED
40,,2026-09-19 22:08:38.906041,2026-09-19 22:08:38.913667,0 days 00:00:00.007626,3,1,uniform,,PRUNED
41,,2026-09-19 22:08:38.913667,2026-09-19 22:08:38.919268,0 days 00:00:00.005601,41,2,uniform,,PRUNED
42,,2026-09-19 22:08:38.919268,2026-09-19 22:08:38.926445,0 days 00:00:00.007177,41,2,uniform,,PRUNED
43,,2026-09-19 22:08:38.926445,2026-09-19 22:08:38.931549,0 days 00:00:00.005104,81,2,uniform,,PRUNED
44,0.5786968704231664,2026-09-19 22:08:38.931549,2026-09-19 22:08:40.650132,0 days 00:00:01.718583,11,2,uniform,,COMPLETE
45,,2026-09-19 22:08:40.650132,2026-09-19 22:08:40.657773,0 days 00:00:00.007641,5,1,distance,,PRUNED
46,,2026-09-19 22:08:40.657773,2026-09-19 22:08:40.658993,0 days 00:00:00.001220,41,2,uniform,,PRUNED
47,,2026-09-19 22:08:40.658993,2026-09-19 22:08:40.658993,0 days 00:00:00,3,1,distance,,PRUNED
48,,2026-09-19 22:08:40.658993,2026-09-19 22:08:40.680165,0 days 00:00:00.021172,41,2,distance,,PRUNED
49,,2026-09-19 22:08:40.680165,2026-09-19 22:08:40.684225,0 days 00:00:00.004060,21,1,distance,,PRUNED
50,,2026-09-19 22:08:40.684225,2026-09-19 22:08:40.690996,0 days 00:00:00.006771,81,2,uniform,,PRUNED
51,,2026-09-19 22:08:40.690996,2026-09-19 22:08:40.697001,0 days 00:00:00.006005,21,1,uniform,,PRUNED
52,,2026-09-19 22:08:40.697001,2026-09-19 22:08:40.707670,0 days 00:00:00.010669,21,1,uniform,,PRUNED
53,0.6010812602467622,2026-09-19 22:08:40.707670,2026-09-19 22:08:43.348725,0 days 00:00:02.641055,41,1,uniform,"{'n_neighbors': 41, 'p': 1, 'weights': 'uniform'}",COMPLETE
54,,2026-09-19 22:08:43.353269,2026-09-19 22:08:43.358093,0 days 00:00:00.004824,41,1,uniform,,PRUNED
55,,2026-09-19 22:08:43.358093,2026-09-19 22:08:43.365799,0 days 00:00:00.007706,41,1,uniform,,PRUNED
56,,2026-09-19 22:08:43.365799,2026-09-19 22:08:43.365799,0 days 00:00:00,41,1,distance,,PRUNED
57,,2026-09-19 22:08:43.365799,2026-09-19 22:08:43.381868,0 days 00:00:00.016069,41,2,uniform,,PRUNED
58,,2026-09-19 22:08:43.381868,2026-09-19 22:08:43.389273,0 days 00:00:00.007405,41,1,distance,,PRUNED
59,,2026-09-19 22:08:43.389273,2026-09-19 22:08:43.397189,0 days 00:00:00.007916,41,2,distance,,PRUNED
60,0.5657516546629832,2026-09-19 22:08:43.397189,2026-09-19 22:08:45.863483,0 days 00:00:02.466294,5,1,uniform,,COMPLETE
61,,2026-09-19 22:08:45.863483,2026-09-19 22:08:45.876085,0 days 00:00:00.012602,21,1,uniform,,PRUNED
62,,2026-09-19 22:08:45.876085,2026-09-19 22:08:45.882129,0 days 00:00:00.006044,21,1,uniform,,PRUNED
63,,2026-09-19 22:08:45.882129,2026-09-19 22:08:45.884854,0 days 00:00:00.002725,81,1,uniform,,PRUNED
64,,2026-09-19 22:08:45.884854,2026-09-19 22:08:45.896878,0 days 00:00:00.012024,41,1,uniform,,PRUNED
65,,2026-09-19 22:08:45.896878,2026-09-19 22:08:45.904717,0 days 00:00:00.007839,21,1,uniform,,PRUNED
66,,2026-09-19 22:08:45.904717,2026-09-19 22:08:45.904717,0 days 00:00:00,81,1,distance,,PRUNED
67,,2026-09-19 22:08:45.904717,2026-09-19 22:08:45.916679,0 days 00:00:00.011962,41,2,uniform,,PRUNED
68,,2026-09-19 22:08:45.916679,2026-09-19 22:08:45.916679,0 days 00:00:00,11,1,distance,,PRUNED
69,0.5650573449514399,2026-09-19 22:08:45.916679,2026-09-19 22:08:47.763973,0 days 00:00:01.847294,5,2,uniform,"{'n_neighbors': 5, 'p': 2, 'weights': 'uniform'}",COMPLETE
70,,2026-09-19 22:08:47.763973,2026-09-19 22:08:47.770640,0 days 00:00:00.006667,41,1,distance,,PRUNED
71,,2026-09-19 22:08:47.770640,2026-09-19 22:08:47.775804,0 days 00:00:00.005164,21,2,uniform,,PRUNED
72,,2026-09-19 22:08:47.775804,2026-09-19 22:08:47.787744,0 days 00:00:00.011940,21,2,uniform,,PRUNED
73,,2026-09-19 22:08:47.787744,2026-09-19 22:08:47.797185,0 days 00:00:00.009441,21,2,uniform,,PRUNED
74,,2026-09-19 22:08:47.797185,2026-09-19 22:08:47.805967,0 days 00:00:00.008782,81,2,uniform,,PRUNED
75,,2026-09-19 22:08:47.805967,2026-09-19 22:08:47.808132,0 days 00:00:00.002165,3,2,uniform,,PRUNED
76,,2026-09-19 22:08:47.808132,2026-09-19 22:08:47.817281,0 days 00:00:00.009149,41,1,distance,,PRUNED
77,,2026-09-19 22:08:47.817281,2026-09-19 22:08:47.823804,0 days 00:00:00.006523,81,2,uniform,,PRUNED
78,0.5783371677211734,2026-09-19 22:08:47.823804,2026-09-19 22:08:49.505571,0 days 00:00:01.681767,11,2,distance,"{'n_neighbors': 11, 'p': 2, 'weights': 'distance'}",COMPLETE
