number,value,datetime_start,datetime_complete,duration,params_C,params_penalty,state
0,0.6181040308157001,2026-09-20 20:30:56.293770,2026-09-20 20:30:56.774150,0 days 00:00:00.480380,0.10483033271302114,l1,COMPLETE
1,0.616828115073088,2026-09-20 20:30:56.776166,2026-09-20 20:30:57.277874,0 days 00:00:00.501708,7.293104416290248,l2,COMPLETE
2,0.6135946863232539,2026-09-20 20:30:57.277874,2026-09-20 20:30:57.753615,0 days 00:00:00.475741,0.017721964236722693,l1,COMPLETE
3,0.6167889504573587,2026-09-20 20:30:57.753615,2026-09-20 20:30:58.237570,0 days 00:00:00.483955,3.8291742488920955,l2,COMPLETE
4,0.6167550985330973,2026-09-20 20:30:58.237570,2026-09-20 20:30:58.694599,0 days 00:00:00.457029,614.8680226366348,l2,COMPLETE
5,0.6167658359555092,2026-09-20 20:30:58.694599,2026-09-20 20:30:59.222736,0 days 00:00:00.528137,0.49075180031873805,l1,COMPLETE
6,0.621535087851172,2026-09-20 20:30:59.222736,2026-09-20 20:30:59.660701,0 days 00:00:00.437965,0.00509205139870505,l2,COMPLETE
7,0.6167584681880313,2026-09-20 20:30:59.660701,2026-09-20 20:31:01.663323,0 days 00:00:02.002622,580.4162413685495,l1,COMPLETE
8,0.6140217671708149,2026-09-20 20:31:01.663323,2026-09-20 20:31:02.111376,0 days 00:00:00.448053,0.001388981686417093,l2,COMPLETE
9,0.6116068413242283,2026-09-20 20:31:02.111376,2026-09-20 20:31:02.538351,0 days 00:00:00.426975,0.0010422784414204655,l2,COMPLETE
10,0.6297660403582035,2026-09-20 20:31:02.538351,2026-09-20 20:31:03.004708,0 days 00:00:00.466357,0.018645735176699974,l2,COMPLETE
11,0.6297610875626517,2026-09-20 20:31:03.004708,2026-09-20 20:31:03.433209,0 days 00:00:00.428501,0.019263332019190046,l2,COMPLETE
12,0.6276259184251597,2026-09-20 20:31:03.433209,2026-09-20 20:31:03.879004,0 days 00:00:00.445795,0.03153294370849008,l2,COMPLETE
13,0.6195691157217781,2026-09-20 20:31:03.879004,2026-09-20 20:31:04.330020,0 days 00:00:00.451016,0.31414778382343217,l2,COMPLETE
14,0.6298614320638632,2026-09-20 20:31:04.330020,2026-09-20 20:31:04.776014,0 days 00:00:00.445994,0.025631383973680824,l2,COMPLETE
15,0.616595706869667,2026-09-20 20:31:04.776014,2026-09-20 20:31:05.274467,0 days 00:00:00.498453,4.568821120395111,l2,COMPLETE
16,0.617956107944299,2026-09-20 20:31:05.274467,2026-09-20 20:31:05.789006,0 days 00:00:00.514539,46.46445640395968,l2,COMPLETE
17,0.6195959666149368,2026-09-20 20:31:05.789006,2026-09-20 20:31:06.218665,0 days 00:00:00.429659,0.08443382760094091,l2,COMPLETE
18,0.5622103204916366,2026-09-20 20:31:06.218665,2026-09-20 20:31:06.685826,0 days 00:00:00.467161,0.005349046348681188,l1,COMPLETE
19,0.6188396361207208,2026-09-20 20:31:06.685826,2026-09-20 20:31:07.143406,0 days 00:00:00.457580,0.12963316979156464,l2,COMPLETE
20,0.6226837213065124,2026-09-20 20:31:07.143406,2026-09-20 20:31:07.580332,0 days 00:00:00.436926,0.005380957178097048,l2,COMPLETE
21,0.6242651697066904,2026-09-20 20:31:07.580332,2026-09-20 20:31:08.047602,0 days 00:00:00.467270,0.04001328256768505,l2,COMPLETE
22,0.6283319723166905,2026-09-20 20:31:08.047602,2026-09-20 20:31:08.474694,0 days 00:00:00.427092,0.014378900229197612,l2,COMPLETE
23,0.6177500585949481,2026-09-20 20:31:08.474694,2026-09-20 20:31:08.950731,0 days 00:00:00.476037,1.1907183664034167,l2,COMPLETE
