number,value,datetime_start,datetime_complete,duration,params_C,params_penalty,state
0,0.4042220726031965,2026-09-21 01:51:02.463549,2026-09-21 01:51:03.077154,0 days 00:00:00.613605,0.007563498095642176,l1,COMPLETE
1,0.598062355090806,2026-09-21 01:51:03.077154,2026-09-21 01:51:03.481878,0 days 00:00:00.404724,0.3565086101047074,l2,COMPLETE
2,0.6028160720981902,2026-09-21 01:51:03.481878,2026-09-21 01:51:04.018568,0 days 00:00:00.536690,1.536748353516432,l1,COMPLETE
3,0.6081918435022281,2026-09-21 01:51:04.018568,2026-09-21 01:51:05.298960,0 days 00:00:01.280392,126.5456325124133,l1,COMPLETE
4,0.6078356185352304,2026-09-21 01:51:05.298960,2026-09-21 01:51:06.709534,0 days 00:00:01.410574,363.7709083222012,l1,COMPLETE
5,0.6079114548591873,2026-09-21 01:51:06.709534,2026-09-21 01:51:07.993339,0 days 00:00:01.283805,60.17810598412429,l1,COMPLETE
6,0.6078356185352304,2026-09-21 01:51:07.993339,2026-09-21 01:51:09.350132,0 days 00:00:01.356793,505.9937967978694,l1,COMPLETE
7,0.5707517801588543,2026-09-21 01:51:09.350132,2026-09-21 01:51:09.768389,0 days 00:00:00.418257,0.051480981729433384,l1,COMPLETE
8,0.6069196173001554,2026-09-21 01:51:09.768389,2026-09-21 01:51:10.187996,0 days 00:00:00.419607,11.258853547395082,l2,COMPLETE
9,0.6069196173001554,2026-09-21 01:51:10.187996,2026-09-21 01:51:10.614916,0 days 00:00:00.426920,10.187013488281474,l2,COMPLETE
10,0.4583705298892959,2026-09-21 01:51:10.614916,2026-09-21 01:51:11.009947,0 days 00:00:00.395031,0.001988326933762658,l2,COMPLETE
11,0.6079114548591873,2026-09-21 01:51:11.009947,2026-09-21 01:51:12.306201,0 days 00:00:01.296254,51.231364744062176,l1,COMPLETE
12,0.6081918435022281,2026-09-21 01:51:12.306201,2026-09-21 01:51:13.564383,0 days 00:00:01.258182,61.924673535268965,l1,COMPLETE
13,0.6081918435022281,2026-09-21 01:51:13.564383,2026-09-21 01:51:15.644628,0 days 00:00:02.080245,74.01286376862684,l1,COMPLETE
14,0.6028427011672345,2026-09-21 01:51:15.644628,2026-09-21 01:51:16.219528,0 days 00:00:00.574900,2.846078127281329,l1,COMPLETE
15,0.6075552298921895,2026-09-21 01:51:16.219528,2026-09-21 01:51:17.655971,0 days 00:00:01.436443,924.6681046529408,l1,COMPLETE
16,0.598569774917967,2026-09-21 01:51:17.655971,2026-09-21 01:51:18.174677,0 days 00:00:00.518706,0.18978631956580827,l1,COMPLETE
17,0.6066105664324469,2026-09-21 01:51:18.174677,2026-09-21 01:51:19.577900,0 days 00:00:01.403223,11.01394388446478,l1,COMPLETE
18,0.6075552298921895,2026-09-21 01:51:19.577900,2026-09-21 01:51:20.006442,0 days 00:00:00.428542,136.68746609246188,l2,COMPLETE
19,0.607823341245041,2026-09-21 01:51:20.006442,2026-09-21 01:51:21.234528,0 days 00:00:01.228086,14.86861680787708,l1,COMPLETE
20,0.6072706267911747,2026-09-21 01:51:21.234528,2026-09-21 01:51:22.631039,0 days 00:00:01.396511,176.0898031733948,l1,COMPLETE
21,0.6079114548591873,2026-09-21 01:51:22.631039,2026-09-21 01:51:23.915074,0 days 00:00:01.284035,50.339010913282735,l1,COMPLETE
22,0.6033875040904256,2026-09-21 01:51:23.915074,2026-09-21 01:51:24.567503,0 days 00:00:00.652429,2.924445425607686,l1,COMPLETE
23,0.6072706267911747,2026-09-21 01:51:24.567503,2026-09-21 01:51:26.062116,0 days 00:00:01.494613,139.62680973051434,l1,COMPLETE
