number,value,datetime_start,datetime_complete,duration,params_n_neighbors,params_p,params_weights,system_attrs_fixed_params,state
0,0.581114259205254,2026-09-20 19:44:32.235245,2026-09-20 19:44:32.747282,0 days 00:00:00.512037,11,2,distance,,COMPLETE
1,0.5900719564886807,2026-09-20 19:44:32.747282,2026-09-20 19:44:33.316706,0 days 00:00:00.569424,41,2,uniform,,COMPLETE
2,0.6061956315875795,2026-09-20 19:44:33.316706,2026-09-20 19:44:34.143222,0 days 00:00:00.826516,41,1,uniform,,COMPLETE
3,0.5445908491581163,2026-09-20 19:44:34.143222,2026-09-20 19:44:34.650393,0 days 00:00:00.507171,3,2,uniform,,COMPLETE
4,0.6005128005670245,2026-09-20 19:44:34.650393,2026-09-20 19:44:35.510089,0 days 00:00:00.859696,41,1,distance,,COMPLETE
5,,2026-09-20 19:44:35.510089,2026-09-20 19:44:35.510089,0 days 00:00:00,41,1,distance,,PRUNED
6,0.586346575897141,2026-09-20 19:44:35.510089,2026-09-20 19:44:36.143650,0 days 00:00:00.633561,81,2,uniform,,COMPLETE
7,,2026-09-20 19:44:36.143650,2026-09-20 19:44:36.143650,0 days 00:00:00,41,2,uniform,,PRUNED
8,0.6046891903875143,2026-09-20 19:44:36.143650,2026-09-20 19:44:36.922052,0 days 00:00:00.778402,21,1,uniform,,COMPLETE
9,0.5770313433907238,2026-09-20 19:44:36.922052,2026-09-20 19:44:37.704541,0 days 00:00:00.782489,5,1,uniform,,COMPLETE
10,0.5866707742547123,2026-09-20 19:44:37.704541,2026-09-20 19:44:38.486748,0 days 00:00:00.782207,11,1,distance,,COMPLETE
11,,2026-09-20 19:44:38.486748,2026-09-20 19:44:38.488744,0 days 00:00:00.001996,21,1,uniform,,PRUNED
12,,2026-09-20 19:44:38.488744,2026-09-20 19:44:38.490743,0 days 00:00:00.001999,21,1,uniform,,PRUNED
13,,2026-09-20 19:44:38.490743,2026-09-20 19:44:38.492744,0 days 00:00:00.002001,21,1,uniform,,PRUNED
14,,2026-09-20 19:44:38.492744,2026-09-20 19:44:38.494745,0 days 00:00:00.002001,5,1,uniform,,PRUNED
15,0.6018709701893935,2026-09-20 19:44:38.495476,2026-09-20 19:44:39.410775,0 days 00:00:00.915299,81,1,uniform,,COMPLETE
16,0.5453336248527415,2026-09-20 19:44:39.410775,2026-09-20 19:44:40.179459,0 days 00:00:00.768684,3,1,uniform,,COMPLETE
17,,2026-09-20 19:44:40.179459,2026-09-20 19:44:40.184887,0 days 00:00:00.005428,21,1,uniform,,PRUNED
18,0.5932058845698122,2026-09-20 19:44:40.184887,2026-09-20 19:44:40.978833,0 days 00:00:00.793946,21,1,distance,,COMPLETE
19,,2026-09-20 19:44:40.978833,2026-09-20 19:44:40.980576,0 days 00:00:00.001743,41,1,uniform,,PRUNED
20,0.5957436642937635,2026-09-20 19:44:40.980576,2026-09-20 19:44:41.783845,0 days 00:00:00.803269,11,1,uniform,,COMPLETE
21,,2026-09-20 19:44:41.783845,2026-09-20 19:44:41.797206,0 days 00:00:00.013361,81,1,uniform,,PRUNED
22,,2026-09-20 19:44:41.797206,2026-09-20 19:44:41.799949,0 days 00:00:00.002743,81,1,uniform,,PRUNED
23,,2026-09-20 19:44:41.799949,2026-09-20 19:44:41.799949,0 days 00:00:00,81,1,uniform,,PRUNED
24,,2026-09-20 19:44:41.799949,2026-09-20 19:44:41.799949,0 days 00:00:00,81,1,uniform,,PRUNED
25,,2026-09-20 19:44:41.799949,2026-09-20 19:44:41.799949,0 days 00:00:00,3,1,uniform,,PRUNED
26,0.5531711283343893,2026-09-20 19:44:41.799949,2026-09-20 19:44:42.291487,0 days 00:00:00.491538,5,2,distance,,COMPLETE
27,,2026-09-20 19:44:42.291487,2026-09-20 19:44:42.291487,0 days 00:00:00,21,1,uniform,,PRUNED
28,,2026-09-20 19:44:42.291487,2026-09-20 19:44:42.291487,0 days 00:00:00,41,1,uniform,,PRUNED
29,,2026-09-20 19:44:42.291487,2026-09-20 19:44:42.291487,0 days 00:00:00,11,2,distance,,PRUNED
30,,2026-09-20 19:44:42.291487,2026-09-20 19:44:42.305409,0 days 00:00:00.013922,81,1,uniform,,PRUNED
31,,2026-09-20 19:44:42.305409,2026-09-20 19:44:42.308403,0 days 00:00:00.002994,41,1,distance,,PRUNED
32,,2026-09-20 19:44:42.308403,2026-09-20 19:44:42.308403,0 days 00:00:00,41,1,distance,,PRUNED
33,,2026-09-20 19:44:42.308403,2026-09-20 19:44:42.312607,0 days 00:00:00.004204,41,1,distance,,PRUNED
34,0.5883244077153841,2026-09-20 19:44:42.312607,2026-09-20 19:44:42.878552,0 days 00:00:00.565945,41,2,distance,,COMPLETE
35,,2026-09-20 19:44:42.878552,2026-09-20 19:44:42.878552,0 days 00:00:00,41,1,distance,,PRUNED
36,0.53706218060601,2026-09-20 19:44:42.878552,2026-09-20 19:44:43.346429,0 days 00:00:00.467877,3,2,distance,,COMPLETE
37,,2026-09-20 19:44:43.346429,2026-09-20 19:44:43.363311,0 days 00:00:00.016882,41,1,uniform,,PRUNED
38,,2026-09-20 19:44:43.363311,2026-09-20 19:44:43.363311,0 days 00:00:00,81,1,uniform,,PRUNED
39,,2026-09-20 19:44:43.363311,2026-09-20 19:44:43.363311,0 days 00:00:00,5,2,distance,,PRUNED
40,,2026-09-20 19:44:43.363311,2026-09-20 19:44:43.363311,0 days 00:00:00,21,1,uniform,,PRUNED
41,,2026-09-20 19:44:43.363311,2026-09-20 19:44:43.363311,0 days 00:00:00,11,1,uniform,,PRUNED
42,,2026-09-20 19:44:43.363311,2026-09-20 19:44:43.363311,0 days 00:00:00,11,1,uniform,,PRUNED
43,,2026-09-20 19:44:43.363311,2026-09-20 19:44:43.363311,0 days 00:00:00,11,1,uniform,,PRUNED
44,,2026-09-20 19:44:43.363311,2026-09-20 19:44:43.378511,0 days 00:00:00.015200,11,1,uniform,,PRUNED
45,0.5988711177217975,2026-09-20 19:44:43.378511,2026-09-20 19:44:44.294612,0 days 00:00:00.916101,81,1,distance,"{'n_neighbors': 81, 'p': 1, 'weights': 'distance'}",COMPLETE
46,,2026-09-20 19:44:44.294612,2026-09-20 19:44:44.294612,0 days 00:00:00,81,1,distance,,PRUNED
47,,2026-09-20 19:44:44.294612,2026-09-20 19:44:44.294612,0 days 00:00:00,81,1,distance,,PRUNED
48,,2026-09-20 19:44:44.294612,2026-09-20 19:44:44.294612,0 days 00:00:00,21,1,distance,,PRUNED
49,,2026-09-20 19:44:44.294612,2026-09-20 19:44:44.294612,0 days 00:00:00,81,1,distance,,PRUNED
50,,2026-09-20 19:44:44.294612,2026-09-20 19:44:44.294612,0 days 00:00:00,41,2,distance,,PRUNED
51,,2026-09-20 19:44:44.294612,2026-09-20 19:44:44.294612,0 days 00:00:00,11,1,uniform,,PRUNED
52,,2026-09-20 19:44:44.294612,2026-09-20 19:44:44.310266,0 days 00:00:00.015654,81,1,uniform,,PRUNED
53,,2026-09-20 19:44:44.310266,2026-09-20 19:44:44.312669,0 days 00:00:00.002403,21,1,uniform,,PRUNED
54,0.5914837408376464,2026-09-20 19:44:44.312669,2026-09-20 19:44:44.815394,0 days 00:00:00.502725,11,2,uniform,"{'n_neighbors': 11, 'p': 2, 'weights': 'uniform'}",COMPLETE
55,,2026-09-20 19:44:44.815394,2026-09-20 19:44:44.818263,0 days 00:00:00.002869,3,1,uniform,,PRUNED
56,,2026-09-20 19:44:44.818263,2026-09-20 19:44:44.818263,0 days 00:00:00,5,1,uniform,,PRUNED
57,,2026-09-20 19:44:44.818263,2026-09-20 19:44:44.818263,0 days 00:00:00,41,1,uniform,,PRUNED
58,,2026-09-20 19:44:44.818263,2026-09-20 19:44:44.818263,0 days 00:00:00,81,1,distance,,PRUNED
59,,2026-09-20 19:44:44.818263,2026-09-20 19:44:44.818263,0 days 00:00:00,21,1,uniform,,PRUNED
60,,2026-09-20 19:44:44.818263,2026-09-20 19:44:44.818263,0 days 00:00:00,81,1,uniform,,PRUNED
61,,2026-09-20 19:44:44.818263,2026-09-20 19:44:44.831128,0 days 00:00:00.012865,21,1,distance,,PRUNED
62,,2026-09-20 19:44:44.831128,2026-09-20 19:44:44.831128,0 days 00:00:00,21,1,distance,,PRUNED
63,0.5829578544061302,2026-09-20 19:44:44.831128,2026-09-20 19:44:45.348906,0 days 00:00:00.517778,21,2,distance,"{'n_neighbors': 21, 'p': 2, 'weights': 'distance'}",COMPLETE
64,,2026-09-20 19:44:45.348906,2026-09-20 19:44:45.355539,0 days 00:00:00.006633,41,1,distance,,PRUNED
65,,2026-09-20 19:44:45.355539,2026-09-20 19:44:45.358050,0 days 00:00:00.002511,21,1,distance,,PRUNED
66,,2026-09-20 19:44:45.358050,2026-09-20 19:44:45.358050,0 days 00:00:00,41,1,distance,,PRUNED
67,,2026-09-20 19:44:45.358050,2026-09-20 19:44:45.362665,0 days 00:00:00.004615,3,1,uniform,,PRUNED
68,,2026-09-20 19:44:45.362665,2026-09-20 19:44:45.365267,0 days 00:00:00.002602,81,1,distance,,PRUNED
69,,2026-09-20 19:44:45.365267,2026-09-20 19:44:45.367272,0 days 00:00:00.002005,21,1,uniform,,PRUNED
70,,2026-09-20 19:44:45.367272,2026-09-20 19:44:45.369277,0 days 00:00:00.002005,5,1,uniform,,PRUNED
71,,2026-09-20 19:44:45.369277,2026-09-20 19:44:45.369277,0 days 00:00:00,11,2,uniform,,PRUNED
72,0.5335693581780538,2026-09-20 19:44:45.369277,2026-09-20 19:44:46.126876,0 days 00:00:00.757599,3,1,distance,"{'n_neighbors': 3, 'p': 1, 'weights': 'distance'}",COMPLETE
73,,2026-09-20 19:44:46.126876,2026-09-20 19:44:46.129753,0 days 00:00:00.002877,11,2,uniform,,PRUNED
74,,2026-09-20 19:44:46.129753,2026-09-20 19:44:46.133153,0 days 00:00:00.003400,11,2,uniform,,PRUNED
75,,2026-09-20 19:44:46.133153,2026-09-20 19:44:46.135592,0 days 00:00:00.002439,11,2,uniform,,PRUNED
76,,2026-09-20 19:44:46.135592,2026-09-20 19:44:46.135592,0 days 00:00:00,41,2,uniform,,PRUNED
77,,2026-09-20 19:44:46.135592,2026-09-20 19:44:46.140714,0 days 00:00:00.005122,11,1,uniform,,PRUNED
78,,2026-09-20 19:44:46.140714,2026-09-20 19:44:46.140714,0 days 00:00:00,81,1,uniform,,PRUNED
79,,2026-09-20 19:44:46.140714,2026-09-20 19:44:46.145025,0 days 00:00:00.004311,41,2,distance,,PRUNED
80,,2026-09-20 19:44:46.145025,2026-09-20 19:44:46.145025,0 days 00:00:00,11,1,uniform,,PRUNED
81,0.5893869572213262,2026-09-20 19:44:46.145025,2026-09-20 19:44:46.658978,0 days 00:00:00.513953,21,2,uniform,"{'n_neighbors': 21, 'p': 2, 'weights': 'uniform'}",COMPLETE
82,,2026-09-20 19:44:46.658978,2026-09-20 19:44:46.673822,0 days 00:00:00.014844,41,2,uniform,,PRUNED
83,,2026-09-20 19:44:46.673822,2026-09-20 19:44:46.674829,0 days 00:00:00.001007,41,2,uniform,,PRUNED
84,,2026-09-20 19:44:46.674829,2026-09-20 19:44:46.679021,0 days 00:00:00.004192,41,2,uniform,,PRUNED
85,,2026-09-20 19:44:46.679021,2026-09-20 19:44:46.679021,0 days 00:00:00,41,1,uniform,,PRUNED
86,,2026-09-20 19:44:46.679021,2026-09-20 19:44:46.683520,0 days 00:00:00.004499,81,1,distance,,PRUNED
87,0.56286863861041,2026-09-20 19:44:46.683520,2026-09-20 19:44:47.187244,0 days 00:00:00.503724,5,2,uniform,,COMPLETE
88,,2026-09-20 19:44:47.187244,2026-09-20 19:44:47.190335,0 days 00:00:00.003091,11,1,distance,,PRUNED
89,,2026-09-20 19:44:47.190335,2026-09-20 19:44:47.192928,0 days 00:00:00.002593,41,1,uniform,,PRUNED
90,,2026-09-20 19:44:47.192928,2026-09-20 19:44:47.195123,0 days 00:00:00.002195,81,1,uniform,,PRUNED
91,,2026-09-20 19:44:47.195123,2026-09-20 19:44:47.197130,0 days 00:00:00.002007,21,2,uniform,,PRUNED
92,,2026-09-20 19:44:47.197130,2026-09-20 19:44:47.199898,0 days 00:00:00.002768,21,2,uniform,,PRUNED
93,,2026-09-20 19:44:47.199898,2026-09-20 19:44:47.202108,0 days 00:00:00.002210,21,2,uniform,,PRUNED
94,,2026-09-20 19:44:47.202108,2026-09-20 19:44:47.204695,0 days 00:00:00.002587,21,2,uniform,,PRUNED
95,,2026-09-20 19:44:47.204695,2026-09-20 19:44:47.206940,0 days 00:00:00.002245,21,2,uniform,,PRUNED
96,0.5853010177547456,2026-09-20 19:44:47.206940,2026-09-20 19:44:47.866274,0 days 00:00:00.659334,81,2,distance,"{'n_neighbors': 81, 'p': 2, 'weights': 'distance'}",COMPLETE
97,,2026-09-20 19:44:47.866274,2026-09-20 19:44:47.874495,0 days 00:00:00.008221,21,1,uniform,,PRUNED
98,,2026-09-20 19:44:47.874495,2026-09-20 19:44:47.874495,0 days 00:00:00,41,1,distance,,PRUNED
99,,2026-09-20 19:44:47.874495,2026-09-20 19:44:47.879974,0 days 00:00:00.005479,11,1,uniform,,PRUNED
100,,2026-09-20 19:44:47.879974,2026-09-20 19:44:47.879974,0 days 00:00:00,21,1,uniform,,PRUNED
101,,2026-09-20 19:44:47.879974,2026-09-20 19:44:47.879974,0 days 00:00:00,41,2,distance,,PRUNED
102,,2026-09-20 19:44:47.879974,2026-09-20 19:44:47.879974,0 days 00:00:00,41,2,distance,,PRUNED
103,,2026-09-20 19:44:47.879974,2026-09-20 19:44:47.879974,0 days 00:00:00,41,2,distance,,PRUNED
104,,2026-09-20 19:44:47.879974,2026-09-20 19:44:47.879974,0 days 00:00:00,41,2,distance,,PRUNED
105,0.5603672827277544,2026-09-20 19:44:47.879974,2026-09-20 19:44:48.679991,0 days 00:00:00.800017,5,1,distance,"{'n_neighbors': 5, 'p': 1, 'weights': 'distance'}",COMPLETE
