number,value,datetime_start,datetime_complete,duration,params_C,params_penalty,state
0,0.6363348099232239,2026-09-20 20:23:43.063843,2026-09-20 20:23:43.452619,0 days 00:00:00.388776,0.05403062565123148,l2,COMPLETE
1,0.6364179858980459,2026-09-20 20:23:43.455583,2026-09-20 20:23:43.865027,0 days 00:00:00.409444,3.4452629136031647,l2,COMPLETE
2,0.6352761254995474,2026-09-20 20:23:43.865027,2026-09-20 20:23:44.259351,0 days 00:00:00.394324,0.0746964852382615,l2,COMPLETE
3,0.6364192897971495,2026-09-20 20:23:44.259351,2026-09-20 20:23:44.673592,0 days 00:00:00.414241,7.138461864666772,l2,COMPLETE
4,0.6374027300100178,2026-09-20 20:23:44.673592,2026-09-20 20:23:45.075042,0 days 00:00:00.401450,0.0029716955889846257,l2,COMPLETE
5,0.538851253649849,2026-09-20 20:23:45.075042,2026-09-20 20:23:45.491507,0 days 00:00:00.416465,0.002113181854932873,l1,COMPLETE
6,0.6333202994959168,2026-09-20 20:23:45.491507,2026-09-20 20:23:45.901970,0 days 00:00:00.410463,0.1933079887207879,l2,COMPLETE
7,0.6372801433343519,2026-09-20 20:23:45.901970,2026-09-20 20:23:46.347067,0 days 00:00:00.445097,0.050037639427743384,l1,COMPLETE
8,0.6353792736317592,2026-09-20 20:23:46.347067,2026-09-20 20:23:47.920705,0 days 00:00:01.573638,678.0379091801906,l1,COMPLETE
9,0.6306413943384462,2026-09-20 20:23:47.920705,2026-09-20 20:23:48.311243,0 days 00:00:00.390538,0.0011191303981438942,l2,COMPLETE
10,0.6353792736317592,2026-09-20 20:23:48.311243,2026-09-20 20:23:49.916525,0 days 00:00:01.605282,119.4352827004695,l1,COMPLETE
11,0.6072907003551905,2026-09-20 20:23:49.916525,2026-09-20 20:23:50.338447,0 days 00:00:00.421922,0.009494460160004629,l1,COMPLETE
12,0.6259358302447454,2026-09-20 20:23:50.338447,2026-09-20 20:23:50.769055,0 days 00:00:00.430608,0.016781045075422427,l1,COMPLETE
13,0.6364565568880048,2026-09-20 20:23:50.769055,2026-09-20 20:23:51.201921,0 days 00:00:00.432866,0.27388933864314224,l1,COMPLETE
14,0.6418173092305232,2026-09-20 20:23:51.201921,2026-09-20 20:23:51.617402,0 days 00:00:00.415481,0.010676776678259529,l2,COMPLETE
15,0.6381757755275129,2026-09-20 20:23:51.617402,2026-09-20 20:23:52.014431,0 days 00:00:00.397029,0.004613635170271642,l2,COMPLETE
16,0.6387693112192117,2026-09-20 20:23:52.014431,2026-09-20 20:23:52.418455,0 days 00:00:00.404024,0.009225197969237445,l2,COMPLETE
17,0.6359190720521363,2026-09-20 20:23:52.418455,2026-09-20 20:23:52.855318,0 days 00:00:00.436863,1.1655094087605151,l2,COMPLETE
18,0.6355845526975681,2026-09-20 20:23:52.855318,2026-09-20 20:23:53.286913,0 days 00:00:00.431595,16.52827841558086,l2,COMPLETE
19,0.6401213688566217,2026-09-20 20:23:53.286913,2026-09-20 20:23:53.703822,0 days 00:00:00.416909,0.018686534707770108,l2,COMPLETE
20,0.6327536716664918,2026-09-20 20:23:53.703822,2026-09-20 20:23:54.109697,0 days 00:00:00.405875,0.48293473638253864,l2,COMPLETE
21,0.640598205056662,2026-09-20 20:23:54.109697,2026-09-20 20:23:54.514074,0 days 00:00:00.404377,0.017159704951828197,l2,COMPLETE
22,0.6412827040900811,2026-09-20 20:23:54.514074,2026-09-20 20:23:54.919672,0 days 00:00:00.405598,0.016645965084690593,l2,COMPLETE
23,0.6361430165884799,2026-09-20 20:23:54.919672,2026-09-20 20:23:55.305083,0 days 00:00:00.385411,0.035184423639264134,l2,COMPLETE
