number,value,datetime_start,datetime_complete,duration,params_C,params_penalty,state
0,0.564329287674452,2026-09-19 23:21:44.765810,2026-09-19 23:21:45.164693,0 days 00:00:00.398883,0.030219185645940803,l1,COMPLETE
1,0.5946171283068752,2026-09-19 23:21:45.169522,2026-09-19 23:21:45.576354,0 days 00:00:00.406832,740.9022345525982,l2,COMPLETE
2,0.5914386355209492,2026-09-19 23:21:45.576354,2026-09-19 23:21:45.947739,0 days 00:00:00.371385,1.2216030437093282,l2,COMPLETE
3,0.5861353491351649,2026-09-19 23:21:45.947739,2026-09-19 23:21:46.329555,0 days 00:00:00.381816,0.085745675481671,l2,COMPLETE
4,0.5934415744484516,2026-09-19 23:21:46.329555,2026-09-19 23:21:46.718189,0 days 00:00:00.388634,63.68227630056183,l2,COMPLETE
5,0.5954327410776465,2026-09-19 23:21:46.718189,2026-09-19 23:21:47.815057,0 days 00:00:01.096868,22.37329118419468,l1,COMPLETE
6,0.5846742882886699,2026-09-19 23:21:47.815057,2026-09-19 23:21:48.173363,0 days 00:00:00.358306,0.04917968635443134,l2,COMPLETE
7,0.2882458035077667,2026-09-19 23:21:48.173363,2026-09-19 23:21:48.572642,0 days 00:00:00.399279,0.005700825987075727,l1,COMPLETE
8,0.5955093677982175,2026-09-19 23:21:48.572642,2026-09-19 23:21:49.378411,0 days 00:00:00.805769,6.7166966347685015,l1,COMPLETE
9,0.5944952530092188,2026-09-19 23:21:49.378411,2026-09-19 23:21:49.868167,0 days 00:00:00.489756,2.0809835742195246,l1,COMPLETE
10,0.5931591261409249,2026-09-19 23:21:49.868167,2026-09-19 23:21:51.012182,0 days 00:00:01.144015,77.93091876656533,l1,COMPLETE
11,0.5939480453900038,2026-09-19 23:21:51.012182,2026-09-19 23:21:51.952474,0 days 00:00:00.940292,11.409596871924586,l1,COMPLETE
12,0.5945817792573824,2026-09-19 23:21:51.952474,2026-09-19 23:21:52.824815,0 days 00:00:00.872341,11.519457759434296,l1,COMPLETE
13,0.5943611146783366,2026-09-19 23:21:52.824815,2026-09-19 23:21:53.958671,0 days 00:00:01.133856,587.2945108160817,l1,COMPLETE
14,0.5952292409748808,2026-09-19 23:21:53.958671,2026-09-19 23:21:54.914642,0 days 00:00:00.955971,7.853398617614938,l1,COMPLETE
15,0.5912724938010895,2026-09-19 23:21:54.914642,2026-09-19 23:21:55.313201,0 days 00:00:00.398559,0.2566761944478593,l1,COMPLETE
16,0.5940723119892747,2026-09-19 23:21:55.313201,2026-09-19 23:21:56.541746,0 days 00:00:01.228545,79.7238151755648,l1,COMPLETE
17,0.5930646029609691,2026-09-19 23:21:56.541746,2026-09-19 23:21:56.968279,0 days 00:00:00.426533,0.4890292163631116,l1,COMPLETE
18,0.5948669348975063,2026-09-19 23:21:56.968279,2026-09-19 23:21:57.659578,0 days 00:00:00.691299,4.193806379515815,l1,COMPLETE
19,0.5944189079674279,2026-09-19 23:21:57.659578,2026-09-19 23:21:58.916306,0 days 00:00:01.256728,31.644388355351815,l1,COMPLETE
20,0.5937248029999217,2026-09-19 23:21:58.916306,2026-09-19 23:22:00.066153,0 days 00:00:01.149847,283.22463404400565,l1,COMPLETE
21,0.5949576657822052,2026-09-19 23:22:00.066153,2026-09-19 23:22:00.919776,0 days 00:00:00.853623,8.287990433513679,l1,COMPLETE
22,0.5948793532900996,2026-09-19 23:22:00.919776,2026-09-19 23:22:01.476119,0 days 00:00:00.556343,2.7953422225982605,l1,COMPLETE
23,0.5944189079674279,2026-09-19 23:22:01.476119,2026-09-19 23:22:02.629184,0 days 00:00:01.153065,30.155147701141367,l1,COMPLETE
