number,value,datetime_start,datetime_complete,duration,params_C,params_penalty,state
0,0.4212702187505641,2026-09-21 01:51:29.810607,2026-09-21 01:51:30.195847,0 days 00:00:00.385240,0.0015396483063692481,l2,COMPLETE
1,0.5949126377882947,2026-09-21 01:51:30.195847,2026-09-21 01:51:30.616978,0 days 00:00:00.421131,960.0353384849867,l2,COMPLETE
2,0.5946238770878062,2026-09-21 01:51:30.616978,2026-09-21 01:51:31.846556,0 days 00:00:01.229578,189.57743243786183,l1,COMPLETE
3,0.5376163568135489,2026-09-21 01:51:31.846556,2026-09-21 01:51:32.231419,0 days 00:00:00.384863,0.006783239031023603,l2,COMPLETE
4,0.5946837379077557,2026-09-21 01:51:32.232410,2026-09-21 01:51:32.633745,0 days 00:00:00.401335,16.46591426384598,l2,COMPLETE
5,0.5937254044912202,2026-09-21 01:51:32.633745,2026-09-21 01:51:33.054707,0 days 00:00:00.420962,146.22832572139046,l2,COMPLETE
6,0.5711806134422713,2026-09-21 01:51:33.054707,2026-09-21 01:51:33.475473,0 days 00:00:00.420766,0.05603269904928505,l1,COMPLETE
7,0.573163338543053,2026-09-21 01:51:33.475473,2026-09-21 01:51:33.907103,0 days 00:00:00.431630,0.07450278706948009,l1,COMPLETE
8,0.590015386482912,2026-09-21 01:51:33.907103,2026-09-21 01:51:34.326827,0 days 00:00:00.419724,1.8961780829158201,l2,COMPLETE
9,0.5949126377882947,2026-09-21 01:51:34.326827,2026-09-21 01:51:34.752499,0 days 00:00:00.425672,473.8202682686789,l2,COMPLETE
10,0.5944344535611256,2026-09-21 01:51:34.752499,2026-09-21 01:51:35.597080,0 days 00:00:00.844581,8.205593694108787,l1,COMPLETE
11,0.5949126377882947,2026-09-21 01:51:35.597080,2026-09-21 01:51:36.018005,0 days 00:00:00.420925,705.9344657319328,l2,COMPLETE
12,0.5949126377882947,2026-09-21 01:51:36.018005,2026-09-21 01:51:36.453510,0 days 00:00:00.435505,928.6763720708556,l2,COMPLETE
13,0.595612137785591,2026-09-21 01:51:36.453510,2026-09-21 01:51:36.882603,0 days 00:00:00.429093,42.47756470403662,l2,COMPLETE
14,0.5956058618888039,2026-09-21 01:51:36.882603,2026-09-21 01:51:37.308559,0 days 00:00:00.425956,32.81077490243108,l2,COMPLETE
15,0.595325595180011,2026-09-21 01:51:37.308559,2026-09-21 01:51:37.726338,0 days 00:00:00.417779,18.728039633958545,l2,COMPLETE
16,0.5943481681348833,2026-09-21 01:51:37.726338,2026-09-21 01:51:38.145007,0 days 00:00:00.418669,55.08696757089191,l2,COMPLETE
17,0.590015386482912,2026-09-21 01:51:38.145007,2026-09-21 01:51:38.566802,0 days 00:00:00.421795,1.569304834027443,l2,COMPLETE
18,0.5883653649674757,2026-09-21 01:51:38.566802,2026-09-21 01:51:39.086762,0 days 00:00:00.519960,0.4470754205412304,l1,COMPLETE
19,0.5910722971020846,2026-09-21 01:51:39.086762,2026-09-21 01:51:39.504817,0 days 00:00:00.418055,6.305899832436785,l2,COMPLETE
20,0.5943481681348833,2026-09-21 01:51:39.504817,2026-09-21 01:51:39.923700,0 days 00:00:00.418883,62.60699496190331,l2,COMPLETE
21,0.5956058618888039,2026-09-21 01:51:39.923700,2026-09-21 01:51:40.350490,0 days 00:00:00.426790,29.556511273374944,l2,COMPLETE
22,0.5943481681348833,2026-09-21 01:51:40.350490,2026-09-21 01:51:40.747599,0 days 00:00:00.397109,51.44090825795184,l2,COMPLETE
23,0.5916301077840981,2026-09-21 01:51:40.747599,2026-09-21 01:51:41.150056,0 days 00:00:00.402457,0.5134456447962983,l2,COMPLETE
