number,value,datetime_start,datetime_complete,duration,params_n_neighbors,params_p,params_weights,system_attrs_fixed_params,state
0,0.5457484430363045,2026-09-19 22:08:54.226863,2026-09-19 22:08:56.015627,0 days 00:00:01.788764,5,2,distance,,COMPLETE
1,0.5616674273632838,2026-09-19 22:08:56.015627,2026-09-19 22:08:58.496557,0 days 00:00:02.480930,5,1,distance,,COMPLETE
2,0.6006944900572702,2026-09-19 22:08:58.496557,2026-09-19 22:09:01.134187,0 days 00:00:02.637630,41,1,uniform,,COMPLETE
3,0.5773660671059494,2026-09-19 22:09:01.134187,2026-09-19 22:09:02.924232,0 days 00:00:01.790045,11,2,distance,,COMPLETE
4,,2026-09-19 22:09:02.924232,2026-09-19 22:09:02.924232,0 days 00:00:00,41,1,uniform,,PRUNED
5,0.5830413980835938,2026-09-19 22:09:02.924232,2026-09-19 22:09:05.377136,0 days 00:00:02.452904,11,1,distance,,COMPLETE
6,0.534973516401266,2026-09-19 22:09:05.377136,2026-09-19 22:09:07.604761,0 days 00:00:02.227625,3,1,distance,,COMPLETE
7,0.5494105061213478,2026-09-19 22:09:07.606292,2026-09-19 22:09:10.103816,0 days 00:00:02.497524,3,1,uniform,,COMPLETE
8,0.5800805658746978,2026-09-19 22:09:10.104941,2026-09-19 22:09:12.231130,0 days 00:00:02.126189,81,2,uniform,,COMPLETE
9,0.5998643986146915,2026-09-19 22:09:12.231130,2026-09-19 22:09:14.656877,0 days 00:00:02.425747,21,1,uniform,,COMPLETE
10,0.5840537620607986,2026-09-19 22:09:14.656877,2026-09-19 22:09:16.315700,0 days 00:00:01.658823,41,2,uniform,,COMPLETE
11,,2026-09-19 22:09:16.315700,2026-09-19 22:09:16.323769,0 days 00:00:00.008069,21,1,uniform,,PRUNED
12,,2026-09-19 22:09:16.323769,2026-09-19 22:09:16.326606,0 days 00:00:00.002837,21,1,uniform,,PRUNED
13,,2026-09-19 22:09:16.326606,2026-09-19 22:09:16.335561,0 days 00:00:00.008955,21,1,uniform,,PRUNED
14,,2026-09-19 22:09:16.335561,2026-09-19 22:09:16.341014,0 days 00:00:00.005453,41,1,uniform,,PRUNED
15,0.5907136224841981,2026-09-19 22:09:16.341014,2026-09-19 22:09:19.033122,0 days 00:00:02.692108,81,1,uniform,,COMPLETE
16,,2026-09-19 22:09:19.048864,2026-09-19 22:09:19.048864,0 days 00:00:00,21,1,uniform,,PRUNED
17,,2026-09-19 22:09:19.048864,2026-09-19 22:09:19.061030,0 days 00:00:00.012166,41,1,uniform,,PRUNED
18,,2026-09-19 22:09:19.061030,2026-09-19 22:09:19.064733,0 days 00:00:00.003703,41,2,uniform,,PRUNED
19,,2026-09-19 22:09:19.064733,2026-09-19 22:09:19.073429,0 days 00:00:00.008696,21,1,uniform,,PRUNED
20,0.5795724516915571,2026-09-19 22:09:19.073429,2026-09-19 22:09:21.594540,0 days 00:00:02.521111,5,1,uniform,,COMPLETE
21,,2026-09-19 22:09:21.594540,2026-09-19 22:09:21.602609,0 days 00:00:00.008069,81,1,uniform,,PRUNED
22,,2026-09-19 22:09:21.602609,2026-09-19 22:09:21.607163,0 days 00:00:00.004554,81,1,uniform,,PRUNED
23,,2026-09-19 22:09:21.607163,2026-09-19 22:09:21.614148,0 days 00:00:00.006985,81,1,uniform,,PRUNED
24,,2026-09-19 22:09:21.614148,2026-09-19 22:09:21.623287,0 days 00:00:00.009139,81,1,uniform,,PRUNED
25,0.5922844676871685,2026-09-19 22:09:21.623287,2026-09-19 22:09:24.025501,0 days 00:00:02.402214,11,1,uniform,,COMPLETE
26,,2026-09-19 22:09:24.025501,2026-09-19 22:09:24.038809,0 days 00:00:00.013308,11,2,distance,,PRUNED
27,,2026-09-19 22:09:24.038809,2026-09-19 22:09:24.041463,0 days 00:00:00.002654,11,1,uniform,,PRUNED
28,,2026-09-19 22:09:24.041463,2026-09-19 22:09:24.052752,0 days 00:00:00.011289,11,1,uniform,,PRUNED
29,0.5249492842426817,2026-09-19 22:09:24.053614,2026-09-19 22:09:25.840731,0 days 00:00:01.787117,3,2,distance,,COMPLETE
30,,2026-09-19 22:09:25.840731,2026-09-19 22:09:25.847684,0 days 00:00:00.006953,5,1,uniform,,PRUNED
31,,2026-09-19 22:09:25.847684,2026-09-19 22:09:25.855232,0 days 00:00:00.007548,11,1,uniform,,PRUNED
32,,2026-09-19 22:09:25.855232,2026-09-19 22:09:25.856464,0 days 00:00:00.001232,41,1,uniform,,PRUNED
33,,2026-09-19 22:09:25.856464,2026-09-19 22:09:25.868388,0 days 00:00:00.011924,21,1,uniform,,PRUNED
34,0.5891108514770398,2026-09-19 22:09:25.868388,2026-09-19 22:09:28.715952,0 days 00:00:02.847564,81,1,distance,,COMPLETE
35,,2026-09-19 22:09:28.715952,2026-09-19 22:09:28.724861,0 days 00:00:00.008909,5,1,uniform,,PRUNED
36,,2026-09-19 22:09:28.724861,2026-09-19 22:09:28.727754,0 days 00:00:00.002893,11,1,distance,,PRUNED
37,,2026-09-19 22:09:28.727754,2026-09-19 22:09:28.741485,0 days 00:00:00.013731,41,2,uniform,,PRUNED
38,,2026-09-19 22:09:28.741485,2026-09-19 22:09:28.742548,0 days 00:00:00.001063,3,1,uniform,,PRUNED
39,,2026-09-19 22:09:28.742548,2026-09-19 22:09:28.755213,0 days 00:00:00.012665,11,1,distance,,PRUNED
40,,2026-09-19 22:09:28.755213,2026-09-19 22:09:28.758721,0 days 00:00:00.003508,81,2,uniform,,PRUNED
41,,2026-09-19 22:09:28.758721,2026-09-19 22:09:28.767891,0 days 00:00:00.009170,81,1,distance,,PRUNED
42,,2026-09-19 22:09:28.767891,2026-09-19 22:09:28.771885,0 days 00:00:00.003994,81,1,distance,,PRUNED
43,0.5630541789537076,2026-09-19 22:09:28.771885,2026-09-19 22:09:30.602800,0 days 00:00:01.830915,5,2,uniform,"{'n_neighbors': 5, 'p': 2, 'weights': 'uniform'}",COMPLETE
44,,2026-09-19 22:09:30.602800,2026-09-19 22:09:30.607204,0 days 00:00:00.004404,81,1,distance,,PRUNED
45,0.5906040515998373,2026-09-19 22:09:30.607204,2026-09-19 22:09:33.257916,0 days 00:00:02.650712,21,1,distance,,COMPLETE
46,,2026-09-19 22:09:33.257916,2026-09-19 22:09:33.263342,0 days 00:00:00.005426,21,1,distance,,PRUNED
47,,2026-09-19 22:09:33.263342,2026-09-19 22:09:33.267360,0 days 00:00:00.004018,21,1,distance,,PRUNED
48,,2026-09-19 22:09:33.267360,2026-09-19 22:09:33.276815,0 days 00:00:00.009455,21,1,uniform,,PRUNED
49,,2026-09-19 22:09:33.276815,2026-09-19 22:09:33.276815,0 days 00:00:00,21,1,uniform,,PRUNED
50,,2026-09-19 22:09:33.276815,2026-09-19 22:09:33.284094,0 days 00:00:00.007279,41,1,uniform,,PRUNED
51,,2026-09-19 22:09:33.288141,2026-09-19 22:09:33.292664,0 days 00:00:00.004523,21,1,distance,,PRUNED
52,,2026-09-19 22:09:33.292664,2026-09-19 22:09:33.296942,0 days 00:00:00.004278,81,1,distance,,PRUNED
53,0.5970047274989972,2026-09-19 22:09:33.296942,2026-09-19 22:09:35.994907,0 days 00:00:02.697965,41,1,distance,,COMPLETE
54,,2026-09-19 22:09:35.994907,2026-09-19 22:09:35.994907,0 days 00:00:00,41,1,distance,,PRUNED
55,,2026-09-19 22:09:35.994907,2026-09-19 22:09:36.011032,0 days 00:00:00.016125,41,1,distance,,PRUNED
56,,2026-09-19 22:09:36.011032,2026-09-19 22:09:36.011032,0 days 00:00:00,41,1,uniform,,PRUNED
57,,2026-09-19 22:09:36.011032,2026-09-19 22:09:36.026961,0 days 00:00:00.015929,41,1,distance,,PRUNED
58,,2026-09-19 22:09:36.026961,2026-09-19 22:09:36.026961,0 days 00:00:00,3,1,uniform,,PRUNED
59,,2026-09-19 22:09:36.026961,2026-09-19 22:09:36.043032,0 days 00:00:00.016071,21,1,uniform,,PRUNED
60,,2026-09-19 22:09:36.043032,2026-09-19 22:09:36.043032,0 days 00:00:00,11,1,uniform,,PRUNED
61,,2026-09-19 22:09:36.043032,2026-09-19 22:09:36.043032,0 days 00:00:00,81,1,distance,,PRUNED
62,0.593317972985291,2026-09-19 22:09:36.043032,2026-09-19 22:09:37.755568,0 days 00:00:01.712536,11,2,uniform,"{'n_neighbors': 11, 'p': 2, 'weights': 'uniform'}",COMPLETE
63,,2026-09-19 22:09:37.755568,2026-09-19 22:09:37.757046,0 days 00:00:00.001478,11,2,uniform,,PRUNED
64,,2026-09-19 22:09:37.757046,2026-09-19 22:09:37.768200,0 days 00:00:00.011154,11,2,uniform,,PRUNED
65,,2026-09-19 22:09:37.768200,2026-09-19 22:09:37.772521,0 days 00:00:00.004321,11,2,uniform,,PRUNED
66,,2026-09-19 22:09:37.772521,2026-09-19 22:09:37.784295,0 days 00:00:00.011774,41,2,uniform,,PRUNED
67,0.5972766000920088,2026-09-19 22:09:37.784295,2026-09-19 22:09:39.643609,0 days 00:00:01.859314,21,2,uniform,,COMPLETE
68,,2026-09-19 22:09:39.643609,2026-09-19 22:09:39.650206,0 days 00:00:00.006597,11,2,uniform,,PRUNED
69,,2026-09-19 22:09:39.653643,2026-09-19 22:09:39.662210,0 days 00:00:00.008567,41,2,uniform,,PRUNED
70,,2026-09-19 22:09:39.662210,2026-09-19 22:09:39.669877,0 days 00:00:00.007667,21,2,uniform,,PRUNED
71,,2026-09-19 22:09:39.669877,2026-09-19 22:09:39.674515,0 days 00:00:00.004638,21,2,uniform,,PRUNED
72,,2026-09-19 22:09:39.674515,2026-09-19 22:09:39.685437,0 days 00:00:00.010922,21,2,uniform,,PRUNED
73,,2026-09-19 22:09:39.685437,2026-09-19 22:09:39.689909,0 days 00:00:00.004472,21,2,uniform,,PRUNED
74,,2026-09-19 22:09:39.689909,2026-09-19 22:09:39.702691,0 days 00:00:00.012782,3,1,uniform,,PRUNED
75,,2026-09-19 22:09:39.702691,2026-09-19 22:09:39.708438,0 days 00:00:00.005747,21,1,uniform,,PRUNED
76,0.5881183961631193,2026-09-19 22:09:39.708438,2026-09-19 22:09:41.573587,0 days 00:00:01.865149,21,2,distance,"{'n_neighbors': 21, 'p': 2, 'weights': 'distance'}",COMPLETE
77,,2026-09-19 22:09:41.573587,2026-09-19 22:09:41.581759,0 days 00:00:00.008172,5,1,uniform,,PRUNED
78,,2026-09-19 22:09:41.581759,2026-09-19 22:09:41.588063,0 days 00:00:00.006304,11,1,uniform,,PRUNED
79,,2026-09-19 22:09:41.588063,2026-09-19 22:09:41.588063,0 days 00:00:00,41,1,uniform,,PRUNED
80,,2026-09-19 22:09:41.588063,2026-09-19 22:09:41.597741,0 days 00:00:00.009678,11,1,distance,,PRUNED
81,,2026-09-19 22:09:41.597741,2026-09-19 22:09:41.606474,0 days 00:00:00.008733,81,1,distance,,PRUNED
82,,2026-09-19 22:09:41.606474,2026-09-19 22:09:41.606474,0 days 00:00:00,21,1,distance,,PRUNED
83,,2026-09-19 22:09:41.606474,2026-09-19 22:09:41.606474,0 days 00:00:00,81,1,distance,,PRUNED
84,,2026-09-19 22:09:41.606474,2026-09-19 22:09:41.622401,0 days 00:00:00.015927,81,1,distance,,PRUNED
85,0.5767436896984185,2026-09-19 22:09:41.622401,2026-09-19 22:09:43.823464,0 days 00:00:02.201063,81,2,distance,"{'n_neighbors': 81, 'p': 2, 'weights': 'distance'}",COMPLETE
86,,2026-09-19 22:09:43.823464,2026-09-19 22:09:43.832622,0 days 00:00:00.009158,41,1,distance,,PRUNED
87,,2026-09-19 22:09:43.832622,2026-09-19 22:09:43.840926,0 days 00:00:00.008304,11,1,uniform,,PRUNED
88,,2026-09-19 22:09:43.840926,2026-09-19 22:09:43.848371,0 days 00:00:00.007445,5,1,uniform,,PRUNED
89,,2026-09-19 22:09:43.848371,2026-09-19 22:09:43.857163,0 days 00:00:00.008792,21,1,distance,,PRUNED
90,,2026-09-19 22:09:43.857163,2026-09-19 22:09:43.857163,0 days 00:00:00,81,1,uniform,,PRUNED
91,,2026-09-19 22:09:43.857163,2026-09-19 22:09:43.872541,0 days 00:00:00.015378,21,2,distance,,PRUNED
92,,2026-09-19 22:09:43.872541,2026-09-19 22:09:43.872541,0 days 00:00:00,21,2,distance,,PRUNED
93,,2026-09-19 22:09:43.872541,2026-09-19 22:09:43.888616,0 days 00:00:00.016075,21,2,distance,,PRUNED
94,0.5752721615225176,2026-09-19 22:09:43.888616,2026-09-19 22:09:45.793489,0 days 00:00:01.904873,41,2,distance,"{'n_neighbors': 41, 'p': 2, 'weights': 'distance'}",COMPLETE
95,,2026-09-19 22:09:45.793489,2026-09-19 22:09:45.806998,0 days 00:00:00.013509,21,2,distance,,PRUNED
96,,2026-09-19 22:09:45.806998,2026-09-19 22:09:45.816478,0 days 00:00:00.009480,3,2,distance,,PRUNED
97,,2026-09-19 22:09:45.816478,2026-09-19 22:09:45.825659,0 days 00:00:00.009181,21,1,uniform,,PRUNED
98,,2026-09-19 22:09:45.825659,2026-09-19 22:09:45.825659,0 days 00:00:00,11,1,uniform,,PRUNED
99,,2026-09-19 22:09:45.825659,2026-09-19 22:09:45.838092,0 days 00:00:00.012433,81,2,distance,,PRUNED
100,,2026-09-19 22:09:45.846197,2026-09-19 22:09:45.854572,0 days 00:00:00.008375,41,1,uniform,,PRUNED
101,,2026-09-19 22:09:45.854572,2026-09-19 22:09:45.856888,0 days 00:00:00.002316,41,2,uniform,,PRUNED
102,,2026-09-19 22:09:45.856888,2026-09-19 22:09:45.871651,0 days 00:00:00.014763,41,2,uniform,,PRUNED
103,0.5468969750270251,2026-09-19 22:09:45.871651,2026-09-19 22:09:47.638233,0 days 00:00:01.766582,3,2,uniform,"{'n_neighbors': 3, 'p': 2, 'weights': 'uniform'}",COMPLETE
