number,value,datetime_start,datetime_complete,duration,params_criterion,params_max_depth,params_min_samples_leaf,system_attrs_fixed_params,state
0,0.5695053310891786,2026-09-20 20:49:13.120619,2026-09-20 20:49:13.607661,0 days 00:00:00.487042,entropy,12.0,1,,COMPLETE
1,,2026-09-20 20:49:13.607661,2026-09-20 20:49:13.607661,0 days 00:00:00,entropy,12.0,1,,PRUNED
2,0.5149498024189053,2026-09-20 20:49:13.607661,2026-09-20 20:49:14.108596,0 days 00:00:00.500935,gini,,1,,COMPLETE
3,0.5346839453869142,2026-09-20 20:49:14.108596,2026-09-20 20:49:14.610845,0 days 00:00:00.502249,entropy,,5,,COMPLETE
4,0.5946036590887137,2026-09-20 20:49:14.610845,2026-09-20 20:49:15.055502,0 days 00:00:00.444657,gini,6.0,1,,COMPLETE
5,0.5745240690988852,2026-09-20 20:49:15.055502,2026-09-20 20:49:15.505533,0 days 00:00:00.450031,entropy,3.0,20,,COMPLETE
6,0.5870201691709148,2026-09-20 20:49:15.505533,2026-09-20 20:49:16.034927,0 days 00:00:00.529394,entropy,6.0,1,,COMPLETE
7,0.5935883936807044,2026-09-20 20:49:16.034927,2026-09-20 20:49:16.518874,0 days 00:00:00.483947,gini,6.0,5,,COMPLETE
8,0.5978536706687495,2026-09-20 20:49:16.518874,2026-09-20 20:49:16.975546,0 days 00:00:00.456672,gini,6.0,20,,COMPLETE
9,0.5726650772111811,2026-09-20 20:49:16.975546,2026-09-20 20:49:17.408852,0 days 00:00:00.433306,gini,3.0,20,,COMPLETE
10,,2026-09-20 20:49:17.408852,2026-09-20 20:49:17.408852,0 days 00:00:00,gini,6.0,20,,PRUNED
11,,2026-09-20 20:49:17.408852,2026-09-20 20:49:17.412590,0 days 00:00:00.003738,gini,6.0,20,,PRUNED
12,,2026-09-20 20:49:17.412590,2026-09-20 20:49:17.412590,0 days 00:00:00,gini,6.0,1,,PRUNED
13,,2026-09-20 20:49:17.412590,2026-09-20 20:49:17.412590,0 days 00:00:00,gini,6.0,20,,PRUNED
14,,2026-09-20 20:49:17.412590,2026-09-20 20:49:17.412590,0 days 00:00:00,gini,6.0,5,,PRUNED
15,,2026-09-20 20:49:17.412590,2026-09-20 20:49:17.412590,0 days 00:00:00,gini,6.0,1,,PRUNED
16,,2026-09-20 20:49:17.412590,2026-09-20 20:49:17.412590,0 days 00:00:00,gini,3.0,20,,PRUNED
17,,2026-09-20 20:49:17.412590,2026-09-20 20:49:17.424692,0 days 00:00:00.012102,gini,,1,,PRUNED
18,0.5855080719161158,2026-09-20 20:49:17.424692,2026-09-20 20:49:17.892561,0 days 00:00:00.467869,entropy,12.0,20,"{'criterion': 'entropy', 'max_depth': 12, 'min_samples_leaf': 20}",COMPLETE
19,,2026-09-20 20:49:17.892561,2026-09-20 20:49:17.892561,0 days 00:00:00,gini,6.0,5,,PRUNED
20,,2026-09-20 20:49:17.892561,2026-09-20 20:49:17.908282,0 days 00:00:00.015721,gini,6.0,20,,PRUNED
21,,2026-09-20 20:49:17.908282,2026-09-20 20:49:17.908282,0 days 00:00:00,gini,6.0,5,,PRUNED
22,,2026-09-20 20:49:17.908282,2026-09-20 20:49:17.908282,0 days 00:00:00,gini,6.0,5,,PRUNED
23,,2026-09-20 20:49:17.908282,2026-09-20 20:49:17.908282,0 days 00:00:00,gini,6.0,5,,PRUNED
24,,2026-09-20 20:49:17.908282,2026-09-20 20:49:17.908282,0 days 00:00:00,gini,6.0,5,,PRUNED
25,,2026-09-20 20:49:17.908282,2026-09-20 20:49:17.908282,0 days 00:00:00,gini,6.0,5,,PRUNED
26,,2026-09-20 20:49:17.908282,2026-09-20 20:49:17.908282,0 days 00:00:00,gini,,1,,PRUNED
27,0.5882590180786909,2026-09-20 20:49:17.908282,2026-09-20 20:49:18.408521,0 days 00:00:00.500239,entropy,6.0,5,"{'criterion': 'entropy', 'max_depth': 6, 'min_samples_leaf': 5}",COMPLETE
28,,2026-09-20 20:49:18.408521,2026-09-20 20:49:18.408521,0 days 00:00:00,gini,3.0,20,,PRUNED
29,0.5687715208642234,2026-09-20 20:49:18.408521,2026-09-20 20:49:18.888495,0 days 00:00:00.479974,gini,12.0,1,,COMPLETE
30,,2026-09-20 20:49:18.888495,2026-09-20 20:49:18.890913,0 days 00:00:00.002418,gini,12.0,1,,PRUNED
31,,2026-09-20 20:49:18.890913,2026-09-20 20:49:18.892918,0 days 00:00:00.002005,entropy,6.0,5,,PRUNED
32,,2026-09-20 20:49:18.892918,2026-09-20 20:49:18.894325,0 days 00:00:00.001407,entropy,6.0,5,,PRUNED
33,,2026-09-20 20:49:18.894325,2026-09-20 20:49:18.894325,0 days 00:00:00,entropy,6.0,5,,PRUNED
34,,2026-09-20 20:49:18.894325,2026-09-20 20:49:18.894325,0 days 00:00:00,entropy,6.0,5,,PRUNED
35,0.5042367859345923,2026-09-20 20:49:18.894325,2026-09-20 20:49:19.466939,0 days 00:00:00.572614,entropy,,1,,COMPLETE
36,0.5768586031761714,2026-09-20 20:49:19.466939,2026-09-20 20:49:19.943811,0 days 00:00:00.476872,entropy,12.0,5,,COMPLETE
37,,2026-09-20 20:49:19.943811,2026-09-20 20:49:19.952121,0 days 00:00:00.008310,entropy,6.0,1,,PRUNED
38,,2026-09-20 20:49:19.952121,2026-09-20 20:49:19.952121,0 days 00:00:00,entropy,3.0,20,,PRUNED
39,,2026-09-20 20:49:19.952121,2026-09-20 20:49:19.952121,0 days 00:00:00,gini,6.0,5,,PRUNED
40,0.5783877727327866,2026-09-20 20:49:19.952121,2026-09-20 20:49:20.447282,0 days 00:00:00.495161,entropy,,20,,COMPLETE
41,,2026-09-20 20:49:20.447282,2026-09-20 20:49:20.453413,0 days 00:00:00.006131,entropy,6.0,1,,PRUNED
42,,2026-09-20 20:49:20.453413,2026-09-20 20:49:20.453413,0 days 00:00:00,entropy,6.0,1,,PRUNED
43,,2026-09-20 20:49:20.453413,2026-09-20 20:49:20.453413,0 days 00:00:00,entropy,6.0,1,,PRUNED
44,,2026-09-20 20:49:20.453413,2026-09-20 20:49:20.459197,0 days 00:00:00.005784,entropy,6.0,1,,PRUNED
45,,2026-09-20 20:49:20.459197,2026-09-20 20:49:20.459197,0 days 00:00:00,gini,6.0,1,,PRUNED
46,,2026-09-20 20:49:20.459197,2026-09-20 20:49:20.459197,0 days 00:00:00,gini,3.0,20,,PRUNED
47,,2026-09-20 20:49:20.459197,2026-09-20 20:49:20.459197,0 days 00:00:00,entropy,6.0,1,,PRUNED
48,,2026-09-20 20:49:20.459197,2026-09-20 20:49:20.459197,0 days 00:00:00,gini,6.0,20,,PRUNED
49,0.5726650772111811,2026-09-20 20:49:20.459197,2026-09-20 20:49:20.911775,0 days 00:00:00.452578,gini,3.0,5,"{'criterion': 'gini', 'max_depth': 3, 'min_samples_leaf': 5}",COMPLETE
50,,2026-09-20 20:49:20.911775,2026-09-20 20:49:20.911775,0 days 00:00:00,entropy,6.0,1,,PRUNED
51,,2026-09-20 20:49:20.911775,2026-09-20 20:49:20.911775,0 days 00:00:00,entropy,12.0,20,,PRUNED
52,,2026-09-20 20:49:20.911775,2026-09-20 20:49:20.927624,0 days 00:00:00.015849,entropy,12.0,20,,PRUNED
53,,2026-09-20 20:49:20.927624,2026-09-20 20:49:20.930081,0 days 00:00:00.002457,entropy,12.0,20,,PRUNED
54,0.5861296687114007,2026-09-20 20:49:20.930081,2026-09-20 20:49:21.408532,0 days 00:00:00.478451,gini,12.0,20,,COMPLETE
55,,2026-09-20 20:49:21.408532,2026-09-20 20:49:21.417099,0 days 00:00:00.008567,gini,12.0,20,,PRUNED
56,,2026-09-20 20:49:21.417099,2026-09-20 20:49:21.417099,0 days 00:00:00,gini,6.0,20,,PRUNED
57,,2026-09-20 20:49:21.417099,2026-09-20 20:49:21.417099,0 days 00:00:00,gini,6.0,5,,PRUNED
58,0.538609237132089,2026-09-20 20:49:21.417099,2026-09-20 20:49:21.906689,0 days 00:00:00.489590,gini,,5,,COMPLETE
59,,2026-09-20 20:49:21.906689,2026-09-20 20:49:21.908690,0 days 00:00:00.002001,gini,12.0,20,,PRUNED
60,,2026-09-20 20:49:21.908690,2026-09-20 20:49:21.910691,0 days 00:00:00.002001,gini,6.0,1,,PRUNED
61,,2026-09-20 20:49:21.910691,2026-09-20 20:49:21.910691,0 days 00:00:00,gini,12.0,20,,PRUNED
62,,2026-09-20 20:49:21.910691,2026-09-20 20:49:21.910691,0 days 00:00:00,gini,12.0,20,,PRUNED
63,,2026-09-20 20:49:21.910691,2026-09-20 20:49:21.910691,0 days 00:00:00,entropy,12.0,20,,PRUNED
64,,2026-09-20 20:49:21.910691,2026-09-20 20:49:21.910691,0 days 00:00:00,gini,12.0,20,,PRUNED
65,,2026-09-20 20:49:21.910691,2026-09-20 20:49:21.910691,0 days 00:00:00,entropy,6.0,5,,PRUNED
66,,2026-09-20 20:49:21.910691,2026-09-20 20:49:21.910691,0 days 00:00:00,gini,6.0,20,,PRUNED
67,0.5737202440504223,2026-09-20 20:49:21.910691,2026-09-20 20:49:22.424107,0 days 00:00:00.513416,gini,12.0,5,"{'criterion': 'gini', 'max_depth': 12, 'min_samples_leaf': 5}",COMPLETE
68,,2026-09-20 20:49:22.424107,2026-09-20 20:49:22.424107,0 days 00:00:00,entropy,6.0,1,,PRUNED
69,,2026-09-20 20:49:22.424107,2026-09-20 20:49:22.424107,0 days 00:00:00,entropy,,20,,PRUNED
70,,2026-09-20 20:49:22.424107,2026-09-20 20:49:22.424107,0 days 00:00:00,gini,6.0,5,,PRUNED
71,,2026-09-20 20:49:22.424107,2026-09-20 20:49:22.424107,0 days 00:00:00,entropy,,20,,PRUNED
72,,2026-09-20 20:49:22.424107,2026-09-20 20:49:22.424107,0 days 00:00:00,entropy,,20,,PRUNED
73,,2026-09-20 20:49:22.424107,2026-09-20 20:49:22.439974,0 days 00:00:00.015867,entropy,,20,,PRUNED
74,,2026-09-20 20:49:22.439974,2026-09-20 20:49:22.439974,0 days 00:00:00,entropy,,20,,PRUNED
75,,2026-09-20 20:49:22.439974,2026-09-20 20:49:22.439974,0 days 00:00:00,entropy,6.0,1,,PRUNED
76,0.5745240690988852,2026-09-20 20:49:22.439974,2026-09-20 20:49:22.884846,0 days 00:00:00.444872,entropy,3.0,1,"{'criterion': 'entropy', 'max_depth': 3, 'min_samples_leaf': 1}",COMPLETE
77,0.5822982560418536,2026-09-20 20:49:22.884846,2026-09-20 20:49:23.347391,0 days 00:00:00.462545,gini,,20,,COMPLETE
78,,2026-09-20 20:49:23.347391,2026-09-20 20:49:23.354458,0 days 00:00:00.007067,gini,6.0,5,,PRUNED
79,,2026-09-20 20:49:23.354458,2026-09-20 20:49:23.354458,0 days 00:00:00,gini,12.0,20,,PRUNED
80,,2026-09-20 20:49:23.354458,2026-09-20 20:49:23.354458,0 days 00:00:00,gini,6.0,5,,PRUNED
81,,2026-09-20 20:49:23.354458,2026-09-20 20:49:23.361032,0 days 00:00:00.006574,gini,,20,,PRUNED
82,,2026-09-20 20:49:23.361032,2026-09-20 20:49:23.361840,0 days 00:00:00.000808,gini,,20,,PRUNED
83,,2026-09-20 20:49:23.361840,2026-09-20 20:49:23.366601,0 days 00:00:00.004761,entropy,,20,,PRUNED
84,,2026-09-20 20:49:23.366601,2026-09-20 20:49:23.368864,0 days 00:00:00.002263,gini,,20,,PRUNED
85,,2026-09-20 20:49:23.368864,2026-09-20 20:49:23.368864,0 days 00:00:00,entropy,,20,,PRUNED
86,0.5958196556435545,2026-09-20 20:49:23.368864,2026-09-20 20:49:23.862209,0 days 00:00:00.493345,entropy,6.0,20,"{'criterion': 'entropy', 'max_depth': 6, 'min_samples_leaf': 20}",COMPLETE
87,,2026-09-20 20:49:23.862209,2026-09-20 20:49:23.869558,0 days 00:00:00.007349,gini,6.0,1,,PRUNED
88,,2026-09-20 20:49:23.869558,2026-09-20 20:49:23.872125,0 days 00:00:00.002567,gini,6.0,20,,PRUNED
89,,2026-09-20 20:49:23.872125,2026-09-20 20:49:23.874242,0 days 00:00:00.002117,entropy,6.0,5,,PRUNED
90,,2026-09-20 20:49:23.874242,2026-09-20 20:49:23.876482,0 days 00:00:00.002240,gini,6.0,1,,PRUNED
91,,2026-09-20 20:49:23.876482,2026-09-20 20:49:23.879070,0 days 00:00:00.002588,entropy,6.0,20,,PRUNED
92,,2026-09-20 20:49:23.879070,2026-09-20 20:49:23.882647,0 days 00:00:00.003577,entropy,6.0,20,,PRUNED
93,,2026-09-20 20:49:23.882647,2026-09-20 20:49:23.885049,0 days 00:00:00.002402,entropy,3.0,20,,PRUNED
94,,2026-09-20 20:49:23.885049,2026-09-20 20:49:23.887244,0 days 00:00:00.002195,entropy,12.0,20,,PRUNED
95,0.5745240690988852,2026-09-20 20:49:23.887244,2026-09-20 20:49:24.330406,0 days 00:00:00.443162,entropy,3.0,5,"{'criterion': 'entropy', 'max_depth': 3, 'min_samples_leaf': 5}",COMPLETE
96,,2026-09-20 20:49:24.330406,2026-09-20 20:49:24.330406,0 days 00:00:00,gini,6.0,20,,PRUNED
97,,2026-09-20 20:49:24.330406,2026-09-20 20:49:24.344785,0 days 00:00:00.014379,entropy,6.0,20,,PRUNED
98,,2026-09-20 20:49:24.344785,2026-09-20 20:49:24.347395,0 days 00:00:00.002610,gini,12.0,1,,PRUNED
99,,2026-09-20 20:49:24.347395,2026-09-20 20:49:24.347395,0 days 00:00:00,entropy,6.0,20,,PRUNED
100,,2026-09-20 20:49:24.347395,2026-09-20 20:49:24.347395,0 days 00:00:00,gini,,20,,PRUNED
101,,2026-09-20 20:49:24.347395,2026-09-20 20:49:24.347395,0 days 00:00:00,entropy,12.0,5,,PRUNED
102,,2026-09-20 20:49:24.347395,2026-09-20 20:49:24.347395,0 days 00:00:00,entropy,12.0,5,,PRUNED
103,,2026-09-20 20:49:24.347395,2026-09-20 20:49:24.360304,0 days 00:00:00.012909,entropy,12.0,5,,PRUNED
104,0.5726650772111811,2026-09-20 20:49:24.360304,2026-09-20 20:49:24.789237,0 days 00:00:00.428933,gini,3.0,1,"{'criterion': 'gini', 'max_depth': 3, 'min_samples_leaf': 1}",COMPLETE
