number,value,datetime_start,datetime_complete,duration,params_C,params_penalty,state
0,0.6219548133774797,2026-09-19 23:48:04.078752,2026-09-19 23:48:05.579833,0 days 00:00:01.501081,66.03963053321499,l1,COMPLETE
1,0.6223916461602841,2026-09-19 23:48:05.579833,2026-09-19 23:48:07.119634,0 days 00:00:01.539801,214.85752625588893,l1,COMPLETE
2,0.622005588851914,2026-09-19 23:48:07.119634,2026-09-19 23:48:07.512622,0 days 00:00:00.392988,52.76620548669305,l2,COMPLETE
3,0.6251340654537292,2026-09-19 23:48:07.512622,2026-09-19 23:48:07.861698,0 days 00:00:00.349076,0.014347846953701579,l2,COMPLETE
4,0.6198846697235602,2026-09-19 23:48:07.861698,2026-09-19 23:48:08.248693,0 days 00:00:00.386995,0.08365170624590385,l1,COMPLETE
5,0.6226373463221312,2026-09-19 23:48:08.248693,2026-09-19 23:48:08.633551,0 days 00:00:00.384858,3.879151703476654,l2,COMPLETE
6,0.6214119606027864,2026-09-19 23:48:08.633551,2026-09-19 23:48:09.021807,0 days 00:00:00.388256,42.44366784696121,l2,COMPLETE
7,0.6260458990186004,2026-09-19 23:48:09.021807,2026-09-19 23:48:09.394707,0 days 00:00:00.372900,0.016204634031754685,l2,COMPLETE
8,0.6168434644064985,2026-09-19 23:48:09.396720,2026-09-19 23:48:09.753216,0 days 00:00:00.356496,0.0012770123572531644,l2,COMPLETE
9,0.621888133706766,2026-09-19 23:48:09.753216,2026-09-19 23:48:10.123318,0 days 00:00:00.370102,0.29852205212224686,l2,COMPLETE
10,0.0,2026-09-19 23:48:10.123318,2026-09-19 23:48:10.463030,0 days 00:00:00.339712,0.0014738670675378616,l1,COMPLETE
11,0.6257017972309091,2026-09-19 23:48:10.463030,2026-09-19 23:48:10.814353,0 days 00:00:00.351323,0.02174557766594079,l2,COMPLETE
12,0.6276840703320073,2026-09-19 23:48:10.814353,2026-09-19 23:48:11.197324,0 days 00:00:00.382971,0.0269864655537994,l2,COMPLETE
13,0.622796624975961,2026-09-19 23:48:11.197324,2026-09-19 23:48:11.566240,0 days 00:00:00.368916,2.411694170217057,l2,COMPLETE
14,0.6261893992031762,2026-09-19 23:48:11.566240,2026-09-19 23:48:11.958127,0 days 00:00:00.391887,0.01221793690887025,l2,COMPLETE
15,0.6237935211837994,2026-09-19 23:48:11.958127,2026-09-19 23:48:12.340912,0 days 00:00:00.382785,0.22240988026715033,l2,COMPLETE
16,0.625404650703042,2026-09-19 23:48:12.340912,2026-09-19 23:48:12.691023,0 days 00:00:00.350111,0.0046239611285968105,l2,COMPLETE
17,0.6270911246100711,2026-09-19 23:48:12.691023,2026-09-19 23:48:13.062031,0 days 00:00:00.371008,0.08718710680660002,l2,COMPLETE
18,0.6217559516658914,2026-09-19 23:48:13.062031,2026-09-19 23:48:13.463251,0 days 00:00:00.401220,0.7577872828224619,l1,COMPLETE
19,0.6249032595064041,2026-09-19 23:48:13.463251,2026-09-19 23:48:13.850187,0 days 00:00:00.386936,0.05697295178157988,l2,COMPLETE
20,0.6220384103254122,2026-09-19 23:48:13.850187,2026-09-19 23:48:14.214377,0 days 00:00:00.364190,6.16562226056951,l2,COMPLETE
21,0.6267711670236428,2026-09-19 23:48:14.214377,2026-09-19 23:48:14.607312,0 days 00:00:00.392935,0.07237094249918334,l2,COMPLETE
22,0.6255470892307814,2026-09-19 23:48:14.607312,2026-09-19 23:48:14.987240,0 days 00:00:00.379928,0.12271067138537613,l2,COMPLETE
23,0.6227829678241411,2026-09-19 23:48:14.987240,2026-09-19 23:48:15.335391,0 days 00:00:00.348151,1.0973709689218563,l2,COMPLETE
