number,value,datetime_start,datetime_complete,duration,params_criterion,params_max_depth,params_min_samples_leaf,system_attrs_fixed_params,state
0,0.5972390238251265,2026-09-21 02:18:56.371372,2026-09-21 02:18:56.796208,0 days 00:00:00.424836,gini,6.0,5,,COMPLETE
1,0.593505660136835,2026-09-21 02:18:56.796208,2026-09-21 02:18:57.223128,0 days 00:00:00.426920,entropy,6.0,20,,COMPLETE
2,0.573862352641911,2026-09-21 02:18:57.223128,2026-09-21 02:18:57.647106,0 days 00:00:00.423978,gini,12.0,20,,COMPLETE
3,0.5745293645165276,2026-09-21 02:18:57.647106,2026-09-21 02:18:58.046750,0 days 00:00:00.399644,entropy,3.0,20,,COMPLETE
4,0.5754775566682383,2026-09-21 02:18:58.046750,2026-09-21 02:18:58.467587,0 days 00:00:00.420837,gini,3.0,20,,COMPLETE
5,,2026-09-21 02:18:58.467587,2026-09-21 02:18:58.467587,0 days 00:00:00,gini,3.0,20,,PRUNED
6,0.5745293645165276,2026-09-21 02:18:58.467587,2026-09-21 02:18:58.890239,0 days 00:00:00.422652,entropy,3.0,5,,COMPLETE
7,0.5934518737156934,2026-09-21 02:18:58.890239,2026-09-21 02:18:59.324478,0 days 00:00:00.434239,gini,6.0,20,,COMPLETE
8,0.5174906964380649,2026-09-21 02:18:59.324478,2026-09-21 02:18:59.795279,0 days 00:00:00.470801,gini,,1,,COMPLETE
9,,2026-09-21 02:18:59.795279,2026-09-21 02:18:59.795279,0 days 00:00:00,gini,6.0,5,,PRUNED
10,0.5258827262928419,2026-09-21 02:18:59.795279,2026-09-21 02:19:00.272075,0 days 00:00:00.476796,entropy,,5,,COMPLETE
11,0.5859127582216069,2026-09-21 02:19:00.272075,2026-09-21 02:19:00.701167,0 days 00:00:00.429092,entropy,6.0,1,,COMPLETE
12,0.5864868609494355,2026-09-21 02:19:00.701167,2026-09-21 02:19:01.132569,0 days 00:00:00.431402,entropy,6.0,5,,COMPLETE
13,,2026-09-21 02:19:01.132569,2026-09-21 02:19:01.132569,0 days 00:00:00,entropy,6.0,5,,PRUNED
14,0.5446236504779184,2026-09-21 02:19:01.132569,2026-09-21 02:19:01.611115,0 days 00:00:00.478546,gini,12.0,1,,COMPLETE
15,,2026-09-21 02:19:01.611115,2026-09-21 02:19:01.613113,0 days 00:00:00.001998,entropy,6.0,20,,PRUNED
16,,2026-09-21 02:19:01.613113,2026-09-21 02:19:01.615113,0 days 00:00:00.002000,entropy,6.0,5,,PRUNED
17,,2026-09-21 02:19:01.615113,2026-09-21 02:19:01.617113,0 days 00:00:00.002000,gini,6.0,5,,PRUNED
18,0.5705314303469434,2026-09-21 02:19:01.617113,2026-09-21 02:19:02.042495,0 days 00:00:00.425382,entropy,12.0,20,,COMPLETE
19,,2026-09-21 02:19:02.042495,2026-09-21 02:19:02.042495,0 days 00:00:00,gini,,1,,PRUNED
20,,2026-09-21 02:19:02.042495,2026-09-21 02:19:02.042495,0 days 00:00:00,gini,6.0,20,,PRUNED
21,,2026-09-21 02:19:02.042495,2026-09-21 02:19:02.051293,0 days 00:00:00.008798,gini,6.0,20,,PRUNED
22,,2026-09-21 02:19:02.051293,2026-09-21 02:19:02.053856,0 days 00:00:00.002563,gini,6.0,20,,PRUNED
23,,2026-09-21 02:19:02.053856,2026-09-21 02:19:02.053856,0 days 00:00:00,gini,6.0,20,,PRUNED
24,,2026-09-21 02:19:02.053856,2026-09-21 02:19:02.053856,0 days 00:00:00,gini,6.0,20,,PRUNED
25,,2026-09-21 02:19:02.053856,2026-09-21 02:19:02.053856,0 days 00:00:00,gini,6.0,5,,PRUNED
26,,2026-09-21 02:19:02.053856,2026-09-21 02:19:02.053856,0 days 00:00:00,entropy,6.0,20,,PRUNED
27,0.5556975808984178,2026-09-21 02:19:02.053856,2026-09-21 02:19:02.495020,0 days 00:00:00.441164,gini,12.0,5,"{'criterion': 'gini', 'max_depth': 12, 'min_samples_leaf': 5}",COMPLETE
28,0.5158942427792232,2026-09-21 02:19:02.495020,2026-09-21 02:19:02.973942,0 days 00:00:00.478922,entropy,,1,,COMPLETE
29,,2026-09-21 02:19:02.973942,2026-09-21 02:19:02.973942,0 days 00:00:00,gini,12.0,20,,PRUNED
30,,2026-09-21 02:19:02.973942,2026-09-21 02:19:02.973942,0 days 00:00:00,gini,6.0,20,,PRUNED
31,,2026-09-21 02:19:02.973942,2026-09-21 02:19:02.973942,0 days 00:00:00,entropy,6.0,5,,PRUNED
32,,2026-09-21 02:19:02.973942,2026-09-21 02:19:02.973942,0 days 00:00:00,entropy,6.0,5,,PRUNED
33,,2026-09-21 02:19:02.973942,2026-09-21 02:19:02.973942,0 days 00:00:00,entropy,6.0,5,,PRUNED
34,,2026-09-21 02:19:02.973942,2026-09-21 02:19:02.987828,0 days 00:00:00.013886,entropy,3.0,5,,PRUNED
35,,2026-09-21 02:19:02.987828,2026-09-21 02:19:02.987828,0 days 00:00:00,entropy,3.0,20,,PRUNED
36,,2026-09-21 02:19:02.987828,2026-09-21 02:19:02.987828,0 days 00:00:00,entropy,6.0,5,,PRUNED
37,0.5961720985245514,2026-09-21 02:19:02.987828,2026-09-21 02:19:03.423860,0 days 00:00:00.436032,gini,6.0,1,"{'criterion': 'gini', 'max_depth': 6, 'min_samples_leaf': 1}",COMPLETE
38,0.575257714258243,2026-09-21 02:19:03.423860,2026-09-21 02:19:03.831483,0 days 00:00:00.407623,gini,3.0,1,,COMPLETE
39,,2026-09-21 02:19:03.831483,2026-09-21 02:19:03.836271,0 days 00:00:00.004788,gini,,1,,PRUNED
40,,2026-09-21 02:19:03.836271,2026-09-21 02:19:03.836271,0 days 00:00:00,gini,6.0,1,,PRUNED
41,,2026-09-21 02:19:03.836271,2026-09-21 02:19:03.841070,0 days 00:00:00.004799,gini,6.0,1,,PRUNED
42,,2026-09-21 02:19:03.841070,2026-09-21 02:19:03.841070,0 days 00:00:00,gini,6.0,5,,PRUNED
43,,2026-09-21 02:19:03.841070,2026-09-21 02:19:03.841070,0 days 00:00:00,entropy,6.0,20,,PRUNED
44,,2026-09-21 02:19:03.841070,2026-09-21 02:19:03.847318,0 days 00:00:00.006248,gini,6.0,1,,PRUNED
45,,2026-09-21 02:19:03.847318,2026-09-21 02:19:03.847318,0 days 00:00:00,entropy,6.0,5,,PRUNED
46,,2026-09-21 02:19:03.847318,2026-09-21 02:19:03.847318,0 days 00:00:00,gini,6.0,20,,PRUNED
47,0.573862352641911,2026-09-21 02:19:03.847318,2026-09-21 02:19:04.285020,0 days 00:00:00.437702,gini,,20,"{'criterion': 'gini', 'max_depth': None, 'min_samples_leaf': 20}",COMPLETE
48,0.5735368415610255,2026-09-21 02:19:04.285020,2026-09-21 02:19:04.738088,0 days 00:00:00.453068,entropy,12.0,5,,COMPLETE
49,,2026-09-21 02:19:04.738088,2026-09-21 02:19:04.738088,0 days 00:00:00,entropy,6.0,1,,PRUNED
50,0.575257714258243,2026-09-21 02:19:04.738088,2026-09-21 02:19:05.166357,0 days 00:00:00.428269,gini,3.0,5,,COMPLETE
51,,2026-09-21 02:19:05.166357,2026-09-21 02:19:05.166357,0 days 00:00:00,entropy,6.0,1,,PRUNED
52,,2026-09-21 02:19:05.166357,2026-09-21 02:19:05.166357,0 days 00:00:00,entropy,6.0,1,,PRUNED
53,,2026-09-21 02:19:05.166357,2026-09-21 02:19:05.166357,0 days 00:00:00,entropy,6.0,1,,PRUNED
54,,2026-09-21 02:19:05.166357,2026-09-21 02:19:05.166357,0 days 00:00:00,entropy,6.0,1,,PRUNED
55,,2026-09-21 02:19:05.166357,2026-09-21 02:19:05.166357,0 days 00:00:00,entropy,6.0,20,,PRUNED
56,,2026-09-21 02:19:05.166357,2026-09-21 02:19:05.166357,0 days 00:00:00,gini,6.0,1,,PRUNED
57,,2026-09-21 02:19:05.166357,2026-09-21 02:19:05.184033,0 days 00:00:00.017676,entropy,6.0,20,,PRUNED
58,,2026-09-21 02:19:05.184033,2026-09-21 02:19:05.184033,0 days 00:00:00,gini,12.0,5,,PRUNED
59,0.5745293645165276,2026-09-21 02:19:05.184033,2026-09-21 02:19:05.626616,0 days 00:00:00.442583,entropy,3.0,1,"{'criterion': 'entropy', 'max_depth': 3, 'min_samples_leaf': 1}",COMPLETE
60,,2026-09-21 02:19:05.626616,2026-09-21 02:19:05.631637,0 days 00:00:00.005021,gini,6.0,20,,PRUNED
61,,2026-09-21 02:19:05.631637,2026-09-21 02:19:05.631637,0 days 00:00:00,gini,3.0,20,,PRUNED
62,,2026-09-21 02:19:05.631637,2026-09-21 02:19:05.631637,0 days 00:00:00,gini,3.0,20,,PRUNED
63,,2026-09-21 02:19:05.631637,2026-09-21 02:19:05.631637,0 days 00:00:00,gini,3.0,20,,PRUNED
64,,2026-09-21 02:19:05.631637,2026-09-21 02:19:05.638898,0 days 00:00:00.007261,gini,6.0,20,,PRUNED
65,0.5375105194420429,2026-09-21 02:19:05.638898,2026-09-21 02:19:06.082953,0 days 00:00:00.444055,gini,,5,,COMPLETE
66,,2026-09-21 02:19:06.082953,2026-09-21 02:19:06.082953,0 days 00:00:00,entropy,6.0,20,,PRUNED
67,,2026-09-21 02:19:06.082953,2026-09-21 02:19:06.082953,0 days 00:00:00,gini,6.0,5,,PRUNED
68,,2026-09-21 02:19:06.082953,2026-09-21 02:19:06.089714,0 days 00:00:00.006761,gini,3.0,20,,PRUNED
69,0.5613368436743443,2026-09-21 02:19:06.089714,2026-09-21 02:19:06.583148,0 days 00:00:00.493434,entropy,12.0,1,,COMPLETE
70,,2026-09-21 02:19:06.583148,2026-09-21 02:19:06.586032,0 days 00:00:00.002884,gini,6.0,5,,PRUNED
71,,2026-09-21 02:19:06.586032,2026-09-21 02:19:06.589403,0 days 00:00:00.003371,gini,3.0,1,,PRUNED
72,,2026-09-21 02:19:06.589403,2026-09-21 02:19:06.592272,0 days 00:00:00.002869,gini,3.0,1,,PRUNED
73,,2026-09-21 02:19:06.592272,2026-09-21 02:19:06.592272,0 days 00:00:00,gini,3.0,1,,PRUNED
74,,2026-09-21 02:19:06.592272,2026-09-21 02:19:06.592272,0 days 00:00:00,gini,3.0,1,,PRUNED
75,,2026-09-21 02:19:06.592272,2026-09-21 02:19:06.598910,0 days 00:00:00.006638,gini,6.0,1,,PRUNED
76,0.5659840956055249,2026-09-21 02:19:06.598910,2026-09-21 02:19:07.067702,0 days 00:00:00.468792,entropy,,20,,COMPLETE
