number,value,datetime_start,datetime_complete,duration,params_n_neighbors,params_p,params_weights,system_attrs_fixed_params,state
0,0.5349073844100127,2026-09-20 19:56:23.525519,2026-09-20 19:56:24.158185,0 days 00:00:00.632666,3,1,distance,,COMPLETE
1,0.6024729875858473,2026-09-20 19:56:24.158185,2026-09-20 19:56:24.715436,0 days 00:00:00.557251,81,2,uniform,,COMPLETE
2,0.599343094785129,2026-09-20 19:56:24.715436,2026-09-20 19:56:25.248496,0 days 00:00:00.533060,41,2,distance,,COMPLETE
3,0.599499369136809,2026-09-20 19:56:25.248496,2026-09-20 19:56:25.758896,0 days 00:00:00.510400,41,2,uniform,,COMPLETE
4,0.5884978494902208,2026-09-20 19:56:25.758896,2026-09-20 19:56:26.251339,0 days 00:00:00.492443,21,2,distance,,COMPLETE
5,,2026-09-20 19:56:26.251339,2026-09-20 19:56:26.251339,0 days 00:00:00,41,2,uniform,,PRUNED
6,,2026-09-20 19:56:26.251339,2026-09-20 19:56:26.251339,0 days 00:00:00,41,2,uniform,,PRUNED
7,0.6034067095459275,2026-09-20 19:56:26.251339,2026-09-20 19:56:27.035208,0 days 00:00:00.783869,81,1,distance,,COMPLETE
8,0.5818061410588735,2026-09-20 19:56:27.035208,2026-09-20 19:56:27.714648,0 days 00:00:00.679440,11,1,distance,,COMPLETE
9,,2026-09-20 19:56:27.714648,2026-09-20 19:56:27.714648,0 days 00:00:00,81,1,distance,,PRUNED
10,0.5734811913503722,2026-09-20 19:56:27.714648,2026-09-20 19:56:28.354615,0 days 00:00:00.639967,5,1,distance,,COMPLETE
11,0.603798349326034,2026-09-20 19:56:28.354615,2026-09-20 19:56:29.110676,0 days 00:00:00.756061,81,1,uniform,,COMPLETE
12,,2026-09-20 19:56:29.110676,2026-09-20 19:56:29.126655,0 days 00:00:00.015979,81,1,uniform,,PRUNED
13,,2026-09-20 19:56:29.126655,2026-09-20 19:56:29.126655,0 days 00:00:00,81,1,uniform,,PRUNED
14,,2026-09-20 19:56:29.126655,2026-09-20 19:56:29.126655,0 days 00:00:00,81,1,distance,,PRUNED
15,0.5934978170161648,2026-09-20 19:56:29.126655,2026-09-20 19:56:29.794203,0 days 00:00:00.667548,21,1,uniform,,COMPLETE
16,0.583527538505733,2026-09-20 19:56:29.794203,2026-09-20 19:56:30.414634,0 days 00:00:00.620431,5,1,uniform,,COMPLETE
17,,2026-09-20 19:56:30.414634,2026-09-20 19:56:30.414634,0 days 00:00:00,11,1,distance,,PRUNED
18,,2026-09-20 19:56:30.414634,2026-09-20 19:56:30.414634,0 days 00:00:00,3,1,distance,,PRUNED
19,,2026-09-20 19:56:30.414634,2026-09-20 19:56:30.414634,0 days 00:00:00,81,1,uniform,,PRUNED
20,,2026-09-20 19:56:30.414634,2026-09-20 19:56:30.430646,0 days 00:00:00.016012,81,1,distance,,PRUNED
21,,2026-09-20 19:56:30.430646,2026-09-20 19:56:30.430646,0 days 00:00:00,81,2,uniform,,PRUNED
22,,2026-09-20 19:56:30.430646,2026-09-20 19:56:30.430646,0 days 00:00:00,81,2,uniform,,PRUNED
23,,2026-09-20 19:56:30.430646,2026-09-20 19:56:30.430646,0 days 00:00:00,81,2,uniform,,PRUNED
24,,2026-09-20 19:56:30.430646,2026-09-20 19:56:30.430646,0 days 00:00:00,81,2,uniform,,PRUNED
25,0.5717404696732643,2026-09-20 19:56:30.430646,2026-09-20 19:56:30.881343,0 days 00:00:00.450697,5,2,distance,"{'n_neighbors': 5, 'p': 2, 'weights': 'distance'}",COMPLETE
26,,2026-09-20 19:56:30.881343,2026-09-20 19:56:30.885428,0 days 00:00:00.004085,81,1,uniform,,PRUNED
27,,2026-09-20 19:56:30.885428,2026-09-20 19:56:30.885428,0 days 00:00:00,21,1,uniform,,PRUNED
28,0.5772721821005743,2026-09-20 19:56:30.885428,2026-09-20 19:56:31.351600,0 days 00:00:00.466172,11,2,uniform,,COMPLETE
29,,2026-09-20 19:56:31.351600,2026-09-20 19:56:31.351600,0 days 00:00:00,3,1,distance,,PRUNED
30,0.5374013771585676,2026-09-20 19:56:31.351600,2026-09-20 19:56:31.986254,0 days 00:00:00.634654,3,1,uniform,,COMPLETE
31,,2026-09-20 19:56:31.986254,2026-09-20 19:56:31.986254,0 days 00:00:00,41,2,uniform,,PRUNED
32,,2026-09-20 19:56:31.986254,2026-09-20 19:56:31.992922,0 days 00:00:00.006668,41,2,uniform,,PRUNED
33,,2026-09-20 19:56:31.992922,2026-09-20 19:56:31.992922,0 days 00:00:00,41,2,uniform,,PRUNED
34,,2026-09-20 19:56:31.992922,2026-09-20 19:56:31.992922,0 days 00:00:00,41,2,uniform,,PRUNED
35,,2026-09-20 19:56:31.992922,2026-09-20 19:56:31.992922,0 days 00:00:00,81,2,uniform,,PRUNED
36,,2026-09-20 19:56:31.992922,2026-09-20 19:56:32.001911,0 days 00:00:00.008989,21,2,distance,,PRUNED
37,,2026-09-20 19:56:32.001911,2026-09-20 19:56:32.001911,0 days 00:00:00,41,2,uniform,,PRUNED
38,0.6020372578092302,2026-09-20 19:56:32.001911,2026-09-20 19:56:32.574150,0 days 00:00:00.572239,81,2,distance,,COMPLETE
39,,2026-09-20 19:56:32.574150,2026-09-20 19:56:32.574150,0 days 00:00:00,81,2,distance,,PRUNED
40,,2026-09-20 19:56:32.574150,2026-09-20 19:56:32.574150,0 days 00:00:00,81,1,distance,,PRUNED
41,,2026-09-20 19:56:32.574150,2026-09-20 19:56:32.574150,0 days 00:00:00,81,2,distance,,PRUNED
42,,2026-09-20 19:56:32.574150,2026-09-20 19:56:32.574150,0 days 00:00:00,81,2,distance,,PRUNED
43,0.5797785523537775,2026-09-20 19:56:32.574150,2026-09-20 19:56:33.034054,0 days 00:00:00.459904,11,2,distance,,COMPLETE
44,,2026-09-20 19:56:33.034054,2026-09-20 19:56:33.049825,0 days 00:00:00.015771,5,2,distance,,PRUNED
45,,2026-09-20 19:56:33.049825,2026-09-20 19:56:33.049825,0 days 00:00:00,81,1,uniform,,PRUNED
46,,2026-09-20 19:56:33.049825,2026-09-20 19:56:33.049825,0 days 00:00:00,41,2,distance,,PRUNED
47,,2026-09-20 19:56:33.049825,2026-09-20 19:56:33.049825,0 days 00:00:00,81,1,uniform,,PRUNED
48,0.5875456603956359,2026-09-20 19:56:33.049825,2026-09-20 19:56:33.915053,0 days 00:00:00.865228,21,1,distance,,COMPLETE
49,,2026-09-20 19:56:33.915053,2026-09-20 19:56:33.920113,0 days 00:00:00.005060,81,2,uniform,,PRUNED
50,,2026-09-20 19:56:33.920113,2026-09-20 19:56:33.920113,0 days 00:00:00,3,1,distance,,PRUNED
51,,2026-09-20 19:56:33.920113,2026-09-20 19:56:33.920113,0 days 00:00:00,41,2,distance,,PRUNED
52,,2026-09-20 19:56:33.920113,2026-09-20 19:56:33.920113,0 days 00:00:00,41,2,distance,,PRUNED
53,,2026-09-20 19:56:33.920113,2026-09-20 19:56:33.930799,0 days 00:00:00.010686,41,2,distance,,PRUNED
54,,2026-09-20 19:56:33.930799,2026-09-20 19:56:33.932806,0 days 00:00:00.002007,81,2,distance,,PRUNED
55,,2026-09-20 19:56:33.932806,2026-09-20 19:56:33.934812,0 days 00:00:00.002006,5,1,uniform,,PRUNED
56,,2026-09-20 19:56:33.934812,2026-09-20 19:56:33.937823,0 days 00:00:00.003011,11,2,distance,,PRUNED
57,0.5831617927969389,2026-09-20 19:56:33.937823,2026-09-20 19:56:34.618656,0 days 00:00:00.680833,11,1,uniform,"{'n_neighbors': 11, 'p': 1, 'weights': 'uniform'}",COMPLETE
58,,2026-09-20 19:56:34.618656,2026-09-20 19:56:34.618656,0 days 00:00:00,81,2,distance,,PRUNED
59,0.5991510388887203,2026-09-20 19:56:34.618656,2026-09-20 19:56:35.348540,0 days 00:00:00.729884,41,1,uniform,,COMPLETE
60,,2026-09-20 19:56:35.348540,2026-09-20 19:56:35.351037,0 days 00:00:00.002497,81,2,uniform,,PRUNED
61,,2026-09-20 19:56:35.351037,2026-09-20 19:56:35.353041,0 days 00:00:00.002004,41,1,uniform,,PRUNED
62,,2026-09-20 19:56:35.355043,2026-09-20 19:56:35.355043,0 days 00:00:00,41,1,uniform,,PRUNED
63,,2026-09-20 19:56:35.355043,2026-09-20 19:56:35.355043,0 days 00:00:00,41,1,uniform,,PRUNED
64,,2026-09-20 19:56:35.355043,2026-09-20 19:56:35.355043,0 days 00:00:00,41,1,uniform,,PRUNED
65,,2026-09-20 19:56:35.355043,2026-09-20 19:56:35.355043,0 days 00:00:00,81,1,uniform,,PRUNED
66,,2026-09-20 19:56:35.355043,2026-09-20 19:56:35.355043,0 days 00:00:00,41,1,uniform,,PRUNED
67,0.5910203377050146,2026-09-20 19:56:35.355043,2026-09-20 19:56:35.840807,0 days 00:00:00.485764,21,2,uniform,,COMPLETE
68,,2026-09-20 19:56:35.840807,2026-09-20 19:56:35.840807,0 days 00:00:00,81,1,distance,,PRUNED
69,0.5380963882449633,2026-09-20 19:56:35.840807,2026-09-20 19:56:36.286385,0 days 00:00:00.445578,3,2,uniform,,COMPLETE
70,0.5992700095348469,2026-09-20 19:56:36.286385,2026-09-20 19:56:36.997033,0 days 00:00:00.710648,41,1,distance,,COMPLETE
71,,2026-09-20 19:56:36.997033,2026-09-20 19:56:37.001198,0 days 00:00:00.004165,41,1,distance,,PRUNED
72,,2026-09-20 19:56:37.001198,2026-09-20 19:56:37.001198,0 days 00:00:00,41,1,distance,,PRUNED
73,,2026-09-20 19:56:37.001198,2026-09-20 19:56:37.001198,0 days 00:00:00,41,1,distance,,PRUNED
74,,2026-09-20 19:56:37.001198,2026-09-20 19:56:37.001198,0 days 00:00:00,41,1,distance,,PRUNED
75,,2026-09-20 19:56:37.001198,2026-09-20 19:56:37.001198,0 days 00:00:00,81,1,distance,,PRUNED
76,0.5812005997488897,2026-09-20 19:56:37.001198,2026-09-20 19:56:37.457670,0 days 00:00:00.456472,5,2,uniform,,COMPLETE
77,,2026-09-20 19:56:37.457670,2026-09-20 19:56:37.462694,0 days 00:00:00.005024,81,1,distance,,PRUNED
78,,2026-09-20 19:56:37.462694,2026-09-20 19:56:37.462694,0 days 00:00:00,41,2,uniform,,PRUNED
79,,2026-09-20 19:56:37.462694,2026-09-20 19:56:37.462694,0 days 00:00:00,81,2,distance,,PRUNED
80,,2026-09-20 19:56:37.462694,2026-09-20 19:56:37.462694,0 days 00:00:00,41,1,uniform,,PRUNED
81,,2026-09-20 19:56:37.462694,2026-09-20 19:56:37.473286,0 days 00:00:00.010592,21,1,uniform,,PRUNED
82,,2026-09-20 19:56:37.473286,2026-09-20 19:56:37.473286,0 days 00:00:00,21,1,uniform,,PRUNED
83,,2026-09-20 19:56:37.473286,2026-09-20 19:56:37.473286,0 days 00:00:00,21,1,uniform,,PRUNED
84,,2026-09-20 19:56:37.473286,2026-09-20 19:56:37.478643,0 days 00:00:00.005357,21,1,uniform,,PRUNED
85,0.5312536565634557,2026-09-20 19:56:37.478643,2026-09-20 19:56:37.911199,0 days 00:00:00.432556,3,2,distance,"{'n_neighbors': 3, 'p': 2, 'weights': 'distance'}",COMPLETE
