number,value,datetime_start,datetime_complete,duration,params_criterion,params_max_depth,params_min_samples_leaf,system_attrs_fixed_params,state
0,0.5973210212744194,2026-09-21 02:27:56.916914,2026-09-21 02:27:57.328734,0 days 00:00:00.411820,entropy,12.0,20,,COMPLETE
1,0.5979705084310326,2026-09-21 02:27:57.328734,2026-09-21 02:27:57.723200,0 days 00:00:00.394466,entropy,6.0,5,,COMPLETE
2,0.5553045120769524,2026-09-21 02:27:57.723200,2026-09-21 02:27:58.118556,0 days 00:00:00.395356,entropy,12.0,1,,COMPLETE
3,0.5584109608910738,2026-09-21 02:27:58.118556,2026-09-21 02:27:58.541700,0 days 00:00:00.423144,gini,12.0,5,,COMPLETE
4,0.5583803880296485,2026-09-21 02:27:58.541700,2026-09-21 02:27:58.940689,0 days 00:00:00.398989,entropy,12.0,5,,COMPLETE
5,0.5735910013548491,2026-09-21 02:27:58.940689,2026-09-21 02:27:59.332479,0 days 00:00:00.391790,entropy,3.0,5,,COMPLETE
6,0.5735910013548491,2026-09-21 02:27:59.332479,2026-09-21 02:27:59.720166,0 days 00:00:00.387687,gini,3.0,20,,COMPLETE
7,0.5543067423620814,2026-09-21 02:27:59.720166,2026-09-21 02:28:00.525764,0 days 00:00:00.805598,gini,,5,,COMPLETE
8,0.5977139075221448,2026-09-21 02:28:00.525764,2026-09-21 02:28:00.928065,0 days 00:00:00.402301,entropy,6.0,1,,COMPLETE
9,,2026-09-21 02:28:00.928065,2026-09-21 02:28:00.932041,0 days 00:00:00.003976,entropy,6.0,5,,PRUNED
10,0.5982716273288916,2026-09-21 02:28:00.932041,2026-09-21 02:28:01.328733,0 days 00:00:00.396692,gini,6.0,1,,COMPLETE
11,,2026-09-21 02:28:01.328733,2026-09-21 02:28:01.328733,0 days 00:00:00,gini,6.0,1,,PRUNED
12,,2026-09-21 02:28:01.328733,2026-09-21 02:28:01.328733,0 days 00:00:00,gini,6.0,1,,PRUNED
13,,2026-09-21 02:28:01.328733,2026-09-21 02:28:01.328733,0 days 00:00:00,gini,6.0,1,,PRUNED
14,0.5973210212744194,2026-09-21 02:28:01.328733,2026-09-21 02:28:01.740847,0 days 00:00:00.412114,entropy,,20,,COMPLETE
15,0.5983775302760144,2026-09-21 02:28:01.740847,2026-09-21 02:28:02.179365,0 days 00:00:00.438518,gini,6.0,5,,COMPLETE
16,,2026-09-21 02:28:02.179365,2026-09-21 02:28:02.181438,0 days 00:00:00.002073,gini,6.0,1,,PRUNED
17,,2026-09-21 02:28:02.181438,2026-09-21 02:28:02.183434,0 days 00:00:00.001996,gini,6.0,1,,PRUNED
18,,2026-09-21 02:28:02.183434,2026-09-21 02:28:02.185436,0 days 00:00:00.002002,gini,,5,,PRUNED
19,,2026-09-21 02:28:02.185436,2026-09-21 02:28:02.187435,0 days 00:00:00.001999,gini,3.0,20,,PRUNED
20,,2026-09-21 02:28:02.187435,2026-09-21 02:28:02.188438,0 days 00:00:00.001003,gini,6.0,1,,PRUNED
21,,2026-09-21 02:28:02.188438,2026-09-21 02:28:02.190437,0 days 00:00:00.001999,entropy,6.0,5,,PRUNED
22,,2026-09-21 02:28:02.190437,2026-09-21 02:28:02.192435,0 days 00:00:00.001998,gini,6.0,5,,PRUNED
23,,2026-09-21 02:28:02.192435,2026-09-21 02:28:02.194535,0 days 00:00:00.002100,entropy,6.0,5,,PRUNED
24,0.601519160229265,2026-09-21 02:28:02.194535,2026-09-21 02:28:02.606524,0 days 00:00:00.411989,entropy,6.0,20,"{'criterion': 'entropy', 'max_depth': 6, 'min_samples_leaf': 20}",COMPLETE
25,0.5995799562024736,2026-09-21 02:28:02.606524,2026-09-21 02:28:03.019467,0 days 00:00:00.412943,gini,6.0,20,,COMPLETE
26,,2026-09-21 02:28:03.019467,2026-09-21 02:28:03.019467,0 days 00:00:00,gini,6.0,20,,PRUNED
27,,2026-09-21 02:28:03.019467,2026-09-21 02:28:03.019467,0 days 00:00:00,gini,3.0,20,,PRUNED
28,,2026-09-21 02:28:03.019467,2026-09-21 02:28:03.028484,0 days 00:00:00.009017,entropy,,20,,PRUNED
29,,2026-09-21 02:28:03.028484,2026-09-21 02:28:03.028484,0 days 00:00:00,entropy,12.0,20,,PRUNED
30,,2026-09-21 02:28:03.028484,2026-09-21 02:28:03.028484,0 days 00:00:00,gini,6.0,20,,PRUNED
31,,2026-09-21 02:28:03.028484,2026-09-21 02:28:03.028484,0 days 00:00:00,gini,6.0,20,,PRUNED
32,,2026-09-21 02:28:03.028484,2026-09-21 02:28:03.035680,0 days 00:00:00.007196,gini,6.0,20,,PRUNED
33,,2026-09-21 02:28:03.035680,2026-09-21 02:28:03.038718,0 days 00:00:00.003038,gini,6.0,20,,PRUNED
34,0.493140719233746,2026-09-21 02:28:03.038718,2026-09-21 02:28:03.445317,0 days 00:00:00.406599,gini,,1,"{'criterion': 'gini', 'max_depth': None, 'min_samples_leaf': 1}",COMPLETE
35,,2026-09-21 02:28:03.445317,2026-09-21 02:28:03.445317,0 days 00:00:00,entropy,12.0,20,,PRUNED
36,,2026-09-21 02:28:03.445317,2026-09-21 02:28:03.445317,0 days 00:00:00,gini,6.0,20,,PRUNED
37,,2026-09-21 02:28:03.445317,2026-09-21 02:28:03.445317,0 days 00:00:00,entropy,6.0,5,,PRUNED
38,0.5339117174869416,2026-09-21 02:28:03.445317,2026-09-21 02:28:03.865524,0 days 00:00:00.420207,gini,12.0,1,,COMPLETE
39,,2026-09-21 02:28:03.865524,2026-09-21 02:28:03.869595,0 days 00:00:00.004071,entropy,3.0,5,,PRUNED
40,,2026-09-21 02:28:03.869595,2026-09-21 02:28:03.869595,0 days 00:00:00,gini,6.0,20,,PRUNED
41,,2026-09-21 02:28:03.869595,2026-09-21 02:28:03.874471,0 days 00:00:00.004876,entropy,6.0,5,,PRUNED
42,,2026-09-21 02:28:03.874471,2026-09-21 02:28:03.874471,0 days 00:00:00,entropy,6.0,5,,PRUNED
43,,2026-09-21 02:28:03.874471,2026-09-21 02:28:03.874471,0 days 00:00:00,entropy,6.0,5,,PRUNED
44,,2026-09-21 02:28:03.874471,2026-09-21 02:28:03.874471,0 days 00:00:00,entropy,6.0,5,,PRUNED
45,,2026-09-21 02:28:03.874471,2026-09-21 02:28:03.874471,0 days 00:00:00,entropy,6.0,1,,PRUNED
46,,2026-09-21 02:28:03.874471,2026-09-21 02:28:03.884442,0 days 00:00:00.009971,gini,12.0,5,,PRUNED
47,0.5735910013548491,2026-09-21 02:28:03.884442,2026-09-21 02:28:04.287917,0 days 00:00:00.403475,entropy,3.0,1,"{'criterion': 'entropy', 'max_depth': 3, 'min_samples_leaf': 1}",COMPLETE
48,,2026-09-21 02:28:04.287917,2026-09-21 02:28:04.291821,0 days 00:00:00.003904,gini,6.0,5,,PRUNED
49,,2026-09-21 02:28:04.291821,2026-09-21 02:28:04.294647,0 days 00:00:00.002826,gini,6.0,1,,PRUNED
50,,2026-09-21 02:28:04.294647,2026-09-21 02:28:04.297961,0 days 00:00:00.003314,entropy,6.0,20,,PRUNED
51,,2026-09-21 02:28:04.297961,2026-09-21 02:28:04.299968,0 days 00:00:00.002007,entropy,6.0,1,,PRUNED
52,,2026-09-21 02:28:04.299968,2026-09-21 02:28:04.301969,0 days 00:00:00.002001,entropy,6.0,1,,PRUNED
53,,2026-09-21 02:28:04.301969,2026-09-21 02:28:04.303968,0 days 00:00:00.001999,entropy,6.0,1,,PRUNED
54,,2026-09-21 02:28:04.303968,2026-09-21 02:28:04.305969,0 days 00:00:00.002001,entropy,6.0,1,,PRUNED
55,,2026-09-21 02:28:04.305969,2026-09-21 02:28:04.307969,0 days 00:00:00.002000,gini,,5,,PRUNED
56,0.5969258513426815,2026-09-21 02:28:04.307969,2026-09-21 02:28:04.702242,0 days 00:00:00.394273,gini,,20,"{'criterion': 'gini', 'max_depth': None, 'min_samples_leaf': 20}",COMPLETE
57,,2026-09-21 02:28:04.702242,2026-09-21 02:28:04.702242,0 days 00:00:00,entropy,6.0,1,,PRUNED
58,,2026-09-21 02:28:04.702242,2026-09-21 02:28:04.702242,0 days 00:00:00,entropy,6.0,5,,PRUNED
59,0.5735910013548491,2026-09-21 02:28:04.702242,2026-09-21 02:28:05.119755,0 days 00:00:00.417513,gini,3.0,1,,COMPLETE
60,,2026-09-21 02:28:05.119755,2026-09-21 02:28:05.119755,0 days 00:00:00,gini,6.0,20,,PRUNED
61,,2026-09-21 02:28:05.119755,2026-09-21 02:28:05.125067,0 days 00:00:00.005312,entropy,12.0,20,,PRUNED
62,,2026-09-21 02:28:05.125067,2026-09-21 02:28:05.127072,0 days 00:00:00.002005,entropy,12.0,20,,PRUNED
63,,2026-09-21 02:28:05.127072,2026-09-21 02:28:05.129856,0 days 00:00:00.002784,entropy,12.0,20,,PRUNED
64,,2026-09-21 02:28:05.129856,2026-09-21 02:28:05.129856,0 days 00:00:00,entropy,12.0,20,,PRUNED
65,,2026-09-21 02:28:05.129856,2026-09-21 02:28:05.135730,0 days 00:00:00.005874,entropy,6.0,20,,PRUNED
66,,2026-09-21 02:28:05.135730,2026-09-21 02:28:05.137735,0 days 00:00:00.002005,gini,6.0,5,,PRUNED
67,,2026-09-21 02:28:05.137735,2026-09-21 02:28:05.139739,0 days 00:00:00.002004,entropy,12.0,1,,PRUNED
68,0.550301303300051,2026-09-21 02:28:05.139739,2026-09-21 02:28:05.544230,0 days 00:00:00.404491,entropy,,5,"{'criterion': 'entropy', 'max_depth': None, 'min_samples_leaf': 5}",COMPLETE
69,,2026-09-21 02:28:05.544230,2026-09-21 02:28:05.549549,0 days 00:00:00.005319,gini,6.0,20,,PRUNED
70,,2026-09-21 02:28:05.549549,2026-09-21 02:28:05.549549,0 days 00:00:00,gini,6.0,20,,PRUNED
71,,2026-09-21 02:28:05.549549,2026-09-21 02:28:05.549549,0 days 00:00:00,entropy,,20,,PRUNED
72,,2026-09-21 02:28:05.549549,2026-09-21 02:28:05.559365,0 days 00:00:00.009816,entropy,,20,,PRUNED
73,,2026-09-21 02:28:05.559365,2026-09-21 02:28:05.559365,0 days 00:00:00,entropy,,20,,PRUNED
74,,2026-09-21 02:28:05.559365,2026-09-21 02:28:05.559365,0 days 00:00:00,entropy,6.0,20,,PRUNED
75,0.5735910013548491,2026-09-21 02:28:05.559365,2026-09-21 02:28:05.945193,0 days 00:00:00.385828,entropy,3.0,20,,COMPLETE
76,,2026-09-21 02:28:05.945193,2026-09-21 02:28:05.945193,0 days 00:00:00,gini,,5,,PRUNED
77,,2026-09-21 02:28:05.945193,2026-09-21 02:28:05.945193,0 days 00:00:00,entropy,6.0,1,,PRUNED
78,,2026-09-21 02:28:05.945193,2026-09-21 02:28:05.945193,0 days 00:00:00,gini,6.0,20,,PRUNED
79,,2026-09-21 02:28:05.945193,2026-09-21 02:28:05.958905,0 days 00:00:00.013712,entropy,12.0,5,,PRUNED
80,,2026-09-21 02:28:05.958905,2026-09-21 02:28:05.958905,0 days 00:00:00,gini,6.0,1,,PRUNED
81,,2026-09-21 02:28:05.958905,2026-09-21 02:28:05.958905,0 days 00:00:00,gini,,20,,PRUNED
82,,2026-09-21 02:28:05.958905,2026-09-21 02:28:05.958905,0 days 00:00:00,gini,,20,,PRUNED
83,,2026-09-21 02:28:05.958905,2026-09-21 02:28:05.958905,0 days 00:00:00,gini,,20,,PRUNED
84,0.5969258513426815,2026-09-21 02:28:05.958905,2026-09-21 02:28:06.361601,0 days 00:00:00.402696,gini,12.0,20,"{'criterion': 'gini', 'max_depth': 12, 'min_samples_leaf': 20}",COMPLETE
85,,2026-09-21 02:28:06.361601,2026-09-21 02:28:06.361601,0 days 00:00:00,gini,,20,,PRUNED
86,,2026-09-21 02:28:06.361601,2026-09-21 02:28:06.376990,0 days 00:00:00.015389,entropy,,20,,PRUNED
87,,2026-09-21 02:28:06.376990,2026-09-21 02:28:06.376990,0 days 00:00:00,gini,6.0,5,,PRUNED
88,,2026-09-21 02:28:06.376990,2026-09-21 02:28:06.376990,0 days 00:00:00,entropy,6.0,1,,PRUNED
89,,2026-09-21 02:28:06.376990,2026-09-21 02:28:06.376990,0 days 00:00:00,gini,3.0,20,,PRUNED
90,,2026-09-21 02:28:06.376990,2026-09-21 02:28:06.376990,0 days 00:00:00,entropy,6.0,5,,PRUNED
91,,2026-09-21 02:28:06.376990,2026-09-21 02:28:06.376990,0 days 00:00:00,gini,12.0,20,,PRUNED
92,,2026-09-21 02:28:06.376990,2026-09-21 02:28:06.392627,0 days 00:00:00.015637,gini,12.0,20,,PRUNED
93,0.49546215347697703,2026-09-21 02:28:06.392627,2026-09-21 02:28:06.799280,0 days 00:00:00.406653,entropy,,1,"{'criterion': 'entropy', 'max_depth': None, 'min_samples_leaf': 1}",COMPLETE
94,,2026-09-21 02:28:06.799280,2026-09-21 02:28:06.805699,0 days 00:00:00.006419,gini,12.0,20,,PRUNED
95,,2026-09-21 02:28:06.805699,2026-09-21 02:28:06.808607,0 days 00:00:00.002908,gini,12.0,20,,PRUNED
96,,2026-09-21 02:28:06.808607,2026-09-21 02:28:06.808607,0 days 00:00:00,gini,6.0,20,,PRUNED
97,,2026-09-21 02:28:06.808607,2026-09-21 02:28:06.813353,0 days 00:00:00.004746,gini,12.0,20,,PRUNED
98,,2026-09-21 02:28:06.813353,2026-09-21 02:28:06.816370,0 days 00:00:00.003017,gini,6.0,1,,PRUNED
99,,2026-09-21 02:28:06.816370,2026-09-21 02:28:06.818662,0 days 00:00:00.002292,entropy,6.0,5,,PRUNED
100,,2026-09-21 02:28:06.818662,2026-09-21 02:28:06.821094,0 days 00:00:00.002432,gini,12.0,20,,PRUNED
101,,2026-09-21 02:28:06.821094,2026-09-21 02:28:06.823426,0 days 00:00:00.002332,entropy,3.0,5,,PRUNED
102,0.5735910013548491,2026-09-21 02:28:06.823426,2026-09-21 02:28:07.216959,0 days 00:00:00.393533,gini,3.0,5,"{'criterion': 'gini', 'max_depth': 3, 'min_samples_leaf': 5}",COMPLETE
