number,value,datetime_start,datetime_complete,duration,params_criterion,params_max_depth,params_min_samples_leaf,system_attrs_fixed_params,state
0,0.567775994029255,2026-09-21 02:14:22.842118,2026-09-21 02:14:23.222848,0 days 00:00:00.380730,gini,6.0,5,,COMPLETE
1,0.5440582093088019,2026-09-21 02:14:23.222848,2026-09-21 02:14:23.637850,0 days 00:00:00.415002,entropy,,20,,COMPLETE
2,0.4832920430839967,2026-09-21 02:14:23.637850,2026-09-21 02:14:24.053592,0 days 00:00:00.415742,gini,3.0,1,,COMPLETE
3,0.5671885196492954,2026-09-21 02:14:24.053592,2026-09-21 02:14:24.456678,0 days 00:00:00.403086,gini,6.0,1,,COMPLETE
4,0.5291688792234127,2026-09-21 02:14:24.456678,2026-09-21 02:14:24.868844,0 days 00:00:00.412166,entropy,12.0,5,,COMPLETE
5,0.48728411350553924,2026-09-21 02:14:24.868844,2026-09-21 02:14:25.275722,0 days 00:00:00.406878,entropy,,1,,COMPLETE
6,,2026-09-21 02:14:25.275722,2026-09-21 02:14:25.275722,0 days 00:00:00,entropy,12.0,5,,PRUNED
7,0.536861495951184,2026-09-21 02:14:25.275722,2026-09-21 02:14:25.671386,0 days 00:00:00.395664,gini,12.0,20,,COMPLETE
8,,2026-09-21 02:14:25.671386,2026-09-21 02:14:25.671386,0 days 00:00:00,gini,6.0,5,,PRUNED
9,,2026-09-21 02:14:25.671386,2026-09-21 02:14:25.671386,0 days 00:00:00,gini,6.0,5,,PRUNED
10,0.4832920430839967,2026-09-21 02:14:25.671386,2026-09-21 02:14:26.071127,0 days 00:00:00.399741,gini,3.0,5,,COMPLETE
11,,2026-09-21 02:14:26.071127,2026-09-21 02:14:26.071127,0 days 00:00:00,gini,6.0,1,,PRUNED
12,,2026-09-21 02:14:26.071127,2026-09-21 02:14:26.071127,0 days 00:00:00,gini,6.0,1,,PRUNED
13,,2026-09-21 02:14:26.071127,2026-09-21 02:14:26.071127,0 days 00:00:00,gini,6.0,1,,PRUNED
14,0.5672494601154064,2026-09-21 02:14:26.071127,2026-09-21 02:14:26.471055,0 days 00:00:00.399928,gini,6.0,20,,COMPLETE
15,,2026-09-21 02:14:26.471055,2026-09-21 02:14:26.478897,0 days 00:00:00.007842,gini,6.0,20,,PRUNED
16,,2026-09-21 02:14:26.478897,2026-09-21 02:14:26.478897,0 days 00:00:00,gini,6.0,20,,PRUNED
17,0.536861495951184,2026-09-21 02:14:26.478897,2026-09-21 02:14:26.877206,0 days 00:00:00.398309,gini,,20,,COMPLETE
18,0.5856795542382888,2026-09-21 02:14:26.877206,2026-09-21 02:14:27.287287,0 days 00:00:00.410081,entropy,3.0,5,,COMPLETE
19,,2026-09-21 02:14:27.287287,2026-09-21 02:14:27.289290,0 days 00:00:00.002003,entropy,3.0,5,,PRUNED
20,,2026-09-21 02:14:27.289290,2026-09-21 02:14:27.291292,0 days 00:00:00.002002,entropy,3.0,5,,PRUNED
21,,2026-09-21 02:14:27.291292,2026-09-21 02:14:27.291292,0 days 00:00:00,entropy,3.0,5,,PRUNED
22,0.5856795542382888,2026-09-21 02:14:27.291292,2026-09-21 02:14:27.719500,0 days 00:00:00.428208,entropy,3.0,20,,COMPLETE
23,,2026-09-21 02:14:27.719500,2026-09-21 02:14:27.719500,0 days 00:00:00,entropy,3.0,5,,PRUNED
24,,2026-09-21 02:14:27.719500,2026-09-21 02:14:27.719500,0 days 00:00:00,entropy,3.0,5,,PRUNED
25,,2026-09-21 02:14:27.719500,2026-09-21 02:14:27.719500,0 days 00:00:00,entropy,3.0,20,,PRUNED
26,,2026-09-21 02:14:27.719500,2026-09-21 02:14:27.719500,0 days 00:00:00,entropy,3.0,5,,PRUNED
27,,2026-09-21 02:14:27.719500,2026-09-21 02:14:27.719500,0 days 00:00:00,entropy,3.0,20,,PRUNED
28,,2026-09-21 02:14:27.719500,2026-09-21 02:14:27.735535,0 days 00:00:00.016035,entropy,12.0,5,,PRUNED
29,,2026-09-21 02:14:27.735535,2026-09-21 02:14:27.735535,0 days 00:00:00,entropy,,20,,PRUNED
30,0.5043863512904762,2026-09-21 02:14:27.735535,2026-09-21 02:14:28.140459,0 days 00:00:00.404924,entropy,,5,,COMPLETE
31,,2026-09-21 02:14:28.140459,2026-09-21 02:14:28.145959,0 days 00:00:00.005500,gini,6.0,20,,PRUNED
32,,2026-09-21 02:14:28.145959,2026-09-21 02:14:28.145959,0 days 00:00:00,gini,6.0,20,,PRUNED
33,0.4832920430839967,2026-09-21 02:14:28.145959,2026-09-21 02:14:28.519106,0 days 00:00:00.373147,gini,3.0,20,,COMPLETE
34,0.6055200908516567,2026-09-21 02:14:28.519106,2026-09-21 02:14:28.929495,0 days 00:00:00.410389,entropy,6.0,20,,COMPLETE
35,,2026-09-21 02:14:28.929495,2026-09-21 02:14:28.929495,0 days 00:00:00,entropy,3.0,20,,PRUNED
36,,2026-09-21 02:14:28.929495,2026-09-21 02:14:28.929495,0 days 00:00:00,entropy,6.0,20,,PRUNED
37,0.5363238693783648,2026-09-21 02:14:28.929495,2026-09-21 02:14:29.406882,0 days 00:00:00.477387,entropy,12.0,1,,COMPLETE
38,,2026-09-21 02:14:29.406882,2026-09-21 02:14:29.411579,0 days 00:00:00.004697,entropy,,5,,PRUNED
39,0.6043060484338421,2026-09-21 02:14:29.411579,2026-09-21 02:14:29.822869,0 days 00:00:00.411290,entropy,6.0,5,,COMPLETE
40,,2026-09-21 02:14:29.822869,2026-09-21 02:14:29.822869,0 days 00:00:00,entropy,6.0,5,,PRUNED
41,,2026-09-21 02:14:29.822869,2026-09-21 02:14:29.822869,0 days 00:00:00,entropy,6.0,5,,PRUNED
42,,2026-09-21 02:14:29.822869,2026-09-21 02:14:29.822869,0 days 00:00:00,entropy,6.0,5,,PRUNED
43,,2026-09-21 02:14:29.822869,2026-09-21 02:14:29.822869,0 days 00:00:00,entropy,6.0,5,,PRUNED
44,,2026-09-21 02:14:29.822869,2026-09-21 02:14:29.836182,0 days 00:00:00.013313,entropy,12.0,5,,PRUNED
45,0.601473888358475,2026-09-21 02:14:29.836182,2026-09-21 02:14:30.240133,0 days 00:00:00.403951,entropy,6.0,1,,COMPLETE
46,,2026-09-21 02:14:30.240133,2026-09-21 02:14:30.242225,0 days 00:00:00.002092,entropy,6.0,1,,PRUNED
47,,2026-09-21 02:14:30.242225,2026-09-21 02:14:30.245001,0 days 00:00:00.002776,entropy,6.0,1,,PRUNED
48,0.5854540236420445,2026-09-21 02:14:30.245001,2026-09-21 02:14:30.656072,0 days 00:00:00.411071,entropy,3.0,1,,COMPLETE
49,,2026-09-21 02:14:30.656072,2026-09-21 02:14:30.658399,0 days 00:00:00.002327,entropy,6.0,1,,PRUNED
50,,2026-09-21 02:14:30.658399,2026-09-21 02:14:30.661135,0 days 00:00:00.002736,entropy,6.0,1,,PRUNED
51,,2026-09-21 02:14:30.661135,2026-09-21 02:14:30.663572,0 days 00:00:00.002437,entropy,3.0,1,,PRUNED
52,,2026-09-21 02:14:30.663572,2026-09-21 02:14:30.663572,0 days 00:00:00,entropy,3.0,1,,PRUNED
53,,2026-09-21 02:14:30.663572,2026-09-21 02:14:30.663572,0 days 00:00:00,entropy,3.0,1,,PRUNED
54,,2026-09-21 02:14:30.663572,2026-09-21 02:14:30.663572,0 days 00:00:00,entropy,3.0,1,,PRUNED
55,,2026-09-21 02:14:30.663572,2026-09-21 02:14:30.663572,0 days 00:00:00,entropy,3.0,1,,PRUNED
56,,2026-09-21 02:14:30.663572,2026-09-21 02:14:30.673767,0 days 00:00:00.010195,entropy,3.0,20,,PRUNED
57,0.5102925886916362,2026-09-21 02:14:30.673767,2026-09-21 02:14:31.104424,0 days 00:00:00.430657,gini,,5,"{'criterion': 'gini', 'max_depth': None, 'min_samples_leaf': 5}",COMPLETE
58,0.5440582093088019,2026-09-21 02:14:31.104424,2026-09-21 02:14:31.573222,0 days 00:00:00.468798,entropy,12.0,20,,COMPLETE
59,,2026-09-21 02:14:31.573222,2026-09-21 02:14:31.576506,0 days 00:00:00.003284,entropy,6.0,1,,PRUNED
60,,2026-09-21 02:14:31.576506,2026-09-21 02:14:31.580030,0 days 00:00:00.003524,entropy,3.0,20,,PRUNED
61,,2026-09-21 02:14:31.580030,2026-09-21 02:14:31.582892,0 days 00:00:00.002862,gini,6.0,5,,PRUNED
62,,2026-09-21 02:14:31.582892,2026-09-21 02:14:31.585267,0 days 00:00:00.002375,gini,6.0,5,,PRUNED
63,,2026-09-21 02:14:31.585267,2026-09-21 02:14:31.587586,0 days 00:00:00.002319,entropy,6.0,5,,PRUNED
64,,2026-09-21 02:14:31.587586,2026-09-21 02:14:31.589890,0 days 00:00:00.002304,entropy,6.0,20,,PRUNED
65,,2026-09-21 02:14:31.589890,2026-09-21 02:14:31.592202,0 days 00:00:00.002312,gini,3.0,1,,PRUNED
66,,2026-09-21 02:14:31.592202,2026-09-21 02:14:31.594510,0 days 00:00:00.002308,entropy,6.0,5,,PRUNED
67,0.4786567255373888,2026-09-21 02:14:31.594510,2026-09-21 02:14:32.031136,0 days 00:00:00.436626,gini,,1,"{'criterion': 'gini', 'max_depth': None, 'min_samples_leaf': 1}",COMPLETE
68,,2026-09-21 02:14:32.031136,2026-09-21 02:14:32.031136,0 days 00:00:00,entropy,3.0,20,,PRUNED
69,,2026-09-21 02:14:32.031136,2026-09-21 02:14:32.031136,0 days 00:00:00,entropy,6.0,5,,PRUNED
70,,2026-09-21 02:14:32.031136,2026-09-21 02:14:32.031136,0 days 00:00:00,entropy,3.0,20,,PRUNED
71,,2026-09-21 02:14:32.031136,2026-09-21 02:14:32.047077,0 days 00:00:00.015941,gini,6.0,20,,PRUNED
72,,2026-09-21 02:14:32.047077,2026-09-21 02:14:32.047077,0 days 00:00:00,gini,6.0,20,,PRUNED
73,,2026-09-21 02:14:32.047077,2026-09-21 02:14:32.047077,0 days 00:00:00,gini,6.0,20,,PRUNED
74,,2026-09-21 02:14:32.047077,2026-09-21 02:14:32.055657,0 days 00:00:00.008580,gini,6.0,20,,PRUNED
75,0.5242873163471935,2026-09-21 02:14:32.055657,2026-09-21 02:14:32.471118,0 days 00:00:00.415461,gini,12.0,5,,COMPLETE
76,,2026-09-21 02:14:32.471118,2026-09-21 02:14:32.479130,0 days 00:00:00.008012,entropy,6.0,20,,PRUNED
77,,2026-09-21 02:14:32.479130,2026-09-21 02:14:32.479130,0 days 00:00:00,gini,6.0,5,,PRUNED
78,,2026-09-21 02:14:32.479130,2026-09-21 02:14:32.479130,0 days 00:00:00,entropy,3.0,20,,PRUNED
79,,2026-09-21 02:14:32.479130,2026-09-21 02:14:32.486844,0 days 00:00:00.007714,entropy,6.0,5,,PRUNED
80,,2026-09-21 02:14:32.486844,2026-09-21 02:14:32.486844,0 days 00:00:00,entropy,3.0,1,,PRUNED
81,,2026-09-21 02:14:32.486844,2026-09-21 02:14:32.486844,0 days 00:00:00,gini,6.0,1,,PRUNED
82,,2026-09-21 02:14:32.486844,2026-09-21 02:14:32.494337,0 days 00:00:00.007493,gini,6.0,1,,PRUNED
83,,2026-09-21 02:14:32.494337,2026-09-21 02:14:32.496570,0 days 00:00:00.002233,gini,6.0,1,,PRUNED
84,0.4995364433041926,2026-09-21 02:14:32.496570,2026-09-21 02:14:32.891704,0 days 00:00:00.395134,gini,12.0,1,"{'criterion': 'gini', 'max_depth': 12, 'min_samples_leaf': 1}",COMPLETE
