number,value,datetime_start,datetime_complete,duration,params_n_neighbors,params_p,params_weights,system_attrs_fixed_params,state
0,0.603798349326034,2026-09-19 22:38:54.126379,2026-09-19 22:38:54.924850,0 days 00:00:00.798471,81,1,uniform,,COMPLETE
1,0.5374013771585676,2026-09-19 22:38:54.924850,2026-09-19 22:38:55.591871,0 days 00:00:00.667021,3,1,uniform,,COMPLETE
2,0.5831617927969389,2026-09-19 22:38:55.591871,2026-09-19 22:38:56.242697,0 days 00:00:00.650826,11,1,uniform,,COMPLETE
3,0.5992700095348469,2026-09-19 22:38:56.242697,2026-09-19 22:38:56.948165,0 days 00:00:00.705468,41,1,distance,,COMPLETE
4,0.6034067095459275,2026-09-19 22:38:56.948165,2026-09-19 22:38:57.719325,0 days 00:00:00.771160,81,1,distance,,COMPLETE
5,0.599499369136809,2026-09-19 22:38:57.719325,2026-09-19 22:38:58.218443,0 days 00:00:00.499118,41,2,uniform,,COMPLETE
6,0.5797785523537775,2026-09-19 22:38:58.218443,2026-09-19 22:38:58.672207,0 days 00:00:00.453764,11,2,distance,,COMPLETE
7,0.5772721821005743,2026-09-19 22:38:58.672207,2026-09-19 22:38:59.115950,0 days 00:00:00.443743,11,2,uniform,,COMPLETE
8,0.583527538505733,2026-09-19 22:38:59.115950,2026-09-19 22:38:59.736294,0 days 00:00:00.620344,5,1,uniform,,COMPLETE
9,0.5934978170161648,2026-09-19 22:38:59.736294,2026-09-19 22:39:00.411353,0 days 00:00:00.675059,21,1,uniform,,COMPLETE
10,0.6020372578092302,2026-09-19 22:39:00.411353,2026-09-19 22:39:01.006462,0 days 00:00:00.595109,81,2,distance,,COMPLETE
11,,2026-09-19 22:39:01.006462,2026-09-19 22:39:01.006462,0 days 00:00:00,81,1,distance,,PRUNED
12,,2026-09-19 22:39:01.006462,2026-09-19 22:39:01.006462,0 days 00:00:00,81,1,distance,,PRUNED
13,,2026-09-19 22:39:01.006462,2026-09-19 22:39:01.022490,0 days 00:00:00.016028,81,1,distance,,PRUNED
14,,2026-09-19 22:39:01.022490,2026-09-19 22:39:01.022490,0 days 00:00:00,81,1,uniform,,PRUNED
15,0.5734811913503722,2026-09-19 22:39:01.022490,2026-09-19 22:39:01.641071,0 days 00:00:00.618581,5,1,distance,,COMPLETE
16,0.5875456603956359,2026-09-19 22:39:01.641071,2026-09-19 22:39:02.357591,0 days 00:00:00.716520,21,1,distance,,COMPLETE
17,,2026-09-19 22:39:02.357591,2026-09-19 22:39:02.373459,0 days 00:00:00.015868,3,1,uniform,,PRUNED
18,0.6024729875858473,2026-09-19 22:39:02.373459,2026-09-19 22:39:03.038189,0 days 00:00:00.664730,81,2,uniform,,COMPLETE
19,,2026-09-19 22:39:03.038189,2026-09-19 22:39:03.054186,0 days 00:00:00.015997,81,1,distance,,PRUNED
20,,2026-09-19 22:39:03.054186,2026-09-19 22:39:03.060894,0 days 00:00:00.006708,81,1,distance,,PRUNED
21,,2026-09-19 22:39:03.060894,2026-09-19 22:39:03.070074,0 days 00:00:00.009180,81,2,uniform,,PRUNED
22,,2026-09-19 22:39:03.070074,2026-09-19 22:39:03.085310,0 days 00:00:00.015236,81,2,uniform,,PRUNED
23,,2026-09-19 22:39:03.085310,2026-09-19 22:39:03.100957,0 days 00:00:00.015647,81,2,uniform,,PRUNED
24,,2026-09-19 22:39:03.100957,2026-09-19 22:39:03.100957,0 days 00:00:00,81,2,uniform,,PRUNED
25,0.5812005997488897,2026-09-19 22:39:03.100957,2026-09-19 22:39:03.784538,0 days 00:00:00.683581,5,2,uniform,,COMPLETE
26,0.5380963882449633,2026-09-19 22:39:03.784538,2026-09-19 22:39:04.753900,0 days 00:00:00.969362,3,2,uniform,,COMPLETE
27,0.5991510388887203,2026-09-19 22:39:04.753900,2026-09-19 22:39:05.897761,0 days 00:00:01.143861,41,1,uniform,,COMPLETE
28,0.5884978494902208,2026-09-19 22:39:05.897761,2026-09-19 22:39:06.515301,0 days 00:00:00.617540,21,2,distance,,COMPLETE
29,,2026-09-19 22:39:06.515301,2026-09-19 22:39:06.531114,0 days 00:00:00.015813,3,1,uniform,,PRUNED
30,,2026-09-19 22:39:06.531114,2026-09-19 22:39:06.531114,0 days 00:00:00,81,1,uniform,,PRUNED
31,,2026-09-19 22:39:06.531114,2026-09-19 22:39:06.547198,0 days 00:00:00.016084,81,2,distance,,PRUNED
32,,2026-09-19 22:39:06.547198,2026-09-19 22:39:06.547198,0 days 00:00:00,81,2,distance,,PRUNED
33,,2026-09-19 22:39:06.547198,2026-09-19 22:39:06.553534,0 days 00:00:00.006336,81,2,distance,,PRUNED
34,,2026-09-19 22:39:06.553534,2026-09-19 22:39:06.563006,0 days 00:00:00.009472,11,2,distance,,PRUNED
35,0.599343094785129,2026-09-19 22:39:06.563006,2026-09-19 22:39:07.168745,0 days 00:00:00.605739,41,2,distance,,COMPLETE
36,,2026-09-19 22:39:07.168745,2026-09-19 22:39:07.168745,0 days 00:00:00,81,2,distance,,PRUNED
37,,2026-09-19 22:39:07.168745,2026-09-19 22:39:07.180334,0 days 00:00:00.011589,11,1,uniform,,PRUNED
38,,2026-09-19 22:39:07.180334,2026-09-19 22:39:07.182575,0 days 00:00:00.002241,81,2,distance,,PRUNED
39,,2026-09-19 22:39:07.182575,2026-09-19 22:39:07.182575,0 days 00:00:00,41,1,uniform,,PRUNED
40,,2026-09-19 22:39:07.182575,2026-09-19 22:39:07.189664,0 days 00:00:00.007089,5,2,uniform,,PRUNED
41,,2026-09-19 22:39:07.189664,2026-09-19 22:39:07.193305,0 days 00:00:00.003641,41,2,uniform,,PRUNED
42,,2026-09-19 22:39:07.193305,2026-09-19 22:39:07.198506,0 days 00:00:00.005201,41,2,uniform,,PRUNED
43,,2026-09-19 22:39:07.198506,2026-09-19 22:39:07.202504,0 days 00:00:00.003998,41,2,uniform,,PRUNED
44,0.5818061410588735,2026-09-19 22:39:07.202504,2026-09-19 22:39:07.947364,0 days 00:00:00.744860,11,1,distance,"{'n_neighbors': 11, 'p': 1, 'weights': 'distance'}",COMPLETE
45,0.5910203377050146,2026-09-19 22:39:07.947364,2026-09-19 22:39:08.467944,0 days 00:00:00.520580,21,2,uniform,,COMPLETE
46,,2026-09-19 22:39:08.467944,2026-09-19 22:39:08.467944,0 days 00:00:00,81,1,uniform,,PRUNED
47,,2026-09-19 22:39:08.467944,2026-09-19 22:39:08.467944,0 days 00:00:00,81,1,distance,,PRUNED
48,,2026-09-19 22:39:08.467944,2026-09-19 22:39:08.483609,0 days 00:00:00.015665,3,2,uniform,,PRUNED
49,,2026-09-19 22:39:08.483609,2026-09-19 22:39:08.485976,0 days 00:00:00.002367,81,1,distance,,PRUNED
50,,2026-09-19 22:39:08.485976,2026-09-19 22:39:08.488513,0 days 00:00:00.002537,41,1,uniform,,PRUNED
51,,2026-09-19 22:39:08.488513,2026-09-19 22:39:08.488513,0 days 00:00:00,41,2,distance,,PRUNED
52,,2026-09-19 22:39:08.488513,2026-09-19 22:39:08.488513,0 days 00:00:00,41,2,distance,,PRUNED
53,,2026-09-19 22:39:08.488513,2026-09-19 22:39:08.499618,0 days 00:00:00.011105,41,2,distance,,PRUNED
54,0.5312536565634557,2026-09-19 22:39:08.499618,2026-09-19 22:39:08.976694,0 days 00:00:00.477076,3,2,distance,"{'n_neighbors': 3, 'p': 2, 'weights': 'distance'}",COMPLETE
55,0.5717404696732643,2026-09-19 22:39:08.976694,2026-09-19 22:39:09.530194,0 days 00:00:00.553500,5,2,distance,,COMPLETE
56,,2026-09-19 22:39:09.530194,2026-09-19 22:39:09.533625,0 days 00:00:00.003431,81,2,distance,,PRUNED
57,,2026-09-19 22:39:09.533625,2026-09-19 22:39:09.538537,0 days 00:00:00.004912,21,1,uniform,,PRUNED
58,,2026-09-19 22:39:09.538537,2026-09-19 22:39:09.545875,0 days 00:00:00.007338,41,2,distance,,PRUNED
59,,2026-09-19 22:39:09.545875,2026-09-19 22:39:09.549485,0 days 00:00:00.003610,81,2,uniform,,PRUNED
60,,2026-09-19 22:39:09.549485,2026-09-19 22:39:09.561588,0 days 00:00:00.012103,81,1,distance,,PRUNED
61,,2026-09-19 22:39:09.561588,2026-09-19 22:39:09.561588,0 days 00:00:00,41,1,distance,,PRUNED
62,,2026-09-19 22:39:09.561588,2026-09-19 22:39:09.577328,0 days 00:00:00.015740,41,1,distance,,PRUNED
63,,2026-09-19 22:39:09.577328,2026-09-19 22:39:09.585341,0 days 00:00:00.008013,41,1,distance,,PRUNED
64,0.5349073844100127,2026-09-19 22:39:09.585341,2026-09-19 22:39:10.233583,0 days 00:00:00.648242,3,1,distance,"{'n_neighbors': 3, 'p': 1, 'weights': 'distance'}",COMPLETE
