number,value,datetime_start,datetime_complete,duration,params_criterion,params_max_depth,params_min_samples_leaf,system_attrs_fixed_params,state
0,0.49515944631392883,2026-09-21 02:14:46.299263,2026-09-21 02:14:46.691471,0 days 00:00:00.392208,gini,3.0,1,,COMPLETE
1,0.5076800423184463,2026-09-21 02:14:46.691471,2026-09-21 02:14:47.116061,0 days 00:00:00.424590,gini,,1,,COMPLETE
2,0.5479844384999256,2026-09-21 02:14:47.116061,2026-09-21 02:14:47.523190,0 days 00:00:00.407129,entropy,,20,,COMPLETE
3,0.5209709713378675,2026-09-21 02:14:47.523190,2026-09-21 02:14:47.945317,0 days 00:00:00.422127,gini,,20,,COMPLETE
4,0.49515944631392883,2026-09-21 02:14:47.945317,2026-09-21 02:14:48.360285,0 days 00:00:00.414968,gini,3.0,20,,COMPLETE
5,0.5479844384999256,2026-09-21 02:14:48.360285,2026-09-21 02:14:48.775143,0 days 00:00:00.414858,entropy,12.0,20,,COMPLETE
6,,2026-09-21 02:14:48.775143,2026-09-21 02:14:48.776189,0 days 00:00:00.001046,gini,,20,,PRUNED
7,0.5260636161792732,2026-09-21 02:14:48.776189,2026-09-21 02:14:49.190580,0 days 00:00:00.414391,entropy,12.0,1,,COMPLETE
8,0.5350295938092802,2026-09-21 02:14:49.190580,2026-09-21 02:14:49.630637,0 days 00:00:00.440057,entropy,6.0,5,,COMPLETE
9,,2026-09-21 02:14:49.630637,2026-09-21 02:14:49.630637,0 days 00:00:00,entropy,6.0,5,,PRUNED
10,,2026-09-21 02:14:49.630637,2026-09-21 02:14:49.630637,0 days 00:00:00,entropy,,20,,PRUNED
11,,2026-09-21 02:14:49.630637,2026-09-21 02:14:49.630637,0 days 00:00:00,entropy,12.0,20,,PRUNED
12,,2026-09-21 02:14:49.630637,2026-09-21 02:14:49.630637,0 days 00:00:00,entropy,12.0,20,,PRUNED
13,,2026-09-21 02:14:49.630637,2026-09-21 02:14:49.642738,0 days 00:00:00.012101,entropy,12.0,20,,PRUNED
14,,2026-09-21 02:14:49.642738,2026-09-21 02:14:49.642738,0 days 00:00:00,entropy,,20,,PRUNED
15,0.5272504500027649,2026-09-21 02:14:49.642738,2026-09-21 02:14:50.054197,0 days 00:00:00.411459,entropy,12.0,5,,COMPLETE
16,0.5412050411931797,2026-09-21 02:14:50.054197,2026-09-21 02:14:50.471592,0 days 00:00:00.417395,entropy,6.0,20,,COMPLETE
17,0.5927431620998113,2026-09-21 02:14:50.471592,2026-09-21 02:14:50.875042,0 days 00:00:00.403450,entropy,3.0,20,,COMPLETE
18,0.5927431620998113,2026-09-21 02:14:50.875042,2026-09-21 02:14:51.281191,0 days 00:00:00.406149,entropy,3.0,5,,COMPLETE
19,,2026-09-21 02:14:51.281191,2026-09-21 02:14:51.283195,0 days 00:00:00.002004,entropy,3.0,5,,PRUNED
20,,2026-09-21 02:14:51.283195,2026-09-21 02:14:51.285199,0 days 00:00:00.002004,entropy,3.0,5,,PRUNED
21,,2026-09-21 02:14:51.285199,2026-09-21 02:14:51.286951,0 days 00:00:00.001752,entropy,3.0,5,,PRUNED
22,,2026-09-21 02:14:51.286951,2026-09-21 02:14:51.286951,0 days 00:00:00,entropy,3.0,5,,PRUNED
23,0.5927431620998113,2026-09-21 02:14:51.286951,2026-09-21 02:14:51.686608,0 days 00:00:00.399657,entropy,3.0,1,,COMPLETE
24,,2026-09-21 02:14:51.686608,2026-09-21 02:14:51.686608,0 days 00:00:00,entropy,3.0,1,,PRUNED
25,,2026-09-21 02:14:51.686608,2026-09-21 02:14:51.691605,0 days 00:00:00.004997,entropy,3.0,1,,PRUNED
26,,2026-09-21 02:14:51.691605,2026-09-21 02:14:51.693861,0 days 00:00:00.002256,gini,3.0,1,,PRUNED
27,,2026-09-21 02:14:51.693861,2026-09-21 02:14:51.693861,0 days 00:00:00,entropy,3.0,1,,PRUNED
28,,2026-09-21 02:14:51.693861,2026-09-21 02:14:51.693861,0 days 00:00:00,entropy,3.0,5,,PRUNED
29,,2026-09-21 02:14:51.693861,2026-09-21 02:14:51.693861,0 days 00:00:00,gini,3.0,1,,PRUNED
30,,2026-09-21 02:14:51.693861,2026-09-21 02:14:51.693861,0 days 00:00:00,entropy,3.0,1,,PRUNED
31,,2026-09-21 02:14:51.693861,2026-09-21 02:14:51.693861,0 days 00:00:00,entropy,,20,,PRUNED
32,0.5173465956681743,2026-09-21 02:14:51.693861,2026-09-21 02:14:52.102294,0 days 00:00:00.408433,gini,6.0,5,"{'criterion': 'gini', 'max_depth': 6, 'min_samples_leaf': 5}",COMPLETE
33,,2026-09-21 02:14:52.102294,2026-09-21 02:14:52.107230,0 days 00:00:00.004936,entropy,,20,,PRUNED
34,,2026-09-21 02:14:52.107230,2026-09-21 02:14:52.107230,0 days 00:00:00,entropy,3.0,1,,PRUNED
35,,2026-09-21 02:14:52.107230,2026-09-21 02:14:52.107230,0 days 00:00:00,entropy,,20,,PRUNED
36,,2026-09-21 02:14:52.107230,2026-09-21 02:14:52.107230,0 days 00:00:00,gini,3.0,20,,PRUNED
37,0.5181710066422589,2026-09-21 02:14:52.107230,2026-09-21 02:14:52.539247,0 days 00:00:00.432017,entropy,,1,,COMPLETE
38,,2026-09-21 02:14:52.539247,2026-09-21 02:14:52.547571,0 days 00:00:00.008324,gini,3.0,20,,PRUNED
39,,2026-09-21 02:14:52.547571,2026-09-21 02:14:52.547571,0 days 00:00:00,entropy,,20,,PRUNED
40,,2026-09-21 02:14:52.547571,2026-09-21 02:14:52.547571,0 days 00:00:00,entropy,3.0,5,,PRUNED
41,,2026-09-21 02:14:52.547571,2026-09-21 02:14:52.547571,0 days 00:00:00,entropy,12.0,20,,PRUNED
42,,2026-09-21 02:14:52.547571,2026-09-21 02:14:52.555076,0 days 00:00:00.007505,entropy,12.0,20,,PRUNED
43,,2026-09-21 02:14:52.555076,2026-09-21 02:14:52.555076,0 days 00:00:00,entropy,12.0,20,,PRUNED
44,,2026-09-21 02:14:52.555076,2026-09-21 02:14:52.555076,0 days 00:00:00,entropy,6.0,20,,PRUNED
45,,2026-09-21 02:14:52.555076,2026-09-21 02:14:52.555076,0 days 00:00:00,entropy,12.0,20,,PRUNED
46,0.49515944631392883,2026-09-21 02:14:52.555076,2026-09-21 02:14:52.970425,0 days 00:00:00.415349,gini,3.0,5,"{'criterion': 'gini', 'max_depth': 3, 'min_samples_leaf': 5}",COMPLETE
47,,2026-09-21 02:14:52.970425,2026-09-21 02:14:52.979897,0 days 00:00:00.009472,entropy,,20,,PRUNED
48,,2026-09-21 02:14:52.979897,2026-09-21 02:14:52.982319,0 days 00:00:00.002422,entropy,12.0,20,,PRUNED
49,0.5315965683611974,2026-09-21 02:14:52.982319,2026-09-21 02:14:53.390624,0 days 00:00:00.408305,entropy,6.0,1,,COMPLETE
50,,2026-09-21 02:14:53.390624,2026-09-21 02:14:53.393787,0 days 00:00:00.003163,entropy,,20,,PRUNED
51,,2026-09-21 02:14:53.393787,2026-09-21 02:14:53.393787,0 days 00:00:00,entropy,6.0,20,,PRUNED
52,,2026-09-21 02:14:53.393787,2026-09-21 02:14:53.393787,0 days 00:00:00,entropy,6.0,20,,PRUNED
53,,2026-09-21 02:14:53.393787,2026-09-21 02:14:53.393787,0 days 00:00:00,entropy,6.0,20,,PRUNED
54,,2026-09-21 02:14:53.393787,2026-09-21 02:14:53.393787,0 days 00:00:00,entropy,6.0,20,,PRUNED
55,,2026-09-21 02:14:53.393787,2026-09-21 02:14:53.393787,0 days 00:00:00,entropy,3.0,20,,PRUNED
56,,2026-09-21 02:14:53.393787,2026-09-21 02:14:53.406495,0 days 00:00:00.012708,entropy,12.0,5,,PRUNED
57,,2026-09-21 02:14:53.406495,2026-09-21 02:14:53.406495,0 days 00:00:00,entropy,3.0,1,,PRUNED
58,0.5166131946749272,2026-09-21 02:14:53.406495,2026-09-21 02:14:53.810197,0 days 00:00:00.403702,gini,,5,"{'criterion': 'gini', 'max_depth': None, 'min_samples_leaf': 5}",COMPLETE
59,,2026-09-21 02:14:53.810197,2026-09-21 02:14:53.815751,0 days 00:00:00.005554,entropy,3.0,20,,PRUNED
60,,2026-09-21 02:14:53.815751,2026-09-21 02:14:53.818364,0 days 00:00:00.002613,entropy,6.0,1,,PRUNED
61,,2026-09-21 02:14:53.818364,2026-09-21 02:14:53.818364,0 days 00:00:00,entropy,6.0,5,,PRUNED
62,,2026-09-21 02:14:53.818364,2026-09-21 02:14:53.818364,0 days 00:00:00,entropy,6.0,5,,PRUNED
63,,2026-09-21 02:14:53.818364,2026-09-21 02:14:53.818364,0 days 00:00:00,entropy,6.0,5,,PRUNED
64,,2026-09-21 02:14:53.818364,2026-09-21 02:14:53.826194,0 days 00:00:00.007830,entropy,3.0,5,,PRUNED
65,,2026-09-21 02:14:53.826194,2026-09-21 02:14:53.826194,0 days 00:00:00,entropy,6.0,5,,PRUNED
66,,2026-09-21 02:14:53.826194,2026-09-21 02:14:53.826194,0 days 00:00:00,entropy,12.0,20,,PRUNED
67,0.5239767552485082,2026-09-21 02:14:53.826194,2026-09-21 02:14:54.255331,0 days 00:00:00.429137,entropy,,5,"{'criterion': 'entropy', 'max_depth': None, 'min_samples_leaf': 5}",COMPLETE
68,,2026-09-21 02:14:54.255331,2026-09-21 02:14:54.260909,0 days 00:00:00.005578,entropy,3.0,1,,PRUNED
69,,2026-09-21 02:14:54.260909,2026-09-21 02:14:54.260909,0 days 00:00:00,entropy,3.0,20,,PRUNED
70,,2026-09-21 02:14:54.260909,2026-09-21 02:14:54.265141,0 days 00:00:00.004232,gini,6.0,5,,PRUNED
71,,2026-09-21 02:14:54.265141,2026-09-21 02:14:54.267927,0 days 00:00:00.002786,entropy,6.0,1,,PRUNED
72,,2026-09-21 02:14:54.267927,2026-09-21 02:14:54.267927,0 days 00:00:00,entropy,6.0,1,,PRUNED
73,,2026-09-21 02:14:54.267927,2026-09-21 02:14:54.267927,0 days 00:00:00,entropy,6.0,1,,PRUNED
74,,2026-09-21 02:14:54.267927,2026-09-21 02:14:54.267927,0 days 00:00:00,entropy,6.0,1,,PRUNED
75,,2026-09-21 02:14:54.267927,2026-09-21 02:14:54.267927,0 days 00:00:00,entropy,3.0,1,,PRUNED
76,0.5061656110926088,2026-09-21 02:14:54.267927,2026-09-21 02:14:54.695796,0 days 00:00:00.427869,gini,12.0,1,"{'criterion': 'gini', 'max_depth': 12, 'min_samples_leaf': 1}",COMPLETE
77,,2026-09-21 02:14:54.695796,2026-09-21 02:14:54.697800,0 days 00:00:00.002004,entropy,3.0,20,,PRUNED
78,,2026-09-21 02:14:54.697800,2026-09-21 02:14:54.697800,0 days 00:00:00,entropy,,20,,PRUNED
79,,2026-09-21 02:14:54.697800,2026-09-21 02:14:54.702823,0 days 00:00:00.005023,entropy,6.0,1,,PRUNED
80,,2026-09-21 02:14:54.702823,2026-09-21 02:14:54.704830,0 days 00:00:00.002007,entropy,3.0,20,,PRUNED
81,,2026-09-21 02:14:54.704830,2026-09-21 02:14:54.707402,0 days 00:00:00.002572,entropy,12.0,5,,PRUNED
82,,2026-09-21 02:14:54.707402,2026-09-21 02:14:54.709523,0 days 00:00:00.002121,entropy,12.0,5,,PRUNED
83,,2026-09-21 02:14:54.709523,2026-09-21 02:14:54.711802,0 days 00:00:00.002279,entropy,12.0,5,,PRUNED
84,,2026-09-21 02:14:54.711802,2026-09-21 02:14:54.711802,0 days 00:00:00,entropy,12.0,5,,PRUNED
85,0.5168376599373502,2026-09-21 02:14:54.711802,2026-09-21 02:14:55.123025,0 days 00:00:00.411223,gini,12.0,5,"{'criterion': 'gini', 'max_depth': 12, 'min_samples_leaf': 5}",COMPLETE
86,,2026-09-21 02:14:55.123025,2026-09-21 02:14:55.127100,0 days 00:00:00.004075,entropy,,20,,PRUNED
87,,2026-09-21 02:14:55.127100,2026-09-21 02:14:55.129615,0 days 00:00:00.002515,entropy,3.0,20,,PRUNED
88,,2026-09-21 02:14:55.129615,2026-09-21 02:14:55.131620,0 days 00:00:00.002005,entropy,6.0,5,,PRUNED
89,,2026-09-21 02:14:55.131620,2026-09-21 02:14:55.133621,0 days 00:00:00.002001,entropy,12.0,1,,PRUNED
90,,2026-09-21 02:14:55.133621,2026-09-21 02:14:55.135622,0 days 00:00:00.002001,entropy,3.0,20,,PRUNED
91,,2026-09-21 02:14:55.135622,2026-09-21 02:14:55.138620,0 days 00:00:00.002998,entropy,12.0,1,,PRUNED
92,,2026-09-21 02:14:55.138620,2026-09-21 02:14:55.140620,0 days 00:00:00.002000,entropy,12.0,1,,PRUNED
93,,2026-09-21 02:14:55.140620,2026-09-21 02:14:55.142601,0 days 00:00:00.001981,entropy,12.0,1,,PRUNED
94,0.5209709713378675,2026-09-21 02:14:55.143598,2026-09-21 02:14:55.534994,0 days 00:00:00.391396,gini,12.0,20,"{'criterion': 'gini', 'max_depth': 12, 'min_samples_leaf': 20}",COMPLETE
95,,2026-09-21 02:14:55.534994,2026-09-21 02:14:55.534994,0 days 00:00:00,entropy,6.0,1,,PRUNED
96,,2026-09-21 02:14:55.534994,2026-09-21 02:14:55.534994,0 days 00:00:00,entropy,,5,,PRUNED
97,,2026-09-21 02:14:55.534994,2026-09-21 02:14:55.544692,0 days 00:00:00.009698,entropy,3.0,1,,PRUNED
98,,2026-09-21 02:14:55.544692,2026-09-21 02:14:55.546915,0 days 00:00:00.002223,entropy,12.0,20,,PRUNED
99,,2026-09-21 02:14:55.546915,2026-09-21 02:14:55.549090,0 days 00:00:00.002175,entropy,6.0,5,,PRUNED
100,,2026-09-21 02:14:55.549090,2026-09-21 02:14:55.550827,0 days 00:00:00.001737,entropy,3.0,20,,PRUNED
101,,2026-09-21 02:14:55.550827,2026-09-21 02:14:55.553570,0 days 00:00:00.002743,entropy,,5,,PRUNED
102,,2026-09-21 02:14:55.553570,2026-09-21 02:14:55.553570,0 days 00:00:00,entropy,,5,,PRUNED
103,0.5195643266429784,2026-09-21 02:14:55.553570,2026-09-21 02:14:55.955580,0 days 00:00:00.402010,gini,6.0,1,"{'criterion': 'gini', 'max_depth': 6, 'min_samples_leaf': 1}",COMPLETE
104,,2026-09-21 02:14:55.955580,2026-09-21 02:14:55.955580,0 days 00:00:00,entropy,,5,,PRUNED
105,,2026-09-21 02:14:55.955580,2026-09-21 02:14:55.955580,0 days 00:00:00,entropy,,5,,PRUNED
106,,2026-09-21 02:14:55.955580,2026-09-21 02:14:55.964598,0 days 00:00:00.009018,entropy,,5,,PRUNED
107,,2026-09-21 02:14:55.964598,2026-09-21 02:14:55.964598,0 days 00:00:00,entropy,,5,,PRUNED
108,,2026-09-21 02:14:55.964598,2026-09-21 02:14:55.971254,0 days 00:00:00.006656,entropy,3.0,20,,PRUNED
109,,2026-09-21 02:14:55.971254,2026-09-21 02:14:55.973931,0 days 00:00:00.002677,entropy,12.0,1,,PRUNED
110,,2026-09-21 02:14:55.973931,2026-09-21 02:14:55.973931,0 days 00:00:00,entropy,6.0,20,,PRUNED
111,,2026-09-21 02:14:55.973931,2026-09-21 02:14:55.973931,0 days 00:00:00,gini,,20,,PRUNED
112,0.5096011656707752,2026-09-21 02:14:55.973931,2026-09-21 02:14:56.374765,0 days 00:00:00.400834,gini,6.0,20,"{'criterion': 'gini', 'max_depth': 6, 'min_samples_leaf': 20}",COMPLETE
