number,value,datetime_start,datetime_complete,duration,params_n_neighbors,params_p,params_weights,system_attrs_fixed_params,state
0,0.5645036676286677,2026-09-21 01:10:17.736477,2026-09-21 01:10:18.203082,0 days 00:00:00.466605,11,2,distance,,COMPLETE
1,0.5136269209511527,2026-09-21 01:10:18.203082,2026-09-21 01:10:18.648823,0 days 00:00:00.445741,3,2,distance,,COMPLETE
2,0.5689993939007811,2026-09-21 01:10:18.648823,2026-09-21 01:10:19.313937,0 days 00:00:00.665114,11,1,distance,,COMPLETE
3,0.538737381510833,2026-09-21 01:10:19.313937,2026-09-21 01:10:19.935322,0 days 00:00:00.621385,5,1,distance,,COMPLETE
4,0.5757868450542387,2026-09-21 01:10:19.935322,2026-09-21 01:10:20.420910,0 days 00:00:00.485588,11,2,uniform,,COMPLETE
5,0.5749230014362974,2026-09-21 01:10:20.420910,2026-09-21 01:10:21.179413,0 days 00:00:00.758503,81,1,uniform,,COMPLETE
6,0.5797958676878711,2026-09-21 01:10:21.179413,2026-09-21 01:10:21.846980,0 days 00:00:00.667567,21,1,distance,,COMPLETE
7,0.5752382195381972,2026-09-21 01:10:21.846980,2026-09-21 01:10:22.422498,0 days 00:00:00.575518,81,2,distance,,COMPLETE
8,0.589431737736701,2026-09-21 01:10:22.422498,2026-09-21 01:10:23.075351,0 days 00:00:00.652853,21,1,uniform,,COMPLETE
9,0.5852379731669339,2026-09-21 01:10:23.075351,2026-09-21 01:10:23.780555,0 days 00:00:00.705204,41,1,uniform,,COMPLETE
10,,2026-09-21 01:10:23.780555,2026-09-21 01:10:23.782559,0 days 00:00:00.002004,21,1,uniform,,PRUNED
11,,2026-09-21 01:10:23.782559,2026-09-21 01:10:23.784304,0 days 00:00:00.001745,41,1,uniform,,PRUNED
12,,2026-09-21 01:10:23.784304,2026-09-21 01:10:23.784304,0 days 00:00:00,41,1,uniform,,PRUNED
13,,2026-09-21 01:10:23.784304,2026-09-21 01:10:23.784304,0 days 00:00:00,41,1,uniform,,PRUNED
14,,2026-09-21 01:10:23.784304,2026-09-21 01:10:23.784304,0 days 00:00:00,21,1,uniform,,PRUNED
15,0.5553801257108649,2026-09-21 01:10:23.784304,2026-09-21 01:10:24.407566,0 days 00:00:00.623262,5,1,uniform,,COMPLETE
16,0.527374994347943,2026-09-21 01:10:24.407566,2026-09-21 01:10:25.033323,0 days 00:00:00.625757,3,1,uniform,,COMPLETE
17,,2026-09-21 01:10:25.033323,2026-09-21 01:10:25.033323,0 days 00:00:00,21,1,uniform,,PRUNED
18,0.5855081338905267,2026-09-21 01:10:25.033323,2026-09-21 01:10:25.534648,0 days 00:00:00.501325,41,2,uniform,,COMPLETE
19,,2026-09-21 01:10:25.534648,2026-09-21 01:10:25.534648,0 days 00:00:00,41,2,uniform,,PRUNED
20,0.5826566960142588,2026-09-21 01:10:25.534648,2026-09-21 01:10:26.031818,0 days 00:00:00.497170,21,2,uniform,,COMPLETE
21,,2026-09-21 01:10:26.031818,2026-09-21 01:10:26.031818,0 days 00:00:00,41,2,uniform,,PRUNED
22,,2026-09-21 01:10:26.031818,2026-09-21 01:10:26.031818,0 days 00:00:00,41,2,uniform,,PRUNED
23,,2026-09-21 01:10:26.031818,2026-09-21 01:10:26.041426,0 days 00:00:00.009608,41,2,uniform,,PRUNED
24,,2026-09-21 01:10:26.041426,2026-09-21 01:10:26.041426,0 days 00:00:00,41,1,uniform,,PRUNED
25,,2026-09-21 01:10:26.041426,2026-09-21 01:10:26.041426,0 days 00:00:00,81,1,uniform,,PRUNED
26,0.5516030809400053,2026-09-21 01:10:26.041426,2026-09-21 01:10:26.491172,0 days 00:00:00.449746,5,2,uniform,,COMPLETE
27,,2026-09-21 01:10:26.491172,2026-09-21 01:10:26.503698,0 days 00:00:00.012526,3,1,uniform,,PRUNED
28,,2026-09-21 01:10:26.503698,2026-09-21 01:10:26.503698,0 days 00:00:00,21,2,uniform,,PRUNED
29,,2026-09-21 01:10:26.503698,2026-09-21 01:10:26.503698,0 days 00:00:00,11,2,distance,,PRUNED
30,,2026-09-21 01:10:26.503698,2026-09-21 01:10:26.503698,0 days 00:00:00,41,1,uniform,,PRUNED
31,,2026-09-21 01:10:26.503698,2026-09-21 01:10:26.503698,0 days 00:00:00,21,2,uniform,,PRUNED
32,,2026-09-21 01:10:26.503698,2026-09-21 01:10:26.503698,0 days 00:00:00,21,2,uniform,,PRUNED
33,,2026-09-21 01:10:26.503698,2026-09-21 01:10:26.503698,0 days 00:00:00,21,2,uniform,,PRUNED
34,0.5714408569600485,2026-09-21 01:10:26.503698,2026-09-21 01:10:26.970555,0 days 00:00:00.466857,21,2,distance,,COMPLETE
35,0.5242467207278344,2026-09-21 01:10:26.970555,2026-09-21 01:10:27.417171,0 days 00:00:00.446616,3,2,uniform,,COMPLETE
36,0.540202635748365,2026-09-21 01:10:27.417171,2026-09-21 01:10:27.869842,0 days 00:00:00.452671,5,2,distance,,COMPLETE
37,0.5778774974003413,2026-09-21 01:10:27.869842,2026-09-21 01:10:28.486524,0 days 00:00:00.616682,11,1,uniform,,COMPLETE
38,,2026-09-21 01:10:28.486524,2026-09-21 01:10:28.486524,0 days 00:00:00,81,2,distance,,PRUNED
39,,2026-09-21 01:10:28.486524,2026-09-21 01:10:28.486524,0 days 00:00:00,21,1,uniform,,PRUNED
40,,2026-09-21 01:10:28.486524,2026-09-21 01:10:28.502537,0 days 00:00:00.016013,41,2,uniform,,PRUNED
41,,2026-09-21 01:10:28.502537,2026-09-21 01:10:28.502537,0 days 00:00:00,21,1,distance,,PRUNED
42,,2026-09-21 01:10:28.502537,2026-09-21 01:10:28.502537,0 days 00:00:00,21,1,distance,,PRUNED
43,,2026-09-21 01:10:28.502537,2026-09-21 01:10:28.502537,0 days 00:00:00,21,1,distance,,PRUNED
44,,2026-09-21 01:10:28.502537,2026-09-21 01:10:28.502537,0 days 00:00:00,21,1,distance,,PRUNED
45,,2026-09-21 01:10:28.502537,2026-09-21 01:10:28.502537,0 days 00:00:00,11,1,distance,,PRUNED
46,0.5122930823231033,2026-09-21 01:10:28.502537,2026-09-21 01:10:29.136382,0 days 00:00:00.633845,3,1,distance,"{'n_neighbors': 3, 'p': 1, 'weights': 'distance'}",COMPLETE
47,,2026-09-21 01:10:29.136382,2026-09-21 01:10:29.136382,0 days 00:00:00,41,1,uniform,,PRUNED
48,,2026-09-21 01:10:29.136382,2026-09-21 01:10:29.136382,0 days 00:00:00,21,1,uniform,,PRUNED
49,,2026-09-21 01:10:29.136382,2026-09-21 01:10:29.136382,0 days 00:00:00,81,1,uniform,,PRUNED
50,,2026-09-21 01:10:29.136382,2026-09-21 01:10:29.136382,0 days 00:00:00,41,2,uniform,,PRUNED
51,,2026-09-21 01:10:29.136382,2026-09-21 01:10:29.136382,0 days 00:00:00,11,1,uniform,,PRUNED
52,,2026-09-21 01:10:29.136382,2026-09-21 01:10:29.152212,0 days 00:00:00.015830,11,1,uniform,,PRUNED
53,,2026-09-21 01:10:29.152212,2026-09-21 01:10:29.152212,0 days 00:00:00,11,1,uniform,,PRUNED
54,,2026-09-21 01:10:29.152212,2026-09-21 01:10:29.152212,0 days 00:00:00,11,1,uniform,,PRUNED
55,0.5845166845384865,2026-09-21 01:10:29.152212,2026-09-21 01:10:29.941365,0 days 00:00:00.789153,81,1,distance,"{'n_neighbors': 81, 'p': 1, 'weights': 'distance'}",COMPLETE
56,,2026-09-21 01:10:29.941365,2026-09-21 01:10:29.941365,0 days 00:00:00,5,1,distance,,PRUNED
57,,2026-09-21 01:10:29.941365,2026-09-21 01:10:29.941365,0 days 00:00:00,81,1,distance,,PRUNED
58,,2026-09-21 01:10:29.941365,2026-09-21 01:10:29.941365,0 days 00:00:00,81,2,distance,,PRUNED
59,,2026-09-21 01:10:29.941365,2026-09-21 01:10:29.941365,0 days 00:00:00,81,1,distance,,PRUNED
60,0.5822095289678387,2026-09-21 01:10:29.941365,2026-09-21 01:10:30.456375,0 days 00:00:00.515010,41,2,distance,,COMPLETE
61,,2026-09-21 01:10:30.456375,2026-09-21 01:10:30.456375,0 days 00:00:00,41,2,distance,,PRUNED
62,,2026-09-21 01:10:30.456375,2026-09-21 01:10:30.456375,0 days 00:00:00,41,2,distance,,PRUNED
63,,2026-09-21 01:10:30.456375,2026-09-21 01:10:30.456375,0 days 00:00:00,41,2,distance,,PRUNED
64,,2026-09-21 01:10:30.456375,2026-09-21 01:10:30.456375,0 days 00:00:00,41,2,distance,,PRUNED
65,,2026-09-21 01:10:30.456375,2026-09-21 01:10:30.456375,0 days 00:00:00,21,2,distance,,PRUNED
66,,2026-09-21 01:10:30.456375,2026-09-21 01:10:30.456375,0 days 00:00:00,41,2,uniform,,PRUNED
67,,2026-09-21 01:10:30.456375,2026-09-21 01:10:30.472405,0 days 00:00:00.016030,21,1,distance,,PRUNED
68,,2026-09-21 01:10:30.472405,2026-09-21 01:10:30.472405,0 days 00:00:00,41,2,uniform,,PRUNED
69,0.5706411128816917,2026-09-21 01:10:30.472405,2026-09-21 01:10:31.036919,0 days 00:00:00.564514,81,2,uniform,"{'n_neighbors': 81, 'p': 2, 'weights': 'uniform'}",COMPLETE
70,,2026-09-21 01:10:31.036919,2026-09-21 01:10:31.036919,0 days 00:00:00,3,1,distance,,PRUNED
71,,2026-09-21 01:10:31.036919,2026-09-21 01:10:31.052756,0 days 00:00:00.015837,11,1,uniform,,PRUNED
72,,2026-09-21 01:10:31.052756,2026-09-21 01:10:31.052756,0 days 00:00:00,21,1,uniform,,PRUNED
73,,2026-09-21 01:10:31.052756,2026-09-21 01:10:31.052756,0 days 00:00:00,41,1,uniform,,PRUNED
74,,2026-09-21 01:10:31.052756,2026-09-21 01:10:31.052756,0 days 00:00:00,5,1,uniform,,PRUNED
75,,2026-09-21 01:10:31.052756,2026-09-21 01:10:31.068676,0 days 00:00:00.015920,21,1,uniform,,PRUNED
76,,2026-09-21 01:10:31.068676,2026-09-21 01:10:31.068676,0 days 00:00:00,41,1,uniform,,PRUNED
77,,2026-09-21 01:10:31.068676,2026-09-21 01:10:31.068676,0 days 00:00:00,21,2,uniform,,PRUNED
78,0.5844977086000219,2026-09-21 01:10:31.068676,2026-09-21 01:10:31.772245,0 days 00:00:00.703569,41,1,distance,"{'n_neighbors': 41, 'p': 1, 'weights': 'distance'}",COMPLETE
