number,value,datetime_start,datetime_complete,duration,params_C,params_penalty,state
0,0.6254876133125556,2026-09-19 23:49:00.355453,2026-09-19 23:49:00.766915,0 days 00:00:00.411462,547.2014346268754,l2,COMPLETE
1,0.6230001797627891,2026-09-19 23:49:00.766915,2026-09-19 23:49:01.149336,0 days 00:00:00.382421,0.0025902210952967247,l2,COMPLETE
2,0.6267758741383666,2026-09-19 23:49:01.149336,2026-09-19 23:49:01.544233,0 days 00:00:00.394897,0.12501271489485546,l1,COMPLETE
3,0.6272032293132564,2026-09-19 23:49:01.544233,2026-09-19 23:49:01.942469,0 days 00:00:00.398236,0.672872043036826,l1,COMPLETE
4,0.5520384182950667,2026-09-19 23:49:01.942469,2026-09-19 23:49:02.313842,0 days 00:00:00.371373,0.0044700673611484925,l1,COMPLETE
5,0.6250856143402467,2026-09-19 23:49:02.313842,2026-09-19 23:49:03.821990,0 days 00:00:01.508148,87.31129324777102,l1,COMPLETE
6,0.6272855931370361,2026-09-19 23:49:03.821990,2026-09-19 23:49:04.199926,0 days 00:00:00.377936,1.2166820737344115,l2,COMPLETE
7,0.6272805361655656,2026-09-19 23:49:04.199926,2026-09-19 23:49:04.560462,0 days 00:00:00.360536,1.6286172790817262,l2,COMPLETE
8,0.6270983792048533,2026-09-19 23:49:04.560462,2026-09-19 23:49:04.949513,0 days 00:00:00.389051,17.900798791376516,l2,COMPLETE
9,0.6270889377860739,2026-09-19 23:49:04.949513,2026-09-19 23:49:05.297995,0 days 00:00:00.348482,0.04938882744620772,l2,COMPLETE
10,0.625305231220817,2026-09-19 23:49:05.297995,2026-09-19 23:49:05.688578,0 days 00:00:00.390583,6.296748168417615,l2,COMPLETE
11,0.6270764961737272,2026-09-19 23:49:05.688578,2026-09-19 23:49:06.063475,0 days 00:00:00.374897,1.4476337330895406,l2,COMPLETE
12,0.6281808052133394,2026-09-19 23:49:06.063475,2026-09-19 23:49:06.446309,0 days 00:00:00.382834,0.21929359521527672,l2,COMPLETE
13,0.6300106645806388,2026-09-19 23:49:06.446309,2026-09-19 23:49:06.820402,0 days 00:00:00.374093,0.06287938732252152,l2,COMPLETE
14,0.628084300489658,2026-09-19 23:49:06.820402,2026-09-19 23:49:07.175356,0 days 00:00:00.354954,0.03458950101738024,l2,COMPLETE
15,0.6287006868669198,2026-09-19 23:49:07.175356,2026-09-19 23:49:07.534558,0 days 00:00:00.359202,0.010485339898942484,l2,COMPLETE
16,0.6296716149347729,2026-09-19 23:49:07.534558,2026-09-19 23:49:07.894218,0 days 00:00:00.359660,0.0124983148865928,l2,COMPLETE
17,0.6301794497642409,2026-09-19 23:49:07.894218,2026-09-19 23:49:08.273104,0 days 00:00:00.378886,0.013575739583350677,l2,COMPLETE
18,0.0,2026-09-19 23:49:08.273104,2026-09-19 23:49:08.643586,0 days 00:00:00.370482,0.0010723457688916725,l1,COMPLETE
19,0.6273538915699898,2026-09-19 23:49:08.643586,2026-09-19 23:49:09.004529,0 days 00:00:00.360943,0.1445593616399409,l2,COMPLETE
20,0.6269029296090127,2026-09-19 23:49:09.004529,2026-09-19 23:49:09.383356,0 days 00:00:00.378827,0.030663401861370163,l2,COMPLETE
21,0.6299256631724444,2026-09-19 23:49:09.383356,2026-09-19 23:49:09.763894,0 days 00:00:00.380538,0.012643105338359339,l2,COMPLETE
22,0.6282638568504223,2026-09-19 23:49:09.763894,2026-09-19 23:49:10.135854,0 days 00:00:00.371960,0.007342366565787227,l2,COMPLETE
23,0.6203580736289508,2026-09-19 23:49:10.135854,2026-09-19 23:49:10.509251,0 days 00:00:00.373397,0.0018661325698159884,l2,COMPLETE
