number,value,datetime_start,datetime_complete,duration,params_C,params_penalty,state
0,0.6209584214142079,2026-09-20 20:29:44.993608,2026-09-20 20:29:45.450830,0 days 00:00:00.457222,0.6440526683419241,l2,COMPLETE
1,0.6263974146462897,2026-09-20 20:29:45.450830,2026-09-20 20:29:45.888086,0 days 00:00:00.437256,0.03700721986833172,l2,COMPLETE
2,0.5894201395239397,2026-09-20 20:29:45.888086,2026-09-20 20:29:46.335719,0 days 00:00:00.447633,0.008291701623628574,l1,COMPLETE
3,0.6211879948911448,2026-09-20 20:29:46.335719,2026-09-20 20:29:46.828186,0 days 00:00:00.492467,0.05860749757974777,l1,COMPLETE
4,0.6205198997412492,2026-09-20 20:29:46.831285,2026-09-20 20:29:48.143644,0 days 00:00:01.312359,4.051737196654072,l1,COMPLETE
5,0.6206632340753061,2026-09-20 20:29:48.143644,2026-09-20 20:29:48.603500,0 days 00:00:00.459856,68.5413042089154,l2,COMPLETE
6,0.6203046927720445,2026-09-20 20:29:48.603500,2026-09-20 20:29:49.070347,0 days 00:00:00.466847,15.094681296170748,l2,COMPLETE
7,0.6227090102059504,2026-09-20 20:29:49.070347,2026-09-20 20:29:49.497935,0 days 00:00:00.427588,0.15086215225751606,l2,COMPLETE
8,0.6200705723151773,2026-09-20 20:29:49.497935,2026-09-20 20:29:49.940718,0 days 00:00:00.442783,0.0012794511214697178,l2,COMPLETE
9,0.6208675326600633,2026-09-20 20:29:49.940718,2026-09-20 20:29:50.396432,0 days 00:00:00.455714,233.47318884012557,l2,COMPLETE
10,0.6102600344052739,2026-09-20 20:29:50.396432,2026-09-20 20:29:50.877548,0 days 00:00:00.481116,0.013709326730727436,l1,COMPLETE
11,0.62179011858893,2026-09-20 20:29:50.877548,2026-09-20 20:29:51.324706,0 days 00:00:00.447158,0.28747693657795936,l2,COMPLETE
12,0.6234996199652308,2026-09-20 20:29:51.324706,2026-09-20 20:29:51.775310,0 days 00:00:00.450604,0.1085392181504257,l2,COMPLETE
13,0.6283745183128048,2026-09-20 20:29:51.775310,2026-09-20 20:29:52.209746,0 days 00:00:00.434436,0.02365744432246305,l2,COMPLETE
14,0.6186974523508263,2026-09-20 20:29:52.209746,2026-09-20 20:29:52.649740,0 days 00:00:00.439994,0.001458958891670833,l2,COMPLETE
15,0.6272373143479283,2026-09-20 20:29:52.649740,2026-09-20 20:29:53.139864,0 days 00:00:00.490124,0.019260097310934744,l2,COMPLETE
16,0.6289275990976367,2026-09-20 20:29:53.139864,2026-09-20 20:29:53.574870,0 days 00:00:00.435006,0.006924556084116338,l2,COMPLETE
17,0.6275810937547659,2026-09-20 20:29:53.574870,2026-09-20 20:29:54.005749,0 days 00:00:00.430879,0.004088957095163317,l2,COMPLETE
18,0.6197855961091076,2026-09-20 20:29:54.005749,2026-09-20 20:29:55.263849,0 days 00:00:01.258100,2.4623356260272966,l1,COMPLETE
19,0.6252742440569294,2026-09-20 20:29:55.263849,2026-09-20 20:29:55.725422,0 days 00:00:00.461573,0.0029998689419873823,l2,COMPLETE
20,0.6208675326600633,2026-09-20 20:29:55.725422,2026-09-20 20:29:56.169116,0 days 00:00:00.443694,939.7463904982783,l2,COMPLETE
21,0.6262888074872257,2026-09-20 20:29:56.169116,2026-09-20 20:29:56.588756,0 days 00:00:00.419640,0.004328106497702267,l2,COMPLETE
22,0.6293665557796067,2026-09-20 20:29:56.588756,2026-09-20 20:29:57.031652,0 days 00:00:00.442896,0.0070407763480112295,l2,COMPLETE
23,0.6270978148944717,2026-09-20 20:29:57.031652,2026-09-20 20:29:57.475493,0 days 00:00:00.443841,0.0265515879604285,l2,COMPLETE
