number,value,datetime_start,datetime_complete,duration,params_n_neighbors,params_p,params_weights,system_attrs_fixed_params,state
0,0.5950221679679221,2026-09-19 22:09:54.639355,2026-09-19 22:09:57.493675,0 days 00:00:02.854320,81,1,distance,,COMPLETE
1,0.5194871415693174,2026-09-19 22:09:57.493675,2026-09-19 22:09:59.109480,0 days 00:00:01.615805,3,2,distance,,COMPLETE
2,0.5578151604767574,2026-09-19 22:09:59.113240,2026-09-19 22:10:01.596980,0 days 00:00:02.483740,5,1,uniform,,COMPLETE
3,0.605567415129849,2026-09-19 22:10:01.596980,2026-09-19 22:10:04.133288,0 days 00:00:02.536308,41,1,uniform,,COMPLETE
4,0.5852629462628045,2026-09-19 22:10:04.133288,2026-09-19 22:10:05.114471,0 days 00:00:00.981183,81,2,uniform,,COMPLETE
5,,2026-09-19 22:10:05.114471,2026-09-19 22:10:05.114471,0 days 00:00:00,5,1,uniform,,PRUNED
6,0.5685256340974637,2026-09-19 22:10:05.114471,2026-09-19 22:10:05.869497,0 days 00:00:00.755026,11,2,distance,,COMPLETE
7,0.5722871862325392,2026-09-19 22:10:05.869497,2026-09-19 22:10:07.933651,0 days 00:00:02.064154,11,1,distance,,COMPLETE
8,,2026-09-19 22:10:07.933651,2026-09-19 22:10:07.949763,0 days 00:00:00.016112,41,1,uniform,,PRUNED
9,0.5977170874335966,2026-09-19 22:10:07.949763,2026-09-19 22:10:10.354284,0 days 00:00:02.404521,21,1,uniform,,COMPLETE
10,0.598457645549442,2026-09-19 22:10:10.354284,2026-09-19 22:10:12.107804,0 days 00:00:01.753520,41,2,uniform,,COMPLETE
11,,2026-09-19 22:10:12.107804,2026-09-19 22:10:12.107804,0 days 00:00:00,41,2,uniform,,PRUNED
12,,2026-09-19 22:10:12.107804,2026-09-19 22:10:12.107804,0 days 00:00:00,41,2,uniform,,PRUNED
13,,2026-09-19 22:10:12.123589,2026-09-19 22:10:12.123589,0 days 00:00:00,41,2,uniform,,PRUNED
14,,2026-09-19 22:10:12.123589,2026-09-19 22:10:12.123589,0 days 00:00:00,41,1,uniform,,PRUNED
15,0.5974336366032721,2026-09-19 22:10:12.123589,2026-09-19 22:10:13.755416,0 days 00:00:01.631827,21,2,uniform,,COMPLETE
16,0.5291488687390327,2026-09-19 22:10:13.755416,2026-09-19 22:10:16.201506,0 days 00:00:02.446090,3,1,uniform,,COMPLETE
17,,2026-09-19 22:10:16.201506,2026-09-19 22:10:16.207734,0 days 00:00:00.006228,41,2,uniform,,PRUNED
18,0.5939064358196348,2026-09-19 22:10:16.207734,2026-09-19 22:10:18.816381,0 days 00:00:02.608647,41,1,distance,,COMPLETE
19,,2026-09-19 22:10:18.816930,2026-09-19 22:10:18.824160,0 days 00:00:00.007230,41,2,uniform,,PRUNED
20,,2026-09-19 22:10:18.824160,2026-09-19 22:10:18.824160,0 days 00:00:00,21,2,uniform,,PRUNED
21,,2026-09-19 22:10:18.824160,2026-09-19 22:10:18.837421,0 days 00:00:00.013261,21,1,uniform,,PRUNED
22,,2026-09-19 22:10:18.838771,2026-09-19 22:10:18.843207,0 days 00:00:00.004436,21,1,uniform,,PRUNED
23,,2026-09-19 22:10:18.843207,2026-09-19 22:10:18.847422,0 days 00:00:00.004215,21,1,uniform,,PRUNED
24,0.5950889685748922,2026-09-19 22:10:18.847422,2026-09-19 22:10:21.804160,0 days 00:00:02.956738,81,1,uniform,,COMPLETE
25,0.5926330575673586,2026-09-19 22:10:21.804160,2026-09-19 22:10:24.236562,0 days 00:00:02.432402,11,1,uniform,,COMPLETE
26,0.5361444470545779,2026-09-19 22:10:24.236562,2026-09-19 22:10:26.679661,0 days 00:00:02.443099,5,1,distance,,COMPLETE
27,,2026-09-19 22:10:26.679661,2026-09-19 22:10:26.687378,0 days 00:00:00.007717,3,1,uniform,,PRUNED
28,,2026-09-19 22:10:26.687378,2026-09-19 22:10:26.691835,0 days 00:00:00.004457,21,2,uniform,,PRUNED
29,,2026-09-19 22:10:26.691835,2026-09-19 22:10:26.695851,0 days 00:00:00.004016,81,1,distance,,PRUNED
30,,2026-09-19 22:10:26.695851,2026-09-19 22:10:26.703997,0 days 00:00:00.008146,41,1,uniform,,PRUNED
31,,2026-09-19 22:10:26.703997,2026-09-19 22:10:26.707989,0 days 00:00:00.003992,21,2,uniform,,PRUNED
32,,2026-09-19 22:10:26.707989,2026-09-19 22:10:26.721003,0 days 00:00:00.013014,21,2,uniform,,PRUNED
33,,2026-09-19 22:10:26.721003,2026-09-19 22:10:26.722144,0 days 00:00:00.001141,21,2,uniform,,PRUNED
34,,2026-09-19 22:10:26.722144,2026-09-19 22:10:26.732072,0 days 00:00:00.009928,21,2,uniform,,PRUNED
35,0.5569249880856625,2026-09-19 22:10:26.732072,2026-09-19 22:10:28.406358,0 days 00:00:01.674286,5,2,uniform,"{'n_neighbors': 5, 'p': 2, 'weights': 'uniform'}",COMPLETE
36,0.5836240603080097,2026-09-19 22:10:28.406358,2026-09-19 22:10:30.288284,0 days 00:00:01.881926,81,2,distance,,COMPLETE
37,0.5317136186821211,2026-09-19 22:10:30.288284,2026-09-19 22:10:32.039728,0 days 00:00:01.751444,3,2,uniform,,COMPLETE
38,,2026-09-19 22:10:32.039728,2026-09-19 22:10:32.045481,0 days 00:00:00.005753,11,1,uniform,,PRUNED
39,0.5939104636826504,2026-09-19 22:10:32.045481,2026-09-19 22:10:33.776843,0 days 00:00:01.731362,41,2,distance,,COMPLETE
40,,2026-09-19 22:10:33.776843,2026-09-19 22:10:33.784990,0 days 00:00:00.008147,5,1,uniform,,PRUNED
41,,2026-09-19 22:10:33.784990,2026-09-19 22:10:33.793431,0 days 00:00:00.008441,81,1,uniform,,PRUNED
42,,2026-09-19 22:10:33.793431,2026-09-19 22:10:33.801694,0 days 00:00:00.008263,81,1,uniform,,PRUNED
43,,2026-09-19 22:10:33.801694,2026-09-19 22:10:33.808027,0 days 00:00:00.006333,81,1,uniform,,PRUNED
44,,2026-09-19 22:10:33.808027,2026-09-19 22:10:33.817497,0 days 00:00:00.009470,81,1,uniform,,PRUNED
45,,2026-09-19 22:10:33.817497,2026-09-19 22:10:33.824235,0 days 00:00:00.006738,41,1,uniform,,PRUNED
46,,2026-09-19 22:10:33.827852,2026-09-19 22:10:33.833438,0 days 00:00:00.005586,41,2,uniform,,PRUNED
47,,2026-09-19 22:10:33.833438,2026-09-19 22:10:33.833438,0 days 00:00:00,21,1,uniform,,PRUNED
48,0.5850021771825015,2026-09-19 22:10:33.833438,2026-09-19 22:10:36.095032,0 days 00:00:02.261594,21,1,distance,"{'n_neighbors': 21, 'p': 1, 'weights': 'distance'}",COMPLETE
49,0.5811194252934547,2026-09-19 22:10:36.095032,2026-09-19 22:10:37.651694,0 days 00:00:01.556662,11,2,uniform,,COMPLETE
50,,2026-09-19 22:10:37.651694,2026-09-19 22:10:37.660161,0 days 00:00:00.008467,41,1,uniform,,PRUNED
51,,2026-09-19 22:10:37.660161,2026-09-19 22:10:37.660161,0 days 00:00:00,81,1,distance,,PRUNED
52,,2026-09-19 22:10:37.660161,2026-09-19 22:10:37.673181,0 days 00:00:00.013020,81,1,distance,,PRUNED
53,,2026-09-19 22:10:37.673181,2026-09-19 22:10:37.674793,0 days 00:00:00.001612,81,1,distance,,PRUNED
54,0.5153499005066039,2026-09-19 22:10:37.674793,2026-09-19 22:10:40.027270,0 days 00:00:02.352477,3,1,distance,,COMPLETE
55,,2026-09-19 22:10:40.027270,2026-09-19 22:10:40.037055,0 days 00:00:00.009785,41,2,uniform,,PRUNED
56,,2026-09-19 22:10:40.037055,2026-09-19 22:10:40.042495,0 days 00:00:00.005440,81,1,distance,,PRUNED
57,,2026-09-19 22:10:40.042495,2026-09-19 22:10:40.054570,0 days 00:00:00.012075,41,1,uniform,,PRUNED
58,,2026-09-19 22:10:40.054900,2026-09-19 22:10:40.061577,0 days 00:00:00.006677,21,2,uniform,,PRUNED
59,,2026-09-19 22:10:40.061577,2026-09-19 22:10:40.068413,0 days 00:00:00.006836,5,1,uniform,,PRUNED
60,,2026-09-19 22:10:40.068413,2026-09-19 22:10:40.075892,0 days 00:00:00.007479,41,1,distance,,PRUNED
61,,2026-09-19 22:10:40.075892,2026-09-19 22:10:40.082722,0 days 00:00:00.006830,41,2,distance,,PRUNED
62,,2026-09-19 22:10:40.082722,2026-09-19 22:10:40.087532,0 days 00:00:00.004810,41,2,distance,,PRUNED
63,0.5898704330430143,2026-09-19 22:10:40.087532,2026-09-19 22:10:41.633811,0 days 00:00:01.546279,21,2,distance,"{'n_neighbors': 21, 'p': 2, 'weights': 'distance'}",COMPLETE
64,,2026-09-19 22:10:41.633811,2026-09-19 22:10:41.640353,0 days 00:00:00.006542,41,2,distance,,PRUNED
65,,2026-09-19 22:10:41.640353,2026-09-19 22:10:41.647992,0 days 00:00:00.007639,41,2,distance,,PRUNED
66,,2026-09-19 22:10:41.647992,2026-09-19 22:10:41.656497,0 days 00:00:00.008505,11,2,uniform,,PRUNED
67,,2026-09-19 22:10:41.656497,2026-09-19 22:10:41.660361,0 days 00:00:00.003864,3,2,uniform,,PRUNED
68,,2026-09-19 22:10:41.660361,2026-09-19 22:10:41.671407,0 days 00:00:00.011046,81,1,distance,,PRUNED
69,,2026-09-19 22:10:41.671407,2026-09-19 22:10:41.673209,0 days 00:00:00.001802,21,2,uniform,,PRUNED
70,,2026-09-19 22:10:41.673209,2026-09-19 22:10:41.683128,0 days 00:00:00.009919,41,1,uniform,,PRUNED
71,,2026-09-19 22:10:41.683128,2026-09-19 22:10:41.688956,0 days 00:00:00.005828,41,1,distance,,PRUNED
72,0.5392898493931441,2026-09-19 22:10:41.691535,2026-09-19 22:10:43.338029,0 days 00:00:01.646494,5,2,distance,"{'n_neighbors': 5, 'p': 2, 'weights': 'distance'}",COMPLETE
