number,value,datetime_start,datetime_complete,duration,params_criterion,params_max_depth,params_min_samples_leaf,system_attrs_fixed_params,state
0,0.5113195284826214,2026-09-20 01:45:11.225885,2026-09-20 01:45:12.083988,0 days 00:00:00.858103,gini,,1,,COMPLETE
1,0.5606769882257887,2026-09-20 01:45:12.083988,2026-09-20 01:45:12.582813,0 days 00:00:00.498825,entropy,12.0,1,,COMPLETE
2,,2026-09-20 01:45:12.582813,2026-09-20 01:45:12.582813,0 days 00:00:00,entropy,12.0,1,,PRUNED
3,0.5855017186473791,2026-09-20 01:45:12.582813,2026-09-20 01:45:13.067303,0 days 00:00:00.484490,entropy,,20,,COMPLETE
4,0.5574373073127369,2026-09-20 01:45:13.067303,2026-09-20 01:45:13.488276,0 days 00:00:00.420973,gini,,5,,COMPLETE
5,0.5891515174522025,2026-09-20 01:45:13.488276,2026-09-20 01:45:13.895089,0 days 00:00:00.406813,gini,,20,,COMPLETE
6,0.5811169805149504,2026-09-20 01:45:13.895089,2026-09-20 01:45:14.258267,0 days 00:00:00.363178,entropy,3.0,1,,COMPLETE
7,0.6077163310022259,2026-09-20 01:45:14.258267,2026-09-20 01:45:14.634737,0 days 00:00:00.376470,entropy,6.0,20,,COMPLETE
8,,2026-09-20 01:45:14.634737,2026-09-20 01:45:14.650454,0 days 00:00:00.015717,entropy,6.0,20,,PRUNED
9,0.6096991403407575,2026-09-20 01:45:14.650454,2026-09-20 01:45:15.040544,0 days 00:00:00.390090,entropy,6.0,5,,COMPLETE
10,0.6139062170071529,2026-09-20 01:45:15.040544,2026-09-20 01:45:15.424772,0 days 00:00:00.384228,gini,6.0,5,,COMPLETE
11,,2026-09-20 01:45:15.424772,2026-09-20 01:45:15.424772,0 days 00:00:00,gini,6.0,5,,PRUNED
12,,2026-09-20 01:45:15.424772,2026-09-20 01:45:15.424772,0 days 00:00:00,gini,6.0,5,,PRUNED
13,,2026-09-20 01:45:15.424772,2026-09-20 01:45:15.424772,0 days 00:00:00,gini,6.0,5,,PRUNED
14,0.5811169805149504,2026-09-20 01:45:15.424772,2026-09-20 01:45:15.827282,0 days 00:00:00.402510,entropy,3.0,5,,COMPLETE
15,,2026-09-20 01:45:15.827282,2026-09-20 01:45:15.827282,0 days 00:00:00,gini,6.0,5,,PRUNED
16,,2026-09-20 01:45:15.827282,2026-09-20 01:45:15.827282,0 days 00:00:00,gini,6.0,5,,PRUNED
17,,2026-09-20 01:45:15.827282,2026-09-20 01:45:15.827282,0 days 00:00:00,entropy,6.0,5,,PRUNED
18,0.5655742078552927,2026-09-20 01:45:15.827282,2026-09-20 01:45:16.233828,0 days 00:00:00.406546,gini,12.0,5,,COMPLETE
19,,2026-09-20 01:45:16.233828,2026-09-20 01:45:16.233828,0 days 00:00:00,entropy,3.0,5,,PRUNED
20,,2026-09-20 01:45:16.233828,2026-09-20 01:45:16.233828,0 days 00:00:00,entropy,6.0,5,,PRUNED
21,,2026-09-20 01:45:16.233828,2026-09-20 01:45:16.265254,0 days 00:00:00.031426,entropy,6.0,20,,PRUNED
22,,2026-09-20 01:45:16.265254,2026-09-20 01:45:16.265254,0 days 00:00:00,entropy,6.0,20,,PRUNED
23,,2026-09-20 01:45:16.265254,2026-09-20 01:45:16.265254,0 days 00:00:00,entropy,6.0,20,,PRUNED
24,,2026-09-20 01:45:16.265254,2026-09-20 01:45:16.265254,0 days 00:00:00,entropy,6.0,20,,PRUNED
25,,2026-09-20 01:45:16.265254,2026-09-20 01:45:16.281007,0 days 00:00:00.015753,entropy,6.0,20,,PRUNED
26,,2026-09-20 01:45:16.281007,2026-09-20 01:45:16.296758,0 days 00:00:00.015751,gini,6.0,5,,PRUNED
27,0.5811169805149504,2026-09-20 01:45:16.296758,2026-09-20 01:45:16.656408,0 days 00:00:00.359650,entropy,3.0,20,"{'criterion': 'entropy', 'max_depth': 3, 'min_samples_leaf': 20}",COMPLETE
28,0.5610395530600923,2026-09-20 01:45:16.656408,2026-09-20 01:45:17.036687,0 days 00:00:00.380279,gini,12.0,1,,COMPLETE
29,,2026-09-20 01:45:17.036687,2026-09-20 01:45:17.046130,0 days 00:00:00.009443,gini,,5,,PRUNED
30,0.6070727488604772,2026-09-20 01:45:17.046130,2026-09-20 01:45:17.409151,0 days 00:00:00.363021,entropy,6.0,1,,COMPLETE
31,,2026-09-20 01:45:17.409151,2026-09-20 01:45:17.409151,0 days 00:00:00,entropy,6.0,1,,PRUNED
32,,2026-09-20 01:45:17.409151,2026-09-20 01:45:17.409151,0 days 00:00:00,entropy,6.0,1,,PRUNED
33,,2026-09-20 01:45:17.409151,2026-09-20 01:45:17.424883,0 days 00:00:00.015732,entropy,6.0,1,,PRUNED
34,,2026-09-20 01:45:17.424883,2026-09-20 01:45:17.424883,0 days 00:00:00,entropy,12.0,1,,PRUNED
35,,2026-09-20 01:45:17.424883,2026-09-20 01:45:17.424883,0 days 00:00:00,entropy,6.0,1,,PRUNED
36,0.5137938904843963,2026-09-20 01:45:17.424883,2026-09-20 01:45:17.832291,0 days 00:00:00.407408,entropy,,1,,COMPLETE
37,,2026-09-20 01:45:17.832291,2026-09-20 01:45:17.832291,0 days 00:00:00,entropy,6.0,20,,PRUNED
38,,2026-09-20 01:45:17.832291,2026-09-20 01:45:17.832291,0 days 00:00:00,gini,12.0,1,,PRUNED
39,0.5501175523890215,2026-09-20 01:45:17.832291,2026-09-20 01:45:18.223916,0 days 00:00:00.391625,entropy,,5,,COMPLETE
40,,2026-09-20 01:45:18.223916,2026-09-20 01:45:18.223916,0 days 00:00:00,entropy,6.0,20,,PRUNED
41,,2026-09-20 01:45:18.223916,2026-09-20 01:45:18.223916,0 days 00:00:00,gini,,20,,PRUNED
42,,2026-09-20 01:45:18.223916,2026-09-20 01:45:18.239649,0 days 00:00:00.015733,gini,,20,,PRUNED
43,,2026-09-20 01:45:18.239649,2026-09-20 01:45:18.239649,0 days 00:00:00,gini,,20,,PRUNED
44,0.5766747833116634,2026-09-20 01:45:18.239649,2026-09-20 01:45:18.599150,0 days 00:00:00.359501,gini,3.0,20,,COMPLETE
45,,2026-09-20 01:45:18.599150,2026-09-20 01:45:18.599150,0 days 00:00:00,gini,,5,,PRUNED
46,,2026-09-20 01:45:18.599150,2026-09-20 01:45:18.614848,0 days 00:00:00.015698,gini,6.0,5,,PRUNED
47,,2026-09-20 01:45:18.614848,2026-09-20 01:45:18.614848,0 days 00:00:00,gini,6.0,5,,PRUNED
48,,2026-09-20 01:45:18.614848,2026-09-20 01:45:18.614848,0 days 00:00:00,entropy,,20,,PRUNED
49,0.6124567497973601,2026-09-20 01:45:18.614848,2026-09-20 01:45:19.008325,0 days 00:00:00.393477,gini,6.0,1,,COMPLETE
50,,2026-09-20 01:45:19.008325,2026-09-20 01:45:19.008325,0 days 00:00:00,gini,6.0,1,,PRUNED
51,,2026-09-20 01:45:19.008325,2026-09-20 01:45:19.008325,0 days 00:00:00,gini,6.0,1,,PRUNED
52,,2026-09-20 01:45:19.008325,2026-09-20 01:45:19.024069,0 days 00:00:00.015744,gini,6.0,1,,PRUNED
53,,2026-09-20 01:45:19.024069,2026-09-20 01:45:19.024069,0 days 00:00:00,gini,6.0,1,,PRUNED
54,,2026-09-20 01:45:19.024069,2026-09-20 01:45:19.024069,0 days 00:00:00,gini,6.0,5,,PRUNED
55,,2026-09-20 01:45:19.024069,2026-09-20 01:45:19.039791,0 days 00:00:00.015722,entropy,3.0,5,,PRUNED
56,0.6082402978628196,2026-09-20 01:45:19.039791,2026-09-20 01:45:19.409237,0 days 00:00:00.369446,gini,6.0,20,,COMPLETE
57,,2026-09-20 01:45:19.409237,2026-09-20 01:45:19.409237,0 days 00:00:00,gini,6.0,1,,PRUNED
58,,2026-09-20 01:45:19.409237,2026-09-20 01:45:19.409237,0 days 00:00:00,entropy,6.0,20,,PRUNED
59,,2026-09-20 01:45:19.409237,2026-09-20 01:45:19.424952,0 days 00:00:00.015715,entropy,6.0,5,,PRUNED
60,,2026-09-20 01:45:19.424952,2026-09-20 01:45:19.424952,0 days 00:00:00,gini,6.0,20,,PRUNED
61,,2026-09-20 01:45:19.424952,2026-09-20 01:45:19.424952,0 days 00:00:00,gini,6.0,20,,PRUNED
62,,2026-09-20 01:45:19.424952,2026-09-20 01:45:19.424952,0 days 00:00:00,gini,6.0,20,,PRUNED
63,0.5891515174522025,2026-09-20 01:45:19.424952,2026-09-20 01:45:19.822384,0 days 00:00:00.397432,gini,12.0,20,,COMPLETE
64,,2026-09-20 01:45:19.822384,2026-09-20 01:45:19.822384,0 days 00:00:00,gini,6.0,20,,PRUNED
65,,2026-09-20 01:45:19.822384,2026-09-20 01:45:19.838239,0 days 00:00:00.015855,entropy,6.0,5,,PRUNED
66,0.5766747833116634,2026-09-20 01:45:19.838239,2026-09-20 01:45:20.198132,0 days 00:00:00.359893,gini,3.0,1,,COMPLETE
67,,2026-09-20 01:45:20.198132,2026-09-20 01:45:20.198132,0 days 00:00:00,entropy,6.0,20,,PRUNED
68,,2026-09-20 01:45:20.198132,2026-09-20 01:45:20.213872,0 days 00:00:00.015740,entropy,6.0,1,,PRUNED
69,,2026-09-20 01:45:20.213872,2026-09-20 01:45:20.213872,0 days 00:00:00,gini,,5,,PRUNED
70,,2026-09-20 01:45:20.213872,2026-09-20 01:45:20.213872,0 days 00:00:00,entropy,6.0,20,,PRUNED
71,,2026-09-20 01:45:20.213872,2026-09-20 01:45:20.213872,0 days 00:00:00,gini,6.0,20,,PRUNED
72,,2026-09-20 01:45:20.213872,2026-09-20 01:45:20.228470,0 days 00:00:00.014598,gini,12.0,20,,PRUNED
73,,2026-09-20 01:45:20.228470,2026-09-20 01:45:20.229450,0 days 00:00:00.000980,gini,12.0,20,,PRUNED
74,,2026-09-20 01:45:20.229450,2026-09-20 01:45:20.229450,0 days 00:00:00,gini,12.0,20,,PRUNED
75,0.5855017186473791,2026-09-20 01:45:20.229450,2026-09-20 01:45:20.620044,0 days 00:00:00.390594,entropy,12.0,20,"{'criterion': 'entropy', 'max_depth': 12, 'min_samples_leaf': 20}",COMPLETE
76,,2026-09-20 01:45:20.620044,2026-09-20 01:45:20.620044,0 days 00:00:00,gini,12.0,1,,PRUNED
77,,2026-09-20 01:45:20.620044,2026-09-20 01:45:20.631072,0 days 00:00:00.011028,gini,,5,,PRUNED
78,,2026-09-20 01:45:20.631072,2026-09-20 01:45:20.632828,0 days 00:00:00.001756,gini,12.0,20,,PRUNED
79,,2026-09-20 01:45:20.632828,2026-09-20 01:45:20.632828,0 days 00:00:00,entropy,6.0,20,,PRUNED
80,0.5766747833116634,2026-09-20 01:45:20.632828,2026-09-20 01:45:20.993484,0 days 00:00:00.360656,gini,3.0,5,,COMPLETE
81,,2026-09-20 01:45:20.993484,2026-09-20 01:45:21.005529,0 days 00:00:00.012045,entropy,,20,,PRUNED
82,,2026-09-20 01:45:21.005529,2026-09-20 01:45:21.009132,0 days 00:00:00.003603,entropy,,20,,PRUNED
83,,2026-09-20 01:45:21.009132,2026-09-20 01:45:21.024123,0 days 00:00:00.014991,entropy,,20,,PRUNED
84,,2026-09-20 01:45:21.025127,2026-09-20 01:45:21.027143,0 days 00:00:00.002016,entropy,,1,,PRUNED
85,,2026-09-20 01:45:21.027143,2026-09-20 01:45:21.037599,0 days 00:00:00.010456,entropy,6.0,20,,PRUNED
86,,2026-09-20 01:45:21.037599,2026-09-20 01:45:21.041102,0 days 00:00:00.003503,gini,,20,,PRUNED
87,,2026-09-20 01:45:21.041102,2026-09-20 01:45:21.041102,0 days 00:00:00,entropy,6.0,1,,PRUNED
88,,2026-09-20 01:45:21.041102,2026-09-20 01:45:21.047426,0 days 00:00:00.006324,gini,6.0,5,,PRUNED
89,0.5648773200838877,2026-09-20 01:45:21.047426,2026-09-20 01:45:21.442084,0 days 00:00:00.394658,entropy,12.0,5,"{'criterion': 'entropy', 'max_depth': 12, 'min_samples_leaf': 5}",COMPLETE
