number,value,datetime_start,datetime_complete,duration,params_C,params_penalty,state
0,0.590131546002061,2026-09-19 23:22:38.557919,2026-09-19 23:22:38.928138,0 days 00:00:00.370219,2.565970078192252,l2,COMPLETE
1,0.5935338922798011,2026-09-19 23:22:38.928138,2026-09-19 23:22:39.307396,0 days 00:00:00.379258,7.651543605005099,l2,COMPLETE
2,0.5937254044912202,2026-09-19 23:22:39.307396,2026-09-19 23:22:39.720371,0 days 00:00:00.412975,128.99515453218868,l2,COMPLETE
3,0.5943682845940811,2026-09-19 23:22:39.720371,2026-09-19 23:22:40.105317,0 days 00:00:00.384946,298.11309340420115,l2,COMPLETE
4,0.5958616205518786,2026-09-19 23:22:40.105317,2026-09-19 23:22:41.267394,0 days 00:00:01.162077,18.064289779729638,l1,COMPLETE
5,0.41409920591197286,2026-09-19 23:22:41.267394,2026-09-19 23:22:41.622277,0 days 00:00:00.354883,0.0014225549304137113,l2,COMPLETE
6,0.5949692576827301,2026-09-19 23:22:41.622277,2026-09-19 23:22:42.010870,0 days 00:00:00.388593,39.12370605076035,l2,COMPLETE
7,0.5780213101130007,2026-09-19 23:22:42.010870,2026-09-19 23:22:42.382907,0 days 00:00:00.372037,0.03071772792849835,l2,COMPLETE
8,0.5727211295586262,2026-09-19 23:22:42.382907,2026-09-19 23:22:42.775866,0 days 00:00:00.392959,0.09052587310145063,l1,COMPLETE
9,0.583516690006261,2026-09-19 23:22:42.775866,2026-09-19 23:22:43.179046,0 days 00:00:00.403180,0.24729562252650106,l1,COMPLETE
10,0.5937254044912202,2026-09-19 23:22:43.179046,2026-09-19 23:22:44.397601,0 days 00:00:01.218555,715.2351201716895,l1,COMPLETE
11,0.5952313601099206,2026-09-19 23:22:44.397601,2026-09-19 23:22:45.577847,0 days 00:00:01.180246,25.360449573924132,l1,COMPLETE
12,0.5958616205518786,2026-09-19 23:22:45.577847,2026-09-19 23:22:46.667414,0 days 00:00:01.089567,15.624953518266143,l1,COMPLETE
13,0.591419883534367,2026-09-19 23:22:46.667414,2026-09-19 23:22:47.114531,0 days 00:00:00.447117,0.8923432802992594,l1,COMPLETE
14,0.5944344535611256,2026-09-19 23:22:47.114531,2026-09-19 23:22:47.942757,0 days 00:00:00.828226,7.786164273276392,l1,COMPLETE
15,0.5943481681348833,2026-09-19 23:22:47.942757,2026-09-19 23:22:49.106807,0 days 00:00:01.164050,55.15807728459416,l1,COMPLETE
16,0.5915482456945734,2026-09-19 23:22:49.106807,2026-09-19 23:22:49.635504,0 days 00:00:00.528697,1.3696873346519303,l1,COMPLETE
17,0.5953382148409138,2026-09-19 23:22:49.635504,2026-09-19 23:22:50.603221,0 days 00:00:00.967717,9.776566210515488,l1,COMPLETE
18,0.0,2026-09-19 23:22:50.603221,2026-09-19 23:22:50.942284,0 days 00:00:00.339063,0.00346298453574472,l1,COMPLETE
19,0.5937254044912202,2026-09-19 23:22:50.942284,2026-09-19 23:22:52.210223,0 days 00:00:01.267939,889.9475194858537,l1,COMPLETE
20,0.5883653649674757,2026-09-19 23:22:52.210223,2026-09-19 23:22:52.630031,0 days 00:00:00.419808,0.4493734236927441,l1,COMPLETE
21,0.5944344535611256,2026-09-19 23:22:52.630031,2026-09-19 23:22:53.472541,0 days 00:00:00.842510,8.14127858675113,l1,COMPLETE
22,0.5955932422279013,2026-09-19 23:22:53.472541,2026-09-19 23:22:54.626920,0 days 00:00:01.154379,16.389556556367467,l1,COMPLETE
23,0.5943481681348833,2026-09-19 23:22:54.626920,2026-09-19 23:22:55.944452,0 days 00:00:01.317532,126.81036332061512,l1,COMPLETE
