number,value,datetime_start,datetime_complete,duration,params_C,params_penalty,state
0,0.6095892975968352,2026-09-21 02:03:48.831734,2026-09-21 02:03:50.959346,0 days 00:00:02.127612,467.3697455365469,l1,COMPLETE
1,0.6079404376224194,2026-09-21 02:03:50.959346,2026-09-21 02:03:51.433995,0 days 00:00:00.474649,523.6965687697273,l2,COMPLETE
2,0.6111489573111499,2026-09-21 02:03:51.433995,2026-09-21 02:03:53.186246,0 days 00:00:01.752251,15.24666760459195,l1,COMPLETE
3,0.612723211529764,2026-09-21 02:03:53.186246,2026-09-21 02:03:53.656314,0 days 00:00:00.470068,0.06800720616407954,l1,COMPLETE
4,0.6164580411957905,2026-09-21 02:03:53.656314,2026-09-21 02:03:54.111071,0 days 00:00:00.454757,0.00587941526313307,l2,COMPLETE
5,0.6116149998563168,2026-09-21 02:03:54.111071,2026-09-21 02:03:55.706548,0 days 00:00:01.595477,9.259953498411326,l1,COMPLETE
6,0.6135241732203569,2026-09-21 02:03:55.706548,2026-09-21 02:03:56.136684,0 days 00:00:00.430136,0.10159552207553735,l2,COMPLETE
7,0.6149002082133624,2026-09-21 02:03:56.136684,2026-09-21 02:03:56.565994,0 days 00:00:00.429310,0.027728539413046024,l2,COMPLETE
8,0.611578551531282,2026-09-21 02:03:56.565994,2026-09-21 02:03:56.997498,0 days 00:00:00.431504,0.0010153524678077751,l2,COMPLETE
9,0.616045704793403,2026-09-21 02:03:56.997498,2026-09-21 02:03:57.419487,0 days 00:00:00.421989,0.00218523780820174,l2,COMPLETE
10,0.6122596435273735,2026-09-21 02:03:57.419487,2026-09-21 02:03:57.875175,0 days 00:00:00.455688,1.784611018947986,l2,COMPLETE
11,0.6112725176991344,2026-09-21 02:03:57.875175,2026-09-21 02:03:58.330632,0 days 00:00:00.455457,0.0011579725417687114,l2,COMPLETE
12,0.6149675706348129,2026-09-21 02:03:58.330632,2026-09-21 02:03:58.784694,0 days 00:00:00.454062,0.0069057559040629855,l2,COMPLETE
13,0.6145734999115052,2026-09-21 02:03:58.784694,2026-09-21 02:03:59.234321,0 days 00:00:00.449627,0.008291371526280376,l2,COMPLETE
14,0.613588852753174,2026-09-21 02:03:59.234321,2026-09-21 02:03:59.710770,0 days 00:00:00.476449,0.378177429458956,l2,COMPLETE
15,0.6148086835990291,2026-09-21 02:03:59.710770,2026-09-21 02:04:00.158298,0 days 00:00:00.447528,0.008848918670857098,l2,COMPLETE
16,0.6181877220897194,2026-09-21 02:04:00.158298,2026-09-21 02:04:00.617150,0 days 00:00:00.458852,0.0031907470961655628,l2,COMPLETE
17,0.6132216595157797,2026-09-21 02:04:00.617150,2026-09-21 02:04:01.065982,0 days 00:00:00.448832,0.45179240428214684,l2,COMPLETE
18,0.6135910793674958,2026-09-21 02:04:01.065982,2026-09-21 02:04:01.576437,0 days 00:00:00.510455,0.031811376496029914,l1,COMPLETE
19,0.6093953273020004,2026-09-21 02:04:01.576437,2026-09-21 02:04:02.059959,0 days 00:00:00.483522,67.56306687061185,l2,COMPLETE
20,0.6178747703374026,2026-09-21 02:04:02.059959,2026-09-21 02:04:02.516834,0 days 00:00:00.456875,0.005056695753365825,l2,COMPLETE
21,0.6176795283409119,2026-09-21 02:04:02.516834,2026-09-21 02:04:02.948773,0 days 00:00:00.431939,0.005106812081386624,l2,COMPLETE
22,0.6177815219610667,2026-09-21 02:04:02.948773,2026-09-21 02:04:03.386296,0 days 00:00:00.437523,0.003328757856875769,l2,COMPLETE
23,0.6148758667307569,2026-09-21 02:04:03.386296,2026-09-21 02:04:03.830471,0 days 00:00:00.444175,0.022653230806626685,l2,COMPLETE
