number,value,datetime_start,datetime_complete,duration,params_C,params_penalty,state
0,0.6337987816427241,2026-09-20 20:24:31.850877,2026-09-20 20:24:32.260316,0 days 00:00:00.409439,0.31208937782452123,l1,COMPLETE
1,0.631993385206361,2026-09-20 20:24:32.276093,2026-09-20 20:24:32.687098,0 days 00:00:00.411005,0.048237867121168156,l2,COMPLETE
2,0.633311829205732,2026-09-20 20:24:32.687098,2026-09-20 20:24:34.515824,0 days 00:00:01.828726,103.87080153604093,l1,COMPLETE
3,0.633311829205732,2026-09-20 20:24:34.515824,2026-09-20 20:24:36.222841,0 days 00:00:01.707017,118.4477105410882,l1,COMPLETE
4,0.583575172412973,2026-09-20 20:24:36.222841,2026-09-20 20:24:36.663478,0 days 00:00:00.440637,0.007271511492437645,l1,COMPLETE
5,0.6355102221685097,2026-09-20 20:24:36.663478,2026-09-20 20:24:37.657893,0 days 00:00:00.994415,3.2722681268125626,l1,COMPLETE
6,0.6348737631069518,2026-09-20 20:24:37.657893,2026-09-20 20:24:38.111375,0 days 00:00:00.453482,0.04207063350811828,l1,COMPLETE
7,0.6335305123594476,2026-09-20 20:24:38.111375,2026-09-20 20:24:38.527288,0 days 00:00:00.415913,159.25582925874693,l2,COMPLETE
8,0.6352603840060175,2026-09-20 20:24:38.527288,2026-09-20 20:24:38.942954,0 days 00:00:00.415666,3.4606956204435417,l2,COMPLETE
9,0.6352693328489399,2026-09-20 20:24:38.942954,2026-09-20 20:24:40.161376,0 days 00:00:01.218422,4.982110235955117,l1,COMPLETE
10,0.6337655368324289,2026-09-20 20:24:40.161376,2026-09-20 20:24:40.567306,0 days 00:00:00.405930,8.646507224531446,l2,COMPLETE
11,0.633937887362985,2026-09-20 20:24:40.567306,2026-09-20 20:24:41.989986,0 days 00:00:01.422680,8.873200960794113,l1,COMPLETE
12,0.6351265463597103,2026-09-20 20:24:41.989986,2026-09-20 20:24:42.435621,0 days 00:00:00.445635,0.44342020070305377,l1,COMPLETE
13,0.635470018568311,2026-09-20 20:24:42.435621,2026-09-20 20:24:43.037086,0 days 00:00:00.601465,1.966365370058201,l1,COMPLETE
14,0.6355003560846854,2026-09-20 20:24:43.037086,2026-09-20 20:24:43.471780,0 days 00:00:00.434694,0.9154063769586243,l1,COMPLETE
15,0.6322009231067186,2026-09-20 20:24:43.471780,2026-09-20 20:24:43.935068,0 days 00:00:00.463288,0.08478037945330984,l1,COMPLETE
16,0.5155798469431995,2026-09-20 20:24:43.935068,2026-09-20 20:24:44.329868,0 days 00:00:00.394800,0.0016768886600344217,l1,COMPLETE
17,0.6365680335924239,2026-09-20 20:24:44.329868,2026-09-20 20:24:44.776430,0 days 00:00:00.446562,0.6815161439546089,l1,COMPLETE
18,0.6337382162995914,2026-09-20 20:24:44.776430,2026-09-20 20:24:45.202517,0 days 00:00:00.426087,892.9318712912178,l2,COMPLETE
19,0.6331045410892923,2026-09-20 20:24:45.202517,2026-09-20 20:24:46.822200,0 days 00:00:01.619683,27.536867714021902,l1,COMPLETE
20,0.6335579884008672,2026-09-20 20:24:46.822200,2026-09-20 20:24:47.247357,0 days 00:00:00.425157,0.2120868925173188,l1,COMPLETE
21,0.6356926232963632,2026-09-20 20:24:47.247357,2026-09-20 20:24:47.711249,0 days 00:00:00.463892,0.7581757897752482,l1,COMPLETE
22,0.635679062533875,2026-09-20 20:24:47.711249,2026-09-20 20:24:48.365180,0 days 00:00:00.653931,1.1188092264541298,l1,COMPLETE
23,0.6359287271098517,2026-09-20 20:24:48.365180,2026-09-20 20:24:48.853753,0 days 00:00:00.488573,1.0428755342315492,l1,COMPLETE
