number,value,datetime_start,datetime_complete,duration,params_C,params_penalty,state
0,0.6218286750378849,2026-09-21 02:03:22.896803,2026-09-21 02:03:23.338109,0 days 00:00:00.441306,74.81769072765898,l2,COMPLETE
1,0.6224328681238562,2026-09-21 02:03:23.338109,2026-09-21 02:03:24.839111,0 days 00:00:01.501002,19.26247578353052,l1,COMPLETE
2,0.6222220152494313,2026-09-21 02:03:24.839111,2026-09-21 02:03:25.279683,0 days 00:00:00.440572,135.64139670429802,l2,COMPLETE
3,0.6220355295136062,2026-09-21 02:03:25.279683,2026-09-21 02:03:26.765415,0 days 00:00:01.485732,37.235650422390364,l1,COMPLETE
4,0.6252236652236652,2026-09-21 02:03:26.765415,2026-09-21 02:03:27.203780,0 days 00:00:00.438365,0.3020373186260634,l2,COMPLETE
5,0.622657771867133,2026-09-21 02:03:27.203780,2026-09-21 02:03:27.663916,0 days 00:00:00.460136,5.6449958981132875,l2,COMPLETE
6,0.6261491882388984,2026-09-21 02:03:27.663916,2026-09-21 02:03:28.104458,0 days 00:00:00.440542,0.1951290448463628,l2,COMPLETE
7,0.6228037877886111,2026-09-21 02:03:28.104458,2026-09-21 02:03:28.989766,0 days 00:00:00.885308,2.8085394168157665,l1,COMPLETE
8,0.6289105187064518,2026-09-21 02:03:28.989766,2026-09-21 02:03:29.426342,0 days 00:00:00.436576,0.003212443785640184,l2,COMPLETE
9,0.6214741666434743,2026-09-21 02:03:29.426342,2026-09-21 02:03:29.867218,0 days 00:00:00.440876,0.0011604358177893734,l2,COMPLETE
10,0.33932916232186305,2026-09-21 02:03:29.867218,2026-09-21 02:03:30.296376,0 days 00:00:00.429158,0.0013709531161875351,l1,COMPLETE
11,0.6292063390797215,2026-09-21 02:03:30.296376,2026-09-21 02:03:30.726311,0 days 00:00:00.429935,0.05822339961840194,l2,COMPLETE
12,0.6317111151946436,2026-09-21 02:03:30.726311,2026-09-21 02:03:31.160396,0 days 00:00:00.434085,0.02869347240497391,l2,COMPLETE
13,0.6312622566451189,2026-09-21 02:03:31.160396,2026-09-21 02:03:31.597423,0 days 00:00:00.437027,0.026504170837827704,l2,COMPLETE
14,0.6302159836035566,2026-09-21 02:03:31.597423,2026-09-21 02:03:32.049285,0 days 00:00:00.451862,0.018288173113329947,l2,COMPLETE
15,0.6301478900809833,2026-09-21 02:03:32.049285,2026-09-21 02:03:32.499130,0 days 00:00:00.449845,0.014787052193584505,l2,COMPLETE
16,0.6224101630605983,2026-09-21 02:03:32.499130,2026-09-21 02:03:32.963453,0 days 00:00:00.464323,757.4758422266508,l2,COMPLETE
17,0.6250200798250275,2026-09-21 02:03:32.963453,2026-09-21 02:03:33.402214,0 days 00:00:00.438761,0.3858133095178481,l2,COMPLETE
18,0.603422455783064,2026-09-21 02:03:33.402214,2026-09-21 02:03:33.855515,0 days 00:00:00.453301,0.009338959988973048,l1,COMPLETE
19,0.6277330062825613,2026-09-21 02:03:33.855515,2026-09-21 02:03:34.308551,0 days 00:00:00.453036,0.06439190055639261,l2,COMPLETE
20,0.6271383224048374,2026-09-21 02:03:34.308551,2026-09-21 02:03:34.751070,0 days 00:00:00.442519,0.07343063913964325,l2,COMPLETE
21,0.6306247731858915,2026-09-21 02:03:34.751070,2026-09-21 02:03:35.184866,0 days 00:00:00.433796,0.015874880210158798,l2,COMPLETE
22,0.6314455263374915,2026-09-21 02:03:35.184866,2026-09-21 02:03:35.616822,0 days 00:00:00.431956,0.00527526498893233,l2,COMPLETE
23,0.6311993022039167,2026-09-21 02:03:35.616822,2026-09-21 02:03:36.054834,0 days 00:00:00.438012,0.004539743671861318,l2,COMPLETE
