number,value,datetime_start,datetime_complete,duration,params_criterion,params_max_depth,params_min_samples_leaf,system_attrs_fixed_params,state
0,0.6030464075348981,2026-09-21 02:23:49.952706,2026-09-21 02:23:50.418563,0 days 00:00:00.465857,entropy,6.0,20,,COMPLETE
1,0.579437357502809,2026-09-21 02:23:50.418563,2026-09-21 02:23:50.851247,0 days 00:00:00.432684,entropy,3.0,1,,COMPLETE
2,0.5765228331080067,2026-09-21 02:23:50.851247,2026-09-21 02:23:51.333761,0 days 00:00:00.482514,gini,12.0,20,,COMPLETE
3,0.606287074368906,2026-09-21 02:23:51.333761,2026-09-21 02:23:51.822109,0 days 00:00:00.488348,entropy,6.0,5,,COMPLETE
4,0.5929298216741782,2026-09-21 02:23:51.822109,2026-09-21 02:23:52.306499,0 days 00:00:00.484390,gini,6.0,1,,COMPLETE
5,,2026-09-21 02:23:52.306499,2026-09-21 02:23:52.306499,0 days 00:00:00,entropy,6.0,20,,PRUNED
6,0.575242310583374,2026-09-21 02:23:52.306499,2026-09-21 02:23:52.741145,0 days 00:00:00.434646,gini,3.0,20,,COMPLETE
7,0.5195234989114627,2026-09-21 02:23:52.741145,2026-09-21 02:23:53.257147,0 days 00:00:00.516002,entropy,,1,,COMPLETE
8,0.5284348162707121,2026-09-21 02:23:53.257147,2026-09-21 02:23:53.761896,0 days 00:00:00.504749,entropy,,5,,COMPLETE
9,0.5625445295252839,2026-09-21 02:23:53.761896,2026-09-21 02:23:54.280124,0 days 00:00:00.518228,entropy,12.0,5,,COMPLETE
10,0.594101713440005,2026-09-21 02:23:54.280124,2026-09-21 02:23:54.733590,0 days 00:00:00.453466,gini,6.0,5,,COMPLETE
11,,2026-09-21 02:23:54.733590,2026-09-21 02:23:54.733590,0 days 00:00:00,entropy,6.0,5,,PRUNED
12,,2026-09-21 02:23:54.733590,2026-09-21 02:23:54.733590,0 days 00:00:00,entropy,6.0,20,,PRUNED
13,,2026-09-21 02:23:54.733590,2026-09-21 02:23:54.733590,0 days 00:00:00,entropy,6.0,5,,PRUNED
14,,2026-09-21 02:23:54.733590,2026-09-21 02:23:54.733590,0 days 00:00:00,entropy,6.0,20,,PRUNED
15,,2026-09-21 02:23:54.733590,2026-09-21 02:23:54.746045,0 days 00:00:00.012455,entropy,6.0,20,,PRUNED
16,0.579437357502809,2026-09-21 02:23:54.746045,2026-09-21 02:23:55.177381,0 days 00:00:00.431336,entropy,3.0,5,,COMPLETE
17,0.5921952376662597,2026-09-21 02:23:55.177381,2026-09-21 02:23:55.666070,0 days 00:00:00.488689,entropy,12.0,20,,COMPLETE
18,0.5320224813636899,2026-09-21 02:23:55.666070,2026-09-21 02:23:56.137796,0 days 00:00:00.471726,gini,,5,,COMPLETE
19,0.6067125399798666,2026-09-21 02:23:56.137796,2026-09-21 02:23:56.599692,0 days 00:00:00.461896,entropy,6.0,1,,COMPLETE
20,,2026-09-21 02:23:56.599692,2026-09-21 02:23:56.603367,0 days 00:00:00.003675,entropy,6.0,1,,PRUNED
21,,2026-09-21 02:23:56.603367,2026-09-21 02:23:56.603367,0 days 00:00:00,entropy,6.0,1,,PRUNED
22,,2026-09-21 02:23:56.603367,2026-09-21 02:23:56.603367,0 days 00:00:00,entropy,6.0,1,,PRUNED
23,,2026-09-21 02:23:56.603367,2026-09-21 02:23:56.603367,0 days 00:00:00,entropy,6.0,1,,PRUNED
24,,2026-09-21 02:23:56.603367,2026-09-21 02:23:56.603367,0 days 00:00:00,entropy,6.0,5,,PRUNED
25,,2026-09-21 02:23:56.603367,2026-09-21 02:23:56.603367,0 days 00:00:00,entropy,6.0,1,,PRUNED
26,,2026-09-21 02:23:56.603367,2026-09-21 02:23:56.603367,0 days 00:00:00,gini,3.0,20,,PRUNED
27,,2026-09-21 02:23:56.603367,2026-09-21 02:23:56.603367,0 days 00:00:00,entropy,12.0,20,,PRUNED
28,0.575242310583374,2026-09-21 02:23:56.603367,2026-09-21 02:23:57.078247,0 days 00:00:00.474880,gini,3.0,5,"{'criterion': 'gini', 'max_depth': 3, 'min_samples_leaf': 5}",COMPLETE
29,,2026-09-21 02:23:57.078247,2026-09-21 02:23:57.078247,0 days 00:00:00,entropy,,1,,PRUNED
30,,2026-09-21 02:23:57.078247,2026-09-21 02:23:57.078247,0 days 00:00:00,entropy,6.0,1,,PRUNED
31,,2026-09-21 02:23:57.078247,2026-09-21 02:23:57.078247,0 days 00:00:00,gini,6.0,5,,PRUNED
32,,2026-09-21 02:23:57.078247,2026-09-21 02:23:57.078247,0 days 00:00:00,gini,6.0,5,,PRUNED
33,,2026-09-21 02:23:57.078247,2026-09-21 02:23:57.078247,0 days 00:00:00,gini,6.0,5,,PRUNED
34,,2026-09-21 02:23:57.078247,2026-09-21 02:23:57.091718,0 days 00:00:00.013471,gini,6.0,5,,PRUNED
35,0.5978728752589904,2026-09-21 02:23:57.091718,2026-09-21 02:23:57.555111,0 days 00:00:00.463393,gini,6.0,20,,COMPLETE
36,,2026-09-21 02:23:57.555111,2026-09-21 02:23:57.555111,0 days 00:00:00,gini,12.0,20,,PRUNED
37,,2026-09-21 02:23:57.555111,2026-09-21 02:23:57.555111,0 days 00:00:00,entropy,6.0,20,,PRUNED
38,0.5746172097448087,2026-09-21 02:23:57.555111,2026-09-21 02:23:58.030283,0 days 00:00:00.475172,gini,,20,,COMPLETE
39,0.579437357502809,2026-09-21 02:23:58.030283,2026-09-21 02:23:58.478466,0 days 00:00:00.448183,entropy,3.0,20,,COMPLETE
40,,2026-09-21 02:23:58.478466,2026-09-21 02:23:58.485459,0 days 00:00:00.006993,entropy,6.0,20,,PRUNED
41,,2026-09-21 02:23:58.485459,2026-09-21 02:23:58.487204,0 days 00:00:00.001745,gini,6.0,5,,PRUNED
42,,2026-09-21 02:23:58.487204,2026-09-21 02:23:58.487204,0 days 00:00:00,gini,6.0,1,,PRUNED
43,,2026-09-21 02:23:58.487204,2026-09-21 02:23:58.487204,0 days 00:00:00,gini,6.0,20,,PRUNED
44,,2026-09-21 02:23:58.487204,2026-09-21 02:23:58.487204,0 days 00:00:00,gini,6.0,5,,PRUNED
45,,2026-09-21 02:23:58.487204,2026-09-21 02:23:58.494202,0 days 00:00:00.006998,gini,6.0,20,,PRUNED
46,,2026-09-21 02:23:58.494202,2026-09-21 02:23:58.494202,0 days 00:00:00,entropy,6.0,5,,PRUNED
47,,2026-09-21 02:23:58.494202,2026-09-21 02:23:58.494202,0 days 00:00:00,gini,12.0,20,,PRUNED
48,0.5605755888813557,2026-09-21 02:23:58.494202,2026-09-21 02:23:58.970450,0 days 00:00:00.476248,gini,12.0,1,"{'criterion': 'gini', 'max_depth': 12, 'min_samples_leaf': 1}",COMPLETE
49,,2026-09-21 02:23:58.970450,2026-09-21 02:23:58.973451,0 days 00:00:00.003001,entropy,,5,,PRUNED
50,,2026-09-21 02:23:58.973451,2026-09-21 02:23:58.975492,0 days 00:00:00.002041,entropy,6.0,20,,PRUNED
51,,2026-09-21 02:23:58.975492,2026-09-21 02:23:58.977503,0 days 00:00:00.002011,gini,6.0,1,,PRUNED
52,,2026-09-21 02:23:58.977503,2026-09-21 02:23:58.979503,0 days 00:00:00.002000,gini,6.0,1,,PRUNED
53,,2026-09-21 02:23:58.979503,2026-09-21 02:23:58.981662,0 days 00:00:00.002159,gini,6.0,1,,PRUNED
54,,2026-09-21 02:23:58.981662,2026-09-21 02:23:58.984710,0 days 00:00:00.003048,entropy,6.0,1,,PRUNED
55,,2026-09-21 02:23:58.984710,2026-09-21 02:23:58.984710,0 days 00:00:00,entropy,6.0,1,,PRUNED
56,,2026-09-21 02:23:58.984710,2026-09-21 02:23:58.984710,0 days 00:00:00,gini,3.0,5,,PRUNED
57,0.575242310583374,2026-09-21 02:23:58.984710,2026-09-21 02:23:59.454298,0 days 00:00:00.469588,gini,3.0,1,"{'criterion': 'gini', 'max_depth': 3, 'min_samples_leaf': 1}",COMPLETE
58,,2026-09-21 02:23:59.454298,2026-09-21 02:23:59.456305,0 days 00:00:00.002007,entropy,6.0,20,,PRUNED
59,,2026-09-21 02:23:59.457305,2026-09-21 02:23:59.459305,0 days 00:00:00.002000,entropy,6.0,5,,PRUNED
60,,2026-09-21 02:23:59.459305,2026-09-21 02:23:59.461305,0 days 00:00:00.002000,entropy,6.0,1,,PRUNED
61,,2026-09-21 02:23:59.461305,2026-09-21 02:23:59.464838,0 days 00:00:00.003533,entropy,12.0,20,,PRUNED
62,,2026-09-21 02:23:59.464838,2026-09-21 02:23:59.465703,0 days 00:00:00.000865,entropy,12.0,20,,PRUNED
63,,2026-09-21 02:23:59.465703,2026-09-21 02:23:59.465703,0 days 00:00:00,entropy,12.0,20,,PRUNED
64,,2026-09-21 02:23:59.465703,2026-09-21 02:23:59.465703,0 days 00:00:00,entropy,12.0,20,,PRUNED
65,0.590929541737658,2026-09-21 02:23:59.465703,2026-09-21 02:24:00.012836,0 days 00:00:00.547133,entropy,,20,,COMPLETE
66,,2026-09-21 02:24:00.013836,2026-09-21 02:24:00.014839,0 days 00:00:00.001003,gini,6.0,5,,PRUNED
67,,2026-09-21 02:24:00.014839,2026-09-21 02:24:00.014839,0 days 00:00:00,entropy,6.0,20,,PRUNED
68,,2026-09-21 02:24:00.014839,2026-09-21 02:24:00.014839,0 days 00:00:00,entropy,6.0,5,,PRUNED
69,,2026-09-21 02:24:00.014839,2026-09-21 02:24:00.014839,0 days 00:00:00,gini,12.0,1,,PRUNED
70,,2026-09-21 02:24:00.014839,2026-09-21 02:24:00.014839,0 days 00:00:00,entropy,6.0,20,,PRUNED
71,,2026-09-21 02:24:00.014839,2026-09-21 02:24:00.014839,0 days 00:00:00,entropy,,20,,PRUNED
72,,2026-09-21 02:24:00.014839,2026-09-21 02:24:00.030535,0 days 00:00:00.015696,entropy,,20,,PRUNED
73,,2026-09-21 02:24:00.030535,2026-09-21 02:24:00.030535,0 days 00:00:00,entropy,,20,,PRUNED
74,0.5500004408569774,2026-09-21 02:24:00.030535,2026-09-21 02:24:00.508643,0 days 00:00:00.478108,gini,12.0,5,"{'criterion': 'gini', 'max_depth': 12, 'min_samples_leaf': 5}",COMPLETE
75,,2026-09-21 02:24:00.508643,2026-09-21 02:24:00.511614,0 days 00:00:00.002971,entropy,,20,,PRUNED
76,,2026-09-21 02:24:00.511614,2026-09-21 02:24:00.514614,0 days 00:00:00.003000,entropy,,20,,PRUNED
77,,2026-09-21 02:24:00.514614,2026-09-21 02:24:00.517256,0 days 00:00:00.002642,entropy,6.0,20,,PRUNED
78,,2026-09-21 02:24:00.517256,2026-09-21 02:24:00.519262,0 days 00:00:00.002006,gini,6.0,1,,PRUNED
79,,2026-09-21 02:24:00.519262,2026-09-21 02:24:00.521262,0 days 00:00:00.002000,entropy,,5,,PRUNED
80,,2026-09-21 02:24:00.521262,2026-09-21 02:24:00.523262,0 days 00:00:00.002000,gini,6.0,20,,PRUNED
81,,2026-09-21 02:24:00.523262,2026-09-21 02:24:00.525262,0 days 00:00:00.002000,entropy,3.0,1,,PRUNED
82,,2026-09-21 02:24:00.526261,2026-09-21 02:24:00.528261,0 days 00:00:00.002000,entropy,3.0,1,,PRUNED
83,0.5570844754576273,2026-09-21 02:24:00.528261,2026-09-21 02:24:01.024450,0 days 00:00:00.496189,entropy,12.0,1,"{'criterion': 'entropy', 'max_depth': 12, 'min_samples_leaf': 1}",COMPLETE
84,,2026-09-21 02:24:01.024450,2026-09-21 02:24:01.027447,0 days 00:00:00.002997,entropy,3.0,1,,PRUNED
85,,2026-09-21 02:24:01.027447,2026-09-21 02:24:01.030446,0 days 00:00:00.002999,entropy,3.0,1,,PRUNED
86,,2026-09-21 02:24:01.030446,2026-09-21 02:24:01.032246,0 days 00:00:00.001800,gini,6.0,5,,PRUNED
87,,2026-09-21 02:24:01.032246,2026-09-21 02:24:01.034284,0 days 00:00:00.002038,entropy,3.0,20,,PRUNED
88,,2026-09-21 02:24:01.034284,2026-09-21 02:24:01.036284,0 days 00:00:00.002000,gini,6.0,1,,PRUNED
89,,2026-09-21 02:24:01.037283,2026-09-21 02:24:01.039377,0 days 00:00:00.002094,entropy,6.0,5,,PRUNED
90,,2026-09-21 02:24:01.039377,2026-09-21 02:24:01.041195,0 days 00:00:00.001818,entropy,6.0,20,,PRUNED
91,,2026-09-21 02:24:01.041195,2026-09-21 02:24:01.043204,0 days 00:00:00.002009,entropy,3.0,5,,PRUNED
92,0.5226408948939621,2026-09-21 02:24:01.043204,2026-09-21 02:24:01.560682,0 days 00:00:00.517478,gini,,1,"{'criterion': 'gini', 'max_depth': None, 'min_samples_leaf': 1}",COMPLETE
